objectID,name,description,url,logo,banner,city,zipcode,department,region,address,lat,lng,org_type,category_tags,ha_tags,active_forms_count,active_forms_type,creation_date,last_order_date,score,partners,contact_email,contact_phone
542549,CLS Racing Team,Association soutien financier CLAISSE Corentin et CLAISSE Antonin ,/associations/cls-racing-team,https://cdn.helloasso.com/img/logos/croppedimage-0bc8b67063db4dafa47ef9289b4fd7b3.jpg,https://cdn.helloasso.com/img/photos/croppedimage-acf69d5446d749299c367b995065d6fe.jpg,Romilly-sur-Seine,10100,Aube,Grand Est,81 Rue Gabriel Péri,48.522638,3.708066,Association1901,Sport,,1,Donation,1729116000,,110,,clsracingteam10@gmail.com,0602618024
541424,Rachetés de Jésus Christ en Actions  ,"RJA est une association à but non lucratifs qui vient en aide aux enfants en Haïti, la situation actuel dans le pays ne permet pas aux enfants de trouver une école gratuite et de qualité dans le pays et qui offre un enseignement de l'Evangile, c'est pour cela que nous avons besoin de VOUS ! ",/associations/rachetes-de-jesus-christ-en-actions,https://cdn.helloasso.com/img/logos/croppedimage-75e1258d17994948bdbfaa9fac37f549.png,https://cdn.helloasso.com/img/photos/croppedimage-0d420152252e4fe4b311f8c4c9cd2383.png,Romilly-sur-Seine,10100,Aube,Grand Est,48 Voie Herbesace,48.501882,3.74415,Association1901,Caritatif | Enfance | Enseignement | Humanitaire | Solidarité et Action Sociale,,1,Donation,1728856800,,110,,jesus.rja.77@gmail.com,+33618191936
525222,Music'Event,"Créée en août 2024, Music'Event est une association romillonne dynamique dédiée à la promotion de la musique et des artistes locaux.",/associations/music-event,https://cdn.helloasso.com/img/logos/croppedimage-cdbb9a6b010e4d49ab041a9220a8fdb2.png,https://cdn.helloasso.com/img/photos/croppedimage-da3b2cad54dd4b65b463964f33c7986c.png,Romilly-sur-Seine,10100,Aube,Grand Est,13 Rue Louis Pasteur,48.518012,3.727329,Association1901,Arts | Culture | Musique | Arts et Culture,,2,"CrowdFunding, Donation",1723932000,,110,,association.musicevent@gmail.com,0683256678
340491,MIXIBULLE,"L’association MixiBulle a été crée en Août 2022  dont le projet final est de fonder une crèche associative inclusive.  Par ce projet, les objectifs seront de favoriser, faciliter, promouvoir et diversifier l’inclusion des enfants en situation de handicap dès leur plus jeune âge.",/associations/mixibulle,https://cdn.helloasso.com/img/logos/croppedimage-f0daf6c333f84326b72e6a755c79e5e2.png,https://cdn.helloasso.com/img/photos/croppedimage-d56b4ce3bddc4dc5a2b78a9e253c0db9.png,Macey,10300,Aube,Grand Est,19 Les Dagues,48.319482,3.939421,Association1901,Crèche | Enfance | Handicap | Humanitaire | Solidarité | Solidarité et Action Sociale,,4,"Donation, Shop, Membership",1661896800,1735667640,110,,associationmixibulle@hotmail.com,0662837241
37649,Troyes aube Fablab,un Fab Lab Laboratoire de Fabrication numérique (en anglais Fabrication Laboratory),/associations/troyes-aube-fablab,https://cdn.helloasso.com/img/logos/troyes-aube-fablab-275aced228394ba8904889ca6af14389.png,https://cdn.helloasso.com/img/photos/68556.JPG,Bar-sur-Aube,10200,Aube,Grand Est,3 rue des gorges fines,48.24222,4.71217,Association1901,Humanitaire | Informatique | Solidarité | Sciences et Technologie,,1,Donation,1448146800,,110,,contact@aubefablab.fr,
308911,Champagne-Ukraine,Venir en aide au peuple ukrainien,/associations/champagne-ukraine,https://cdn.helloasso.com/img/logos/croppedimage-f1750358ec0246ecb65b5152e25afc17.png,https://cdn.helloasso.com/img/photos/croppedimage-d5ccbafae7df4925b1baf3745064cd4c.png,Troyes,10000,Aube,Grand Est,55 Rue de la Paix,48.302208,4.068728,Association1901,Solidarité et Action Sociale | Caritatif | Humanitaire,,1,Donation,1646262000,1651220653,110,,champagneukraine.jps@gmail.com,0661055375
28341,Association Coeur de Chattounes,Une maison de retraite pour chats au coeur d'un foyer familial chaleureux.,/associations/association-coeur-de-chattounes,https://cdn.helloasso.com/img/logos/association-coeur-de-chattounes.jpg,https://cdn.helloasso.com/img/photos/49642.jpg,Mailly-le-Camp,10230,Aube,Grand Est,48 allée des Prunus,48.663748,4.206289,Association1901Rig,Chats | Humanitaire | Solidarité | Animaux | Santé,,1,Donation,1404079200,1425201273,110,,,
28644,Association ANGELUS3,MINISTERE DE LOUANGE & ADORATION ( ANGELUS3),/associations/association-angelus3,https://cdn.helloasso.com/img/logos/association-angelus3-3c1b4ea74584473fb507ab07aebbedd2.jpg,https://cdn.helloasso.com/img/photos/43856.jpg,Maizières-la-Grande-Paroisse,10510,Aube,Grand Est,4 RUE PATRIS DE BREUIL,48.509884,3.793758,Association1901Rig,Humanitaire | Solidarité | Solidarité et Action Sociale,,2,"Donation, CrowdFunding",1407448800,,110,,angelus3@live.fr,0658435875
56612,Ainsi Font Pour Marion,"Favoriser l’autonomie, la mobilité, l’indépendance, l’intégration et l’épanouissement d’une personne handicapée, et plus particulierement d'un enfant.",/associations/ainsi-font-pour-marion,https://cdn.helloasso.com/img/logos/ainsi-font-pour-marion.jpg,https://cdn.helloasso.com/img/photos/101600.jpg,Saint-Léger-près-Troyes,10800,Aube,Grand Est,"19, rue de Montreuil",48.240233,4.079721,Association1901Rig,Enfance | Humanitaire | Solidarité | Solidarité et Action Sociale | Santé,Don,1,Donation,1482102000,1725898501,110,,ainsifont.pourmarion@yahoo.com,0669568527
232360,Association ED (Gospel Vision Center),Une église évangélique contemporaine !,/associations/association-ed-gospel-vision-center,https://cdn.helloasso.com/img/logos/association ed gospel vision center-ee36b375abdd4511a4e829a050453219.png,https://cdn.helloasso.com/img/photos/gv center-7f6255bc02ab4a668f1e091812c5f1c6.jpg,Sainte-Savine,10300,Aube,Grand Est,Association ED (Espace Gospel Vision Center) 6 Rue de la Maladiere,48.293065,4.024987,Association1905,Religion | Patrimoine,,1,Event,1606345200,1729412781,110,,contact@gospelvision-international.com,0325752067
477965,Pôle européen du chanvre,"Le Pôle européen du chanvre rassemble l’ensemble des acteurs de la chaîne de valeur du chanvre, de l’amont à l’aval, et de ses différents marchés d’application au sein d’un écosystème coopératif, pour contribuer au développement de la production, des transformations et des usages du chanvre. ",/associations/pole-europeen-du-chanvre,https://cdn.helloasso.com/img/logos/croppedimage-9e1fdf7c620a4eb68eabd6b1d7da55e0.png,https://cdn.helloasso.com/img/photos/croppedimage-1f8eb11d8181400d9dd151c798da15d9.png,Sainte-Savine,10300,Aube,Grand Est,13 Avenue de l'Europe,48.292273,4.008389,Association1901,Environnement | Ecologie et Environnement,,1,Event,1708470000,1728315443,110,,contact@polechanvre.eu,0310644677
326719,Association Piney en Fete,"L’association « PINEY en fête » a pour objet l'animation de la commune, propose des animations repas, festivités mais aussi des activités en relation avec la santé, la prévention, l’écologie, et le bien-être.",/associations/association-piney-en-fete,https://cdn.helloasso.com/img/logos/croppedimage-73047003fb3443ce835d3e6710ac1a39.png,https://cdn.helloasso.com/img/photos/croppedimage-049cc233bbad420daba18054822d9f9c.png,Piney,10220,Aube,Grand Est,Rue Louis Husson,48.36396,4.33278,Association1901,Fête | Écologie | Loisirs,,1,Event,1654380000,1727957575,110,,pineyenfete@gmail.com,0786949779
513080,PEEP APE ROMILLY SUR SEINE," les VALEURS DE LA PEEP, restent la primauté éducative des parents, l’épanouissement des élèves, l’attachement à l'école publique et laïque et l’Indépendance syndicale, politique et religieuse.   ",/associations/peep-ape-romilly-sur-seine,https://cdn.helloasso.com/img/logos/croppedimage-a01d41167a344c739143dcb3be94d8bf.png,https://cdn.helloasso.com/img/photos/croppedimage-efdb598ba3ee4b92b33f1241efc2221e.png,Maizières-la-Grande-Paroisse,10510,Aube,Grand Est,26 Rue du Docteur Sollier,48.503845,3.781684,Association1901,Education | Formation | Syndicats,,1,Membership,1718143200,1726241887,110,,peepromillysurseine@gmail.com,0688098807
530592,ASSOCIATION LES Z'ÂMIS - Troyes,"""Ensemble pour un Mieux-Être Inclusif"" L'association ""Les Z'Amis"" a été fondée avec la conviction profonde que le bien-être est un droit fondamental pour tous, indépendamment des défis que la vie peut présenter. ",/associations/association-les-z-amis-troyes,https://cdn.helloasso.com/img/logos/croppedimage-314ef91209aa402aad1f1bb64426e605.png,https://cdn.helloasso.com/img/photos/croppedimage-9b17d8156921414a932f45ad78bb8003.png,Troyes,10000,Aube,Grand Est,4 Rue de la Marne,48.28068,4.072875,Association1901,Humanitaire | Solidarité,,1,Membership,1725573600,1729708511,110,,associationlesamis10@gmail.com,0695602325
366626,Association pour la Sauvegarde du Patrimoine Rural et Artisanal - ASPRA,"Gardien de la mémoire des hommes et des traditions, l'Ecomusée de la Forêt d'Orient vous fera découvrir la vie rurale à travers ses objets d'art populaire, ses métiers et ses reconstitutions.",/associations/association-pour-la-sauvegarde-du-patrimoine-rural-et-artisanal-aspra,https://cdn.helloasso.com/img/logos/croppedimage-121622ca7d5145da83496d4de15845a7.jpg,https://cdn.helloasso.com/img/photos/croppedimage-811762acab0e436ca2b9cd396c2266cd.png,Brienne-la-Vieille,10500,Aube,Grand Est,Rue Voltaire,48.375359,4.52457,Association1901,Arts | Culture | Arts et Culture | Patrimoine,,1,Membership,1672873200,1722183346,110,,eco.musee@laposte.net,
290088,LA GENERALE EDUCATIVE LAGED,"LAGED est une asso de promotion de l'éducation et du droit d'accès à l'éducation.  Notre VISION c'est que nous voyons que l'on ""peut tout faire par l'éducation"".   Nos ambitions : PROMOUVOIR-ORIENTER-ACCOMPAGNER   ",/associations/la-generale-educative-laged,https://cdn.helloasso.com/img/logos/croppedimage-ae5691c30c394d518e67f806770a7435.png,https://cdn.helloasso.com/img/photos/croppedimage-682477ca9ad14162b6b87aba79295206.png,Troyes,10000,Aube,Grand Est,63 Avenue Pasteur,48.302301,4.063003,Association1901Rig,Formation | Education | Solidarité et Action Sociale,,3,"Membership, CrowdFunding, Event",1635894000,1716303504,110,,bonjour@laged-educ.fr,0753613107
258668,ARCIS HANDBALL FEMININ,"Cre´e´ en 2008, le club de handball Arcis Handball Fe´minin ouvre ses portes aux femmes et aux jeunes filles de la Valle´e de l’Aube et ses environs pour jouer au handball dans un environnement convivial et bienveillant. http://www.arcishand.fr/",/associations/arcis-handball-feminin,https://cdn.helloasso.com/img/logos/croppedimage-d9138f221c70473f82da805f7dda3ee2.png,https://cdn.helloasso.com/img/photos/croppedimage-a6c55d5574c54dd086d8edfb86bfacfd.png,Aubeterre,10150,Aube,Grand Est,2 Voie de la Fontaine,48.430396,4.117629,Association1901,Environnement | Handball | Sport,,1,Event,1619733600,1765860402,110,FFHB,5610032@ffhandball.net,0612486092
348106,TROYES CHAPTER FRANCE,"TROYES CHAPTER FRANCE est un club affilié et sponsorisé par Harley Davidson – Harley Owners Group -  TROYES CHAPTER FRANCE est sponsorisé par Harley-Davidson TROYES.  Notre Chapter est composé  d’hommes et de femmes  ayant une passion commune, celle de rouler en HARLEY DAVIDSON !",/associations/troyes-chapter-france,https://cdn.helloasso.com/img/logos/croppedimage-f8275d839d3b4b29a3c4fea34ce5a47c.png,https://cdn.helloasso.com/img/photos/croppedimage-edd21520e83f4113b6fd35e357fe84d4.png,Saint-Germain,10120,Aube,Grand Est,1 Rue Paul Cézanne,48.252879,4.028098,Association1901,Loisirs,,1,Shop,1664920800,1733599211,110,,troyeschapterfrance@gmail.com,0611239163
507912,TROYALE GAMBLE ,"Association de jeux, visant à rassembler les étudiants respirant la même passion.",/associations/troyale-gamble,https://cdn.helloasso.com/img/logos/croppedimage-d9e4f6485eb949d387271163eaa19d2c.png,https://cdn.helloasso.com/img/photos/croppedimage-cc928e09c4674e3fad9024b65d0d0a7d.png,Rosières-près-Troyes,10430,Aube,Grand Est,1 Rue Fernand Sastre,48.269986,4.061779,Association1901,Jeux | Étudiants | Réseaux pros et étudiants,,1,Membership,1716415200,,110,,diego.leberre@estp.fr,0766088608
506126,ASSOCIATION POUR LA PAIX LA PROSPÉRITÉETL'UNITÉNATIONALE,"L’association a pour objectifs de :  - promouvoir sur le plan national, la paix, l’unité et la solidarité sous toutes leurs  formes. - développer des activités de prévention, de formation, d’accompagnement,  d’animation à caractère culturel, sportif, social et de coaching dans la  réalisation.",/associations/association-pour-la-paix-la-prosperiteetl-unitenationale,https://cdn.helloasso.com/img/logos/croppedimage-a425ced72ef14fbb99df2cfd283950d1.png,https://cdn.helloasso.com/img/photos/croppedimage-b28af2732b1c44d68b490090e5c1366a.png,Troyes,10000,Aube,Grand Est,Rue du Premier B C P,48.293271,4.072907,Association1901,Culture | Formation | Humanitaire | Solidarité | Solidarité et Action Sociale,,1,Donation,1715810400,,110,,appunitenationale@gmail.com,699995219
378253,Perspectives Numériques 10,"Perspectives Numériques 10, anciennement Agence 10 TIC, a été créée le 28 juin 2004 sous la forme d’une association afin d’échanger sur les enjeux, les pratiques, expériences et difficultés rencontrées afin de mettre en place des actions départementales auprès des entreprises du département.",/associations/perspectives-numeriques-10,https://cdn.helloasso.com/img/logos/croppedimage-4557f66387e24fadbe75e11460b2922e.png,https://cdn.helloasso.com/img/photos/croppedimage-79002d73df3942dbb640874e661ec9fa.png,Troyes,10000,Aube,Grand Est,1 Boulevard Charles Baltet,48.291008,4.070715,Association1901,Étudiants | Réseaux pros et étudiants,,1,Membership,1676761200,,110,OHME,gburysek@live.fr,0678232463
505203,COMITE DES FETES DE RUVIGNY,"Elle a pour but d’organiser diverses manifestations festives, culturelles, sportives au bénéfice des habitants de la commune lors d’événements marquants tout au long de l’année",/associations/comite-des-fetes-de-ruvigny,https://cdn.helloasso.com/img/logos/croppedimage-f8cfb40c9cfa44dd8491eafc3923011c.png,https://cdn.helloasso.com/img/photos/croppedimage-2c2f029119c64b96b9d07e4d1e3f769f.png,Ruvigny,10410,Aube,Grand Est,1 Grande Rue,48.274923,4.179246,Association1901,Culture | Fête | Loisirs,Comites-des-fetes,1,Event,1715637600,,110,,comitedesfetesderuvigny@gmail.com,0660855387
446292,Les Meuh' Zicos,"L'association a pour objet : créer et animer un festival de musiques, dans la région Grand Est, plus particulièrement à Racines (10130), organiser également des rassemblements motos, dans la région Grand Est, à Racines (10130).",/associations/les-meuh-zicos,https://cdn.helloasso.com/img/logos/croppedimage-8d8304a166ba48059b4a6e07eeee6d6b.png,https://cdn.helloasso.com/img/photos/croppedimage-6238870136d54d3ba33045b9b75b4f97.png,Racines,10130,Aube,Grand Est,22 Rue de la Crépinerie,48.044909,3.842925,Association1901,Arts | Culture | Moto | Musique,,1,Event,1698966000,,110,,lesmeuhzicos@yahoo.com,0763499898
494878,les amis de seche fontaine,"Seche fontaine, vallon perdu près des bois de Fiel, Saint Bruno y passa quelques années en ermite avant de fonder la grande Chartreuse. Ce site est progressivement nettoyé, restauré dans l'objectif de permettre des réunions, séminaires, évènements.",/associations/les-amis-de-seche-fontaine,https://cdn.helloasso.com/img/logos/croppedimage-d864badf37aa4c27bab77888af08a799.png,https://cdn.helloasso.com/img/photos/croppedimage-4cc6cc1b096045e9b6ed6e32083caea3.png,Avirey-Lingey,10340,Aube,Grand Est,sèche fontaine,48.053571,4.307598,Association1901Rig,Patrimoine,,2,"CrowdFunding, Donation",1712181600,,110,,masure@turcat.com,0624315714
432691,Fighting Airsoft Aube,Notre association a pour but de promouvoir l'Airsoft et la self-défense. Nous pratiquons ces deux activités dans la bonne humeur et en cohésion.,/associations/fighting-airsoft-aube,https://cdn.helloasso.com/img/logos/croppedimage-d0cd85c4aaf046c68cbed62f1c1665fa.png,https://cdn.helloasso.com/img/photos/croppedimage-711c56d7fc31416ab6ac784525aa7432.png,Troyes,10000,Aube,Grand Est,63 Av. Pasteur,48.302301,4.063003,Association1901,Sport | Airsoft | Self defense,,1,Event,1694728800,1710959627,110,,asso.FAA.10@gmail.com,0787652257
483478,YouFit Y SCHOOLS,"Fashion association from Y SCHOOLS Events, fashion show (and more!) Wanna join the adventure?",/associations/youfit-y-schools,https://cdn.helloasso.com/img/logos/croppedimage-72912b2f6f77433a8977e4a9090ab44f.png,https://cdn.helloasso.com/img/photos/croppedimage-079428060c91407eb90dbcea11f296de.png,Troyes,10000,Aube,Grand Est,217 Avenue Pierre Brossolette,48.283727,4.078757,Association1901Rig,Étudiants,,1,Event,1709852400,,110,,youfit@yschools.eu,0652257340
328921,Centre d'Initiation à l'Environnement d'Othe et d'Armance ,"""Le CIEOA à pour objectif d’initier, éduquer, sensibiliser, à l’environnement et au développement durable, tous les citoyens d’aujourd’hui et de demain. Pour se faire, il offre l’opportunité de confronter savoirs, a priori et cultures, par des rencontres, des partages, des découvertes concrètes...",/associations/centre-d-initiation-a-l-environnement-d-othe-et-d-armance,https://cdn.helloasso.com/img/logos/croppedimage-9dbcb5a15dd44596b59fd49e4d5e40d5.png,https://cdn.helloasso.com/img/photos/croppedimage-a210629867d94069aa477e63593632c3.png,Les Loges-Margueron,10210,Aube,Grand Est,1 Rue des Etangs,48.084506,4.100885,Association1901,Culture | Développement durable | Environnement | Ecologie et Environnement,,2,"Donation, Membership",1655157600,1726499227,110,,info@cieoa.fr,0325401059
461409,GMPower Team,Notre association est dans le but de participer au 4L Trophy. En effet nous sommes deux étudiants en Génie mécanique et productique à Troyes et avons donc créé une équipe donc une association pour notre participation au 4L Trophy,/associations/gmpower-team,https://cdn.helloasso.com/img/logos/croppedimage-c38cb819c4e54dcdb4cf67013b437435.png,https://cdn.helloasso.com/img/photos/croppedimage-356890bbeda043cf9c8e4f3f77e23cbd.png,Troyes,10000,Aube,Grand Est,49 Rue Charles Delaunay,48.301615,4.065261,Association1901,Sport automobile | Étudiants | Sport,,1,Donation,1704236400,1704730491,110,,teamgmpower@gmail.com,0784456030
309861,Actionable Science for Urban Sustainability,"AScUS se consacre à promouvoir l'échange d'idées provenant de multiples disciplines, en utilisent divers formats (conférences universitaires, séminaires, événements de mis en réseau, etc ; ) , afin de développer des actions en faveur de la durabilité/ soutenabilité urbaine dans le monde entier.",/associations/actionable-science-for-urban-sustainability,https://cdn.helloasso.com/img/logos/croppedimage-d16f500f4546481c80b40720e8b4a90a.png,https://cdn.helloasso.com/img/photos/croppedimage-7faf08849ab04543a85d162f76040a3f.png,Troyes,10000,Aube,Grand Est,22 Rue des Guillemets,48.3,4.085711,Association1901,Recherche | Sciences | Sciences et Technologie,,2,"Membership, Event",1646694000,,110,,contact@ascus-society.org,
385123,Les petits saultiers,Association créer pour les enfants du groupe scolaire Paul Pasquier de La Saulsotte (10400),/associations/les-petits-saultiers,https://cdn.helloasso.com/img/logos/croppedimage-41fbccf046d84a5ba6d1fe16492b8098.png,https://cdn.helloasso.com/img/photos/croppedimage-6bd94c92d73349738ae0cdf925cb9384.png,La Saulsotte,10400,Aube,Grand Est,1 Rue Putte Musse,48.541371,3.50521,Association1901,Education | Enfance | Formation,,2,"Donation, Event",1678834800,1698309169,110,,maximederuelle@icloud.com,
428266,Team 34 EL MHARECH,"Notre association nous permet d’organiser des événements afin de récolter des fonds pour financer notre participation au Trek Elles Marchent en 2024 : Trek solidaire  d’orientation en équipe , 100%féminin.  Nous reversons 10% des dons récoltés et recettes à l’AREMIG.",/associations/team-34-el-mharech,https://cdn.helloasso.com/img/logos/croppedimage-e9393aa67f0a46998c21b3bc6a654c77.png,https://cdn.helloasso.com/img/photos/croppedimage-be95371e33a141978b340df785b9919e.png,Rumilly-lès-Vaudes,10260,Aube,Grand Est,3bis Route de Nicey,48.14081,4.213654,Association1901,Solidarité et Action Sociale,,1,Event,1693778400,1696696131,110,,treksolidaireteam34@gmail.com,0630018847
348733,DT'R,"DT'R comme détèr! Nouveau club à Troyes! Club Boxe pieds poings / kick boxing. Technique, cardio et renforcement! L'esprit de groupe avant tout, nous avançons et progressons tous ensemble. ",/associations/dt-r,https://cdn.helloasso.com/img/logos/croppedimage-f3a3e3dfc4144f3fb21d14f9d9466afc.png,https://cdn.helloasso.com/img/photos/croppedimage-8b6dce59ee924f8f99759e8063e9378b.jpg,Troyes,10000,Aube,Grand Est,35 Rue des Marots,48.305427,4.050877,Association1901,Sport | Boxe | Kick-boxing,,2,"CrowdFunding, Membership",1665093600,,110,,moh.bend@gmail.com,0622055192
66593,Sport Aventure Nogentais 10,Club sportif de disciplines d'endurance enchaînées,/associations/sport-aventure-nogentais-10,https://cdn.helloasso.com/img/logos/croppedimage-e1c0cb809b9547caacd56a4702dee096.png,https://cdn.helloasso.com/img/photos/154646-17accd2b8d6f4618b85ef73ea8641638.jpg,Nogent-sur-Seine,10400,Aube,Grand Est,29 Rue des Fosses,48.492035,3.499152,Association1901,Sport,,1,Event,1499810400,1696525481,110,,bastien.dumoutier@gmail.com,0662687545
373994,TERRE ET SENS,"""REMETTRE DES ARBRES DANS SA VILLE""  Création de forêts urbaines et périurbaines participatives 100% naturelles, selon des méthodes qui permettent de reconstituer des écosystèmes forestiers sur des surfaces réduites.",/associations/terre-et-sens,https://cdn.helloasso.com/img/logos/croppedimage-9ba7107049d64e2ca8f307ae2db452d3.png,https://cdn.helloasso.com/img/photos/croppedimage-b3d130f80f434818bce1c6578b05cc3e.png,Troyes,10000,Aube,Grand Est,55 Rue de la Cite,48.300016,4.079853,Association1901,Ecologie et Environnement | Environnement | Forêt,,6,"PaymentForm, Membership",1675378800,1742149144,110,,asso.terre.et.sens@gmail.com,0685234405
296881,Les Ateliers Dynamo - Psychomotricité ASBL,"Les Ateliers Dynamo - Psychomotricité ASBL, est une association à Bruxelles, composée de psychomotricien.ne.s, musicien.ne.s et danseu.r.se.s qui proposent aux enfants de tous les âges, des séances individuelles et groupales, pour aller à la rencontre, au travers du jeu, de soi-même et des autres. ",/associations/les-ateliers-dynamo-psychomotricite-asbl,https://cdn.helloasso.com/img/logos/croppedimage-d029d18f949c4f51a6c3ed250b81bb25.png,https://cdn.helloasso.com/img/photos/croppedimage-32ba8e34cc254126a01c491e69a9cacd.png,Troyes,10000,Aube,Grand Est,4 Rue de la Forêt d'Houthulst,48.3007,4.0852,Association1901,Enfance | Humanitaire | Solidarité | Spiritualité,,1,Donation,1639782000,1645791851,110,,dynamo.reveurs@gmail.com,0485257628
156897,SAVIE DANSE,"Cécile Gaillard dispense des cours de danse jazz, classique, hip-hop et contemporaine. L'accueil se fait à partir de l'âge de 4ans et jusqu'à l'âge adulte. Savie danse c'est aussi une compagnie,"" Liberta"" qui se compose de danseuses d'un bon niveau technique , polyvalentes et passionnées.",/associations/savie-danse,https://cdn.helloasso.com/img/logos/croppedimage-ddf29e996e5a4487baf1ddc33504dd27.png,https://cdn.helloasso.com/img/photos/croppedimage-a9b0c4cc58ee4ddb8535b95d7bc703c9.png,La Chapelle-Saint-Luc,10600,Aube,Grand Est,13 Rue Antoine Lumière,48.324153,4.034946,Association1901,Arts | Culture | Danse | Hip-hop | Jazz | Arts et Culture,,2,Event,1562454000,1685700273,110,,saviedanse@gmail.com,07 82 40 49 79
406128,Nourrir la Vie en Soi,"L'association ""Nourrir la Vie en Soi"" a pour objet de promouvoir et diffuser différentes approches favorisant le mieux-être individuel et collectif par le biais notamment d'informations, d'accompagnements, d'ateliers, de pratiques en lien avec la biodanza, la naturopathie et les bains de forêt.",/associations/nourrir-la-vie-en-soi,https://cdn.helloasso.com/img/logos/croppedimage-b788692358d64ce7b20497187724b2af.jpg,https://cdn.helloasso.com/img/photos/croppedimage-3c90ab5e35964e48bab21b6754a90d2f.jpg,Épagne,10500,Aube,Grand Est,1 Grande Rue,48.392324,4.461795,Association1901,Santé | Spiritualité,,2,Event,1685228400,,110,,,
305717,FabAdd-Académie,"FabAdd-Académie a pour objet principal de rassembler les établissements assurant des formations sur la fabrication additive, d’accompagner les organismes dans la création des formations sur l’impression 3D et de préserver leurs intérêts.",/associations/fabadd-academie,https://cdn.helloasso.com/img/logos/croppedimage-f01a6151b4c4442287ff98a9ecda92ff.png,https://cdn.helloasso.com/img/photos/croppedimage-8e19274eecab40f8a1c625920877a33f.png,Rosières-près-Troyes,10430,Aube,Grand Est,2 Rue Fernand Sastre,48.270002,4.064246,Association1901,Formation | Education,,2,"Event, Membership",1644793200,1718283112,110,,formation@fabadd-academie.eu,0325707357
396334,Groupement interparoissial et familial d'Ervy,Kermesse du 15 Aout d'Ervy-le-Châtel. ,/associations/groupement-interparoissial-et-familial-d-ervy,https://cdn.helloasso.com/img/logos/croppedimage-f7da54385d0b4344a44cfbf42864550f.jpg,https://cdn.helloasso.com/img/photos/croppedimage-9effa2ccde8748359960aaea37639924.png,Ervy-le-Châtel,10130,Aube,Grand Est,6 Rue du 14 Juillet,48.040143,3.909395,Association1901,Caritatif | Humanitaire | Solidarité et Action Sociale,,2,Event,1682377200,1682704861,110,,davybavoil@gmail.com,0673270540
