objectID,name,description,url,logo,banner,city,zipcode,department,region,address,lat,lng,org_type,category_tags,ha_tags,active_forms_count,active_forms_type,creation_date,last_order_date,score,partners,contact_email,contact_phone
390846,Association Sportive du Golf de la Forêt d'Orient,L ’Association Sportive du Golf de la Forêt d’Orient est affiliée à la Fédération Française de Golf et fait partie de la Ligue Grand Est. Elle assure son rôle d'animateur sportif au club en organisant des compétitions grâce au soutien de nos sponsors et des propriétaires du domaine.,/associations/association-sportive-du-golf-de-la-foret-d-orient,https://cdn.helloasso.com/img/logos/croppedimage-a91802f2fc324d89b9111440ec086f81.png,https://cdn.helloasso.com/img/photos/croppedimage-82e7e40e7a5e4f8db787468f9e872e3d.png,Rouilly-Sacey,10220,Aube,Grand Est,Route de Geraudot,48.328406,4.286763,Association1901,Sport | Forêt | Golf,,10,Event,1680472800,1775059175,110,,contact@asgfo.fr,
309880,Maison de la Science - Hubert Curien,"Association loi 1901 regroupant des associations scientifiques et d’éducation populaire.  Afin de rendre les sciences accessibles à tous, la Maison de la Science met en place tout au long de l’année différentes actions de médiation. ",/associations/maison-de-la-science-hubert-curien,https://cdn.helloasso.com/img/logos/croppedimage-3c15d91a1b4f462eab9b425149486baa.png,https://cdn.helloasso.com/img/photos/croppedimage-f76213a985954e7fbe3ccce49986510a.png,Sainte-Savine,10300,Aube,Grand Est,2ter Rue Lamoriciere,48.29355,4.055792,Association1901Rig,Arts | Culture | Sciences | Sciences et Technologie,,46,"Shop, Event, Donation, Membership",1646694000,1775040754,110,,secretariat@maisondelascience.fr,0325710352
209504,Le Rucher Créatif,"Le Rucher Créatif est un tiers-lieu innovant et collaboratif au centre-ville de Troyes, proche de la gare.  Tous nos évènements sur : https://le-rucher-creatif.org/programmation/",/associations/le-rucher-creatif,https://cdn.helloasso.com/img/logos/croppedimage-2217a8267f0341ec9c3fccf6e7016b51.png,https://cdn.helloasso.com/img/photos/croppedimage-4ac6971b4818405da6f3df035893f823.png,Troyes,10000,Aube,Grand Est,17 Rue Colonel Driant,48.29477,4.068599,Association1901Rig,Humanitaire | Informatique | Solidarité | Solidarité et Action Sociale,,84,"Event, Membership",1592776800,1775032096,110,OHME,contact@le-rucher-creatif.org,0780348769
393096,ASSOCIATION DES PARENTS D'ELEVES DE L'ECOLE SAINTE JULE,L’APEL de l’école est une association constituée de parents d’élèves bénévoles L’UNE DES ACTIONS DE L’APEL VISE Á RÉCOLTER DES FONDS. Ces fonds participent à la mise en place des projets de l’école L’APEL par son dynamisme et son soutien participe à la vie à l’établissement ,/associations/association-des-parents-d-eleves-de-l-ecole-sainte-jule,https://cdn.helloasso.com/img/logos/croppedimage-895c2c788c1d4b2cbb1dde722a267e0b.png,https://cdn.helloasso.com/img/photos/croppedimage-d18e3135efce466f9d04b6666abcc78c.png,Troyes,10000,Aube,Grand Est,5 Rue Saint Antoine,48.304457,4.065677,Association1901,Education | Formation,,2,"Shop, Membership",1681250400,1774986377,110,,tresorerie.apelstejule23@gmail.com,
285917,Aux Adelphes,"Tiers-lieu artistique, culturel, inclusif au cœur de Troyes. Pour peindre avec les doigts, cueillir les bons champignons, brasser votre propre bière, faire des petits monstres au crochet, participer à des cercles de parole…   https://www.auxadelphes.com/ ",/associations/aux-adelphes,https://cdn.helloasso.com/img/logos/croppedimage-76ae07bf3d914fa7aa0f9db2bc461721.png,https://cdn.helloasso.com/img/photos/croppedimage-d4310100b29d45edaba97d3440755356.png,Sainte-Savine,10300,Aube,Grand Est,72 Avenue du General Gallieni,48.294034,4.055649,Association1901,Arts | Culture | Peinture | Arts et Culture,,15,"Event, Donation, Membership",1633557600,1775025920,110,OHME,auxadelphes@gmail.com,
568726,ASSOCIATION TEAM PILOTE,L'association TEAM PILOTE a le plaisir de vous convier à la 2ème édition de son Grand Rassemblement Autos - Motos - Camions : Pilote Passion Festival qui se déroulera jeudi 1er mai 2025 à Pon-Sainte-Marie (10).,/associations/association-team-pilote,https://cdn.helloasso.com/img/logos/croppedimage-a80cee766f6e483bbedac06284055d23.png,https://cdn.helloasso.com/img/photos/croppedimage-1ee38b0078384d5395baeea5515e31a9.png,Pont-Sainte-Marie,10150,Aube,Grand Est,24 rue Danton,48.324012,4.104476,Association1901,Moto | Sport,,1,Event,1738796400,1775063525,110,,pilotepassionfestival@gmail.com,
265485,Nid de créateurs,"Cette Association a pour objet de promouvoir l’artisanat d’art, la création “fait main” au travers d'événements divers. Nous avons ouvert un tiers-lieu ouvert au co-working et aux ateliers créatifs qui se trouve à Maraye-en-Othe.",/associations/nid-de-createurs,https://cdn.helloasso.com/img/logos/croppedimage-6c69d35770fa44ba9cbddc29ff914bbd.png,https://cdn.helloasso.com/img/photos/croppedimage-149b8432f9fb4382abc85e89644eb150.png,Maraye-en-Othe,10160,Aube,Grand Est,rue du pressoir,48.162903,3.853885,Association1901,Artisanat | Arts | Coworking | Humanitaire | Solidarité | Arts et Culture,,11,"Shop, Event, Membership",1622498400,1774977842,110,,niddecreateurs@yahoo.com,
55182,Quai des Arts,"Participer à une dynamique de développement rural dans le barséquanais au travers d'activités culturelles, éducatives, artistiques..",/associations/quai-des-arts,https://cdn.helloasso.com/img/logos/quai-des-arts.jpg,https://cdn.helloasso.com/img/photos/97025.jpg,Polisot,10110,Aube,Grand Est,"L'Aiguillage, 3 place de la gare",48.073051,4.384906,Association1901Rup,Arts | Culture | Arts et Culture,,3,"Event, PaymentForm, Membership",1478214000,1775038062,110,,contact@laiguillage.org,0351637152
300937,Basket Sancéo Troyen,"Basket Sancéo Troyen, c’est un club familial et passionné, actif à Troyes et Saint-Julien-les-Villas. Ouvert à tous : enfants, ados, adultes, débutants ou compétiteurs ! Une ambiance conviviale, des entraîneurs engagés et des bénévoles au top.",/associations/basket-sanceo-troyen,https://cdn.helloasso.com/img/logos/croppedimage-6129616e89224f88b824018a618c32f0.png,https://cdn.helloasso.com/img/photos/croppedimage-8b55a58a91a64b84902c931f999f2693.jpg,Troyes,10000,Aube,Grand Est,63 Avenue Pasteur,48.302301,4.063003,Association1901,Basketball | Enfance | Sport,,2,"Donation, Membership",1642287600,1774988164,110,FFBB,contact@basket-sanceo-troyen.fr,
518087,WATCHMEN INTERNATIONAL MISSION,"La WATCHMEN INTERNATIONAL MISSION est une association culturelle de type protestante évangélique poursuivant des objectifs missionnaires (France, Europe, et étranger).Elle vise la promotion de la paix, le dialogue inter religieux, la formation des bénévoles et l’assistance des personnes vulnérables.",/associations/watchmen-international-mission,https://cdn.helloasso.com/img/logos/croppedimage-fd7bfc10c49f4b4d83d78daea01ac9e1.png,https://cdn.helloasso.com/img/photos/croppedimage-101e9d55b549412ca0809302f0c59344.png,Troyes,10000,Aube,Grand Est,1 Rue Colonel Driant,48.294837,4.069296,Association1901,Solidarité et Action Sociale | Culture | Formation | Religion,,8,"Donation, PaymentForm, Event, Membership",1720044000,1774213799,110,OHME,contact@watchmen-im.com,0783433786
450761,Romilly Catch Club,Le Romilly Catch Club est une association loi 1901 qui propose une pratique et apprentissage du Catch dans l'Aube .,/associations/romilly-catch-club,https://cdn.helloasso.com/img/logos/croppedimage-92bfa086477c4903bb2b16c60a0bb6de.png,https://cdn.helloasso.com/img/photos/croppedimage-b9b1f28e91a9416ea8c92429ee0d2f6e.png,Romilly-sur-Seine,10100,Aube,Grand Est,15 Rue Gabriel Willaume,48.520074,3.727909,Association1901,Sport,,1,Event,1700175600,1775032441,110,,romillycatchclub@gmail.com,0781427879
325049,Handball Club Savino Chapelain,"Le handball club savino-chapelain c'est une association situé à Sainte-Savine et La chapelle St-Luc, dans l'agglomération de Troyes avec près de 200 licenciés dans toutes les catégories dès 3 ans ! Venez nous découvrir ! ",/associations/handball-club-savino-chapelain,https://cdn.helloasso.com/img/logos/croppedimage-b0c22ce7c93340ca8af1644dc152ff70.png,https://cdn.helloasso.com/img/photos/croppedimage-50a2d63f418f4483874dd325a223978d.png,Sainte-Savine,10300,Aube,Grand Est,1 Rue Lamoriciere,48.29376,4.055846,Association1901,Sport | Handball,,2,"Shop, Event",1653775200,1774981970,110,FFHB,5610029@ffhandball.net,
398284,Interlink UTT,Interlink est l'association de l’UTT qui aide les étudiants français et étrangers à mieux se connaître entre eux en organisant des voyages et activités à Troyes et ces alentours.  ,/associations/interlink-utt,https://cdn.helloasso.com/img/logos/croppedimage-d5631300d91348ab9cedc7cd455fd978.png,https://cdn.helloasso.com/img/photos/croppedimage-3cbde0b8811d4fe99cc6105549c5752b.png,Troyes,10000,Aube,Grand Est,12 Rue Marie Curie,48.272346,4.07644,Association1901,Voyages | Étudiants | Réseaux pros et étudiants,,1,Event,1683064800,1774634656,110,,interlink@utt.fr,0651150734
118910,Amis du Musée Camille Claudel,Découvrir et faire rayonner l’art et la culture à travers l’oeuvre de Camille Claudel. Valoriser les actions de son Musée à Nogent-sur-Seine.,/associations/amis-du-musee-camille-claudel,https://cdn.helloasso.com/img/logos/amis du musee camille claudel-f7b4e6eb5e014801b7669d6e255236aa.jpg,https://cdn.helloasso.com/img/photos/valse des valses-789d4a097c8b47f6b71a0ae0e34be2a4.jpg,Nogent-sur-Seine,10400,Aube,Grand Est,2 rue des Capucins,48.496917,3.497762,Association1901Rig,Arts | Culture | Musées | Arts et Culture,Don | Journee-patrimoine,4,"Event, Donation, Membership",1542668400,1774711786,110,SiteW,camilleclaudel.nogentsurseine@gmail.com,
573567,ASSOCIATION AMELYNE,"Amelyne a pour objet de créer du lien entre les êtres humains de différentes générations et accompagner dans la recherche d’épanouissement personnel (tant physique, mental que culturel) ",/associations/association-amelyne,https://cdn.helloasso.com/img/logos/croppedimage-c57655a15feb4cb09d2758a3b4c4ead0.png,https://cdn.helloasso.com/img/photos/croppedimage-57f66d9633b34932ae746859547346f5.png,Buchères,10800,Aube,Grand Est,5 rue de l'Égalité,48.233619,4.104973,Association1901,Arts | Culture | Recherche | Arts et Culture,,2,Event,1740697200,1775052443,110,,surmesureaube@gmail.com,
534352,Les Ailes de L'EPF,"Les Ailes de l'EPF est l’association aéronautique du campus de l'EPF Troyes. Rassemblant des passionnés d'aviation, elle vise à faire découvrir et promouvoir le domaine de l’aéronautique auprès des étudiants.",/associations/les-ailes-de-l-epf,https://cdn.helloasso.com/img/logos/croppedimage-f44418d3b77c43f8b4be6f04beed30c0.png,https://cdn.helloasso.com/img/photos/croppedimage-0ea65ee82fca4e7e8e5c12110161ddfb.png,Rosières-près-Troyes,10430,Aube,Grand Est,2 Rue Fernand Sastre,48.270002,4.064246,Association1901,Étudiants | Sport,,1,Event,1726783200,1774528879,110,,ADE@epfedu.fr,0767170594
433665,ASSOCIATION DES PARENTS D'ELEVES DE VERRIERES,"L'APEV a pour objet la défense des intérêts moraux et matériels des élèves de la commune. Elle a également pour rôle d'organiser des manifestations pour les enfants telles que : loto des écoles, color run, ateliers créatifs... L'ensemble des bénéfices étant reversé aux écoles de la commune.",/associations/association-des-parents-d-eleves-de-verrieres,https://cdn.helloasso.com/img/logos/croppedimage-0b2d7da5ee09461aa1686a8b3185c2c8.png,https://cdn.helloasso.com/img/photos/croppedimage-f7e62f3c0ff24d4daf66cb8fa385af3a.jpg,Verrières,10390,Aube,Grand Est,1 Rue des Ecoles,48.231362,4.147473,Association1901,Enfance | Loterie | Education,,1,Shop,1695074400,1775022630,110,,apev10390@gmail.com,0668185868
520759,Fédération de pêche de l'Aube et protection milieu aquatique,"La fédération de pêche de l’Aube a deux missions : la protection des milieux aquatiques et le développement de la pêche de loisir. Avec la création de la Maison de la Pêche, la fédération peut vous proposer un programme diversifié d’animations pêche et de découvertes des milieux aquatiques.",/associations/federation-de-peche-de-l-aube-et-protection-milieu-aquatique,https://cdn.helloasso.com/img/logos/croppedimage-1b915b5d67a749769078b3cd4b4db69f.png,https://cdn.helloasso.com/img/photos/croppedimage-0cb2b3d8009d47ecb9d6e81a5a1fbc22.png,Lusigny-sur-Barse,10270,Aube,Grand Est,8 Route de Montreuil,48.244218,4.27957,Association1901Rup,Environnement | Pêche | Loisirs,,4,Event,1721340000,1774645724,110,,contact@fedepeche10.fr,0325733582
321720,Troyes OS Noes Tennis de table,"Promotion du tennis de table pour tous : - Ecole de tennis de table pour jeunes débutants - Ping loisirs pour tous, femmes, hommes quel que soit l'âge, - Compétitions tous niveaux - Entraineur salarié diplômé d'Etat - Actions vers publics prioritaires : jeunes quartiers défavorisés, adultes ",/associations/troyes-os-noes-tennis-de-table,https://cdn.helloasso.com/img/logos/croppedimage-738f5e8113cc49eaadd1828ba3f0275d.png,https://cdn.helloasso.com/img/photos/croppedimage-755eb8f34ad843e1aef37843a1208f0f.png,Troyes,10000,Aube,Grand Est,30d Boulevard Jules Guesde,48.291065,4.082318,Association1901Rig,Sport | Tennis | Tennis de table,,4,"Shop, Event, PaymentForm, Membership",1652133600,1774906130,110,,tosnoes10@gmail.com,0633359234
358492,Atscaf de l'Aube,"L'ATSCAF de l'Aube est une association à but non lucratif dont la vocation, est de proposer à ses adhérents la possibilité de pratiquer au coût le plus juste des activités variées dans les domaines du tourisme, du sport et de la culture.  La billetterie n'est accessible qu'aux adhérents !",/associations/atscaf-de-l-aube,https://cdn.helloasso.com/img/logos/croppedimage-02cf4c8c9ab94ba2836e56f353d8a277.png,https://cdn.helloasso.com/img/photos/croppedimage-7fd42890b7b842c5b9e687df49bf8446.png,Troyes,10000,Aube,Grand Est,22 Boulevard Gambetta,48.299395,4.072031,Association1901,Culture | Tourisme | Sport | Loisirs,,34,"Shop, Event",1669158000,1774875889,110,,atscaf.aube@dgfip.finances.gouv.fr,0689542794
449630,Les Gus 2.3," Les Gus 2.3, une association troyenne de passionnés de bières artisanales qui regroupe plus de 40 membres.  Notre idée est de faire découvrir à tous et toutes la scène brassicole française en pleine ébullition. ",/associations/les-gus-2-3,https://cdn.helloasso.com/img/logos/croppedimage-6fc3ad3e30a14447ae392a0e3a21dc55.png,https://cdn.helloasso.com/img/photos/croppedimage-a86b40b58ab447be91c27e8a9ac183ee.png,Sainte-Maure,10150,Aube,Grand Est,Sainte-Maure,48.345285,4.065826,Association1901,Arts | Culture | Artisanat et Cuisine,,4,"Shop, Event, Membership",1699916400,1774984689,110,,lesgus2.3@gmail.com,
652908,Comité des Fêtes de Coursan en Othe,"Bienvenue sur la boutique du Comité des Fêtes de Coursan en Othe ! Depuis 30 ans, le nouveau comité anime et égaie les rues et la salle des fêtes du village. Pour soutenir ou participer, vous trouverez ici adhésions, billetterie et goodies. Merci de votre soutien! https://www.site2.coursan.net",/associations/comite-des-fetes-de-coursan-en-othe,https://cdn.helloasso.com/img/logos/croppedimage-84e295d522b24f0f8f30cb3f9a64786c.png,https://cdn.helloasso.com/img/photos/croppedimage-482889be157f455981fdc218a88224ee.png,Coursan-en-Othe,10130,Aube,Grand Est,12 Grande Rue,48.070948,3.83976,Association1901,Loisirs,Comites-des-fetes,6,"Shop, Event, Membership",1772492400,1774263521,110,,contact@coursan.net,
435006,Têtes de Lin'Othe,"Association de parents d'élèves de l'école de l'Orée d'Othe du RPI Bucey-Fontvannes-Messon. Nous organisons diverses manifestations et ventes afin de récolter des fonds permettant de contribuer au financement des projets des enseignants pour nos enfants (sorties scolaires, voyage au ski etc...).",/associations/tetes-de-lin-othe,https://cdn.helloasso.com/img/logos/croppedimage-0692155c4c884dc0bfcf4f24a9610e0b.png,https://cdn.helloasso.com/img/photos/croppedimage-2ffd5968799f4e13aac4ced40e1aa7bd.png,Fontvannes,10190,Aube,Grand Est,1 Rue des Marais,48.275564,3.872429,Association1901Rup,Education | Enfance | Enseignement | Formation | Parents d'élèves | Ski | Voyages,,2,"Event, Membership",1695420000,1774942194,110,,tetesdelinothe@gmail.com,0785271276
478823,Louis l'Enfant Papillon,L'association a pour objet de faire connaitre l’épidermolyse bulleuse qui est une maladie génétique qui rend la peau aussi fragile que les ailes d’un papillon et de soutenir Louis au quotidien dans la maladie et les frais que cela engage.  ,/associations/louis-l-enfant-papillon,https://cdn.helloasso.com/img/logos/croppedimage-dbec0081129041afbd0909cc0b0533ef.png,https://cdn.helloasso.com/img/photos/croppedimage-a43bc2db5cf648899020918b1f0c53e7.png,Sainte-Savine,10300,Aube,Grand Est,20 Rue Volta,48.295658,4.056081,Association1901Rig,Animaux | Caritatif | Humanitaire | Santé,,3,"Event, Donation, Membership",1708642800,1774992913,110,,louislenfantpapillon@gmail.com,0676167310
642446,POP - Protection des Oubliés à Pattes,"Association POP - Protection des Oubliés à Pattes.  Nos engagements : Accueillir et sécuriser, soigner et réhabiliter, socialiser et redonner confiance, trouver des familles responsables et sensibiliser le grand public. ",/associations/pop-protection-des-oublies-a-pattes,https://cdn.helloasso.com/img/logos/croppedimage-2aaff1cb4939477692abcafefc69f531.png,https://cdn.helloasso.com/img/photos/croppedimage-039b2d5d77e34edd88ce482f13d43302.png,Saint-Julien-les-Villas,10800,Aube,Grand Est,9 Avenue de la Gare,48.267625,4.09055,Association1901,Caritatif | Humanitaire | Ecologie et Environnement,,2,"Donation, Membership",1768950000,1774706593,110,,,
317316,ASSOCIATION SPORTIVE DE L'UNIVERSITE DE TECHNOLOGIE DE TROYES,"L'AS UTT est l'Association Sportive de l'Université de Technologie de Troyes. Sa mission est de contribuer à la mise en oeuvre de la politique sportive et de dynamiser la vie étudiante au travers d'animations sportives diverses (voyages, événements, tournois, compétitions FFSU...).",/associations/association-sportive-de-l-universite-de-technologie-de-troyes,https://cdn.helloasso.com/img/logos/croppedimage-7c4df37a682a42a18aca81c0ab2ea716.png,https://cdn.helloasso.com/img/photos/croppedimage-56c9aad3d0e54efc856864bc4e4a1114.jpg,Troyes,10000,Aube,Grand Est,12 Rue Marie Curie,48.272346,4.07644,Association1901,Sport | Technologie | Voyages | Étudiants,,46,"Shop, Event, Membership",1650060000,1775055528,110,Zapier | Funbreak,asutt@utt.fr,
416768,Centre Culturel Rachi,"La Maison Rachi vous transporte au coeur de l’histoire d’une communauté millénaire et met en lumière ce personnage clé de l’histoire qu’est Rachi, et la communauté juive de Troyes. Une expérience d’ouverture et de transmission unique en France. Elle est ouverte à tous, juifs et non-juifs.",/associations/centre-culturel-rachi,https://cdn.helloasso.com/img/logos/croppedimage-12a7c05df325423fbf596870642ff47f.png,https://cdn.helloasso.com/img/photos/croppedimage-dcd8680e3e7d406ba1eca0e6099c2b5a.png,Troyes,10000,Aube,Grand Est,5 Rue Brunneval,48.296418,4.070812,Association1901,Arts | Culture | Religion | Patrimoine,,2,Event,1688421600,1774250501,110,,contact@rachi-toyes.com,03 25 73 53 01
608651,LES TROYES NOMADES,Embarquez avec nous pour le Trek'In Gazelles 2026.  Suivez-nous sur Instagram : les_troyes_nomades ,/associations/les-troyes-nomades,https://cdn.helloasso.com/img/logos/croppedimage-d38e096f0c4941628bb86818642ca2d1.png,https://cdn.helloasso.com/img/photos/croppedimage-db1351c4760d494bb4c835c135ab4dac.jpg,Buchères,10800,Aube,Grand Est,15 rue de la Liberté,48.232448,4.107964,Association1901,Humanitaire | Solidarité | Solidarité et Action Sociale,,3,"CrowdFunding, Shop, Event",1756159200,1774102833,110,,Lestroyesnomades@gmail.com,
451641,C qu'Ailes - du trauma à l'envol,"C qu’Ailes a pour mission d’accompagner et de soutenir les femmes victimes de toutes formes de violences sur le chemin de la reconstruction. Espaces de parole, d'ateliers, de rencontres, de conférences, d' événements solidaires et toute action favorisant l’entraide, l’écoute et le mieux-être.",/associations/c-qu-ailes-du-trauma-a-l-envol,https://cdn.helloasso.com/img/logos/croppedimage-4708d02952c34f10ad4747618500d2bf.png,https://cdn.helloasso.com/img/photos/croppedimage-f94c29c2ef8b4cb79af0cfc2a91f6f9c.png,Troyes,10000,Aube,Grand Est,8 Rue de la Grille de Fer,48.305351,4.058311,Association1901,Humanitaire | Solidarité | Solidarité et Action Sociale,,6,"Event, Membership",1700521200,1773920359,110,,cquailes.asso@gmail.com,0765166045
257438,FFMC10,"Depuis 1980, la FFMC agit pour développer la pratique des deux-roues motorisés ou engins assimilés. Elle défend, sans corporatisme, leurs utilisateurs en tant qu’usagers de la route, consommateurs et en tant que citoyens.",/associations/ffmc10,https://cdn.helloasso.com/img/logos/croppedimage-4443da07d5cb43609433f7c7e8954945.png,https://cdn.helloasso.com/img/photos/croppedimage-77661ca7ad1c441b98ef11b925a07362.png,Troyes,10000,Aube,Grand Est,63 Avenue Pasteur,48.302301,4.063003,Association1901,Humanitaire | Solidarité | Solidarité et Action Sociale,,3,"Shop, Event, Membership",1619042400,1774108816,110,,contact@ffmc10.fr,0681770172
624858,UN DEUX TROYES POLOGNE,"Que vous soyez passionné par la culture polonaise, désireux de retrouver vos racines ou simplement curieux de découvrir un peu de la « polska dusza » (l’âme polonaise), l’Association Un Deux Troyes Pologne vous accueille avec le sourire et le cœur ouvert. ??",/associations/un-deux-troyes-pologne,https://cdn.helloasso.com/img/logos/croppedimage-48a5909082314b69bbe4e2323051a37f.png,https://cdn.helloasso.com/img/photos/croppedimage-db2f9ec17d51446897bcfed926b81d29.jpg,Troyes,10000,Aube,Grand Est,32  Place,48.294805,4.070424,Association1901,Culture | Loisirs,,3,"Shop, Event, Membership",1761606000,1774612895,110,,undeuxtroyespologne@gmail.com,
575958,TROYES AUBE SPORTS NATURE,"Promouvoir la pratique du vol libre , particulièrement en parapente et des activités en plein air",/associations/troyes-aube-sports-nature,https://cdn.helloasso.com/img/logos/croppedimage-ec5866e200c3456aa1140bef435ca045.png,https://cdn.helloasso.com/img/photos/croppedimage-1b48fbec0e4f4e3bb45bef9acc558eba.png,Troyes,10000,Aube,Grand Est,63 Avenue Pasteur,48.302301,4.063003,Association1901,Sport,,2,"Shop, Membership",1741647600,1774598863,110,,tasn.aube@gmail.com,0651257517
264257,Theatre le Quai,"L’association Théâtre le Quai contribue à la mise en valeur du patrimoine artistique local et national, à la diffusion de la culture pour tous les publics, à la promotion de la création artistique sous toutes ses formes et à la programmation culturelle du Théâtre Le Quai à Troyes.",/associations/theatre-le-quai,https://cdn.helloasso.com/img/logos/croppedimage-a2728fd4580c4582a3a95968ea16ee95.png,https://cdn.helloasso.com/img/photos/croppedimage-83b48782bd4c4f31a108d5694b3008c0.png,Troyes,10000,Aube,Grand Est,5 Rue Leon Couturat,48.293549,4.06706,Association1901Rig,Arts et Culture | Arts | Culture | Informatique | Théâtre,,5,"Event, PaymentForm, Membership",1621807200,1774902325,110,OHME,contact@theatrelequai.fr,
514169,RUGBY CHAMPAGNE SAINT ANDRE LES VERGERS,RUGBY CHAMPAGNE SAINT ANDRE LES VERGER - RCSA,/associations/rugby-champagne-saint-andre-les-vergers,https://cdn.helloasso.com/img/logos/croppedimage-6fc0e6d7015e46cb927c3938410bd950.png,https://cdn.helloasso.com/img/photos/croppedimage-39bdebfabd0342abbe39981b90e340d6.png,Saint-André-les-Vergers,10120,Aube,Grand Est,9 Rue Amédée Gambey,48.280828,4.038357,Association1901,Sport | Rugby,,4,"Shop, Event, Donation, Membership",1718575200,1775038007,110,,stephanie.queirel@gmail.com,0663813489
536039,A2RM,Association de parents d'élèves qui a pour but de récolter des fonds destinés à soutenir l'action éducative des enseignants sans se substituer au rôle pédagogique de ceux-ci afin d'améliorer la vie scolaire des élèves.,/associations/a2rm,https://cdn.helloasso.com/img/logos/croppedimage-d6b4260c68044781ba2da50a7cff7814.png,https://cdn.helloasso.com/img/photos/croppedimage-1bcff16ae6dc430fb67cae10f3905a7f.png,Montaulin,10270,Aube,Grand Est,94 Grande Rue,48.252299,4.194153,Association1901,Education | Enseignement | Formation | Parents d'élèves,,1,Event,1727301600,1774640671,110,,assoa2rm@gmail.com,0610455085
345241,Humani3,"HUMANI3, l'association humanitaire et écologique de l’ESTP Troyes, réunit énergie et générosité pour de grandes causes. Chaque année, ses membres s'engagent avec passion pour organiser des événements tels que :  • Chantier solidaire • Don du Sang • Téléthon • Bingo • 4L Trophy  ",/associations/humani3,https://cdn.helloasso.com/img/logos/croppedimage-2ae19b3288f64489ade14f56d2ccec5f.png,https://cdn.helloasso.com/img/photos/croppedimage-4e1bf394cd3348f986277e001bd9df40.png,Rosières-près-Troyes,10430,Aube,Grand Est,1 Rue Fernand Sastre,48.269986,4.061779,Association1901Rig,Caritatif | Humanitaire | Sport automobile | Écologie | Solidarité et Action Sociale,Téléthon,3,"CrowdFunding, Shop, Membership",1663797600,1773319854,110,Vibly,humani3.estp@gmail.com,0604177719
