objectID,name,description,url,logo,banner,city,zipcode,department,region,address,lat,lng,org_type,category_tags,ha_tags,active_forms_count,active_forms_type,creation_date,last_order_date,score,partners,contact_email,contact_phone
593059,GENTES COMITIS - PROVINS 1152-1284,Gentes Comitis est une association de reconstitution historique centrée sur le début du XIIIème siècle sous les comtes de Champagne.  Nous présentons l'entourage de chevaliers lige du comte Thibault IV de Chamapgne (1201 - 1253) de la chatellenie de Provins: les chevaliers de Lourps.,/associations/gentes-comitis-provins-1152-1284,,https://cdn.helloasso.com/img/photos/croppedimage-7b64ce8fd09a4cdb94c94637ede6f009.jpg,Villenauxe-la-Grande,10370,Aube,Grand Est,4 Ruelle Fariat,48.587244,3.555745,Association1901,Arts | Culture | Patrimoine | Arts et Culture,,0,,1748383200,,80,,gentescomitis@gmail.com,
568766,PHIMADELPHIE COUNTRY,Coopérer dans une chaleureuse ambiance de générosité  Occulter ses soucis et tracas l'instant d'une soirée  Unir et consolider ses efforts en toute convivialité  Nouer des amitiés durables et sincères en toute honnêteté  Tapoter le sol en musicalité  Respecter les chorégraphies enseignées avec fidél,/associations/phimadelphie-country,,https://cdn.helloasso.com/img/photos/croppedimage-eee2d7257bc54b68a2d5d17156e049fa.png,Saint-Pouange,10120,Aube,Grand Est,"mairie,",48.240654,4.024746,Association1901,Arts | Culture | Arts et Culture,,0,,1738796400,,80,,phimadelphie@laposte.net,
564760,Loisirs et Bien-être Nogentais,"L'association Loisirs et Bien-être Nogentais propose de la rando santé, de la marche active et des ateliers bien-être.  Elle organise depuis 2024 un salon bien-être à Nogent-sur-Seine. ",/associations/loisirs-et-bien-etre-nogentais,,https://cdn.helloasso.com/img/photos/croppedimage-60d631a9545d4efd8edbce9b2e4846b9.png,Nogent-sur-Seine,10400,Aube,Grand Est,6ter Rue Anatole France,48.497491,3.504667,Association1901,Santé,,0,,1737500400,,80,,assolbnogentais@gmail.com,
563673,AKSVB - Association de Kungfu Shaolin Vu Ba,"Kungfu traditionnel et moderne, Taï Chi Chuan, Boxe Thaïlandaise",/associations/aksvb-association-de-kungfu-shaolin-vu-ba,,https://cdn.helloasso.com/img/photos/croppedimage-d2e13d18ba4946a6b0b430c4a557dc27.png,Troyes,10000,Aube,Grand Est,7 Impasse du Sommerard,48.306608,4.062794,Association1901,Sport | Boxe,,0,,1737241200,,80,,pdelau@outlook.com,
558443,UNASS 10 52,"L'UNASS AUBE HAUTE MARNE propose des formations citoyennes telles que les Gestes qui sauvent (GQS), le PSC (Premier Secours Citoyen), Aider sans se Cabosser mais également des formations professionnelles : Sauveteur Secouriste du Travail (SST), maintien des acquis (MAC SST), Incendie.  ",/associations/unass-10-52,,https://cdn.helloasso.com/img/photos/croppedimage-cec2d44387fe41579b6930dcfe115239.png,Sainte-Savine,10300,Aube,Grand Est,6 Rue Jean Marais,48.295679,4.03925,Association1901,Formation | Informatique | Premiers secours | Education,,0,,1735167600,,80,unass,president-aubehautemarne@unass.fr,
388412,EX-CD,r,/associations/ex-cd,,https://cdn.helloasso.com/img/photos/croppedimage-78e6ad60a73b4667aaf705917a3a326b.png,Troyes,10000,Aube,Grand Est,33 Rue Jules Lebocey,48.298454,4.071664,Association1901,Arts | Culture | Arts et Culture,,0,,1679785200,,80,,ex.cd.soundsystem@gmail.com,0763551506
377393,Jeunes du Barséquanais JMJ 2023 ,Parrainer 5 jeunes de la paroisse de Bar-sur-Seine (10) et leur donner la possibilité d'aller aux JMJ 2023 à Lisbonne.,/associations/jeunes-du-barsequanais-jmj-2023,,https://cdn.helloasso.com/img/photos/croppedimage-ccb63fb266c046e887f11240061e5304.png,Villemorien,10110,Aube,Grand Est,11 route de Polisot ,48.083315,4.301207,Association1901,Religion | Spiritualité,,0,,1676415600,,80,,leo.desimpel@orange.fr,0787923397
314596,VTT sur Seine,VTT,/associations/vtt-sur-seine,,https://cdn.helloasso.com/img/photos/croppedimage-fe7930f6095042f0a5bfcef5d0aef073.png,Gyé-sur-Seine,10250,Aube,Grand Est,Place de la mairie,48.029001,4.426802,Association1901,Sport | VTT,,0,,1648767600,,80,,vttsurseine@nacre.fr,0666547084
373024,Amicale des Parents d'Elèves de Buchères,"L'APE de Buchères est une association loi 1901, qui organise des évènements, des ventes au profit des enfants de l'école de Buchères. Certains ouverts à tous. Les fonds reversés servent à financer une partie des sorties pédagogiques, achat de matériel... Notre but est également de créer du lien!",/associations/amicale-des-parents-d-eleves-de-bucheres,https://cdn.helloasso.com/img/logos/croppedimage-e27396187fb14aaba294f4afe6c14e15.png,,Buchères,10800,Aube,Grand Est,1 Rue de la Mairie,48.235549,4.109951,Association1901,Education | Enfance,,17,"Shop, Event, PaymentForm",1675033200,1774988795,60,,apedebucheres@gmail.com,06615909200
501934,Tennis Club Sancéen,"Pratique du tennis dans un club familiale avec un moniteur diplômé d’Etat.  Nous disposons de 4 courts (2 couverts et 2 en extérieur), vestiaires, douches et Club House. ",/associations/tennis-club-sanceen,https://cdn.helloasso.com/img/logos/logo_FFT.png,,Saint-Julien-les-Villas,10800,Aube,Grand Est,26 Rue Voltaire,48.27524,4.105329,Association1901,Sport | Tennis,,1,Event,1714428000,1774711587,60,FFT,tresorerie.tcs@gmail.com,0674374707
384209,Arbres Remarquables de l'Aube,L'association Arbres Remarquables de l'Aube a pour but de contribuer à la mise en valeur et la préservation des plus beaux spécimens d’arbres du département de l’Aube. Elle est affiliée à l'association A.R.B.R.E.S.,/associations/arbres-remarquables-de-l-aube,https://cdn.helloasso.com/img/logos/croppedimage-632cf3021a444ac3a7133763268f7a20.png,,Sainte-Maure,10150,Aube,Grand Est,6bis Grande Rue,48.333356,4.074534,Association1901Rig,Environnement | Ecologie et Environnement,,3,"Event, Donation, Membership",1678575600,1774949766,60,,,
288497,Association Fées l'un pour l'autre ,"L'association Fées l'un pour l'autre vient en aide aux chats blessés, abandonnés, maltraités. Une fois soignés ils sont placés en famille d'accueil puis sont stérilisés, identifiés et proposés à l'adoption. ",/associations/association-fees-l-un-pour-l-autre,https://cdn.helloasso.com/img/logos/croppedimage-127135e0fafe4da8b6bfe5bc83c00d0f.png,,Marcilly-le-Hayer,10290,Aube,Grand Est,5 Rue Saint-roch,48.351112,3.633172,Association1901Rup,Animaux | Caritatif | Chats | Humanitaire,,2,"Donation, Membership",1634940000,1774696404,60,,mathildejourdheuil3@gmail.com,0665268680
420135,U.V.C.A. Troyes,,/associations/u-v-c-a-troyes,,https://cdn.helloasso.com/img/photos/croppedimage-9684f9350db4435f9daee37f70c73259.png,Troyes,10000,Aube,Grand Est,63 Avenue Pasteur,48.302301,4.063003,Association1901,Sport,,3,"Shop, Event",1689976800,1775052478,60,,bmx.uvcatroyes@gmail.com,0616798059
510947,APE Saint-Pouange,"Association des parents d'élèves de l'école de Saint-Pouange. Nous aidons au financement des sorties scolaires, participons à l'achat de matériel pédagogique pour les élèves.",/associations/ape-saint-pouange,https://cdn.helloasso.com/img/logos/croppedimage-97fa6c56a6ae44ceac7fd8949ecf5b66.jpg,,Saint-Pouange,10120,Aube,Grand Est,3 Rue Edouard Herriot,48.227032,4.042264,Association1901,Education | Humanitaire | Parents d'élèves | Solidarité,,1,Event,1717452000,1774179049,60,,stpouange.ape@gmail.com,0689941670
597912,LATINEA,,/associations/latinea,https://cdn.helloasso.com/img/logos/croppedimage-30f587e2d3104ebb8ef0ea01c768eb15.png,,Saint-André-les-Vergers,10120,Aube,Grand Est,30 Rue des Epingliers,48.267238,4.044007,Association1901,Arts et Culture | Arts | Culture,,4,"Shop, Event, Membership",1750370400,1774528296,60,,latinea.troyes@gmail.com,0784248080
200363,Les étincelles de Loucas ,Les étincelles de Loucas aide les familles d'enfant handicapé à financer des matériels et thérapies.,/associations/les-etincelles-de-loucas,https://cdn.helloasso.com/img/logos/les etincelles de loucas-bcfdb185e94c46dea0b7736b739920f8.bmp,,Merrey-sur-Arce,10110,Aube,Grand Est,31 Rue de l’Eglise,48.092338,4.387553,Association1901Rig,Enfance | Handicap | Humanitaire | Solidarité | Solidarité et Action Sociale,Don,3,"Donation, Membership",1586901600,1774345046,60,,lesetincellesdeloucas@gmail.com,0661722707
630726,SOUL'IN MOVE,La bachata et la kizomba sont au coeur de notre passion... ,/associations/soul-in-move,https://cdn.helloasso.com/img/logos/croppedimage-0025d432aa5c47a1b81d0246a1a0df4a.png,,Neuville-sur-Vanne,10190,Aube,Grand Est,2 rue du Quebec,48.253682,3.775551,Association1901,Arts | Bachata | Culture | Arts et Culture,,1,Event,1763766000,1772896570,60,,soulinmove@hotmail.com,
214842,Troyes Chante,L'association vise à organiser des concerts de chanson francophone à Troyes au théâtre Le Quai et dans le département de l'Aube.,/associations/troyes-chante,https://cdn.helloasso.com/img/logos/troyes chante-4a31f44fff1c442f973888da58ddf97c.png,,Saint-Germain,10120,Aube,Grand Est,19 Rue Maillet,48.255775,4.032875,Association1901Rig,Arts | Culture | Théâtre | Musique,Don,5,"Event, Membership",1596837600,1774948013,60,,,
529532,Up Stars Villenauxe Gymnastique,Enseignements des activités gymnique et acrobatique en loisirs et compétitions ,/associations/up-stars-villenauxe-gymnastique,https://cdn.helloasso.com/img/logos/croppedimage-a94e34e836d145cd9590133db6b61e10.png,,Villenauxe-la-Grande,10370,Aube,Grand Est,Rue Les prés du Château,48.582613,3.551228,Association1901Rig,Sport,,2,"Donation, PaymentForm",1725314400,1773334248,60,Gestgym | GoTombola,usvillenauxe.gymnastique@gmail.com,0632268035
545499,Eden Business Connect,Création d'évènement professionnel ,/associations/eden-business-connect,https://cdn.helloasso.com/img/logos/croppedimage-a2be2a7c61c6440890bbfe41c449d64b.png,,Troyes,10000,Aube,Grand Est,Troyes,48.292817,4.075149,Association1901,Professionnels | Étudiants | Réseaux pros et étudiants,,1,Shop,1730156400,1772583942,60,,ebc.asso@gmail.com,0645737477
371698,AS EPF Troyes,Association sportive étudiante de l'EPF Troyes.,/associations/as-epf-troyes,https://cdn.helloasso.com/img/logos/croppedimage-a3819d0cc4b74b97879c77bc7ed0df65.jpg,,Rosières-près-Troyes,10430,Aube,Grand Est,2 Rue Fernand Sastre,48.270002,4.064246,Association1901,Sport | Étudiants,Octobre-rose,16,"Shop, Event, PaymentForm, Membership",1674601200,1773416763,60,,bds-troyes@epfedu.fr,0695339794
649794,LISTE B EPF TROYES 2026/2027,"?? Chut… Notre nom et nos couleurs sont encore secrets ! Nous sommes la future liste BDE de l’EPF. Pour vous préparer une campagne inoubliable et un Révél explosif, on a besoin de vous. Soutenez notre équipe de l'ombre à l'aveugle pour financer nos surprises ! Merci à tous ! ?? ",/associations/liste-b-epf-troyes-2026-2027,https://cdn.helloasso.com/img/logos/croppedimage-631d40b6017f4a09b2dc0b9e08f587cb.png,,Rosières-près-Troyes,10430,Aube,Grand Est,2 Rue Fernand Sastre,48.269636,4.06252,Association1901,BDE | Étudiants | Education,,1,Event,1771282800,1773822296,60,,,
647360,RICEYS CYCLISME,"Club cyclisme, VTT, cyclo-cross, randonnée situé aux Riceys dans l'Aube.",/associations/riceys-cyclisme,https://cdn.helloasso.com/img/logos/croppedimage-f14ea2fd97444523b912b52e16777642.png,,Les Riceys,10340,Aube,Grand Est,35 Rue du Général de Gaulle,47.991861,4.365831,Association1901,Sport | Cyclisme | Randonnée | VTT,,1,Event,1770505200,,60,,,
543191,Human Law,"Human Law est une association à but non lucratif qui lutte contre la précarité alimentaire et l'isolement social. Elle organise des événements et actions solidaires à Troyes, Paris et Reims, visant à créer des liens entre les individus et à soutenir les plus démunis.",/associations/human-law,https://cdn.helloasso.com/img/logos/croppedimage-d978174da9b349eeabf4dee58c671bf5.png,,Romilly-sur-Seine,10100,Aube,Grand Est,Romilly-sur-Seine,48.510645,3.722976,Association1901,Solidarité et Action Sociale | Humanitaire | Solidarité,,1,Donation,1729375200,1769860812,60,,Humanlaw10@gmail.com,
568642,SAVEURS LOCALES,"Saveurs locales est une association basée à Jeugny dont les objectifs sont la promotion  des produits locaux, des circuits courts et des producteurs afin d’offrir des moments conviviaux, des produits délicieux et des sourires.",/associations/saveurs-locales,https://cdn.helloasso.com/img/logos/croppedimage-ba19010fb1ae4f849eb7e5fc80fa3996.png,,Jeugny,10320,Aube,Grand Est,32 grande rue,48.130203,4.035332,Association1901,Artisanat et Cuisine,,1,Membership,1738796400,1772908869,60,,asso.saveurslocales@gmail.com,
48642,PrépaTroyes,,/associations/prepatroyes,https://cdn.helloasso.com/img/logos/prepatroyes-c44ce1ff92874d2fbe8de1d59e52bcd2.png,,Troyes,10000,Aube,Grand Est,2 rue de Québec,48.269842,4.079845,Association1901,Education | Formation,,5,"Donation, Membership",1464213600,1773090106,60,,alexis.nez@ac-reims.fr,
216889,TROYES ROLLER,"L'association a pour but de régir, d'organiser, de développer le roller hockey, le roller en ligue et toutes les disciplines reconnues par la Fédération Française de Roller et Skateboard, (loisir et compétitions) ",/associations/troyes-roller,https://cdn.helloasso.com/img/logos/troyes roller-163d114d302a4a1e9d285d87073a19cb.png,,Troyes,10000,Aube,Grand Est,63 Avenue Pasteur,48.302301,4.063003,Association1901Rig,Sport | Hockey sur glace | Roller | Skate,,2,"Event, PaymentForm",1598479200,1773503912,60,FFRS,troyes.roller@gmail.com,0667001955
610378,Bureau des Arts de L EPF Troyes,"Le Bureau des Arts (BDA) fait vivre l’art et la culture sur le campus ! Concerts, soirées à thème, expositions, ateliers et projets créatifs rythment l’année. Que tu sois artiste confirmé ou juste curieux, le BDA est là pour révéler tes talents et dynamiser la vie étudiante. ",/associations/bureau-des-arts-de-l-epf-troyes,https://cdn.helloasso.com/img/logos/croppedimage-757d9cd940134ac9bfab26aa6bd3f6ed.jpg,,Rosières-près-Troyes,10430,Aube,Grand Est,2 Rue Fernand Sastre,48.269636,4.06252,Association1901,Arts | Culture | Étudiants | Arts et Culture,,1,Event,1756764000,1771244036,60,,bda-troyes@epfedu.fr,
274034,Le combat d'Anne-So ,"Sensibiliser le public sur le cancer du sein Organisation d'événements ,récolter des subventions pour venir en aide aux personnes atteintes du cancer . ""Je donne mon foulard  Qui traîne au fond du placard """,/associations/le-combat-d-anne-so,https://cdn.helloasso.com/img/logos/croppedimage-e11d0ed33448452a9e7c62be1a30e1eb.png,,Buchères,10800,Aube,Grand Est,22 Rue des Grands Nauzois,48.243211,4.100418,Association1901Rup,Cancer | Caritatif | Humanitaire | Santé,Octobre-rose,3,"Event, Donation, Membership",1626127200,1774628054,60,,Lecombatdanneso@laposte.net,
259819,Association ATHANOR,"ATHANOR est l'association  des formations Patrimoine de l'URCA, qui a pour but de fédérer les étudiants du Master et de la Licence pro autour de projets culturels, de soirées, et de les soutenir dans la réalisation de leurs projets professionnels et étudiants.",/associations/association-athanor,https://cdn.helloasso.com/img/logos/croppedimage-2952e39c2a8b48b7be6c63909ae7cb02.png,,Troyes,10000,Aube,Grand Est,Troyes,48.292817,4.075149,Association1901,Culture | Formation | Professionnels | Étudiants | Education,,4,"Donation, PaymentForm, Membership",1620424800,1772549293,60,,athanortroyes@gmail.com,
406746,Rugby Universite de technologie de Troyes,"Le RUTT est une association qui réunit la totalité des joueurs de l’AS RUGBY UTT. Nous sommes là pour augmenter la cohésion de l’équipe de rugby en organisant différents événements tels que des AfterWorks, des départs pour différents tournois ou encore un calendrier innovant du RUTT !",/associations/rugby-universite-de-technologie-de-troyes,https://cdn.helloasso.com/img/logos/croppedimage-65275e17c7794701808ec39067e5416f.png,,Troyes,10000,Aube,Grand Est,12 Rue Marie Curie,48.272346,4.07644,Association1901,Rugby | Sport,,4,Event,1685484000,1774471533,60,,rutt@utt.fr,0649701864
367655,Malice Day,Le Malice Day est un évènement annuel qui réuni amis et famille pour braver un parcours du combattant dans un cadre naturel. On vous donne rendez-vous pour relever notre défi ! ,/associations/malice-day,https://cdn.helloasso.com/img/logos/croppedimage-666d34af4ac64077b7978280c22d82f8.png,,Marolles-lès-Bailly,10110,Aube,Grand Est,24 Grande Rue,48.186444,4.348851,Association1901,Loisirs,,1,Event,1673218800,1774884625,60,,lisonflch@hotmail.com,0685264341
302101,UTT Marine,"Utt Marine, c'est l'association de Voile de l’UTT. Elle a pour but de rendre les sports nautiques accessibles à tous les étudiants !",/associations/utt-marine,https://cdn.helloasso.com/img/logos/croppedimage-1c30f921d73c4183aae6f11d54bb2cba.png,,Montgueux,10300,Aube,Grand Est,12 rue Marie Curie ,48.300497,3.965015,Association1901,Sport | Étudiants,,7,"Shop, PaymentForm, Donation, Membership",1642978800,1772805322,60,,marine@utt.fr,
74353,France alzheimer Aube,Soutenir les familles et malades d'Alzheimer et maladies apparentées,/associations/france-alzheimer-aube,https://cdn.helloasso.com/img/logos/france-alzheimer-aube-d499a6e0198b4373851bcd3658d28e5f.jpg,,Nogent-sur-Seine,10400,Aube,Grand Est,5 Rue des Ponts,48.494275,3.499059,Association1901Rig,Humanitaire | Solidarité | Santé,Urgence-solidaire,2,Donation,1515970800,1767078257,60,,contact10@francealzheimer.org,03 25 21 89 16
431220,Association The Lords of the floor ,"L'association LOTF a pour but d'accompagner, de promouvoir et de développer l'univers sportif, culturel,  artistique et social de la danse Breaking. Plus largement, elle accueille les autres danses hip-hop et offre une place aux activités urbaines parallèles.",/associations/association-the-lords-of-the-floor,https://cdn.helloasso.com/img/logos/croppedimage-46bcb835cb6945a3b3fdae8feb3ff366.png,,Troyes,10000,Aube,Grand Est,1 Rue de Darmstadt,48.303856,4.095137,Association1901,Arts et Culture | Arts | Culture | Danse | Hip-hop,,3,"Shop, Donation, Membership",1694383200,1773765598,60,,association.lotf10@gmail.com,0651866065
246081,mayflower,"Mayflower est une compagnie de théâtre qui propose des spectacles jeunes publics, tout public, des comédies, du clown, des textes émouvants, mais aussi des ateliers arts de la scène pour enfants, adolescents, adultes, personnes en situation de handicap... Le bonheur simple de se retrouver sur scène.",/associations/mayflower,https://cdn.helloasso.com/img/logos/mayflower-a5c5b397a8a94323bc9f1611f628afa3.jpg,,Troyes,10000,Aube,Grand Est,maison des associations 63 avenue pasteur,48.302301,4.063003,Association1901,Arts | Cirque | Culture | Enfance | Handicap | Théâtre | Arts et Culture,,1,Membership,1612825200,1768334803,60,,ciemayflower@gmail.com,0620531132
207568,Association Astronomique Auboise,Le ciel à notre portée,/associations/association-astronomique-auboise,https://cdn.helloasso.com/img/logos/croppedimage-81fe90e7449d4ea08709737f5213c452.png,,Sainte-Savine,10300,Aube,Grand Est,72 Avenue du General Gallieni,48.294034,4.055649,Association1901,Loisirs,,1,Membership,1591653600,1769543444,60,,assoastroauboise@gmail.com,
565652,Troyes Fight Club,"Du sport, de la lutte, des compétiteurs !",/associations/troyes-fight-club,https://cdn.helloasso.com/img/logos/croppedimage-4ecfaa4863c14a30b73aa1fd9d767768.png,,Troyes,10000,Aube,Grand Est,124 Avenue Robert Schumann,48.306363,4.094711,Association1901,Sport,,1,Membership,1737846000,1763291893,60,,Elton-azizi@outlook.fr,
613400,RÉVOLTÉ 6TM,Sound système activiste de l' Aube / Marne - Actif depuis 2008.,/associations/revolte-6tm,https://cdn.helloasso.com/img/logos/croppedimage-292c8dc55ce8490882e557f1947eba00.png,,Pel-et-Der,10500,Aube,Grand Est,35 grande rue de Der,48.395524,4.414831,AssociationProprietaire,Arts | Culture | Arts et Culture,,2,"Event, Donation",1757800800,1762030994,60,,,
558007,Les Anciens de la Viti de Bar,Nous avons pour mission de soutenir la formation des jeunes apprentis viticulteurs en soutenant leurs projets et en favorisant la modernisation de leurs installations.,/associations/les-anciens-de-la-viti-de-bar,https://cdn.helloasso.com/img/logos/croppedimage-33ed13bfbbb947258a07e1e9f2fae470.png,,Bar-sur-Seine,10110,Aube,Grand Est,1 Impasse De La Vigne,48.108844,4.388314,Association1901Rig,Formation | Étudiants | Education,,3,"Shop, Donation, Membership",1734735600,1759131730,60,,lesanciensdelavitidebar@gmail.com,0325298550
54883,Our Project,,/associations/our-project,https://cdn.helloasso.com/img/logos/our-project-037c51387881460db3f68c5c4c2bec9a.jpg,,La Chapelle-Saint-Luc,10600,Aube,Grand Est,1B Rue Veuve Bénard Bodié,48.312125,4.050307,Association1901Rig,Caritatif | Humanitaire | Solidarité et Action Sociale,,5,"CrowdFunding, Donation",1477260000,1761998710,60,,,
204042,ES MUNICIPAUX TROYES,initiation et perfectionnement dans l'activité football de 3 ans aux adultes,/associations/es-municipaux-troyes,https://cdn.helloasso.com/img/logos/croppedimage-cad35b2749c24c71bd97f32717ac8cd7.png,,Troyes,10000,Aube,Grand Est,Hôtel de Ville,48.280099,4.074346,Association1901,Sport | Football,,1,Membership,1589234400,1771524574,60,,esmtfoot@gmail.com,
49148,DiscTroy(es),"DiscTroy(es), club d'ultimate frisbee à Troyes",/associations/disctroy-es,https://cdn.helloasso.com/img/logos/disctroy-es.jpg,,Troyes,10000,Aube,Grand Est,"Maison des Associations, 63 avenue Pasteur",48.302301,4.063003,Association1901Rig,Sport,,3,"Shop, Donation, Membership",1465941600,1762543685,60,,disctroyes@gmail.com,0684064549
524904,Amicale du lycée Chrestien de Troyes,"L'Amicale du lycée CDT est une association dont le but est d'organiser tout au long de l'année scolaire des événements, des soirées, des moments conviviaux entre les personnels actuels et les anciens personnels du lycée!  Rejoignez-nous vite!",/associations/amicale-du-lycee-chrestien-de-troyes,https://cdn.helloasso.com/img/logos/croppedimage-81120d78f11a4037bb1dfa1e669941fe.png,,Troyes,10000,Aube,Grand Est,3 Rue de Quebec,48.269499,4.079798,Association1901,Education,,1,Membership,1723672800,1767789955,60,,,
390990,Arts et jeux sancéens,"Promouvoir et organiser des événements artistiques, culturels et ludiques en proposant régulièrement, des soirées thématiques ayant pour but de croiser différents domaines artistiques, culturels et ludiques (ex : projection d'un film en rapport avec un univers de jeu de société, suivi d'un débat).",/associations/arts-et-jeux-sanceens,https://cdn.helloasso.com/img/logos/croppedimage-caebac62972c4c0f982110527dc8eb25.png,,Saint-Julien-les-Villas,10800,Aube,Grand Est,76 Rue Fontenelle,48.27953,4.096465,Association1901,Arts | Culture | Jeux de société | Arts et Culture,,1,Membership,1680559200,1768291472,60,,arts.jeux.sanceens@gmail.com,0783682400
481950,La Chapelle Saint Luc AJCTB,"Pratique de Twirling Bâton, sport mélangeant danse, gym, maniement du baton et théâtre. En loisirs ou compétition. Tous niveaux et miste",/associations/la-chapelle-saint-luc-ajctb,https://cdn.helloasso.com/img/logos/croppedimage-bc90c7f2038744b884cc7da4224171aa.png,,La Chapelle-Saint-Luc,10600,Aube,Grand Est,Rue du Maréchal Leclerc,48.310953,4.04581,Association1901,Sport | Danse | Gymnastique | Théâtre,,1,Shop,1709506800,1769612997,60,,ajctwirlingbaton@gmail.com,0664249486
566364,NURSE CARE,"Améliorer l'accès au soin et promouvoir la santé pour tous, en apportant notre soutien aux personnes défavorisées sans distinction d'origine, de sexe, ou de religion, en France et à l'international",/associations/nurse-care,https://cdn.helloasso.com/img/logos/croppedimage-08fdcaeef0534478b980ec54d3c42219.png,,La Chapelle-Saint-Luc,10600,Aube,Grand Est,2 Impasse des Rosiers,48.309973,4.030003,Association1901Rup,Caritatif | Humanitaire | Religion | Solidarité et Action Sociale,,1,Donation,1738018800,1754929518,60,,asso.nursecare@gmail.com,
328053,Association Sportive de Payns,Association sportive gérant les équipes de football séniors et vétérans de la ville de PAYNS (10),/associations/association-sportive-de-payns,https://cdn.helloasso.com/img/logos/croppedimage-403dcb7d7db24968accb68697f7bfc15.png,,Payns,10600,Aube,Grand Est,Rue Hugues de Payns,48.382354,3.977341,Association1901,Sport | Football,,1,PaymentForm,1654812000,1771954894,60,,brice.martins.perso@gmail.com,0666626923
571668,LES DÉTREKMINÉES DE TROYES,"Nous sommes une association sportive (Angélique, Mathilde et Dorothée) et participons au TREK ROSE TRIP du Maroc du 30.10 au 05.11.2025. Il s'agit d'une marche de 21kms par jour dans le désert afin de soutenir les associations  Ruban rose, Enfants du désert, ainsi que Louis l'enfant papillon.",/associations/les-detrekminees-de-troyes,https://cdn.helloasso.com/img/logos/croppedimage-ddf6ae26fffc40319e3fa95e234008ad.png,,Saint-Julien-les-Villas,10800,Aube,Grand Est,14 Rue de la Libération,48.269506,4.096385,Association1901,Animaux | Enfance | Solidarité et Action Sociale,,1,Donation,1739919600,1754562996,60,,lesdetrekmineesdetroyes@gmail.com,
331508,Union Sportive Sainte Maure Handball ,Club de Handball,/associations/union-sportive-sainte-maure-handball,https://cdn.helloasso.com/img/logos/croppedimage-2dd213ce55374bfc91c7a645ffd30250.png,,Sainte-Maure,10150,Aube,Grand Est,Place Joseph Fimbel,48.346594,4.059845,Association1901,Sport | Handball,,1,Membership,1656021600,1774701821,60,FFHB,saintemaurehandball@gmail.com,0325769360
463328,CERCLE OFFICIEL DES INTERNES DE TROYES,Cercle officiel des internes de Troyes,/associations/cercle-officiel-des-internes-de-troyes,https://cdn.helloasso.com/img/logos/croppedimage-d94ad0757f6c4677bd9a286c5ff63edf.png,,Troyes,10000,Aube,Grand Est,101 Avenue Anatole France,48.279897,4.068811,Association1901,Étudiants | Réseaux pros et étudiants | Spiritualité,,2,"Membership, Event",1704582000,1761934555,60,,internat.coit@gmail.com,
