objectID,name,description,url,logo,banner,city,zipcode,department,region,address,lat,lng,org_type,category_tags,ha_tags,active_forms_count,active_forms_type,creation_date,last_order_date,score,partners,contact_email,contact_phone
439214,Église cathare de France,Association cultuelle participant à la résurgence du catharisme.,/associations/eglise-cathare-de-france,,https://cdn.helloasso.com/img/photos/croppedimage-6e8e85c4e99c44d49d86da84c38f802b.png,Carcassonne,11000,Aude,Occitanie,10 D rue Alfred de Musset,43.21982,2.343916,Association1901,Religion | Spiritualité,,3,"Shop, Donation, Membership",1696802400,1769101702,80,,admin@catharisme.eu,0662494652
439186,Culture et études cathares,"Recherches et études à propos du catharisme et défense des int""érêts du catharisme d'aujourd'hui. Association strictement laïque.",/associations/culture-et-etudes-cathares,,https://cdn.helloasso.com/img/photos/croppedimage-7229f189f2a94b1f97af387b44ac132b.png,Carcassonne,11000,Aude,Occitanie,10 D Rue Alfred de Musset,43.21982,2.343916,Association1901,Arts | Culture | Sciences et Technologie,,2,"Donation, Membership",1696802400,1774364343,80,,admin@catharisme.eu,0662494652
572195,Un volant pour Enzo ,"Accompagner les enfants et adultes, en situation de handicap, dans la découverte et la pratique des sports mécaniques.Organisation d'événements sur circuit et à l'extérieur. ",/associations/un-volant-pour-enzo,,https://cdn.helloasso.com/img/photos/croppedimage-985a0667e64942b7a09aec378a808d4a.png,Pieusse,11300,Aude,Occitanie,14 Chemin de Fourques,43.076581,2.242004,Association1901,Sport | Enfance | Handicap,,2,"Event, Membership",1740178800,1762627938,80,,unvolantpourenzo.co@gmail.com,
384078,Minervois Handball Club,"Club de handball dans le minervois,  département de l'aude. ",/associations/minervois-handball-club,,https://cdn.helloasso.com/img/photos/croppedimage-c82608859bc947299b074570b8f88e76.png,Caunes-Minervois,11160,Aude,Occitanie,7 Porte de Narbonne,43.326532,2.530898,Association1901,Sport | Handball,,1,Membership,1678489200,1758538154,80,FFHB,6111031@ffhandball.net,0679813137
578187,A LASSO DU 11,collectif d'artisans créateurs  occitan  Organisation évènement,/associations/a-lasso-du-11,,https://cdn.helloasso.com/img/photos/croppedimage-72ed5d45bda64a6f92d6e59f2f3cf495.png,Villeneuve-Minervois,11160,Aude,Occitanie,Lotissement La Blabine,43.318666,2.466304,Association1901,Arts et Culture | Artisanat | Arts | Culture,,4,"Donation, Event, Membership",1742425200,1754736767,80,,alassodu11@gmail.com,
497445,Las Festas d'aici ,"Des fêtes, des animations et des rencontres, pour petits et grands et le tout, dans la bonne humeur!",/associations/las-festas-d-aici,,https://cdn.helloasso.com/img/photos/croppedimage-f196259dbcc742afb9e18628cee7d4a6.png,Trausse,11160,Aude,Occitanie,28bis Rue Marcellin Albert,43.311325,2.564305,Association1901,Fête | Loisirs,,1,Event,1712959200,1751626971,80,,lasfestasdaici@gmail.com,0650253122
414196,Les compagnons de Segure,Acceder au programme du festival : https://www.theatre-de-segure.fr/festival-2025-accueil,/associations/les-compagnons-de-segure,,https://cdn.helloasso.com/img/photos/croppedimage-8d09cffba8184486a3e4bc9b1fd960c0.png,Tuchan,11350,Aude,Occitanie,Segure,42.923485,2.713171,Association1901Rup,Arts | Culture | Théâtre | Arts et Culture,,2,"Donation, Membership",1687903200,1754642772,80,,compasegure@gmail.com,0652263167
344729,le panier du dinosaure,"L’association Le panier du dinosaure a pour objet la mise en oeuvre de pratiques collectives, participatives et alternatives favorisant le lien social, l’expression de la citoyenneté active et le développement de l’économie locale et solidaire sur le territoire. ",/associations/le-panier-du-dinosaure,,https://cdn.helloasso.com/img/photos/croppedimage-68eb72d969044ec4a213555d1bf0718a.png,Albas,11360,Aude,Occitanie,Place de l'Eglise,43.006152,2.735004,Association1901Rig,Humanitaire | Solidarité | Économie | Ecologie et Environnement,,3,"Donation, PaymentForm, Membership",1663624800,1772643815,80,,nadine.bienfait@gmail.com,0652938300
359672,ASMVAL,"L’ASMVAL a pour objet principal la restauration, l’aménagement, la conservation et la mise en valeur du patrimoine architectural unique constitué par l’Abbaye de Lagrasse, classée Monument Historique, ses jardins et dépendances.",/associations/asmval,,https://cdn.helloasso.com/img/photos/croppedimage-a821a9b6355b45979a0100249542df9b.jpg,Lagrasse,11220,Aude,Occitanie,6 rive Gauche,43.090141,2.617022,Association1901Rig,Patrimoine | Jardinage | Monuments,,1,Donation,1669676400,1766743879,80,,asmval@obviews.fr,0643373773
546768,Les Mistigris Sallois,Association à but non lucratif de droit français régie par la loi du 1er juillet 1901 venant en aide aux chats errants sur la commune de Salles d'Aude (11).  Notre but étant d'effectuer le nourrissage des chats et réduire la prolifération des chats errants par la stérilisation de ces derniers.,/associations/les-mistigris-sallois,,https://cdn.helloasso.com/img/photos/croppedimage-52eefe3a72d243ceb547fbcf25337f4b.png,Salles-d’Aude,11110,Aude,Occitanie,1 Rue Voltaire,43.238821,3.118359,Association1901,Animaux | Chats | Environnement,,2,Donation,1730674800,1734015530,80,,lesmistigrissallois@gmail.com,0649596502
531133,Association Mosquée Essalam Carcassonne,"L'association de la mosquée Essalam, située à Carcassonne, est un pilier essentiel de la communauté musulmane locale. Depuis sa création, elle s'efforce de promouvoir les valeurs de paix, de solidarité et de respect à travers divers programmes et activités.",/associations/association-mosquee-essalam-carcassonne,,https://cdn.helloasso.com/img/photos/croppedimage-b9cb673fcb084b82b36e54baff6d2b7d.jpg,Carcassonne,11000,Aude,Occitanie,77 Bd I et Frederic Joliot Curie,43.216212,2.362867,Association1905,Religion | Solidarité | Solidarité et Action Sociale | Spiritualité,,4,"Donation, Membership",1725832800,1771546888,80,,contact@mosqueedecarcassonne.fr,+33 (en cours)
414651,Enfance Meurtrie Sans Frontières International,"Enfance Meurtrie Sans Frontières a pour vocation de s’occuper des orphelins et enfants vulnérables ainsi que des mères isolées dans les pays où les besoins se font sentir. Notre base pilote avec un orphelinat d'une quarantaine d'enfants est située à Abidjan, quartier Grand Bassam, en Côte d'Ivoire. ",/associations/enfance-meurtrie-sans-frontieres-international,,https://cdn.helloasso.com/img/photos/croppedimage-21d29bb81425453cab5c26456209e8a2.png,Limoux,11300,Aude,Occitanie,4 Avenue André Chénier,43.056622,2.221263,Association1901,Caritatif | Enfance | Humanitaire | Solidarité et Action Sociale,,3,"Donation, Membership",1688076000,1746546557,80,,kimbertranne@gmail.com,0659238754
21711,Charly's Angels,"Charly's Angels vient en aide aux chats FIV+ Notre association vient en aide aux chats porteurs du virus du FIV Nous les prenons en charge en les récupérant dans des fourrières de toute la France, ou bien suite à des appels de particuliers ou d'autres associations... ",/associations/charly-s-angels,,https://cdn.helloasso.com/img/photos/19075.jpg,Narbonne,11100,Aude,Occitanie,3 impasse de la liberté,43.190557,3.014438,Association1901Rig,Chats | Humanitaire | Solidarité | Animaux,Don,1,Donation,1351897200,1774950802,80,,charly-s-angels@hotmail.fr,
257716,Voiles à Bages,L'association a pour but de pérenniser la pratique du windsurf au départ de Bages.,/associations/voiles-a-bages,,https://cdn.helloasso.com/img/photos/croppedimage-9825fd2eba7e4de198223707d0a1ebe5.jpg,Bages,11100,Aude,Occitanie,30 Lotissement Village des Pecheurs,43.120819,2.986666,Association1901,Loisirs,,1,Membership,1619301600,1751817291,80,,voilesabages@gmail.com,
585795,LES TREIZISTES DU FCL 13,"L’association Les 13istes du FCL 13 a pour mission de rassembler, dynamiser et faire vivre la grande famille du FCL 13 autour de valeurs fortes : le partage, la convivialité et la transmission. ???  Afin de concrétiser nos futurs projets, nous faisons appel à votre soutien.",/associations/les-treizistes-du-fcl-13,,https://cdn.helloasso.com/img/photos/croppedimage-ac596fdb37284ccba97afe28feb7ee52.png,Lézignan-Corbières,11200,Aude,Occitanie,9 B avenue Charles Cros,43.190214,2.759361,Association1901,Solidarité et Action Sociale,,1,Donation,1745445600,,80,,l.cuellar0103@gmail.com,
574981,LES LAISSÉS POUR COMPTE ,"Le but est d'aider les personnes qui ne peuvent vivre décemment faute de moyens techniques et/ou de moyens financiers, cela s'adresse pour toutes personnes valides ou non et de l’enfance à l'âge avancé. ",/associations/les-laisses-pour-compte,,https://cdn.helloasso.com/img/photos/croppedimage-9201e58155b444248d192bda4178960d.png,Belvèze-du-Razès,11240,Aude,Occitanie,30 Avenue de l'Hôtel de Ville,43.124705,2.094891,Association1901,Enfance | Étudiants | Santé | Solidarité et Action Sociale,,1,Membership,1741302000,,80,,7711jocelyne.bruand@gmail.com,
434308,Institut écocitoyen en santé environnementale de l'Aude,L'Institut écocitoyen en santé environnementale de l'Aude (IECSEA) est une association indépendante qui répond aux questions des citoyens en matière de pollutions et d'impacts sur la santé au travers de recherches participatives. ,/associations/institut-ecocitoyen-en-sante-environnementale-de-l-aude,,https://cdn.helloasso.com/img/photos/croppedimage-1942c142d8fc4de5af57c1cb9fd708f3.png,Narbonne,11100,Aude,Occitanie,13 Rue Viollet le Duc,43.184524,3.005679,Association1901,Environnement | Ecologie et Environnement,,2,"Event, Membership",1695247200,1773851629,80,,institutecocitoyendelaude@gmail.com,0664356120
560919,TRIAL CLUB LES ROUES VERTES,"Club de trial motos anciennes, modernes et side-car situé à Ribaute dans les Corbières (Aude)",/associations/trial-club-les-roues-vertes,,https://cdn.helloasso.com/img/photos/croppedimage-cc4744f0e54c46229b9a5d0011764fc9.png,Ribaute,11220,Aude,Occitanie,15 Avenue des Corbières,43.107217,2.634944,Association1901,Sport | Moto,,1,Event,1736290800,1738867556,80,,lesrouesvertes11@gmail.com,
557617,Mille Poètes en Méditerranée,"programmation culturelle intergénérationnelle et plurielle, à La Place des Arts, 10 place Voltaire à Narbonne, de concerts, de rencontres littéraires et poétiques, de conférences, d’expositions accessibles à tous publics, un soutien solidaire aux pratiques et à la production artistique aux artistes ",/associations/mille-poetes-en-mediterranee,,https://cdn.helloasso.com/img/photos/croppedimage-c591f9f2f0b14cbabbe146af31a8aa06.png,Narbonne,11100,Aude,Occitanie,37 Rue des Lentisques,43.139495,2.967035,Association1901,Arts | Culture | Informatique | Littérature | Arts et Culture,,1,Membership,1734562800,,80,,millepoetes2@orange.fr,
35612,La Guinguette des Possibles,"La Guinguette des Possibles est un lieu de culture, de détente, de convivialité en mode Culture plein champ dans l'esprit guinguette avec une programmation musicale, pédagogique et culturelle responsable et équitable...",/associations/la-guinguette-des-possibles,,https://cdn.helloasso.com/img/photos/63389.jpg,Sigean,11130,Aude,Occitanie,23 rue Jacqueline Auriol,43.024071,2.986413,Association1901Rig,Culture | Humanitaire | Informatique | Mode | Solidarité | Loisirs,,1,Donation,1435615200,,80,,guinguettedespossibles11@gmail.com,0662801901
34266,la ruche de Treilles,"Cette association a pour objet de promouvoir l'économie local, la mise en relation de producteurs locaux et de consommateurs via le site de ""la ruche qui dit oui!"", des manifestations.",/associations/la-ruche-de-treilles,,https://cdn.helloasso.com/img/photos/60524.jpg,Treilles,11510,Aude,Occitanie,8 les carignans ,42.923695,2.945674,Association1901,Humanitaire | Solidarité | Économie | Réseaux pros et étudiants,,1,Donation,1429653600,,80,,laruchequiditouitreilles@live.fr,0611725315
473339,Association buenaventura aude ,"Association pour personnes en situation de handicap .  Réalisation d'ateliers , de journée en extérieur ou de week end.   Poterie, cuisine, écriture, lecture, sport ...  Journées sportives, culturelle ... ",/associations/association-buenaventura-aude,,https://cdn.helloasso.com/img/photos/croppedimage-303c012fc84745e19a4eb6e15127cb02.png,Carcassonne,11000,Aude,Occitanie,13 Rue des Pyrénées,43.207913,2.335394,Association1901,Cuisine | Culture | Handicap | Humanitaire | Lecture | Poterie | Solidarité | Arts et Culture,,1,Donation,1707260400,,80,,association.buenaventura.aude@gmail.com,0635234828
32426,ARTISTES & CHEMINS EN HAUTE VALLEE DE L'AUDE,"ARTISTES A SUIVRE. Durant 4 jours, 50 lieux publics et privés sont transformés en « galeries éphémères». Exigence artistique, qualité de la sélection, diversité, et présence requise de l'artiste pendant les 4 jours, sont  les composantes essentielles de la manifestation, et de son succès. ",/associations/artistes-chemins-en-haute-vallee-de-l-aude,,https://cdn.helloasso.com/img/photos/21099-1425295832056.jpg,Cassaignes,11190,Aude,Occitanie,2 RUE DU FAUBOURG,42.945017,2.298168,Association1901,Arts | Culture | Arts et Culture,,1,Donation,1425250800,1515319254,80,,,
30964,SYFSED,"La SYFSED a pour objet d'appuyer des actions dans les domaines de l'éducation/formation, de la santé préventive et de la souveraineté alimentaire afin de favoriser un développement autonome et solidaire des populations d’Afrique et d’Europe, pour une gestion durable des ressources.",/associations/syfsed,,https://cdn.helloasso.com/img/photos/49515.JPG,Carcassonne,11000,Aude,Occitanie,5 rue Emile Chabrier ,43.220408,2.33339,Association1901,Formation | Humanitaire | Solidarité | Solidarité et Action Sociale,,2,"Donation, Membership",1419289200,1480627246,80,,syfsed@laposte.net,
29040,Tous Aexequo ,Association ayant pour vocation la pratique du sport aux personnes handicapées afin de leur redonner la joie de vivre. Sensibilisation des enfants des écoles sur le handicap afin d'apporter un autre regard sur le handicap  .,/associations/tous-aexequo,,https://cdn.helloasso.com/img/photos/44838.jpg,Carcassonne,11000,Aude,Occitanie,Maison des sports,43.212161,2.353663,Association1901Rig,Enfance | Handicap | Humanitaire | Solidarité | Solidarité et Action Sociale,,1,Donation,1411509600,,80,,jeangeorge.chevalier@neuf.fr,0603986225
23215,lykemi,"lykemi est une ONG 2.0 qui mène des actions humanitaires capitalisant sur les relations personnelles de ses adhérents, et également à ses membres de conduire sous son égide des projets à leur initiative avec leurs proches et réseaux sociaux",/associations/lykemi,,https://cdn.helloasso.com/img/photos/21397.png,Carcassonne,11000,Aude,Occitanie,15 Chemin de Rieumajou,43.198697,2.397416,Association1901,Humanitaire | Solidarité et Action Sociale,,4,"Donation, Membership, CrowdFunding",1363129200,1400949787,80,,contactez-nous@lykemi.fr,0664634392
8052,l'Aude à la Poésie,"L'association désire mieux faire connaître la poésie et les poètes amateurs.  Nous organisons des expositions arts plastiques complétés par des poèmes, des scènes ouvertes, des concours, des ateliers d'écriture.",/associations/l-aude-a-la-poesie,,https://cdn.helloasso.com/img/photos/5332.jpg,Castelnaudary,11400,Aude,Occitanie,36 rue du Château d'Eau,43.321722,1.954416,Association1901,Arts | Littérature | Arts et Culture,,1,Donation,1345327200,,80,,audealapoesie@sfr.fr,
18716,Société Carcassonnaise de Protection Animale,"La Société Carcassonnaise de Protection Animale, SCPA ou appelée plus communément SPA de Carcassonne, se situe à Carcassonne, dans l'Aude (11).Elle accueille dans son enceinte une centaine de chiens ainsi qu'un centaine de chats.",/associations/societe-carcassonnaise-de-protection-animale,,https://cdn.helloasso.com/img/photos/15756.jpg,Carcassonne,11009,Aude,Occitanie,"Chemin de la SPA, BP600",43.21216201782227,2.353662967681885,Association1901,Animaux | Chats | Chiens | Humanitaire | SPA | Solidarité,,1,Donation,1347055200,,80,,laurene.d@hotmail.fr,
522451,Téléthon Razès 11 ,Association qui organise des manifestations. Tout les bénéfices sont reversés à l'AFM TELETHON,/associations/telethon-razes-11,,https://cdn.helloasso.com/img/photos/croppedimage-3860675971e14d9dae207f2243ddf10f.png,Belvèze-du-Razès,11240,Aude,Occitanie,Le Village,43.125727,2.095076,Association1901,Caritatif | Humanitaire,Téléthon,2,Event,1722290400,1726201194,80,,chantalmaligorne@gmail.com,0680589915
523627,Des Sons et des Liens,"L’asso «Des Sons et Des Liens» se donne pour objectif de favoriser le lien social et les échanges interpersonnels par tous moyens y compris artistiques ou pédagogiques. Elle soutiendra le vivre ensemble, la création de liens intergénérationnels.",/associations/des-sons-et-des-liens,,https://cdn.helloasso.com/img/photos/croppedimage-64fed4e87770462eb17be76240941874.png,Espéraza,11260,Aude,Occitanie,"1 Rue Jean Mermoz, Appartement 27, Bat Roussillon",42.93179,2.217938,Association1901,Arts | Culture | Arts et Culture,,1,Membership,1722895200,1727867381,80,,dessonsetdesliens@gmail.com,
523545,le café du village,café associatif  lieux d'échange et de convivialité,/associations/le-cafe-du-village,,https://cdn.helloasso.com/img/photos/croppedimage-f32caa0964db4f31a4419b5815762965.png,Duilhac-sous-Peyrepertuse,11350,Aude,Occitanie,7 Rue de l'Ecole,42.862872,2.566597,Association1901,Arts | Culture | Arts et Culture,,1,Event,1722895200,,80,,le.cafe.du.village.11@gmail.com,0629726148
307000,RALLYE AVENTURE OCCITANIE,L'association Rallye Aventure Occitanie organise des événements culturels et sportif autour de la culture Occitane.,/associations/rallye-aventure-occitanie,,https://cdn.helloasso.com/img/photos/croppedimage-bd24fbfe10834bf9be4c95ddfc6d1123.png,Vinassan,11110,Aude,Occitanie,7 Rue Voltaire,43.206343,3.073647,Association1901,Culture | Rallye | Sport,,1,Event,1645398000,1714681045,80,,rallye.aventure11@gmail.com,0672465458
500510,TEAM PAQUITO ,"Notre association a pour but de soutenir Paco Gutierrez dans la pratique du Motocross ( moralement, physiquement et financièrement). C'est un jeune déterminé, son but faire un excellent classement aux courses de prairie en 85cc cette année",/associations/team-paquito,,https://cdn.helloasso.com/img/photos/croppedimage-68ad2b7e88274e3eb655d2e3be9e2145.png,Chalabre,11230,Aude,Occitanie,17 Rue Capitaine Danjou,42.982351,2.008363,Association1901,Sport,,3,"CrowdFunding, Donation",1713909600,1713973739,80,,slavna.mineraux@hotmail.fr,0677470951
434497,NARBO NORDIK CLUB,"Notre club a pour vocation d'améliorer la condition physique et morale à travers la discipline ""Marche Nordique"". Nos entraînements précis et adaptés à chacun permettent aux adhérents de s'épanouir pleinement en constatant leur bien être s'accroitre. ",/associations/narbo-nordik-club,,https://cdn.helloasso.com/img/photos/croppedimage-b5ffbc9b9b714578ae0b239cadc3cb8f.png,Narbonne,11100,Aude,Occitanie,21 Rue Paul Philoctete,43.184086,3.020347,Association1901,Marche nordique | Sport,,1,CrowdFunding,1695247200,1710968593,80,BasicCompta,narbo.nordik.club@gmail.com,0787102893
488380,ASsociation de Défense des Droits des personnes en situation de Handicap - ASDDH,L’association ASDDH à trois axes : - L’insertion scolaire; - L’engagement sur l’ensemble professionnel; - Sur le soutien aux familles /ou leurs projets familiaux. Nous faisons en sorte que la Loi de 2005 et suivantes qui protègent les familles en situation de handicap soient respectées au quotidien.,/associations/association-de-defense-des-droits-des-personnes-en-situation-de-handicap-asddh,,https://cdn.helloasso.com/img/photos/croppedimage-da7fcef4d0064b4d9f52cbeaae745ea8.png,Espéraza,11260,Aude,Occitanie,1 Rue Condorcet,42.935103,2.220683,Association1901Rig,Handicap | Humanitaire | Professionnels | Solidarité | Solidarité et Action Sociale,,1,Donation,1710802800,,80,,contact@assoassddh11.org,0658830476
402392,Les Ice Angels d'Icemind,"Nous aidons les personnes en souffrance physique et/ou psychique.  En organisant des évènements hors-normes en lien avec le froid et les méthodes de santé naturelle (nos records du monde annuels, notamment)  Prochain défi:  Briser la glace pour sauver un enfant.  Samedi 14 octobre, à Gruissan. ",/associations/les-ice-angels-d-icemind,,https://cdn.helloasso.com/img/photos/croppedimage-0958657fd1d94d74adfb7a38991e4a1c.png,Narbonne,11100,Aude,Occitanie,20 Boulevard du Docteur Lacroix,43.180131,3.001962,Association1901Rup,Caritatif | Enfance | Humanitaire | Santé mentale | Santé,Don-75,3,"Donation, Membership",1684274400,1710270956,80,Zapier,jf@icemind.com,0666177768
405407,Liberalia,"Notre centre culturel accueillera à partir de 2024 des événements divers, dans la belle campagne du Minervois, entre Cité de Carcassonne, vignes et Canal du Midi.  Culture, art, solidarité, formation, lien social sont les cordes de notre arc. Participez à l'aventure ! ",/associations/liberalia,,https://cdn.helloasso.com/img/photos/croppedimage-d076b013c543485ba27b457aeac4a6bc.png,Badens,11800,Aude,Occitanie,Domaine Sainte-Eulalie,43.208416,2.500945,Association1901Rig,Arts | Culture | Formation | Solidarité | Arts et Culture,,2,"Donation, Membership",1684965600,1687784381,80,,contact@liberalia.fr,0643853535
384952,Le Bon Chemin Rouge,Cette association a pour objet : la recherche et la découverte du Bien-Être sous toutes ses formes en lien avec une éco-thérapie salutaire a l'ensemble du vivant.  Et notamment par la Connaissance de Soi au travers de la compréhension de son thème astral vu par l'Astrologie. ,/associations/le-bon-chemin-rouge,,https://cdn.helloasso.com/img/photos/croppedimage-b25d85d1af844938898e2c4ac89c5b7c.png,Laroque-de-Fa,11330,Aude,Occitanie,Route de Massac,42.952577,2.563293,Association1901,Arts | Culture | Recherche,,2,"Event, Membership",1678748400,1683925149,80,,leboncheminrouge@gmail.com,0683683277
381314,cyclo club Tuchan Corbieres,Club Cyclo des Hautes Corbières. Siège du Club TUCHAN 11350 Relancé après la difficile période du COVID.. Aujourd'hui une Douzaine de licenciés FFCT FFV,/associations/cyclo-club-tuchan-corbieres,,https://cdn.helloasso.com/img/photos/croppedimage-e27f848f9e1541da904375cd8335c8ee.png,Tuchan,11350,Aude,Occitanie,18 Rue Neuve,42.88994,2.717833,Association1901,Sport,,1,Event,1677625200,1680765771,80,,cycloclub.tuchancorbieres@gmail.com,0695089496
387212,La Boutique IDEAL,"Notre boutique solidaire, située 31 avenue Général Leclerc à Narbonne, propose des vêtements et accessoires de mode, et des créations de notre atelier Décomode à des tarifs solidaires. Nos salariés sont des personnes en transition professionnelle, bénéficiant d'un accompagnement individualisé.",/associations/la-boutique-ideal,,https://cdn.helloasso.com/img/photos/croppedimage-e921b708a8c746f69cdfaca3789ab42f.png,Narbonne,11100,Aude,Occitanie,9 Rue Nicolas Leblanc,43.159113,2.969485,Association1901,,,1,Donation,1679439600,1681570927,80,,c.madrieres@ideal-asso.eu,0650276009
288234,Influent Arts,Une association pour la promotion des arts influents,/associations/influent-arts,,https://cdn.helloasso.com/img/photos/croppedimage-68e8992903154cb0ab64422b580fc032.png,Carcassonne,11000,Aude,Occitanie,7 Allée Képler,43.209386,2.312966,Association1901,Arts | Culture | Arts et Culture,,1,Donation,1634770800,,80,,karen5@hotmail.fr,
285759,KtyCat Creation,"Création Graphique et Protection Animale, Des œuvres, pour aider les associations, une boutique d'objets en tout genre, des campagnes de mobilisation. Tout cela en visuels et en réel .",/associations/ktycat-creation,,https://cdn.helloasso.com/img/photos/croppedimage-2d40a3a5ccc74a7ca5ae477045c20326.jpg,Azille,11700,Aude,Occitanie,22bis Avenue du Minervois,43.278383,2.655583,Association1901,Arts | Culture | Animaux | Arts et Culture,,1,Donation,1633474800,,80,,ktycat.artdesign@gmail.com,0434442896
33322,AB AUTISME,"AB AUTISME, association d’intérêt  général, n'ayant aucune subvention, gère une structure comportementale pour enfants autistes de 2 à 14 ans, fonctionnant sur le modèle de la prise en charge ABA (Applied behavorial Analysis ou Analyse Appliquée du comportement).",/associations/ab-autisme,,https://cdn.helloasso.com/img/photos/57370.jpg,Narbonne,11100,Aude,Occitanie,20 avenue de Razimbaud,43.196223,3.01923,Association1901,Enfance | Handicap | Humanitaire | Solidarité | Santé,,2,Donation,1427065200,,80,,,
30360,Les Messagers du vent,“Les Messagers du vent” est une association familliale qui allie la navigation à  plusieurs actions solidaires lors d’un voyage en voilier au Sénégal dans le Siné Saloum,/associations/les-messagers-du-vent,,https://cdn.helloasso.com/img/photos/47612.png,Leucate,11370,Aude,Occitanie,600 quai du pla de l'entrée Mr van den Broeck,42.9106,3.0294,Association1901,Arts | Culture | Voyages | Solidarité et Action Sociale,,1,Donation,1414710000,1553681838,80,,contact@lesmessagersduvent.fr,0612125579
33367,Calandreta Lo Becarut,"Ecole associative (maternelle et primaire) d'enseignement de l'occitan en immersion pour un véritable bilinguisme. Ecole résolument tournée vers l'avenir, l'ouverture aux autres, au monde et plusieurs fois labellisée ""éco-école""",/associations/calandreta-lo-becarut,,https://cdn.helloasso.com/img/photos/21099-1427148820751.JPG,Sigean,11130,Aude,Occitanie,40 grand rue,43.029825,2.977405,Association1901Rig,Education | Enseignement | Formation,,1,Donation,1427065200,1631223825,80,,,
