objectID,name,description,url,logo,banner,city,zipcode,department,region,address,lat,lng,org_type,category_tags,ha_tags,active_forms_count,active_forms_type,creation_date,last_order_date,score,partners,contact_email,contact_phone
562198,Football club Corbières Méditerranée ,Le Football Club Corbières Méditerranée est devenu  l’un des plus gros club du département. Il regroupe  des footballeurs et footballeuses jeunes et moins jeunes de plus de onze communes du canton des Corbières Méditerranée.,/associations/football-club-corbieres-mediterranee,https://cdn.helloasso.com/img/logos/croppedimage-880218d206f94d03bdc1df28ab87b9d8.png,https://cdn.helloasso.com/img/photos/croppedimage-a8ffa70563914bc391fa3199deb8f480.png,La Palme,11480,Aude,Occitanie,97 Rue des Lavandières,42.977366,2.997317,Association1901,Football | Sport,,3,"Shop, Membership, CrowdFunding",1736722800,,110,,Francktrankilou@hotmail.fr,
518344,Malicious Seeker,Malicious Seeker est une association organisant des jeux de rôle grandeur nature et partageant le wargame elle est basée sur la commune de Castelnaudary.,/associations/malicious-seeker,https://cdn.helloasso.com/img/logos/croppedimage-e1f40391a245485b8a03c20163859175.png,https://cdn.helloasso.com/img/photos/croppedimage-0d8093718f6d4164af8fbcc994bcea36.png,Castelnaudary,11400,Aude,Occitanie,Castelnaudary,43.315108,1.959918,Association1901,Arts | Culture | Jeux | Loisirs | Arts et Culture,,1,Event,1720216800,,110,,malicious.seeker@gmail.com,
264466,Barri del Rock,"Cette association à but non lucratif a pour objet la promotion des musiques actuelles et amplifiées, à travers les spectacles amateurs d’un groupement de musiciens bénévoles.",/associations/barri-del-rock,https://cdn.helloasso.com/img/logos/croppedimage-fcdd5d56d0434fbaa9c4a83df093ad40.png,https://cdn.helloasso.com/img/photos/croppedimage-1d7d318fd64247cfbe4b42a1d68422ee.png,Palaja,11570,Aude,Occitanie,3bis L’Oliveta,43.1678,2.391727,Association1901,Arts | Culture | Musique,,1,Membership,1621980000,1739864066,110,,barridelrock@gmail.com,
373273,ECOLE DES NOUVELLES FEMMES,"Une communauté SORO-FRATERNELLE d’échange, d’expérimentation et de partage qui œuvre à rév(e)éler la puissance du féminin au service du monde d’aujourd’hui et de demain. ",/associations/ecole-des-nouvelles-femmes,https://cdn.helloasso.com/img/logos/croppedimage-94e1d70e24bd49a39892da7d265204fd.png,https://cdn.helloasso.com/img/photos/croppedimage-b20326c17502413aa0238b6ecae1b331.png,Sigean,11130,Aude,Occitanie,2 Route de Portel,43.030134,2.974916,Association1901,Formation | Education,,1,Membership,1675119600,1771009178,110,,financier@ednf.fr,0682494278
547325,Association Syndicale des Familles du Lauragais,"L'ASF-CSF défend les droits des personnes et des familles.  Elle dispose: - d'un Espace de Vie Sociale avec des ateliers ( parentalité, intergénérationnel, échanges de savoirs, sorties, ateliers cuisine, couture…) - d'un chantier d'insertion professionnel  - d'un jardin partagé",/associations/association-syndicale-des-familles-du-lauragais,https://cdn.helloasso.com/img/logos/croppedimage-1c7a07e065ef4924851d3edaa53d1797.png,https://cdn.helloasso.com/img/photos/croppedimage-95a20dbb683742b7935a38787e0341a3.png,Castelnaudary,11400,Aude,Occitanie,26 Place de Verdun,43.319383,1.955549,Association1901Rig,Couture | Cuisine | Humanitaire | Jardinage | Professionnels | Solidarité | Solidarité et Action Sociale,,1,Donation,1730847600,1733862667,110,,asf.csf11@gmail.com,0468949803
551436,Association de sauvegarde du Château de Termes,"Bonjour, L'ASCT œuvre depuis plus de 40 ans à la valorisation du patrimoine de Termes dans les Corbières (Aude), particulièrement les vestiges du château de Termes et ses abords.  Le petit nombre de membres cherche a être soutenu dans ses actions. Merci !",/associations/association-de-sauvegarde-du-chateau-de-termes,https://cdn.helloasso.com/img/logos/croppedimage-16cf2c6ca9734d34b7c69fa3baa938f3.png,https://cdn.helloasso.com/img/photos/croppedimage-e3aa492d8b194a37a859fd7a2b2cc760.png,Termes,11330,Aude,Occitanie,Camin Dal Molin,43.000016,2.562316,Association1901,Patrimoine,,1,Membership,1732230000,,110,,asso.termes@gmail.com,0468700920
550553,ASSOCIATION AIDER PARTAGER REVITALISER INFORMER,"« Synergie Thérapeutique » avec un « volet » praticiens et un « volet » clients Praticiens : échanges de pratiques, de savoirs et de connaissances  Clients : aider à aller mieux, aide financière si besoin https://apriassociation.wixsite.com/apri",/associations/association-aider-partager-revitaliser-informer,https://cdn.helloasso.com/img/logos/croppedimage-2d17ed9daff0441dbeb3c15d98e6fd6f.png,https://cdn.helloasso.com/img/photos/croppedimage-723c88c5b2c84f8db5a2f93529c62fcd.png,Caunes-Minervois,11160,Aude,Occitanie,28 Allée d'Occitanie,43.328664,2.517791,Association1901,Formation | Santé | Education,,1,Event,1731970800,,110,,apri.association@gmail.com,0620252260
443148,Les 4 Z'ARTS de Fanjeaux,L'association les 4 Z'ARTS assure la promotion et la programmation d'événements culturels et le spectacle vivant sur la commune de Fanjeaux. Elle est affiliée à la Fédération des ciné-clubs de la Méditerranée (FCCM).,/associations/les-4-z-arts-de-fanjeaux,https://cdn.helloasso.com/img/logos/croppedimage-c5e238042c3b459eb9f01fe22d280ec7.png,https://cdn.helloasso.com/img/photos/croppedimage-876b8672774f448aa48e64b88829c15a.png,Fanjeaux,11270,Aude,Occitanie,4 Rue de la Porte du Marche,43.18749,2.033575,Association1901,Arts | Culture | Informatique | Arts et Culture,,1,Membership,1697925600,1708708321,110,,4zartsfanjeaux@gmail.com,0682685566
545628,Free Ride Moto Club,Free Ride Moto Club Association sportive affiliée à la FFM,/associations/free-ride-moto-club,https://cdn.helloasso.com/img/logos/croppedimage-870fa1b460854e6b98ed518510ec09f9.png,https://cdn.helloasso.com/img/photos/croppedimage-6df9b78b79c84979a1e3f164fd9d8b20.png,Bram,11150,Aude,Occitanie,RD 43 de Montréal,43.235233,2.118827,Association1901,Sport | Moto,,1,Event,1730242800,,110,,mxbram@orange.fr,0632657632
513209,Les frères Locomotive,"La compagnie Les frères Locomotive explore un univers musical et théâtral décalé et paradoxal, aux frontières du burlesque.  Elle propose des formes de spectacles modulables dans l'espace public, entre théâtre musical et cinéma d'ombres.",/associations/les-freres-locomotive,https://cdn.helloasso.com/img/logos/croppedimage-d40cc0246f4943f683529353d1362a79.png,https://cdn.helloasso.com/img/photos/croppedimage-f876493b0d8a42edb598fd98446e4d53.jpg,Villemoustaussou,11620,Aude,Occitanie,20 Chemin de Las Passos,43.258163,2.367655,Association1901,Arts | Cinéma | Culture | Théâtre | Arts et Culture,,1,CrowdFunding,1718143200,1731429763,110,,lesfrereslocomotive@gmail.com,0643318100
511113,LA MACHINE 1907,Groupe de supporter du Racing Club Narbonnais tribune Centrale Clape,/associations/la-machine-1907,https://cdn.helloasso.com/img/logos/croppedimage-1ea10014cabf468088be4dac7dbfd560.png,https://cdn.helloasso.com/img/photos/croppedimage-429e09381a36434da068fa7a9935f17b.png,Narbonne,11100,Aude,Occitanie,parc des sports,43.169309,2.991537,Association1901,Sport,,2,"Shop, PaymentForm",1717452000,1762281130,110,,lamachine1907@hotmail.com,0695949308
546864,La Chicane Production,Organisation d'évènements de musique électronique et de lutte pour le progrès social,/associations/la-chicane-production,https://cdn.helloasso.com/img/logos/croppedimage-97691988d1764dd388c1ed06fdf8d3f9.png,https://cdn.helloasso.com/img/photos/croppedimage-e32216403f8e4e36983ceb72f037d88e.png,La Palme,11480,Aude,Occitanie,783 Rue des Montpellières,42.980461,2.986431,Association1901,Arts | Culture | Musique électronique | Musique,,1,Shop,1730674800,1732273061,110,,lachicaneproduction@gmail.com,0783764610
442485,Mo-vèir,"Mo-vèir est une association d'intérêt général qui a pour but de promouvoir la santé par l'activité physique et par la sensibilisation.  Mo-vèir signifie ""bouger"" en occitan. Se bouger pour une cause en bougeant physiquement. "" Solidarité - Sport - Santé """,/associations/mo-veir,https://cdn.helloasso.com/img/logos/croppedimage-303d417f8f0445e4bceb081bf183da2d.png,https://cdn.helloasso.com/img/photos/croppedimage-47abadd612944b5aba709f1e5b8271c3.jpg,Carcassonne,11000,Aude,Occitanie,13 Rue Marcellin Berthelot,43.222383,2.351696,Association1901,Humanitaire | Solidarité | Santé,Movember,2,"Event, CrowdFunding",1697666400,1699710776,110,,moveir.contact@gmail.com,0602691965
248611,Le Guide du Flâneur,"Le Guide du Flâneur propose un tourisme solidaire et alternatif qui, à travers le plaisir de la rencontre et du partage, invite à agir sur de nombreux enjeux de société.",/associations/le-guide-du-flaneur,https://cdn.helloasso.com/img/logos/croppedimage-71f53498125c4e24baa0a8609d415784.png,https://cdn.helloasso.com/img/photos/croppedimage-0485ca737c594d58bd2f75d29f68c4c4.png,Roquefère,11380,Aude,Occitanie,Le Rampaillou,43.381731,2.381901,Association1901,Humanitaire | Solidarité | Tourisme | Solidarité et Action Sociale,,2,"Donation, PaymentForm",1614466800,1616231068,110,,info@leguideduflaneur.com,0616460734
377721,FAIRE ET AIDER UN POINT C'EST TOUT,"TOUTE FORME D'AIDE (BRICOLAGE,JARDINAGE, ADMINISTRATIF, INFORMATIQUE, GARDE DE CHIENS) AIDE AUX DEPLACEMENTS (ACCOMPAGNEMENT AUX COURSES, DEPLACMENT VERS LES MARCHES ET FOIRES) ORGANISATION D'EXCURSIONS ANIMATIONS",/associations/faire-et-aider-un-point-c-est-tout,https://cdn.helloasso.com/img/logos/croppedimage-45a9cb31212a4998a90a47106ad2deb4.png,https://cdn.helloasso.com/img/photos/croppedimage-52f6bc207d8e4f9eaf34f929ac81577b.png,Espéraza,11260,Aude,Occitanie,8 Rue Roland Garros,42.932672,2.215564,Association1901,Bricolage | Chiens | Humanitaire | Informatique | Jardinage | Solidarité | Animaux | Réseaux pros et étudiants,,1,Donation,1676502000,1676891891,110,,faire.et.aider@free.fr,0752059503
176397,defisdefilles.solidaires,Défis de filles est à la fois une association qui a pour objet de participer à des défis sportifs mais c'est aussi de soutenir des  associations caritatives ou humanitaires,/associations/defisdefilles-solidaires,https://cdn.helloasso.com/img/logos/defisdefilles solidaires-1d3314ada30a4e9e89c5677935f2e6a3.png,https://cdn.helloasso.com/img/photos/photo 4-94ce31ec00e648189850665ae63f83b3.png,Narbonne,11100,Aude,Occitanie,"19, rue mandarinier",43.198146,2.966779,Association1901,Caritatif | Humanitaire | Solidarité | Solidarité et Action Sociale,,1,Donation,1574031600,1582574854,110,,defisdefilles.solidaires@gmail.com,0680386008
113103,Les Festéjaïres du Cazal,Organisation de la fête au Cazal,/associations/les-festejaires-du-cazal,https://cdn.helloasso.com/img/logos/les-festejaires-du-cazal-191252d6724b4ce78b6dc37f76641429.jpg,https://cdn.helloasso.com/img/photos/157273-08f0fd4b4693408e813347ef154e7abe.jpg,Chalabre,11230,Aude,Occitanie,"Mairie de Chalabre, Cours Sully",42.982148,2.006105,Association1901,Fête | Humanitaire | Solidarité | Solidarité et Action Sociale,,2,"Donation, PaymentForm",1535925600,1552820244,110,,titoucnocquart@yahoo.fr,0674947546
51248,les cat's pattes,"notre mission est de nourrir , soigner , stériliser et mettre à l'adoption les chats errants de limoux et ses alentours.",/associations/les-cat-s-pattes,https://cdn.helloasso.com/img/logos/les-cat-s-pattes.jpg,https://cdn.helloasso.com/img/photos/86941.jpg,Cavanac,11570,Aude,Occitanie,47 place de la condamine,43.167768,2.32912,Association1901,Animaux | Chats,,1,Donation,1467583200,1467702045,110,,virginielainey@hotmail.com,0664453693
539130,Asteraé,"Notre association, localisée à Axat dans l'Aude, a pour missions d'accompagner les projets, ainsi que de réaliser des animations et des formations en faveur de l’environnement.",/associations/asterae,https://cdn.helloasso.com/img/logos/croppedimage-1f2cfb97bd224dbb8c4769e9ce9218ea.png,https://cdn.helloasso.com/img/photos/croppedimage-d601898156b4437baaabd7f82343dba0.jpg,Axat,11140,Aude,Occitanie,2 Impasse Ampere,42.802431,2.231652,Association1901Rig,Environnement | Formation | Ecologie et Environnement,,1,Donation,1728252000,,110,,contact@asterae.org,0645923810
168464,ADEFE,Asssociation de Développement de la Foire d'Espezel,/associations/adefe,https://cdn.helloasso.com/img/logos/adefe-115a515c2c2a4de08c3c36b3dd1dbe12.png,https://cdn.helloasso.com/img/photos/dsc04785-76baed99ad674b368af0ff336bd5e87b.jpg,Quillan,11500,Aude,Occitanie,15 Quai Pouzadou,42.873673,2.186165,Association1901,Humanitaire | Solidarité | Solidarité et Action Sociale,,1,Donation,1569535200,1573200886,110,,adefe@gmail.com,0468206795
164227,Paysans Terre Mer,Concevoir des nouvelles pratiques agricoles Terre Mer en réponse aux effets du réchauffement climatique,/associations/paysans-terre-mer,https://cdn.helloasso.com/img/logos/paysans terre mer-d15a8467f0e345a2816849e375d34741.jpg,https://cdn.helloasso.com/img/photos/ecailles-de8f4293e9cf43a888aa7126340a3ca5.png,Saint-Papoul,11400,Aude,Occitanie,9 Place de la Mairie,43.331225,2.035771,Association1901,Climat | Environnement | Ecologie et Environnement,,3,"Membership, Donation",1567116000,1647202175,110,,,
160098,Agir Pour Bénarès,Agir pour Bénarès en soignant les plus démunis ,/associations/agir-pour-benares,https://cdn.helloasso.com/img/logos/agir pour benares-12d9a473297f4ad095445a283824ae71.gif,https://cdn.helloasso.com/img/photos/img 20190728 181643-d3dbc83b8efb4a22a277892e4f5ed660.jpg,Fabrezan,11200,Aude,Occitanie,3 Rue du Moulin,43.136748,2.697726,Association1901,Caritatif | Humanitaire | Solidarité et Action Sociale,,1,Donation,1564264800,1632476571,110,,contact@agirpourbenares.org,
73906,Les Chats d'Oc,Les chats d'Oc - Narbonne Plage,/associations/les-chats-d-oc,https://cdn.helloasso.com/img/logos/les-chats-d-oc-712f6e251e4f4cefae1867659312220d.jpg,https://cdn.helloasso.com/img/photos/129928-cb8a259843dc4350871f42d2544ecf17.jpg,Narbonne,11100,Aude,Occitanie,2 rue des Pins Parasol,43.157208,3.160182,Association1901,Chats | Humanitaire | Solidarité | Animaux,,2,"Donation, Membership",1515452400,1515571811,110,,aliette.foulche@free.fr,06
300004,Association À l'Abri,Nous sommes des bénevoles engagés à protèger et deféndre les animaux non humains. Nous avons crée un refuge qui se trouve dans une petite enclave dans les montagnes et nous voulons maintenant construire des abris pour accueillir d'autres animaux en situation de détresse.  On a besoin de vous!,/associations/association-a-l-abri,https://cdn.helloasso.com/img/logos/croppedimage-2f403995ccdf4ef0adb8500551ed957f.png,https://cdn.helloasso.com/img/photos/croppedimage-ee7f80a0acf54a5a8b86eb46b70fd6e3.png,Saint-Jean-de-Paracol,11260,Aude,Occitanie,Moulin du Trou,42.931073,2.125721,Association1901,Animaux | Humanitaire | Solidarité,,1,Donation,1641769200,,110,,,
458999,association pour l'éducation audoise montessori,"L'APEAM est une structure associative située dans l'Aude (11), à Cuxac-Cabardès : nous participons au développement et au rayonnement  de la pédagogie Montessori dans l'Aude auprès de tout public et de chaque structure souhaitant nous rejoindre.",/associations/association-pour-l-education-audoise-montessori,https://cdn.helloasso.com/img/logos/croppedimage-42177ed503984214965f29146b5c011a.png,https://cdn.helloasso.com/img/photos/croppedimage-ff45c880227548d1a0b91a0fcd8ca110.png,Cuxac-Cabardès,11390,Aude,Occitanie,4 Rue Bellevue Cazelles,43.360996,2.276276,Association1901Rig,Formation | Education,Don,3,"Donation, CrowdFunding, Membership",1702940400,1731088073,110,,,
453063,LAP ROAD Production,"LAP ROAD Production, c'est une association, basée à Narbonne (11), spécialisée dans la production audiovisuelle.  Toutes nos productions ont récoltés plus de 2 millions de vues !  Des séries, des films, des reportages... on touche à tout !",/associations/lap-road-production,https://cdn.helloasso.com/img/logos/croppedimage-724d34df3e3b4654b051e4997c80b70f.png,https://cdn.helloasso.com/img/photos/croppedimage-effc3ee599884c709cb37ee51cc03dd3.jpg,Canet,11200,Aude,Occitanie,28 Traverse de Villedaigne,43.223352,2.853574,Association1901,Arts | Culture | Arts et Culture,,2,"Membership, Donation",1700953200,1721151451,110,,,
27497,CALECHES D'AUDE,"EVITER QUE LES ""GROS COEURS"" QUE SONT LES CHEVAUX DE TRAIT NE DISPARAISSENT...",/associations/caleches-d-aude,https://cdn.helloasso.com/img/logos/caleches-d-aude.jpg,https://cdn.helloasso.com/img/photos/43291.jpg,Fleury,11560,Aude,Occitanie,18  la Frégate II,43.18476,3.195497,Association1901,Animaux | Humanitaire | Solidarité,,1,Donation,1398981600,,110,,calechesdaude@live.fr,0651019022
26842,L'ETANGD'ART,"Toute notre énergie est consacrée à la médiation culturelle en arts plastiques au travers d'expositions d'art contemporain, de l'éducation populaire et de la jeunesse. Lien entre la création contemporaine et le public le plus large possible. ",/associations/l-etangd-art,https://cdn.helloasso.com/img/logos/l-etangd-artimg5.jpg,https://cdn.helloasso.com/img/photos/l-etangd-artimg1.jpg,Bages,11100,Aude,Occitanie,"8, rue de l'ancien puits",43.123416,2.992028,Association1901Rig,Arts et Culture | Arts | Culture,,1,Donation,1396562400,,110,,letangdart@wanadoo.fr,0468428111
193596,VICTIM-DMI,"Association Victim-DMI est une association loi 1901 créée en février 2020 qui a pour objectifs: INFORMER, SOUTENIR, AGIR en faveur des victimes d'implants médicaux",/associations/victim-dmi,https://cdn.helloasso.com/img/logos/croppedimage-0f4ba78eaaf1471e9eb699df0fce1335.png,https://cdn.helloasso.com/img/photos/croppedimage-50a9e0bfbbf642cea3c25756902f8e15.png,Ginestas,11120,Aude,Occitanie,Cite des Vignes 1,43.269286,2.878163,Association1901Rig,Humanitaire | Solidarité | Solidarité et Action Sociale,,2,"Donation, Membership",1582326000,1740576612,110,,brigitte..marty@victim-dmi.com,0674010784
61226,Le genivre,Le Génivre est une association qui promeut la joie de vivre ensemble en milieu rural !,/associations/le-genivre,https://cdn.helloasso.com/img/logos/le-genivre-775c10075db3454cb01a866e089a958f.png,https://cdn.helloasso.com/img/photos/108282.jpg,Termes,11330,Aude,Occitanie,Carriera de la gleisa,43.000407,2.562881,Association1901,Ecologie et Environnement,,1,Donation,1490997600,1498911286,110,,romaindejouvancourt@gmail.com,0646120086
260138,Narbo'chats,"Narbo'chats est une association d'utilité publique qui oeuvre à Narbonne pour la protection des chats et chatons de la rue. Nos bénévoles interviennent pour récupérer les chatons sauvages, trapper et stériliser les chats sauvages afin d'éviter les naissances massives, et soigner les chats de la rue.",/associations/narbo-chats,https://cdn.helloasso.com/img/logos/croppedimage-a487e4f645ac436db25d6d1566656f41.png,https://cdn.helloasso.com/img/photos/croppedimage-7dbc02eab1be4e4b860276230d2004cb.png,Narbonne,11100,Aude,Occitanie,13 Rue Paul Philoctete,43.184332,3.019633,Association1901Rup,Animaux | Chats | Humanitaire | Solidarité,Don,8,Donation,1620597600,1732807927,110,,narbochats@gmail.com,
253314,Les Saints-Chatnais,"Les Saints-Chatnais, ce sont à l'origine deux personnes qui veulent aider les nombreux chats errants d'un petit village du Sud !  Stérilisations, identifications, adoptions, soins, sauvetages urgents, éducation, aménagements d'abris, nourriture... Tout don sera le bienvenu pour nous aider, merci !",/associations/les-saints-chatnais,https://cdn.helloasso.com/img/logos/croppedimage-dbbd2990ccf54cd6b9d50c33c288b9b2.png,https://cdn.helloasso.com/img/photos/croppedimage-78d96c641dfb4c9cbd3f8725cb08f654.png,Saint-Jean-de-Barrou,11360,Aude,Occitanie,Saint-Jean-de-Barrou,42.961962,2.841508,Association1901,Chats | Humanitaire | Solidarité | Animaux,,1,Donation,1616540400,1659272020,110,,irisdouzet@gmail.com,
536031,LVcDR ,LVcDR a pour but de d'arrondir vaut fin de mois afin que vous puissiez profiter de votre temp. Pour ce faire nous utiliserons tous les moyens nécessaires a notre disposition notre premier service étant la revente de vêtements seconde main et prestations d'aide au personne en difficulté.,/associations/lvcdr,https://cdn.helloasso.com/img/logos/croppedimage-22e84a128a95413c8ccf21f06185e1b5.png,https://cdn.helloasso.com/img/photos/croppedimage-9828eb9c04fb441d94bf3ef79bfbdd12.png,Carcassonne,11000,Aude,Occitanie,Rue Josquin des Prés,43.217058,2.369809,Association1901,Humanitaire | Solidarité | Solidarité et Action Sociale,,1,Membership,1727301600,,110,,lvcdroses@gmail.com,0641333951
490051,Association Rassemblement pour Limoux,"Le Rassemblement pour Limoux est une association présidée par le député Julien Rancoule, active au sein de la vie municipale de Limoux.  Elle a pour mission de défendre les intérêts des citoyens et de proposer des solutions pour améliorer la gestion de la ville. ",/associations/association-rassemblement-pour-limoux,https://cdn.helloasso.com/img/logos/croppedimage-0096d2ce72dc4ed4ac5e551cdf65c14a.jpg,https://cdn.helloasso.com/img/photos/croppedimage-2050d804839a4c698167eceba578abfe.png,Limoux,11300,Aude,Occitanie,Limoux,43.049781,2.237853,Association1901,Réseaux pros et étudiants,,1,Membership,1711234800,,110,,rassemblement.limoux@gmail.com,0643615341
540656,rahpsody11,"                                                TEAM   M&M'S                              Association a but humanitaire ,loi 1901    - aidons les plus démunis  qui sont en réel besoin    - collecte de vêtements , couvertures , produits de premières nécessités    - dons financiers ,dons médicaments  ",/associations/rahpsody11,https://cdn.helloasso.com/img/logos/croppedimage-4814d2eb72d94f18933698678870cf4e.png,https://cdn.helloasso.com/img/photos/croppedimage-fff9bf5e2729433fb83decc01345acfe.png,Pépieux,11700,Aude,Occitanie,45 Rue Victor Hugo,43.296716,2.674296,Association1901Rup,Solidarité et Action Sociale | Caritatif | Humanitaire,,1,Membership,1728597600,,110,,,
347014,CLUB LEO LAGRANGE NARBONNE,Club de loisirs sportifs et artistiques pour toute la famille!,/associations/club-leo-lagrange-narbonne,https://cdn.helloasso.com/img/logos/croppedimage-539ea5bd0c4242728013cf7e607df1bb.png,https://cdn.helloasso.com/img/photos/croppedimage-07b33106b0b04110a23864a784355882.png,Narbonne,11100,Aude,Occitanie,27 Avenue de Lattre de Tassigny,43.191132,3.009188,Association1901,Arts | Sport | Loisirs,,1,Membership,1664488800,1744809437,110,,contact@leolagrange-narbonne.com,0468655726
533038,ASSO LUCIOLE,"L'ASSO LUCOISE QUI VOUS FAIT DU BIEN !  > BeauBar ouvert les mercredis matins et dimanches soirs  > Spectacles, concerts, jeux, festival Bal'Odrom et Bal'Ivern",/associations/asso-luciole,https://cdn.helloasso.com/img/logos/croppedimage-8715dc8acafe4c02b38cab11166d9f8b.png,https://cdn.helloasso.com/img/photos/croppedimage-a3e19d6c52d345d1925a495ac601fb59.png,Luc-sur-Aude,11190,Aude,Occitanie,Place du Foyer,42.958997,2.270293,Association1901,Arts | Culture | Jeux | Arts et Culture,,2,Event,1726437600,1731088877,110,,assoluciole11@gmail.com,
423120,HORS-CHAMPS FEUILLA,"Développer des projets culturels en lien avec le territoire et l'environnement qui l'entoure pour favoriser la rencontre et l'échange, impulser des dynamiques collectives autour de la création et pour sensibiliser le grand public aux enjeux de la paysannerie et plus largement à l'écologie ;  ",/associations/hors-champs-feuilla,https://cdn.helloasso.com/img/logos/croppedimage-8e727cfc42e845148dc90984c39bdb15.png,https://cdn.helloasso.com/img/photos/croppedimage-b9796d0f76fe451e899b20157e791692.png,Feuilla,11510,Aude,Occitanie,2 Rue de l'Aire,42.932319,2.912248,Association1901,Arts | Culture | Environnement | Écologie | Ecologie et Environnement,,1,Membership,1691618400,1712565517,110,,horschamps.feuilla@gmail.com,0687006948
529421,Les ludistes audois,"En rejoignant les Ludistes audois , vous adhérez à une communauté adulte (18ans et plus) réunie  autour de la pratique du jeu de société et aurez accès en illimité à toutes les sessions de jeux  organisées par l'association.",/associations/les-ludistes-audois,https://cdn.helloasso.com/img/logos/croppedimage-6ca2f2d608024bb5b7bec57ce89f7383.png,https://cdn.helloasso.com/img/photos/croppedimage-cadc2200d5954d0f95536a8a068d8376.png,Salles-d’Aude,11110,Aude,Occitanie,Place de l'Eglise,43.238535,3.116459,Association1901,Jeux | Jeux de société | Loisirs,,1,Membership,1725314400,,110,,lesludistesaudois@gmail.com,0641352693
423869,Association solidaire des Corbières - ASoC,"L'ASoC a pour objet de créer du lien dans le village de Ferrals-les-Corbières (Aude, Occitanie), par des actions et évènements solidaires: espaces de gratuité, ramassages de déchets, soirées jeux, balades familiales, repas, etc...",/associations/association-solidaire-des-corbieres-asoc,https://cdn.helloasso.com/img/logos/croppedimage-1ea5406c823d412f90ae55a006434339.png,https://cdn.helloasso.com/img/photos/croppedimage-0708ed96e3364d51b6fe5044de56a224.png,Ferrals-les-Corbières,11200,Aude,Occitanie,Ferrals-les-Corbières,43.148033,2.726272,Association1901,Humanitaire | Jeux | Solidarité | Loisirs | Solidarité et Action Sociale,,1,Membership,1692136800,,110,,contact@asoc11.org,
