objectID,name,description,url,logo,banner,city,zipcode,department,region,address,lat,lng,org_type,category_tags,ha_tags,active_forms_count,active_forms_type,creation_date,last_order_date,score,partners,contact_email,contact_phone
314928,ALPA Les Potes à Pouf,Association Lannemezanaise de Protection Animale  A.L.P.A Les Potes à Pouf refuge canin sis à Capvern 4500 route de Tarbes 65130,/associations/alpa-les-potes-a-pouf,https://cdn.helloasso.com/img/logos/croppedimage-8c83f6464e2c42928691c020856d720c.png,,Capvern,65130,Hautes-Pyrénées,Occitanie,4500 Route Départementale 817,43.116478,0.368937,Association1901Rup,Chiens | Environnement | Animaux,,2,"Shop, Membership",1648936800,1767865207,60,,potesapouf@gmail.com,0604066162
617725,LE NOUVEAU PLANNING FAMILIAL 65,"Association féministe d’éducation populaire qui lutte pour le droit à l’accès, à l’information, à l’éducation à la vie relationnelle et affective et à la santé sexuelle. Elle s’engage en particulier en territoire rural, inscrit ses actions dans le combat contre les inégalités et les oppressions.",/associations/le-nouveau-planning-familial-65,https://cdn.helloasso.com/img/logos/croppedimage-2e9f01aa00d4445cadc575dec590ad25.png,,Tarbes,65000,Hautes-Pyrénées,Occitanie,11 Rue de la Chaudronnerie,43.241796,0.075266,Association1901Rig,Féminisme | Humanitaire | Solidarité | Solidarité et Action Sociale,,2,"Donation, Membership",1759183200,1773843474,60,BasicCompta,contact@nouveauplanningfamilial65.fr,07 44 40 31 14
629125,COLLECTIF CELTIC,Le Collectif Celtic est une jeune association créée afin de préserver l’activité et l'identité du mythique Celtic Pub (bar culturel tarbais actuellement en vente). Nous souhaitons reprendre l’activité de manière collective sous forme de coopérative. ,/associations/collectif-celtic,https://cdn.helloasso.com/img/logos/croppedimage-9ee9e2a3108041cbb69a97483d7c5d2a.jpg,,Tarbes,65000,Hautes-Pyrénées,Occitanie,20 rue Des Pyrénées,43.230945,0.070272,Association1901,Culture | Humanitaire | Solidarité | Solidarité et Action Sociale,,1,Membership,1763161200,1768738877,60,,collectifceltic@gmail.com,
534828,Bramadub,"Association BRAMADUB est situé dans la vallée de la Barousse (65)  Tisseur de liens locaux et culturels    Elle a pour but l'organisation d'évènement tel que ""BRAM'A'DUB"" mais aussi d’offrir une structure pour les artistes et label musical.",/associations/bramadub,https://cdn.helloasso.com/img/logos/croppedimage-81449522bac34d29858a94ededb96fdf.jpg,,Bramevaque,65370,Hautes-Pyrénées,Occitanie,Bramevaque,42.978795,0.573519,Association1901,Arts | Culture | Arts et Culture | Musique,,1,Event,1726956000,1772199562,60,,Bramadub@gmail.com,0687511878
550339,Horgues Odos Football Club,Club de football des communes d'Horgues et Odos. Crée en 2013.,/associations/horgues-odos-football-club,https://cdn.helloasso.com/img/logos/croppedimage-8bfde79ae1a94b90bdec5f099e75eee6.png,,Horgues,65310,Hautes-Pyrénées,Occitanie,Rue de l’Agriculture,43.187483,0.085313,Association1901,Sport | Football,,2,"Shop, Membership",1731884400,1770669037,60,Team Pulse,csportif-hofc@orange.fr,0682174873
419513,POLE DANCE 65,Association enseignant la pole dance depuis 2013 dans les Hautes-Pyrénées ,/associations/pole-dance-65,https://cdn.helloasso.com/img/logos/croppedimage-786038a0996d4a128152903216d39658.png,,Lourdes,65100,Hautes-Pyrénées,Occitanie,Lourdes,43.104761,-0.046139,Association1901Rig,Sport | Enseignement,,2,"Shop, Donation",1689631200,1773992120,60,,flo.abbadie@wanadoo.fr,0677142070
631177,LOURDES VTT,Le club Lourdes VTT – Section BMX lance officiellement son équipe de Division Nationale 2 (DN2). C’est la première DN2 du département et de la région Occitanie!  Nous voulons permettre à nos pilotes de haut niveau de progresser tout en restant sur nos terres lourdaises. ,/associations/lourdes-vtt,https://cdn.helloasso.com/img/logos/croppedimage-d19bab0339bc457daea7428dfe0e59d7.png,,Lourdes,65100,Hautes-Pyrénées,Occitanie,2 Place de l'Abattoir,43.095643,-0.036258,Association1901Rig,Sport | BMX | VTT,,1,Donation,1763938800,1765731892,60,,lourdesvtt@gmail.com,
255756,F.C. Trie Rugby,Description bréve,/associations/f-c-trie-rugby,https://cdn.helloasso.com/img/logos/croppedimage-94132bf76f9645959b32c596d29a102b.png,,Trie-sur-Baïse,65220,Hautes-Pyrénées,Occitanie,Rue des sports,43.32298,0.370568,Association1901Rig,Sport,,2,Donation,1618092000,1671185384,60,,adeline.barbaresco@sfr.fr,
533376,Judo Odos,,/associations/judo-odos,https://cdn.helloasso.com/img/logos/croppedimage-1ce3a818a9d644b88d755041581969a6.png,,Odos,65310,Hautes-Pyrénées,Occitanie,13 Rue de Bigorre,43.198999,0.059409,Association1901,Sport,,2,"Shop, Membership",1726524000,1760469759,60,,judodos@gmail.com,0662110348
187233,ASSOCIATION JUMEAUX ET PLUS 65,,/associations/association-jumeaux-et-plus-65,https://cdn.helloasso.com/img/logos/association jumeaux et plus 65-8b21ee0a24ce495ea375817caa55f715.jpg,,Azereix,65380,Hautes-Pyrénées,Occitanie,8 ter chemin de juillan,43.209962,-0.00324,Association1901Rup,Solidarité et Action Sociale | Humanitaire | Solidarité,,1,Membership,1579129200,1773663586,60,,jumeaux.ad65@gmail.com,0671714646
248946,Craniopharyngiome Solidarité,"Association à but non lucratif (loi 1901) ayant pour objet de mettre en contact les familles concernées par le craniopharyngiome, les informer et organiser une entraide. ",/associations/craniopharyngiome-solidarite,https://cdn.helloasso.com/img/logos/croppedimage-ea7c76aa52f0479394f7b2e6a4361299.png,,Tarbes,65000,Hautes-Pyrénées,Occitanie,6 Rue Pasteur,43.236206,0.066661,Association1901Rig,Humanitaire | Solidarité | Solidarité et Action Sociale,Don,2,"Donation, Membership",1614639600,1774973258,60,,webmaster@craniopharyngiome-solidarite.org,
631833,LES JOLIS COEURS,"Association de soutien et de bien-être pour les personnes touchées par le cancer. Une parenthèse de douceur et d'estime de soi.  Offrir un moment de réconfort, de beauté et de sérénité à ceux qui traversent l'épreuve du cancer.  Parce qu'un soin, un sourire, une écoute peuvent tout changer...",/associations/les-jolis-coeurs,https://cdn.helloasso.com/img/logos/croppedimage-54b74a85c62445c7ba3abf3a4cc359ff.png,,Laloubère,65310,Hautes-Pyrénées,Occitanie,11 rue Marechal Foch,43.206604,0.073041,Association1901,Cancer | Humanitaire | Solidarité | Santé,,3,"CrowdFunding, Donation, Membership",1764198000,1764327180,60,,majoliebeauty65@gmail.com,
566295,Diversités en Pyrénées,"Créée le 10 novembre 2018, l’association Diversités en Pyrénées  a pour objet de valoriser les exceptionnelles diversités culturelles, naturelles et paysagères des Pyrénées, lesquelles méritent d’être  reconnues au niveau international.",/associations/diversites-en-pyrenees,https://cdn.helloasso.com/img/logos/croppedimage-1a4dbe4aea1e4810bbe7bb9726c1da5d.png,,Bagnères-de-Bigorre,65200,Hautes-Pyrénées,Occitanie,Bagnères-de-Bigorre,42.999349,0.128609,Association1901Rig,Patrimoine | Culture,,1,CrowdFunding,1738018800,1761239931,60,,robert.feiss@free.fr,
555749,Aidons Raphaël,L’Association a pour objectif de financer les prises en charge de Raphaël non remboursées par les organismes de santé ainsi que de créer du lien entre les familles de notre territoire concernées par les TND. Elle offre une aide concrète en mettant à disposition des outils pédagogiques et du conseil.,/associations/aidons-raphael,https://cdn.helloasso.com/img/logos/croppedimage-1fc4864bb053456d9c09a798cb41de3d.png,,Cizos,65230,Hautes-Pyrénées,Occitanie,route d'auch,43.269817,0.507214,Association1901,Humanitaire | Solidarité | Solidarité et Action Sociale,,1,Donation,1733785200,1746037675,60,,,
246605,FOOTBALL CLUB des ENCLAVES et du PLATEAU,L'Histoire a débuté en 1977 par l'Avenir Luquetois. Le Club a évolué pendant plus de 30 ans dans le district des Hautes-Pyrénées puis en 2012 lors des changements de statuts il est devenu le FCEP. Depuis de club évolue dans le district des Pyrénées Atlantique et compte près de 200 Licenciés,/associations/football-club-des-enclaves-et-du-plateau,https://cdn.helloasso.com/img/logos/croppedimage-3925eb8a82514602bc3909bf51012151.png,,Luquet,65320,Hautes-Pyrénées,Occitanie,Route du Stade,43.256408,-0.121766,Association1901,Sport,,1,Shop,1613170800,1772476470,60,,550537@lfaquitaine.fr,0610097794
502860,Bureaucraft,Association Bureaucraft - Loi 1901 Crafted events / événements sur mesure - 65200 - Bagnères-de-Bigorre,/associations/bureaucraft,https://cdn.helloasso.com/img/logos/croppedimage-127d5bb869a6494089894e0499be0c10.png,,Bagnères-de-Bigorre,65200,Hautes-Pyrénées,Occitanie,Place Achille Jubinal,43.063419,0.15026,Association1901,Arts | Culture | Arts et Culture,,2,"Membership, Donation",1714687200,1761987581,60,,hellobureaucraft@gmail.com,0632052967
581240,LA BALEINE DE CAMPAN,,/associations/la-baleine-de-campan,https://cdn.helloasso.com/img/logos/croppedimage-e67f36cd9fa949ad82fd64c07d3e8b4f.png,,Campan,65710,Hautes-Pyrénées,Occitanie,4268 chemin de Peyrehitte,42.948135,0.22661,Association1901,Arts et Culture | Arts | Culture,,1,Event,1743544800,1760906033,60,,labaleinedecampan@gmail.com,0562427297
499747,US MARQUISAT,Club où il fait bon vivre football,/associations/us-marquisat,https://cdn.helloasso.com/img/logos/croppedimage-37af99d1823e47e69265ae1367b6bce0.png,,Lanne,65380,Hautes-Pyrénées,Occitanie,49 Rue des Chênes,43.168834,0.006899,Association1901Rig,Sport | Football,,1,Donation,1713650400,1760384476,60,,517586@footoccitanie.fr,0688691388
620003,ASSOCIATION POUR LA CULTURE PAYSANNE,,/associations/association-pour-la-culture-paysanne,https://cdn.helloasso.com/img/logos/croppedimage-63a55dc707b34624a82c6561fb8bf694.png,,Bagnères-de-Bigorre,65200,Hautes-Pyrénées,Occitanie,21 rue des Thermes,43.063146,0.148146,Association1901,Arts et Culture | Arts | Culture,,1,Event,1759874400,1761830984,60,,conf65@orange.fr,
234883,Amicale des Sapeurs-Pompiers de Tarbes,"L'Amicale vient en aide aux Sapeurs-Pompiers, à leurs familles grâce à vos dons.",/associations/amicale-des-sapeurs-pompiers-de-tarbes,https://cdn.helloasso.com/img/logos/amicale des sapeurs pompiers de tarbes-6f93478d8b8e4b96bf49a7b9b2b87808.jpg,,Tarbes,65000,Hautes-Pyrénées,Occitanie,31 Boulevard Claude Debussy,43.21983,0.06739,Association1901,Protection civile | Réseaux pros et étudiants | Solidarité et Action Sociale,Sapeurs-pompiers,1,Donation,1607468400,1767173480,60,,amicale-csp-tarbes@orange.fr,0614572214
200856,Fit & Trail ,"Organisation d'événements sportifs (marches, trails et fitness) dans les Hautes-Pyrénées.",/associations/fit-trail,https://cdn.helloasso.com/img/logos/fit trail-d361b8d1752747019acb7ceef2cef320.jpg,,Capvern,65130,Hautes-Pyrénées,Occitanie,"679, Rue du 8 Mai 1945",43.105296,0.32364,Association1901,Sport | Fitness,,1,Event,1587247200,1756478580,60,,fitattitude65@gmail.com,0683503293
182936,AIME65,"L'Association Intempéries Météo65 a été créée à la suite des crues du mois de juin 2013. L'idée est de proposer notre aide à toute personnes ou entreprise sinistrée à la suite d'intempérie. l'association fédère des bénévoles prêts à aider en cas de besoin, à l'aide de matériel mis à disposition ",/associations/aime65,https://cdn.helloasso.com/img/logos/aime65-69e862011d3e411fbd15636d0e50cd6e.jpg,,Lourdes,65100,Hautes-Pyrénées,Occitanie,36 Rue de Pau,43.099072,-0.049781,Association1901Rup,Caritatif | Humanitaire | Solidarité et Action Sociale,,2,"Donation, Membership",1576364400,1755184140,60,,aime.meteo65@gmail.com,
602678,Mouledous animation,Mouledous animation permet de créer des liens entre les habitants du villages et des environs à travers diverses activités. Notamment la fête du village qui se tiendra le 15 août 2025,/associations/mouledous-animation,https://cdn.helloasso.com/img/logos/croppedimage-e79f397d7d14450e996f4769339ece5a.png,,Moulédous,65190,Hautes-Pyrénées,Occitanie,Place de la Mairie,43.228055,0.235623,Association1901,Fête | Loisirs,,1,Event,1752616800,1754916292,60,,mouledous.animation@gmail.com,
235159,Amicale Des Sapeurs Pompiers de LANNEMEZAN,,/associations/amicale-des-sapeurs-pompiers-de-lannemezan,https://cdn.helloasso.com/img/logos/croppedimage-0d2f273b803c460ba5fe721f7f494a6b.png,,Lannemezan,65300,Hautes-Pyrénées,Occitanie,Rue Sandrine Ortuso,43.120334,0.400501,Association1901,Loisirs,Sapeurs-pompiers,4,Donation,1607641200,1767387364,60,FNSPF,amicale.lannemezan@gmail.com,0647983101
227333,OAPHB,"En partage avec les habitants et les acteurs locaux, une équipe scientifique actualise l’approche que l’on peut avoir des ressources naturelles locales.",/associations/oaphb,https://cdn.helloasso.com/img/logos/oaphb-778d8b885f47416c8c4e79d7499a848d.png,,Bagnères-de-Bigorre,65200,Hautes-Pyrénées,Occitanie,1 Rue Larrey,43.063375,0.146499,Association1901Rig,Patrimoine,Don,3,"Donation, Membership",1604185200,1769319521,60,,,
296236,L'oiseau bleu de N'Zérékoré,"L’association ""L’Oiseau bleu de N’Zérekoré"" a été fondée le 25 janvier 2005 par  Marie Niambalamou Kolou. Le siège social est situé au 807 avenue de Tarbes à Maubourget (65700).  Notre projet est la création d'un centre d’accueil et d'hébergement pour venir en aide aux enfants en Guinée Conakry.",/associations/l-oiseau-bleu-de-n-zerekore,https://cdn.helloasso.com/img/logos/croppedimage-6bdccf7c5aad4c98abca76013f114325.png,,Maubourguet,65700,Hautes-Pyrénées,Occitanie,807 Avenue de Tarbes,43.454906,0.039527,Association1901,Animaux | Caritatif | Enfance | Humanitaire | Solidarité et Action Sociale,,1,Donation,1639350000,1640372949,60,,mzereko@gmail.com,0677148337
561564,Rock'n roses,"3 femmes engagées dans l'aventure Trek Rose Trip Maroc 2025 ! Du 30/10 au 4/11/2025, Virginie, Mathilde et Aurore seront dans le désert marocain pour relevé un défi sportif et solidaire! Le Trek Rose Trip apporte son soutien à diverses associations notamment dans la lutte contre le cancer du sein",/associations/rock-n-roses,https://cdn.helloasso.com/img/logos/croppedimage-0562910166904d3b8b9f163ec746ee88.png,,Bordères-sur-l’Échez,65320,Hautes-Pyrénées,Occitanie,Avenue du Pic du Midi,43.266912,0.039461,Association1901,Solidarité et Action Sociale | Cancer | Caritatif | Humanitaire,,2,"Shop, Donation",1736550000,1761561631,60,,rocknroses2025@gmail.com,
468696,Dessemellesdeventpourlya,"Coucou ! Je m’appelle Lya , j’ai 3 ans .  Je suis née , avec ma sœur jumelle , grande prématurée 3 mois avant la date prévu de mon terme .  Je suis atteinte de leucomalacie péri ventriculaire appelée aussi paralysie cérébrale. J’ai un handicap moteur au niveau des jambes . ",/associations/dessemellesdeventpourlya,https://cdn.helloasso.com/img/logos/croppedimage-53b9a460e27c483c8ab1dcb1329384f7.png,,Bours,65460,Hautes-Pyrénées,Occitanie,16 Rue Las Canteres,43.275406,0.085934,Association1901,Caritatif | Handicap | Humanitaire | Santé,,1,Donation,1706050800,1758612477,60,,dessemellesdeventpourlya@gmail.com,0676375851
374134,En Casa,"Le toit d’une maison, la chaleur d’une famille… En casa est une colocation solidaire entre des personnes en situation précaire et/ou de fragilité qui souhaitent trouver un chemin de retour vers l’autonomie, et des personnes qui désirent vivre autrement et donner du sens à leur quotidien.",/associations/en-casa,https://cdn.helloasso.com/img/logos/croppedimage-295a065031454ed78878f5bf2396b9e1.png,,Lourdes,65100,Hautes-Pyrénées,Occitanie,2 Chemin des Rochers,43.092836,-0.047886,Association1901,Solidarité et Action Sociale | Caritatif | Humanitaire,,1,Donation,1675378800,1773390000,60,,association-en-casa@orange.fr,
74189,BIGORRE ALZEIHMER ET TROUBLES APPARENTES,"Accueil, écoute et soutien des familles de malades Alzheimer et maladies apparentées",/associations/bigorre-alzeihmer-et-troubles-apparentes,https://cdn.helloasso.com/img/logos/65_hautes-pyrenees.jpg,,Tarbes,65000,Hautes-Pyrénées,Occitanie,"Maison des associations de l'Arsenal 11, rue de la Chaudronnerie Bât. 100 - Bureau 16",43.241796,0.075266,Association1901Rig,Santé,,2,"Donation, PaymentForm",1515711600,1771237288,60,,francealzheimer65@orange.fr,05 62 38 14 49
507819,ASSOCIATION COURAGE MATHIAS,L'Association Courage Mathias a pour but de venir en aide à Mathias accidenté lors d'un match de rugby.,/associations/association-courage-mathias,https://cdn.helloasso.com/img/logos/croppedimage-d9c258cb3db74352a9c65028c698ccde.png,,Momères,65360,Hautes-Pyrénées,Occitanie,30 Rue de la Plantère,43.17544,0.084097,Association1901,Humanitaire | Rugby | Solidarité | Solidarité et Action Sociale,,1,Donation,1716415200,1772282654,60,,courage.mathias14@gmail.com,0670566529
432594,Association Urgence Solidarité Maroc,Urgence Solidarité Maroc a pour objectif de soutenir et venir en aide au peuple Marocain qui traverse actuellement une crise sans précédent suite au tremblement de terre du 08 septembre 2023. Urgence Solidarité Maroc continuera son action au delà des frontières et s'engage à aider les plus ,/associations/association-urgence-solidarite-maroc,https://cdn.helloasso.com/img/logos/croppedimage-2d98c5706ecb4b08a82eb659499f8318.png,,Tarbes,65000,Hautes-Pyrénées,Occitanie,6 Rue Jean Perrin,43.220264,0.079114,Association1901,Caritatif | Humanitaire | Solidarité | Solidarité et Action Sociale,,2,"Donation, Membership",1694642400,1697534638,60,,youslas49@gmail.com,0623246472
241610,Association La Galave,"Nous œuvrons pour l’implantation, l’adaptation et la diffusion des grandes traditions par l’organisation d’événements, le développement et la gestion de lieux dédiés.",/associations/association-la-galave,https://cdn.helloasso.com/img/logos/association la galave-4a7da373bb6e4dc0ac2e7235d5fa5a84.png,,Galez,65330,Hautes-Pyrénées,Occitanie,lieu-dit La Galave,43.197785,0.416838,Association1901,Arts | Culture | Arts et Culture,,1,Donation,1610838000,1769940310,60,,lagalave@lasauvete.org,0695178402
582327,Banda Les Boléros Burgais,,/associations/banda-les-boleros-burgais,,https://cdn.helloasso.com/img/photos/croppedimage-f85ab559ef134f0c910506ce8dcd8e07.jpg,Burg,65190,Hautes-Pyrénées,Occitanie,Burg,43.182772,0.32268,Association1901,Arts et Culture | Arts | Culture,,1,Event,1743976800,1751719787,60,,chloemarmougetpro@gmail.com,
536458,Pyrénées Terroir Excellence PY-TEX,"PYRÉNÉES TERROIR EXCELLENCE est une association dédiée à la promotion et à la valorisation du territoire pyrénéen, en mettant en lumière sa culture, sa gastronomie, son histoire et ses acteurs locaux. La remise de distinctions culturelles est l’un des projets phares de l’association.",/associations/pyrenees-terroir-excellence-py-tex,https://cdn.helloasso.com/img/logos/croppedimage-bbddcc7b89484f77b5ab923ed190c98c.png,,Barbazan-Debat,65690,Hautes-Pyrénées,Occitanie,29 Rue du Néouvielle,43.196039,0.114498,Association1901,Arts | Culture | Gastronomie | Patrimoine,,2,"Membership, Event",1727388000,1749133041,60,,,
586903,LIGAMS - ASSOCIATION DES PARENTS D'ÉLÈVES D'IBOS,"C'est l'association des parents d'élèves de l'école d'Ibos ! Nous proposons durant l'année scolaire, des moments de convivialité avec les enfants et les parents, des goûters, des ateliers masques, le Carnaval, la fête de l'école... avec pour objectif créer du lien (Ligams = Lien en Occitan)",/associations/ligams-association-des-parents-d-eleves-d-ibos,https://cdn.helloasso.com/img/logos/croppedimage-e9052c2ba8c04b92985973bfadaf1c5f.png,,Ibos,65420,Hautes-Pyrénées,Occitanie,place de Verdun,43.233476,0.001354,Association1901,Education | Enfance | Formation | Fête | Parents d'élèves,,1,Event,1745877600,1749125538,60,,Ligams.ibos@gmail.com,
582579,APEL de l'école de Saint Pierre Juillan,L'APEL de l'école Saint-Pierre est une association de parents d'élèves agissant  bénévolement pour proposer des temps forts pendant l'année et agir pour le bien être des enfants de l'école. Les bénéfices des actions servent à financer ces temps forts et autres projets associés.,/associations/apel-de-l-ecole-de-saint-pierre-juillan,https://cdn.helloasso.com/img/logos/croppedimage-8f785f7e706a4e348e49bfffee9afaa9.png,,Juillan,65290,Hautes-Pyrénées,Occitanie,5bis Rue Voltaire,43.202336,0.022167,Association1901,Education | Enfance | Formation | Parents d'élèves,,1,Shop,1744063200,1746380067,60,,apelecolesaintpierrejuillan@gmail.com,
232219,Comité Hautes-Pyrénées Handball,,/associations/comite-hautes-pyrenees-handball,https://cdn.helloasso.com/img/logos/croppedimage-49dafcd2e0c344fcb6f564f66888d329.png,,Tarbes,65000,Hautes-Pyrénées,Occitanie,37 Boulevard du Martinet,43.238454,0.082101,Association1901Rup,Sport,,10,Event,1606258800,1772206879,60,FFHB,6165000@ffhandball.net,
229583, GROUPE D'ENSEIGNEMENT POST-UNIVERSITAIRE DES MEDECINS DES HAUTES-PYRENEES,Développement et amélioration de la formation médicale en Hautes-Pyrénées,/associations/groupe-d-enseignement-post-universitaire-des-medecins-des-hautes-pyrenees,https://cdn.helloasso.com/img/logos/gepu 65-6fa8c39fd87c487ca80d37cb6f583486.jpg,,Tarbes,65000,Hautes-Pyrénées,Occitanie,12 Chemin de l'Ormeau,43.224573,0.077292,Association1901,Education | Formation,,1,Membership,1605222000,1774481704,60,,contact.gepu65@gmail.com,
576090,Association Les Pamelas,"L’association Les Pamelas a pour mission de mener des actions humanitaires et solidaires en faveur des enfants en situation de précarité. Elle œuvre non seulement pour répondre à leurs besoins essentiels, mais aussi pour sensibiliser le public aux difficultés qu'ils rencontrent.",/associations/association-les-pamelas,https://cdn.helloasso.com/img/logos/croppedimage-b6ee5f715aae406f8d5592debd5bf660.png,,Rabastens-de-Bigorre,65140,Hautes-Pyrénées,Occitanie,17 Place Centrale,43.387783,0.149456,Association1901,Solidarité et Action Sociale | Caritatif | Enfance | Humanitaire,,1,Donation,1741734000,,60,,lespamelas65@gmail.com,
191484,Théâtre de L'or Bleu,,/associations/theatre-de-l-or-bleu,https://cdn.helloasso.com/img/logos/theatre de l or bleu-5ad4d033530d4bad9a6ee7b20c577bdf.jpg,,Tarbes,65000,Hautes-Pyrénées,Occitanie,1 Impasse Dieudonné Costes,43.246334,0.058025,Association1901Rig,Arts et Culture | Arts | Culture,Don,1,Event,1581289200,1742660780,60,,orbleu.prod@gmail.com,0695521061
156959,Binaros," Binaros a pour but de promouvoir, défendre et diffuser les connaissances sur les patrimoines pyrénéens. Elle privilégie la promotion et la diffusion de l’édition, du livre, des œuvres graphiques et des médias ayant des sujets en rapport avec les Pyrénées en organisant des événements culturels.  ",/associations/binaros,https://cdn.helloasso.com/img/logos/croppedimage-82e7e75ebb0d4aa6a9570967be3c9fc4.png,,Bagnères-de-Bigorre,65200,Hautes-Pyrénées,Occitanie,Place des Vignaux,43.067007,0.15018,Association1901,Arts | Culture | Arts et Culture,,1,Membership,1562536800,1759691894,60,,as.binaros@gmail.com,0652615242
379241,Association TRAIT-D'UNION AIDANTS-AIDES SUD,L'Association Trait-d'Union Aidants-Aidés Sud est une organisation dédiée à soutenir les Aidants Familiaux et à favoriser le maintien à domicile des personnes dépendantes. Nous sommes convaincus que le Aidants jouent un rôle essentiel dans la société et qu'ils méritent tout notre soutien.,/associations/association-trait-d-union-aidants-aides-sud,https://cdn.helloasso.com/img/logos/croppedimage-c9df0f5255734fc89a41cce6873daa3c.png,,Saint-Laurent-de-Neste,65150,Hautes-Pyrénées,Occitanie,1 Avenue des Sports,43.076781,0.483014,Association1901Rig,Humanitaire | Solidarité | Solidarité et Action Sociale,,1,CrowdFunding,1677020400,1743351231,60,,presidence@trait-union-sud.org,0771149091
318622,APE Les Pitchounets,"Association de parents d'élèves proposant des activités à but lucratif ou non , à destination des familles de l'école",/associations/ape-les-pitchounets,https://cdn.helloasso.com/img/logos/croppedimage-38beebf351d34d09857f879c64ea9ac5.png,,Juillan,65290,Hautes-Pyrénées,Occitanie,1 Impasse du Moulin,43.199028,0.02822,Association1901,Education | Formation | Parents d'élèves,,1,Event,1650837600,1740061546,60,,apejuillan@gmail.com,0782301898
557869,PYRÉNÉES CLUB AFFAIRES 64 65,"Réseau d'affaire agissant sur le 64 et le 65. BUSINESS CONNECT CLUB ne recrute pas de membre, nous travaillons uniquement par cooptation et vote à l'unanimité pour l'accueil d'un nouveau membre. Mise en réseau, camaraderie et business sont les maitres mots de notre Club. ",/associations/pyrenees-club-affaires-64-65,https://cdn.helloasso.com/img/logos/croppedimage-b7a0bc4f0f9c4a5fa798492860f84768.png,,Juillan,65290,Hautes-Pyrénées,Occitanie,13d Route de Lourdes,43.199879,0.034134,Association1901,Professionnels | Étudiants | Réseaux pros et étudiants,,1,Membership,1734649200,,60,,pyreneesclubaffaires@gmail.com,
550182,Association des Professionnels de la Spéléologie Béarn-Bigorre,l'APSBB est la section locale Pyrénées du Syndicat National des Professionnels de la Spéléologie. Elle regroupe les moniteurs exerçant en Béarn et/ou Bigorre.,/associations/association-des-professionnels-de-la-speleologie-bearn-bigorre,https://cdn.helloasso.com/img/logos/croppedimage-d86e7d27118c42029583aa859509d58e.png,,Préchac,65400,Hautes-Pyrénées,Occitanie,23 Cami Deths Tintins,42.990915,-0.072245,Association1901,Professionnels | Spéléologie | Syndicats | Étudiants | Réseaux pros et étudiants,,1,Donation,1731798000,1735549171,60,,,
