objectID,name,description,url,logo,banner,city,zipcode,department,region,address,lat,lng,org_type,category_tags,ha_tags,active_forms_count,active_forms_type,creation_date,last_order_date,score,partners,contact_email,contact_phone
333447,Les Pelles et Pioches,Création d'un Bike Park sur la commune de Saint Pé de Bigorre 65270 France. Déjà 3 pistes de descente mêlant passages naturels et modules + 2 sections Free Ride et 1 Drop zone en projet. Le tout accessible à la force du mollet ou par rotation véhicule en 15 mn.,/associations/les-pelles-et-pioches,https://cdn.helloasso.com/img/logos/croppedimage-98d0c6c7ab3e4b62834263931b097975.png,https://cdn.helloasso.com/img/photos/croppedimage-5e4578751a164dc4a6b09c184a908179.png,Saint-Pé-de-Bigorre,65270,Hautes-Pyrénées,Occitanie,Place des Arcades,43.103456,-0.158942,Association1901Rig,Sport,,2,Membership,1656799200,1736026743,110,,pelles-pioches@outlook.fr,0628713261
518249,LES ZIMPROBABLES ,"Christelle, Cathy et Solé les 3 Zimprobables Au travers de notre association , nous soutenons et mettons en avant EndoFrance, qui vient en aide aux femmes atteintes d'endométriose et leurs entourages. ",/associations/les-zimprobables,https://cdn.helloasso.com/img/logos/croppedimage-2d63460c4c604a52bede98d23939e060.png,https://cdn.helloasso.com/img/photos/croppedimage-14f56776ebeb4994833f8f92a4e92a06.png,Gardères,65320,Hautes-Pyrénées,Occitanie,8 Chemin de Mazères,43.2864,-0.115944,Association1901,Humanitaire | Solidarité | Solidarité et Action Sociale,,2,"Event, CrowdFunding",1720130400,1729105012,110,,leszimprobables2024@gmail.com,0631436734
494621,Association des ami-e-s de la ferme de la Coume ,"Nous sommes une association liée très fortement à une ferme, en l'occurrence la ferme de la Coume. Nous avons comme objectif de permettre à tout un chacun et chacune de découvrir le lien à la terre en accueillant sur la ferme pour des chantiers participatifs, évènements culturels et/ou festifs, etc.",/associations/association-des-ami-e-s-de-la-ferme-de-la-coume,https://cdn.helloasso.com/img/logos/croppedimage-d0e62ed0aaae43f0b934bddcf3866bf7.png,https://cdn.helloasso.com/img/photos/croppedimage-3db563929d224782a67952e10ca00905.jpg,Banios,65200,Hautes-Pyrénées,Occitanie,Ferme de la Coume ,43.044792,0.223969,Association1901,Culture | Fête | Humanitaire | Solidarité | Solidarité et Action Sociale,,1,CrowdFunding,1712095200,1720549041,110,,amisdelacoume@mailo.com,
333554,JAB BASKET,Association sportive pour le développement et  la pratique du basket-ball en compétition dans un esprit convivial et familial. Pratique 5*5 et 3*3  Les babys sont mixtes et les autres catégories sont exclusivement féminines.,/associations/jab-basket,https://cdn.helloasso.com/img/logos/croppedimage-c548a0ae81c44af987bcbc0467f3bd65.png,https://cdn.helloasso.com/img/photos/croppedimage-f042e13f49e1451293d781d7dd7727c0.png,Bordères-sur-l’Échez,65320,Hautes-Pyrénées,Occitanie,Place Jean Jaurès,43.258479,0.051007,Association1901,Sport | Basketball,,1,Shop,1656885600,,110,,s.azam65500@gmail.com,0682979173
306163,Association Sophie Mateos,Organisation d'événements culturels et artistiques. Spécialité : MODE,/associations/association-sophie-mateos,https://cdn.helloasso.com/img/logos/croppedimage-fc68b34bfe5d4d8e92eee91b05fae848.png,https://cdn.helloasso.com/img/photos/croppedimage-9539704ab2724fd996453ade2ee91f82.png,Ibos,65420,Hautes-Pyrénées,Occitanie,8 Rue de la Poste,43.233214,0.003302,Association1901,Arts | Culture | Mode | Arts et Culture,,1,Event,1644966000,1720289793,110,,,
33587,Artpiculture,Association d'Education Créative à l'Environnement,/associations/artpiculture,https://cdn.helloasso.com/img/logos/artpiculture-82df5220f8d44804a481eb84e4f8a150.jpg,https://cdn.helloasso.com/img/photos/21095-1427280676661.jpg,Artagnan,65500,Hautes-Pyrénées,Occitanie,1 bis rue Bousquet,43.403842,0.077421,Association1901,Ecologie et Environnement | Environnement,Sudouest,2,"Event, Donation",1427238000,1710786916,110,,nectar@artpiculture.org,0972302711
467675,hameau dé nousté temps,"Association de quartier qui prône le développement de l'artisanat, le partage des connaissances et l'entraide, avec pour objectif l'expression des pleins potentiels de chacun. Nos valeurs sont guidées par le respect de l'environnement et le faire ensemble pour se reconnecter les uns aux autres.",/associations/hameau-de-nouste-temps,https://cdn.helloasso.com/img/logos/croppedimage-103b0b1c6151430e8e819583d667c6a7.png,https://cdn.helloasso.com/img/photos/croppedimage-4103e2ceee5440d8a11c55f31f87acba.png,Castelnau-Magnoac,65230,Hautes-Pyrénées,Occitanie,4 Chemin du Vignemale,43.282325,0.497977,Association1901,Artisanat | Environnement | Étudiants | Ecologie et Environnement,,3,"Membership, Shop",1705791600,1706045738,110,,hameaudenoustetemps@gmail.com,0678665336
505348,Groupe Généalogique de la vallée de Gistain,"Association de généalogie transfrontalière regroupant les familles natives et originaires de 7 villages de la vallée de Gistaín (Saravillo, Sin y Salinas, Señes, Serveto, Plan, San Juan de Plan et Gistaín). Elle se propose comme finalité la rédaction d'une chronique familiale sur cette vallée.",/associations/groupe-genealogique-de-la-vallee-de-gistain,https://cdn.helloasso.com/img/logos/croppedimage-91f2367f7f7f4bf583c7f18710796aca.png,https://cdn.helloasso.com/img/photos/croppedimage-340de8246d754a228f5f96c6dddb6d54.jpg,Arreau,65240,Hautes-Pyrénées,Occitanie,Place de la Mairie,42.904722,0.359775,Association1901,Patrimoine,,1,Membership,1715637600,1717147135,110,,gggistain@gmail.com,0624178525
482106,ASSEMBLÉE DES CHEFS DE DÉPARTEMENTS GESTION ENTREPRISES ET ADMINISTRATIONS,ACD - ASSEMBLÉE DES CHEFS DE DÉPARTEMENTS  GESTION des ENTREPRISES et des  ADMINISTRATIONS à Tarbes (65) 5 - 6 - 7 juin 2024 organisée par l'IUT de Tarbes ,/associations/assemblee-des-chefs-de-departements-gestion-entreprises-et-administrations,https://cdn.helloasso.com/img/logos/croppedimage-dc5288a61efd4de1ac84b67dc4a938f2.png,https://cdn.helloasso.com/img/photos/croppedimage-8913840b552f4764aab30f9595956378.png,Tarbes,65000,Hautes-Pyrénées,Occitanie,1 Rue Lautreamont,43.227484,0.048103,Association1901,Formation | Education,,1,Event,1709506800,1716364086,110,,stephanie.haristoy@iut-tarbes.fr,0651666225
501928,UDAF 65,"L’Udaf 65 intervient auprès des pouvoirs publics (parlementaires, conseil départemental, communes, intercommunalités) pour évaluer et co-construire les politiques en faveur des familles.",/associations/udaf-65,https://cdn.helloasso.com/img/logos/croppedimage-b07aeb2da4dc484898046619a5af0d20.png,https://cdn.helloasso.com/img/photos/croppedimage-2083366a8ab14a7cab729d1dc02266f1.png,Tarbes,65000,Hautes-Pyrénées,Occitanie,32 Avenue de la Libération,43.245491,0.067089,Association1901,Humanitaire | Solidarité | Solidarité et Action Sociale,,4,Event,1714428000,1715700970,110,,sif@udaf65.fr,0562440236
337737,Comité Départemental de la Ligue Contre Le Cancer des Hautes-Pyrénées,"Association loi 1901 qui œuvre pour la lutte contre le cancer dans le domaine de la recherche, la prévention, l'aide aux malades et soins de support.",/associations/comite-departemental-de-la-ligue-contre-le-cancer-des-hautes-pyrenees,https://cdn.helloasso.com/img/logos/croppedimage-5177bdf2cc0a48ae98a0cc7ef5d9b6ab.png,https://cdn.helloasso.com/img/photos/croppedimage-1ca594be4cc64d0db3aa4b418d7c2e07.png,Tarbes,65000,Hautes-Pyrénées,Occitanie,28 Rue Georges Lassalle,43.235041,0.070344,Association1901,Santé | Caritatif | Humanitaire | Recherche,Octobre-rose,1,Event,1659996000,1711827419,110,,annette.cuq@ligue-cancer.net,0562342089
466953,FREE STYLE LISTEN,"Après quelques années ... revoilà nos meilleurs CREWs pour vous annoncer un beau Festival en 2025..... en attendant nous organisons qq petites soirées de soutient, pour vous ravis au mieux en Août 2025............. Foxtanz, Mbm, Depra'V et j'en passe vous ne serez pas déçus....",/associations/free-style-listen,https://cdn.helloasso.com/img/logos/croppedimage-da1b2f1800ea4daa834136cb4db65d91.png,https://cdn.helloasso.com/img/photos/croppedimage-13a6ab71e6024f83ac126032921f4d9a.png,Bagnères-de-Bigorre,65200,Hautes-Pyrénées,Occitanie,7 Rue de Lorry,43.064441,0.152412,Association1901,Arts | Culture | Arts et Culture,,1,Event,1705532400,1709925177,110,,unitfest65@gmail.com,0616351107
470127,toi toi émoi,"bonjour,  nous brodons de tout sur tout,  quick broderie,  0754354955,  https://quick-broderie-54.webselfsite.net/accueil...      à votre service pour échanges services... cordialement",/associations/toi-toi-emoi,https://cdn.helloasso.com/img/logos/croppedimage-2df4759a90cc471bb7d3cd52703a3296.jpg,https://cdn.helloasso.com/img/photos/croppedimage-11ee058db8254ca099191f15a21f8a44.png,Aureilhan,65800,Hautes-Pyrénées,Occitanie,3bis Avenue de la Chartreuse,43.238252,0.095148,Association1901,Internet | Étudiants | Education,,1,Shop,1706482800,,110,,toi.toi.emoi@gmail.com,075435495
478235,Culture de la Musique Electronique en France,association qui permet de développer l'accès et la découverte de la musique électronique et de ses sous-genre en france. ,/associations/culture-de-la-musique-electronique-en-france,https://cdn.helloasso.com/img/logos/croppedimage-434cbe9fdb9948e3ad1b93bfeb11a3cd.png,https://cdn.helloasso.com/img/photos/croppedimage-789d8c0ab0ff480dad4219ee79f5d903.png,Sarrancolin,65410,Hautes-Pyrénées,Occitanie,Route des Nestes,42.969756,0.37611,Association1901,Arts | Culture | Musique électronique | Musique,,2,"Donation, Membership",1708470000,,110,,asso.cmef65@gmail.com,
473180,Eco d'Om,"Au Chapit'ô vise a créer un lieu de partage autour du cirque, de soirées à thème, d'activités de bien-être et de sensibiliser au respect de la nature. Ces activités auront lieu prés de Campan, dans les hautes Pyrénées (65),  sous un chapiteau. ",/associations/eco-d-om,https://cdn.helloasso.com/img/logos/croppedimage-ca68b4f063ca49eaa6c72c14533a59ec.png,https://cdn.helloasso.com/img/photos/croppedimage-ae1785a4500b423396bdc24ce87b7e9f.png,Campan,65710,Hautes-Pyrénées,Occitanie,"Residence Beau Site, Rue General Leclerc ",43.017026,0.17741,Association1901,Arts | Cirque | Culture,,1,Donation,1707174000,,110,,ochapito65@gmail.com,0683064175
379507,Sundari Kahani,Association d’enseignement de danses indiennes et Bollywood en général. Organisation de stages et événements autour de la culture indienne.,/associations/sundari-kahani,https://cdn.helloasso.com/img/logos/croppedimage-132a9025ae954830b9a154647ee46261.png,https://cdn.helloasso.com/img/photos/croppedimage-425bd7d5a93a414fa54b0b9573852532.png,Tarbes,65000,Hautes-Pyrénées,Occitanie,11 Boulevard du Martinet,43.233903,0.085781,Association1901,Arts | Culture | Danse | Enseignement | Arts et Culture,,3,Event,1677106800,1713553992,110,,sundarikahani@gmail.com,0684380581
469503,Les Fêtes de la Paix,"Les Fêtes de la Paix vous invitent à pratiquer la paix Submergés par le fracas des mauvaises nouvelles nous oublions souvent que la paix est à l’intérieur de nous et qu’elle est accessible. Venez fêter avec nous la bonté, la solidarité, la simplicité dont nous sommes tous capables.",/associations/les-fetes-de-la-paix,https://cdn.helloasso.com/img/logos/croppedimage-668f66996be74e01acf7734bece80107.png,https://cdn.helloasso.com/img/photos/croppedimage-114734c854214f2ca0166254e1b1bc16.png,Lascazères,65700,Hautes-Pyrénées,Occitanie,6 Chemin des Palombière,43.502464,-0.028602,Association1901,Caritatif | Fête | Humanitaire | Solidarité | Solidarité et Action Sociale,,1,Membership,1706223600,,110,,fetesdelapaix@gmail.com,0676080292
461756,Jeux d'Adour,"Nous organisons, dans les villages voisins, des rencontres intergénérationnelles  autour du jeu de société dans un cadre public ou privé. ",/associations/jeux-d-adour,https://cdn.helloasso.com/img/logos/croppedimage-883dbd940fba42cca23a115b04ea2281.png,https://cdn.helloasso.com/img/photos/croppedimage-26c005ff315d42c58f08b3b589c83cc9.png,Villenave-près-Marsac,65500,Hautes-Pyrénées,Occitanie,1 Impasse des Jardins de Berdoye,43.332794,0.090131,Association1901,Jeux de société | Loisirs,,1,Shop,1704409200,,110,,jeuxdadour@gmail.com,0687471341
460609,SLDREAMS,On va donner la chance sans grande étude (cinéma;webdesigner:commerce internationale;ect...) et avoir un carnet d'adresse fabuleux.,/associations/sldreams,https://cdn.helloasso.com/img/logos/croppedimage-573575e156ac46baab04e496fae158e7.png,https://cdn.helloasso.com/img/photos/croppedimage-6aab790de6a346c893e976af2ff6f72e.png,Aucun,65400,Hautes-Pyrénées,Occitanie,Aucun,42.979271,-0.185307,Association1901,Arts | Cinéma | Culture | Arts et Culture,,1,Donation,1703804400,,110,,mornandmaxime@gmail.com,0626866344
459239,La 4L Mines'icipale,"L'objet de l'association est de fournir du matériel scolaire et sportif à des enfants démunis du Sud marocain en participant à une ou plusieurs éditions du rallye-raid humanitaire 4L Trophy à bord d'une Renault 4, dont elle devra financer les frais de rénovation",/associations/la-4l-mines-icipale,https://cdn.helloasso.com/img/logos/croppedimage-6aeb3dec27704311aa82319a012508cf.jpg,https://cdn.helloasso.com/img/photos/croppedimage-0b83c4a936204f949826f5abfec63d96.png,Cieutat,65200,Hautes-Pyrénées,Occitanie,2 Chemin du Tailh,43.123926,0.20998,Association1901,Caritatif | Enfance | Humanitaire | Rallye | Sport automobile | Solidarité et Action Sociale,,2,"Donation, CrowdFunding",1703026800,1703280876,110,,,
446558,Escola de Louey,Association des parents d'élèves de l'école de Louey,/associations/escola-de-louey,https://cdn.helloasso.com/img/logos/croppedimage-5b512204542049ec83f9afcf5a9be9da.png,https://cdn.helloasso.com/img/photos/croppedimage-ae47ce79bbe94dfb853d4f7b9a721828.png,Louey,65290,Hautes-Pyrénées,Occitanie,1 Rue du Vignemale,43.174497,0.017592,Association1901,Education | Humanitaire | Parents d'élèves | Solidarité,,1,Shop,1699052400,1700261012,110,,escoladelouey65290@gmail.com,0602657975
445571,Association le Bocal,"Grâce à sa ""formation suspendue"", l'association ""Le Bocal"" permet aux personnes n'ayant pas accès à la formation professionnelle par le biais des instances déjà existantes, de se former gratuitement pour retrouver du travail.",/associations/association-le-bocal,https://cdn.helloasso.com/img/logos/croppedimage-848415cbdab34a7181ebc5506bee0c90.png,https://cdn.helloasso.com/img/photos/croppedimage-79438a3e62f24ae89606c538bf9dbc99.png,Tarbes,65000,Hautes-Pyrénées,Occitanie,7 Rue Arago,43.230589,0.08479,Association1901,Caritatif | Formation | Humanitaire | Education | Solidarité et Action Sociale,,1,Donation,1698706800,1699279609,110,,contact@le-bocal.fr,0675749067
427817,Ha-Py Bloc,Ha-Py Bloc souhaite accompagner le développement et l'animation de sites d'escalade en bloc pour fédérer les usagers autour des activités d’escalade de bloc dans le territoire des Hautes-Pyrénées. ,/associations/ha-py-bloc,https://cdn.helloasso.com/img/logos/croppedimage-bc512aab5a9b4b68812ce5ceed95544c.png,https://cdn.helloasso.com/img/photos/croppedimage-7a0c1bb7c2e84c08b9628e5ed39b939c.png,Tournay,65190,Hautes-Pyrénées,Occitanie,1bis Rue de la Côte,43.189444,0.251844,Association1901,Escalade | Sport,,1,Donation,1693692000,1717756515,110,,hapy.bloc@gmail.com,
346270,Office Municipal des Sports de la Ville de Tarbes,"Soutenir, encourager et provoquer tout effort tendant à répandre et à développer pour tous, la pratique de l’éducation physique et sportive et le contrôle médico-sportif. Faciliter, dans les mêmes domaines, une coordination des efforts : Promotion sportive de Tarbes en France et à l'étranger.",/associations/office-municipal-des-sports-de-la-ville-de-tarbes,https://cdn.helloasso.com/img/logos/croppedimage-9c50c0d8dca04a489278bb027da9b127.png,https://cdn.helloasso.com/img/photos/croppedimage-2807471978d843baa99c05e92bbf321c.png,Tarbes,65000,Hautes-Pyrénées,Occitanie,"Hôtel de Ville, Place Jean Jaurès",43.232708,0.078027,Association1901,Sport,,1,Event,1664229600,1698319648,110,,oms@mairie-tarbes.fr,
370770,les râleuses au grand coeur ,"Les Râleuses au grand cœur est une association créée en 2014 afin de venir en aide  aux enfants défavorisés du Maroc ainsi qu'aux familles dans le besoin, chez nous en France.  ",/associations/les-raleuses-au-grand-coeur,https://cdn.helloasso.com/img/logos/croppedimage-942ffd82ca934cba952497aba939d5b2.png,https://cdn.helloasso.com/img/photos/croppedimage-03c4fb020dab46339822f48d6bc4b0c9.png,Vielle-Aure,65170,Hautes-Pyrénées,Occitanie,43 lotissement le Bernet ,42.836255,0.331391,Association1901,Caritatif | Enfance | Humanitaire | Solidarité et Action Sociale,,1,CrowdFunding,1674342000,1696409229,110,,peggyrahmani@gmail.com,0784083173
432951,FESTIVAL DE GAVARNIE,"Depuis 36 ans, le Festival de Gavarnie propose, chaque été, par le biais d’une résidence de création, la diffusion d’une production ou diffusion pluridisciplinaire et essentiellement théâtrale, sur le site de la Courade du Cirque de Gavarnie, dans un site exceptionnel d'altitude.",/associations/festival-de-gavarnie,https://cdn.helloasso.com/img/logos/croppedimage-d32d575ec0d44ad9adc6c32b72a11910.png,https://cdn.helloasso.com/img/photos/croppedimage-b02e1dde431f4139a720970d6a0707a4.jpg,Gavarnie-Gèdre,65120,Hautes-Pyrénées,Occitanie,MAIRIE PLACE DE L'EGLISE,42.788659,0.019533,Association1901,Arts | Cirque | Culture | Théâtre | Arts et Culture,,1,Membership,1694815200,1694937262,110,,coordination.festivaldegavarnie@gmail.com,0689279803
432071,Nemesys,Nemesys 4 a Better World est une association solidaire et humanitaire qui a pour but de lutter contre les injustices globales en aidant les populations les plus démunies et en soutenant plusieurs causes dans le monde entier. ,/associations/nemesys,https://cdn.helloasso.com/img/logos/croppedimage-34aeccfe789348019f9834798eb0f436.png,https://cdn.helloasso.com/img/photos/croppedimage-14175d0a98a347a58eb4096fc88836d4.png,Aureilhan,65800,Hautes-Pyrénées,Occitanie,4 Rue Jean-francois Millet,43.256557,0.093623,Association1901,Solidarité et Action Sociale | Caritatif | Humanitaire,,1,Donation,1694556000,,110,,,
57979,Eths Esclops,"Groupe d'arts et de traditions populaires bigourdanes. Danses, Musiques et Costumes de la deuxième moitié du XIX siècle. Association loi 1901, basé à Tarbes (Hautes-Pyrénées).",/associations/eths-esclops,https://cdn.helloasso.com/img/logos/eths-esclops.gif,https://cdn.helloasso.com/img/photos/croppedimage-18d9c5f1b4d345dd8395c88a7080c8b4.png,Tarbes,65000,Hautes-Pyrénées,Occitanie,1 Rue de l’Ossau,43.242725,0.063433,Association1901,Arts | Culture | Danse | Arts et Culture,,1,Event,1485730800,1695492117,110,,ethsesclops@gmail.com,0623767244
270652,SENSHI KUMA DOJO,"Enseignement du travail de l’école Kishinkaï Aïkido dans les Hautes-Pyrénées, développement et perpétuation des arts martiaux traditionnels japonais ainsi que les disciplines d'éducation corporelle qui en sont dérivées et la culture.",/associations/senshi-kuma-dojo,https://cdn.helloasso.com/img/logos/croppedimage-3c363f5c7d86468e9e1d96b1866a6ea4.png,https://cdn.helloasso.com/img/photos/croppedimage-993973f60bc6441db46891df3ca97217.png,La Barthe-de-Neste,65250,Hautes-Pyrénées,Occitanie,Rue de la Poste,43.079761,0.384331,Association1901,Arts martiaux | Aïkido | Culture | Enseignement | Sport,,1,Membership,1624140000,1701114630,110,,sroudiere@gmail.com,
410905,Société gymnastique de Lourdes ,Activité gymnastique sportive et rythmique  ,/associations/societe-gymnastique-de-lourdes,https://cdn.helloasso.com/img/logos/croppedimage-146faac9f3b24673b714f1e8e4bf767d.png,https://cdn.helloasso.com/img/photos/croppedimage-5550256517e44d74a747e47a156f56f2.png,Lourdes,65100,Hautes-Pyrénées,Occitanie,27 Chemin de Lannedarre,43.106103,-0.057693,Association1901,Sport | Gymnastique,,1,Membership,1686780000,1720618959,110,,sgl.contact@yahoo.fr,0750060371
420546,AFDI65,"Afdi 65 travaille depuis plus de 20 ans avec Adfa Atlantique, une association béninoise de femmes agricultrices.",/associations/afdi65,https://cdn.helloasso.com/img/logos/croppedimage-a75191b8407b4b04a9028232c007a1db.jpg,https://cdn.helloasso.com/img/photos/croppedimage-e89ce07d0c244cf9b3e515caa89079b8.png,Tarbes,65000,Hautes-Pyrénées,Occitanie,20 Place du Foirail,43.23033,0.084401,Association1901,Caritatif | Humanitaire | Solidarité et Action Sociale,,1,Membership,1690236000,1690312301,110,,afdi65.hp@gmail.com,0772030989
406711,EPSTN,"Le club de natation de Séméac est fier de vous accueillir au sein des piscines du Grand Tarbes. Nous proposons divers disciplines adaptées pour les plus petits comme pour les plus grands. Bénéficiez d'une ambiance conviviale, où la bonne humeur et les valeurs sportives règnent.",/associations/epstn,https://cdn.helloasso.com/img/logos/croppedimage-4c8090976ee24507a0e09b69d86fceec.png,https://cdn.helloasso.com/img/photos/croppedimage-8039dfaae7084116b17bc7c9b8bc137e.png,Séméac,65600,Hautes-Pyrénées,Occitanie,121 Avenue Francois Mitterrand,43.219482,0.105954,Association1901,Natation | Sport,,1,Shop,1685484000,1686945858,110,,epstn@sfr.fr,0562365145
399414,Les amis de la culture pour tous,"Création, découverte, promotion des musiques actuelles, des arts plastiques et graphiques ainsi que des spectacles vivants, des activités à but éducatif, préventif ou à la préservation du patrimoine.",/associations/les-amis-de-la-culture-pour-tous,https://cdn.helloasso.com/img/logos/croppedimage-e8c063ab7e24497e9566dab0672832db.png,https://cdn.helloasso.com/img/photos/croppedimage-a7e123cea34f4c069b34206e06f90d2f.png,Asque,65130,Hautes-Pyrénées,Occitanie,3 CAMI DETH PLA DE HOURC,43.033959,0.256219,Association1901,Arts | Culture | Arts et Culture | Musique,,1,Membership,1683410400,,110,,lacpt.heretik@gmail.com,0659812098
376179,LA BRIGADE SAVATE BOXE FRANÇAISE,"Bienvenue à La Brigade SBF, le club de boxe française situé à Argelès-Gazost, dans la magnifique vallée des gaves des Pyrénées. Notre club est dédié à l'enseignement de la boxe française, également connue sous le nom de savate, un sport de combat qui combine les techniques de pieds et de poings.  ",/associations/la-brigade-savate-boxe-francaise,https://cdn.helloasso.com/img/logos/croppedimage-0a526439780a46a2ae60adee404283f9.png,https://cdn.helloasso.com/img/photos/croppedimage-8b469a9eaef34334aeb41992355a9e7d.png,Arcizans-Avant,65400,Hautes-Pyrénées,Occitanie,10 Camin d’Azun,42.985977,-0.101042,Association1901,Sport | Boxe | Enseignement,,2,"Shop, Membership",1675983600,1679936118,110,,labrigade.sbf@gmail.com,0781192827
354282,Pyrénées Club Affaire 64 65,Pyrénées Club Affaire 64/65 est un réseau de professionnels exerçant leurs activités dans les Pyrénées Atlantique et les Hautes Pyrénées. Ce réseaux de professionnels d'excellence à pour but d'échanger sur leur problématiques respectives et se recommander les un les autres. ,/associations/pyrenees-club-affaire-64-65,https://cdn.helloasso.com/img/logos/croppedimage-a1e79e5d519a40d2a05e3a06dfc3f714.png,https://cdn.helloasso.com/img/photos/croppedimage-d42430147656423c93d17d38de957571.png,Juillan,65290,Hautes-Pyrénées,Occitanie,13d Route de Lourdes,43.200964,0.035702,Association1901,Professionnels | Étudiants | Spiritualité,,1,Membership,1667343600,,110,,pyreneesclubaffaires6465@gmail.com,0687941812
201344,SPARK association,"Notre association a pour objet la promotion des acteurs et pratiquants du Sud-Ouest, ceux gravitant dans le domaine de l’art ou du skate. C’est à travers plusieurs supports qu’elle y parvient : magazines, vidéos, vêtements, évènements, actions, et autres.  ",/associations/spark-association,https://cdn.helloasso.com/img/logos/spark association-63f3712b642d4892a7ec046aec3b5c37.jpg,https://cdn.helloasso.com/img/photos/croppedimage-27ebdff5dd894baaa30282bea7413634.jpg,Bourg-de-Bigorre,65130,Hautes-Pyrénées,Occitanie,6 chemin de la serre,43.082714,0.261495,Association1901,Arts | Culture | Skate | Arts et Culture,,2,Membership,1587510000,1683011957,110,,sparkclothing.tarbes@gmail.com,0666961157
171801,Passejadas,"Une associations, deux groupes,un seul but : la chanson pour tous !",/associations/passejadas,https://cdn.helloasso.com/img/logos/passejadas-21d9ce4c118c4d5986fe998e2d60a49a.jpg,https://cdn.helloasso.com/img/photos/3g 3-8b007ff4983d44c68bedf90ed64cd39d.jpg,Pouzac,65200,Hautes-Pyrénées,Occitanie,4 bis Chemin des Crêtes,43.087564,0.14832,Association1901,Arts | Culture | Musique,,1,Donation,1571439600,1580848712,110,,passejadas@gmail.com,0635211770
216038,ESE,Depuis 2018 nous sensibilisons à la protection de l'environnement par la pratique du sport dans le milieu.,/associations/ese,https://cdn.helloasso.com/img/logos/ese-f3b7d2a72f5b4fc8aa1124825f474552.png,https://cdn.helloasso.com/img/photos/img 3946-b3f542ae21c24cc3ba60de39e870e12a.jpg,Tarbes,65000,Hautes-Pyrénées,Occitanie,2 Rue François Mousis,43.231605,0.08182,Association1901Rig,Environnement | Ecologie et Environnement,,5,"PaymentForm, Donation",1598047200,1633201127,110,,contact@ese65.org,
383439,Fraag Esport,Association E-sport sous loi 1901 ,/associations/fraag-esport,https://cdn.helloasso.com/img/logos/croppedimage-09d54688973b4ca1a94151fb6f93cd88.png,https://cdn.helloasso.com/img/photos/croppedimage-9432b25b3b714260a3bdbaa65a4c9d65.png,Vic-en-Bigorre,65500,Hautes-Pyrénées,Occitanie,13 Rue Baloc,43.388022,0.054876,Association1901,Sport | eSport,,1,Shop,1678316400,,110,,mordocrick@gmail.com,0670682867
