objectID,name,description,url,logo,banner,city,zipcode,department,region,address,lat,lng,org_type,category_tags,ha_tags,active_forms_count,active_forms_type,creation_date,last_order_date,score,partners,contact_email,contact_phone
352056,COMITE D'ANIMATION CALVIGNAC,"Le Comité d'Animation de Calvignac a pour objet l’organisation d’événements culturels, sportifs et de loisirs.",/associations/comite-d-animation-calvignac,,https://cdn.helloasso.com/img/photos/croppedimage-e8d4de0d0b6f48e7ba481a61752654da.png,Calvignac,46160,Lot,Occitanie,Le Bourg,44.438266,1.771303,Association1901Rig,Arts | Culture | Arts et Culture,Comites-des-fetes | Don,1,Donation,1666303200,1755422830,80,,comite-animation-calvignac@hotmail.com,0620414099
482794,Comité des fêtes de Bach,"Des Bachois(e)s prêt à tout pour garder de l’animation dans leur village. Plusieurs manifestations ouvertes à tous sont prévues sur l’année. Il y en a pour tous les goûts, les sportifs, les fêtards, les Pétanqueurs… N’hésitez pas à nous rejoindre et à nous suivre sur les réseaux. Merci et à bientôt.",/associations/comite-des-fetes-de-bach,,https://cdn.helloasso.com/img/photos/croppedimage-aff5fd45ad8a4aca9d9c7fe089217517.png,Bach,46230,Lot,Occitanie,4 Route de Saint-Jacques,44.350417,1.671342,Association1901,Arts | Culture | Arts et Culture,Comites-des-fetes,1,Event,1709679600,1744539714,80,,comitedesfetes-bach@laposte.net,0659043617
457011,Salviac Cyclotourisme,"Association de cyclistes pratiquant le VTT , le Gravel et le Cyclotourisme, nous organisons au moins 2 évènements annuels afin de promouvoir nos activités et nous soutenons bénévolement les évènements organisés par le Codep46",/associations/salviac-cyclotourisme,,https://cdn.helloasso.com/img/photos/croppedimage-956ac462a3c74d95b6d8ec69f535f533.png,Salviac,46340,Lot,Occitanie,Place Marie Sudres,44.681766,1.265715,Association1901,VTT | Sport,,1,Event,1702249200,1743256857,80,,jpbrie@gmail.com,0607541613
501365,SOCIETE DES ETUDES LITTERAIRES SCIENTIFIQUES ET ARTISTIQUES DU LOT,"Créée en 1872, la Société des Études du Lot s'interesse à l'histoire et au patrimoine du Quercy. Elle publie un bulletin trimestriel, organise des conférences et des sorties dans le région. ",/associations/societe-des-etudes-litteraires-scientifiques-et-artistiques-du-lot,,https://cdn.helloasso.com/img/photos/croppedimage-89ef36fbf66d44cfa5783cbeec1a3fb1.png,Cahors,46000,Lot,Occitanie,Rue de la Chantrerie,44.447127,1.443851,Association1901Rup,Patrimoine | Arts | Culture,,1,Shop,1714168800,1772878301,80,,etudesdulot@orange.fr,
545700,Association Les amis de Balajou,"Depuis 2018, notre exploitation fonctionne dans le respect des animaux et de la nature. Aucune chèvre n'est partie à l'abattoir et nous faisons tout notre possible pour soigner tous les animaux que nous pouvons. Or pour continuer dans cette démarche, nous avons besoin de vous !",/associations/association-les-amis-de-balajou,,https://cdn.helloasso.com/img/photos/croppedimage-8eca0a10179d4f939db73cd40bfa1cff.jpg,Figeac,46100,Lot,Occitanie,130 chemin de balajou,44.593831,2.016462,Association1901,Animaux | Caritatif | Humanitaire,,1,Membership,1730242800,1769060303,80,,lesamisdebalajou@gmail.com,0642383502
319790,Association des musulmans du Lot,"As salamu aleykoum wa rahmatouLah wa barakatuh,  Nous mettons en place cette cagnotte afin de permettre à tous les fidèles de participer au développement et à l’aggrandissement de votre mosquée bi idni Llah.  Aucun don n’est petit auprès d’Allah soubhanou wa taala.  Jazakoum Allahou kheyran.",/associations/association-des-musulmans-du-lot,,https://cdn.helloasso.com/img/photos/croppedimage-5d3387181ed64ab28f68de52b847df9b.png,Cahors,46000,Lot,Occitanie,Chemin du Perie,44.446813,1.432016,Association1901,Religion | Solidarité et Action Sociale,,1,Donation,1651356000,1651406601,80,,mosqueearrissalahcahors@gmail.com,0783895988
31441,Handi Rando Compostelle Evasion,L'association à pour but de mettre gracieusement à disposition un tricycle hippomobileà usage des Personnes à Mobilité Réduite.,/associations/handi-rando-compostelle-evasion,,https://cdn.helloasso.com/img/photos/50674.JPG,Cœur de Causse,46240,Lot,Occitanie,Le Bourg,44.681676,1.517642,Association1901Rig,Humanitaire | Solidarité | Solidarité et Action Sociale,,4,"Donation, Event",1422831600,,80,,rocastella46@laposte.net,0684057389
423349,Bleu Blanc Rose 46,L’association a pour but de sortir de l’isolement les personnes atteintes du cancer du sein en participant aux ateliers créatifs proposés par l’association. Mais aussi organiser des groupes de parole pour les personnes atteintes du cancer du sein et les aidants. Troc de perruques et turbans. ,/associations/bleu-blanc-rose-46,,https://cdn.helloasso.com/img/photos/croppedimage-e73bbad027e2408eaa97eb567419453b.png,Sauzet,46140,Lot,Occitanie,Rue Ilot du Foirail,44.41706,1.255367,Association1901,Cancer | Humanitaire | Solidarité | Santé,Octobre-rose,3,"CrowdFunding, Membership, Donation",1691791200,1724259642,80,,bleublancrose46@gmail.com,0630114924
23676,Rongeurs Connections,"Rongeurs Connections est une association loi 1901 qui s'occupe de rongeurs, principalement des chinchillas, ayant été abandonnés ou maltraités.",/associations/rongeurs-connections,,https://cdn.helloasso.com/img/photos/35057.jpg,Mercuès,46090,Lot,Occitanie,1045 rue de l'Ancienne Gare,44.504873,1.384976,Association1901,Humanitaire | Solidarité | Solidarité et Action Sociale,,1,Donation,1377468000,,80,,rongeursconnections31@gmail.com,
477744,CAHORS BLUES FESTIVAL,Festival de Blues à Cahors,/associations/cahors-blues-festival,,https://cdn.helloasso.com/img/photos/croppedimage-0994748bcf3a46b1af13e351646d53be.png,Cahors,46000,Lot,Occitanie,"Maison des Associations, Place Bessières",44.4522,1.438871,Association1901Rig,Arts | Blues | Culture | Arts et Culture | Musique,Don,1,Donation,1708383600,1726907679,80,,carnajac.genevieve@neuf.fr,0680842557
531269,ARTS'AS EVENEMENT,"Arts’as Evenement (Arts associés) développe deux axes : arts et cultures, nature et biodiversité. Notre raison d’être : montrer de façon pédagogique et ludique, toutes formes d'art et tous modes de jardinage au naturel en les diffusant au travers d'événements spécifiques au sein de notre terroir.",/associations/arts-as-evenement,,https://cdn.helloasso.com/img/photos/croppedimage-72645746477e464e8e8cee72e44c4a7e.jpg,Cajarc,46160,Lot,Occitanie,738 Chemin de la Route Vieille,44.470627,1.837987,Association1901,Arts | Biodiversité | Culture | Jardinage | Patrimoine,,1,Shop,1725832800,,80,,,
400548,Café associatif de Souillac,"Mai 2023, le café associatif commence son activité. En mode nomade pour l’instant.  Un an après, nous sommes plus de 80 adhérents et 4 à 5 activités par mois.  Bien être, soirée jeux, café des langues, café philo, ateliers créatifs…   Retrouvez notre actualité   https://www.facebook.com/kfeass  ",/associations/cafe-associatif-de-souillac,,https://cdn.helloasso.com/img/photos/croppedimage-fde8d89c5217409894b1bc14a9f7c617.png,Souillac,46200,Lot,Occitanie,27 Avenue de Toulouse,44.886677,1.484007,Association1901,Jeux | Mode | Philosophie | Loisirs,,1,Membership,1683669600,,80,,cafeasso@laposte.net,0663919219
453843,Cancer Support France National,Cancer Support France provides support to English-speaking people living in France whose lives have been touched by cancer.,/associations/cancer-support-france-national,,https://cdn.helloasso.com/img/photos/croppedimage-2f71a84c05e842dea67db0a471584fa8.png,Cahors,46000,Lot,Occitanie,Place Bessières,44.4522,1.438871,Association1901,Cancer | Humanitaire | Solidarité | Solidarité et Action Sociale | Santé,,1,Event,1701212400,,80,,publicrelations@cancersupportfrance.org,0800240200
449883,Le Fil d'ARIANE46,"ASSOCIATION culturelle qui associe le domaine des arts vivants mais aussi des arts picturaux: expositions ainsi que  l enseignement sur un territoire de la communauté des communes de la Vallée du Lot implantée et active a Prayssac, en lien avec toute forme de bien être et de solidarité",/associations/le-fil-d-ariane46,,https://cdn.helloasso.com/img/photos/croppedimage-bf3f28c73c4d4090a900e53897d4bf29.png,Prayssac,46220,Lot,Occitanie,11 Rue des Garabets,44.505277,1.18771,Association1901,Arts | Culture | Enseignement | Solidarité | Arts et Culture,,1,Event,1700002800,1700655808,80,,fildariane46@gmail.com,0656858729
437059,AQUI l'OC,"À l'occasion de ses 10 ans, l'Association AQUÍ L'ÒC lance un appel aux dons.   Aidez-la à continuer à promouvoir le développement de la langue et de la culture occitanes dans le nord du Lot.   Merci beaucoup pour votre soutien !",/associations/aqui-l-oc,,https://cdn.helloasso.com/img/photos/croppedimage-4b9d11769444477ab879310c72109196.jpg,Saint-Céré,46400,Lot,Occitanie,60 Avenue Pierre et Andree Delbos,44.860528,1.892775,Association1901,Culture | Patrimoine,,1,Donation,1696111200,1700120178,80,,asso.aquiloc@gmail.com,0673626463
401907,Bien-Etre et Equilibre 46,"Cette association a pour but de promouvoir le bien-être au quotidien par une variétés de pratiques de développement personnel et de thérapies alternatives. Accompagner vers plus d’équilibre d’harmonie et de bien-être, cela dans le respect de soi et de  l’environnement. ",/associations/bien-etre-et-equilibre-46,,https://cdn.helloasso.com/img/photos/croppedimage-00794e769a81440a914e41a37907aacb.png,Vaylats,46230,Lot,Occitanie,413 route du mas vieil,44.329666,1.651972,Association1901,Environnement | Humanitaire | Solidarité | Santé,,1,Event,1684101600,,80,,bee46@myyahoo.com,0681383428
370284,FIT ZEN,"Une association à but non lucratif propose des activités sportives, culturelle et artistique dont les activités de Zumba, Yoga, Gymnastique Rythmique, pilate, relaxation et Line dance. ",/associations/fit-zen,,https://cdn.helloasso.com/img/photos/croppedimage-77c5a353f99546a98f797d0448709f3a.png,Gorses,46210,Lot,Occitanie,Vieil Canet,44.811818,2.006553,Association1901Rig,Arts | Culture | Gymnastique | Zumba | Bien-être,,1,Membership,1674082800,,80,,fitzen46@gmail.com,0652003552
367296,Bicentenaire du pont Vicat,"Célébrez le bicentenaire du premier édifice construit avec du ciment artificiel.  Faites connaître Louis Vicat, homme d’exception ! Valorisez notre patrimoine, les sciences et les techniques. Favorisez le déploiement des matériaux de construction bas carbone et suscitez des vocations.",/associations/bicentenaire-du-pont-vicat,,https://cdn.helloasso.com/img/photos/croppedimage-012d148f63b64b88abaff7429b6a7980.png,Souillac,46200,Lot,Occitanie,"Mairie, 5 route de Sarlat",44.893981,1.478902,Association1901,Arts | Culture | Sciences | Patrimoine,,2,"Shop, Membership",1673132400,1680471673,80,,quittardjp@imelavi.fr,0782570430
385475,LE CHAMP DES FONTAINES,"Il s'agit de créer un chantier d'insertion dont l'activité est la production marchande de légumes biologiques. Cette production, destinée en priorité aux collectivités territoriales, permettrait d’approvisionner les structures de restauration collective.",/associations/le-champ-des-fontaines,,https://cdn.helloasso.com/img/photos/croppedimage-38a3224e63db4d3496875adb79c706b9.jpg,Souillac,46200,Lot,Occitanie,1 Boulevard Louis Jean Malvy,44.893515,1.479706,Association1901Rig,Humanitaire | Solidarité | Réseaux pros et étudiants,,1,Donation,1678921200,1680468025,80,,audrey.bressoles@initiatives-emplois.fr,0607547190
205387,"ARFA 46 ASSOCIATION DES RESIDENTS, DES FAMILLES ET DES AMIS DES E.H.P.A.D DE CAHORS ET ENVIRONS","L’association a pour objectif d’intervenir pour le bien-être des résidents des EHPAD dans le plus grand respect, par toutes les actions pouvant lui apporter joie, douceur, écoute, prise en compte de leurs besoins.  ",/associations/arfa-46-association-des-residents-des-familles-et-des-amis-des-e-h-p-a-d-de-cahors-et-environs,,https://cdn.helloasso.com/img/photos/croppedimage-55610822ec5f4b4fb239138a9c5e26e3.png,Cahors,46000,Lot,Occitanie,Imp Mal J de Lattre de Tassigny,44.45158,1.430105,Association1901Rig,Caritatif | Humanitaire | Santé,,2,"Donation, Membership",1590188400,,80,,arfaehpad@gmail.com,0647871983
309334,ADAMA Association du Développement de l'Artisanat et des Métiers d'Art,"L’Association du Développement de l'Artisanat et des Métiers d'Art  Participer à la valorisation et à la reconnaissance de l'art et de l’artisanat à travers différentes activités 1 - De promouvoir l'art et l'artisanat 2 - étudier, créer et réaliser, toute manifestation d'intérêt général",/associations/adama-association-du-developpement-de-l-artisanat-et-des-metiers-d-art,,https://cdn.helloasso.com/img/photos/croppedimage-228a682265fb47b8a16741f5d313a19b.png,Saint-Céré,46400,Lot,Occitanie,4 Place du Mercadial,44.860902,1.890286,Association1901Rig,Artisanat | Arts | Culture | Arts et Culture,,1,Donation,1646434800,,80,,adama46400@gmail.com,0640060071
189510,choeur DIVONA," Créé en 1986 par Albertus Dercksen, l'ensemble vocal DIVONA , du Conservatoire de Musique de Cahors, réunit une quarantaine de choristes amateurs. Vous trouverez un aperçu de notre répertoire, essentiellement baroque, sur notre site web choraledivona.net.",/associations/choeur-divona,,https://cdn.helloasso.com/img/photos/croppedimage-2f5fb7aed6cf4d32ab0cb560482bda70.png,Cahors,46000,Lot,Occitanie,Place des Consuls,44.455084,1.437907,Association1901,Arts | Chant | Chorale | Culture | Musique | Loisirs,,1,Donation,1580252400,1656234043,80,,jomourlacaza@gmail.com,0760092152
182671,Quercy blanc modelisme,Amenez les enfants à construire des maquettes de bateaux navigables,/associations/quercy-blanc-modelisme,,https://cdn.helloasso.com/img/photos/les enfants a notre lac-fcaf2f024efa4c1ba6a41e5e8612d199.jpg,Lalbenque,46230,Lot,Occitanie,158 Lotissement de Lucante,44.310835,1.598265,Association1901,Loisirs,,2,Donation,1576105200,,80,,quercymodelisme@orange.fr,0647094169
472839,CYCLO-MARNHAC,"Cyclo Marnhac est un club de cyclotourisme affilié à FFVélo. Nous pratiquons le vélo de route avec trois sorties par semaine de Mars à Novembre (les mercredi, vendredi et dimanche) et deux sorties par semaine de Décembre à Février (mercredi et dimanche).  Contact : cmarnhac@gmail.com",/associations/cyclo-marnhac,,https://cdn.helloasso.com/img/photos/croppedimage-34263e6602d94d0fb611715e736f9030.jpg,Labastide-Marnhac,46090,Lot,Occitanie,Rue de la Mairie,44.386723,1.398524,Association1901,Vélo | Sport,,0,,1707174000,1774724019,80,,cmarnhac@gmail.com,0608003717
399575,COMITE DES FETES DE ST LAURENT LES TOURS,Nous sommes le comité des fêtes de Saint-Laurent-les-tours et organisons chaque année la fête du village le 1er samedi d'août.  Venez nous rejoindre !,/associations/comite-des-fetes-de-st-laurent-les-tours,,https://cdn.helloasso.com/img/photos/croppedimage-005bbcde3ebf4346ab811f6909624c4d.png,Saint-Laurent-les-Tours,46400,Lot,Occitanie,1151 Avenue Jean Lurçat,44.868546,1.894928,Association1901,Fête | Loisirs,Comites-des-fetes,0,,1683496800,1754138328,80,,comitedesfetesstllt@gmail.com,0661830250
312657,Cahors Football Club ,"Tout les ans, Cahors Football Club réalise un tournoi national où nous recevons une soixantaine d’équipes qui viennent de toute la France. Cette manifestation est très importante pour le club mais aussi pour l’ensemble des enfants de la catégorie U 12. ",/associations/cahors-football-club,,https://cdn.helloasso.com/img/photos/croppedimage-ee28d31b964f418492697bd8656aca2f.png,Cahors,46000,Lot,Occitanie,Rue Robert Schumann,44.465398,1.455207,Association1901,Enfance | Football | Sport,,0,,1647903600,1680703638,80,,cahors.foot@orange.fr,0565223339
650187,COMITE DEPARTEMENTAL DE CYCLOTOURISME DU LOT,"L'objectif du Comité Départemental est de favoriser toute action utile au développement et à la promotion du cyclotourisme sous toutes ses formes, tant sur route que sur tous les autres terrains (VTT, Gravel, VTC, etc..) ",/associations/comite-departemental-de-cyclotourisme-du-lot,,https://cdn.helloasso.com/img/photos/croppedimage-5442d704630343828084bef06d008e5c.png,Cœur de Causse,46240,Lot,Occitanie,Place de la Mairie,44.648189,1.568275,Association1901,VTT | Sport,,0,,1771369200,,80,,departement46-presidence@ffvelo.fr,07 57 49 77 57
639715,MONTCUQ EN ROSE,"L’association a pour but de : · Mener des campagnes de sensibilisation pour la lutte contre le cancer du sein, · Organiser des manifestations afin de collecter des fonds qui seront reversés à la Ligue contre le cancer.",/associations/montcuq-en-rose,,https://cdn.helloasso.com/img/photos/croppedimage-db9a8c4a5b064ba896299eb6808bebde.png,Montcuq-en-Quercy-Blanc,46800,Lot,Occitanie,1 place des Consuls,44.338418,1.209699,AssociationProprietaire,Cancer | Caritatif | Humanitaire | Solidarité et Action Sociale | Santé,,0,,1768086000,,80,,,
451154,FSE collège Luzech," F.S.E. signifie ""Foyer socio-éducatif"", association loi 1901. Le F.S.E. a pour but d’animer la vie collective de l’établissement, et de développer la responsabilité des élèves dans le cadre  des activités comme les clubs, Il peut aussi subventionner les actions périscolaires ( sorties, voyages)",/associations/fse-college-luzech,,https://cdn.helloasso.com/img/photos/croppedimage-7479c2b0bda344d2913ec44b891dddaa.png,Luzech,46140,Lot,Occitanie,Chemin du Pech Delmas,44.47669,1.277239,Association1901,Education | Formation | Voyages,,0,,1700348400,,80,,Fsecollegeluzech@hotmail.com,0663603064
336513,DAUPHINS OMNISPORTS DE LA VALLEE DU LOT ET DU VIGNOBLE,"Natation de loisir, natation course, natation sport-bien-être",/associations/dauphins-omnisports-de-la-vallee-du-lot-et-du-vignoble,,https://cdn.helloasso.com/img/photos/croppedimage-69cf7b2c8b104f9ea6b12b39db6d23ec.png,Puy-l’Évêque,46700,Lot,Occitanie,Place de la Truffière,44.504357,1.136507,Association1901,Sport | Natation,,0,,1658962800,,80,,dovlv-puyleveque@orange.fr,0788443522
620725,HELLFIRE CHAMPIONSHIP WRESTLING,,/associations/hellfire-championship-wrestling,,https://cdn.helloasso.com/img/photos/croppedimage-206371d26c8144b886cc450a1e8f572a.png,Pradines,46090,Lot,Occitanie,110 avenue Gaston Monnerville,44.473017,1.407093,Association1901,Sport,,2,Event,1760133600,1774958006,60,,Hcw.catch@gmail.com,
177012,ELAN MARIVALOIS,,/associations/elan-marivalois,https://cdn.helloasso.com/img/logos/elan marivalois-9f8acfa6ad394f9aacb2729d9ec6e0e7.png,,Lacapelle-Marival,46120,Lot,Occitanie,Champ de Belair,44.741766,1.924247,Association1901,Sport,,7,Event,1574204400,1774988738,60,,marivalois.elan@gmail.com,0676800306
631697,COMMERCANTS ET ARTISANS DE CABRERETS,,/associations/commercants-et-artisans-de-cabrerets,,https://cdn.helloasso.com/img/photos/croppedimage-c9cb8670d83945be9f057352ba2c7388.jpg,Cabrerets,46330,Lot,Occitanie,Place de la Mairie,44.50601,1.653907,Association1901,Arts et Culture | Arts | Culture,,2,"Event, Membership",1764111600,1774608969,60,,yanoellelemoine@gmail.com,
159935,C’est pour demain !,"L'association ""C'est pour demain"" gère L’École d’aujourd’hui, école alternative et Forest School pour les enfants de 3 à 11 ans, à Fons dans le Lot. ",/associations/c-est-pour-demain,https://cdn.helloasso.com/img/logos/c est pour demain-2393d6cf12e745d1bcc509d0ec831817.jpg,,Fons,46100,Lot,Occitanie,Le Bourg,44.678158,1.93931,Association1901Rig,Education | Enfance | Formation,Don,4,"Shop, Donation",1564092000,1773826470,60,,cestpourdemain@lilo.org,
215401,Connexion,L'association et Organisme de formation Connexion est implantée sur la commune de Gindou (46). L'association est un organisme de formation certifié Qualiopi et elle propose aussi diverses activités culturelles et de bien-être.  ,/associations/connexion,https://cdn.helloasso.com/img/logos/croppedimage-f006cb41e4a94e178ecad9ba497d0cf3.png,,Gindou,46250,Lot,Occitanie,Lagarrigue,44.62071,1.263066,Association1901,Culture | Formation | Education,Don,5,"Event, PaymentForm, Donation",1597442400,1773080802,60,,connexion@emailasso.net,0667289636
649240, ASSOCIATION DES PARENTS D ELEVES ET AMIS DE L ECOLE PUBLIQUE DE BAGNAC, ,/associations/association-des-parents-d-eleves-et-amis-de-l-ecole-publique-de-bagnac,https://cdn.helloasso.com/img/logos/croppedimage-ad40e955d8514b5ba72ece383dac47a7.png,,Bagnac-sur-Célé,46270,Lot,Occitanie,Rue des Castors,44.66833,2.164142,Association1901,Loisirs,,1,Event,1771110000,1774719148,60,,,
620726,CDS 46 Comité Départemental de Spéléologie du Lot,,/associations/cds-46-comite-departemental-de-speleologie-du-lot,,https://cdn.helloasso.com/img/photos/croppedimage-0dda074304454c5d970410fa664d827b.png,Montfaucon,46240,Lot,Occitanie,Route de la Bastide,44.686844,1.561809,Association1901,Patrimoine,,2,Event,1760133600,1773390147,60,,comitediecteur46@gmail.com,
38889,Cantica Sacra Rocamadour,Rocamadour - musique sacrée,/associations/cantica-sacra-rocamadour,https://cdn.helloasso.com/img/logos/croppedimage-1427737f9a7a4b75a46430fe58e4de04.png,,Rocamadour,46500,Lot,Occitanie,Rue de la Mercerie,44.798429,1.616856,Association1901Rig,Arts | Culture | Musique,Don,18,"Shop, Donation, Membership",1453417200,1774810711,60,OHME,direction@musique-sacree-rocamadour.eu,
283529,"L'Arrosoir, espace social et culturel","Cette association a pour but de créer un lieu dans Figeac qui participe à l’animation socio-culturelle du territoire et permet aux citoyens d’en être acteur en partenariat avec les habitants, les associations et acteurs socio-économiques locaux, que ce soit des personnes physiques ou morales.",/associations/l-arrosoir-espace-social-et-culturel,https://cdn.helloasso.com/img/logos/croppedimage-479c1fa631be49ea9f0dd41875b5d968.png,,Figeac,46100,Lot,Occitanie,5 Rue de Crussol,44.610024,2.032576,Association1901,Culture | Humanitaire | Solidarité | Solidarité et Action Sociale,,2,"Donation, Membership",1632175200,1772891015,60,,contact@larrosoir.org,0952250749
201435, FIGEAC CAPDENAC QUERCY FOOTBALL CLUB,Figeac Capdenac Quercy FC est né de la fusion des clubs de Figeac Quercy Foot et Foot Vallée du Lot Capdenac,/associations/figeac-capdenac-quercy-football-club,https://cdn.helloasso.com/img/logos/test intersport figeac capdenac qfc-0ede8a1ca5274a16bdd5c80cad0e32db.png,,Figeac,46100,Lot,Occitanie,Maison des sportifs - Stade du Calvaire,44.610325,2.031981,Association1901,Sport | Football,,2,"Shop, Event",1587592800,1773329954,60,,figeac.capdenac.qfc@gmail.com,0565340891 
377642,Derrière L'Usine,"Lieu social et culturel et bar associatif dont l'objectif est d'être un lieu de partage et d'échanges intergénérationnels et interculturels, un espace de réflexion et de paroles, de solidarité, de respect de l'environnement, , d'ouverture au monde, d'expression artistique.",/associations/derriere-l-usine,https://cdn.helloasso.com/img/logos/croppedimage-6027910084304364a7c5070a39ea77a6.png,,Castelfranc,46140,Lot,Occitanie,Chemin des Pradelles,44.506014,1.227732,Association1901,Arts | Bar associatif | Culture | Environnement | Humanitaire | Solidarité | Spiritualité,,1,Event,1676502000,1770388725,60,,derrierelusine@gmail.com,0766123238
419509,RALLY COM,"Rally.com est une association qui organise des évènements automobiles. Elle est notamment à l'origine de la montée historique du Lot, Saint Cirq Classic",/associations/rally-com,https://cdn.helloasso.com/img/logos/croppedimage-ec1953b9786b41c1b1d64e61b3f1d828.png,,Saint-Cirq-Lapopie,46330,Lot,Occitanie,Route des Bories hautes,44.441291,1.651986,Association1901,Humanitaire | Solidarité | Solidarité et Action Sociale,,1,Event,1689631200,1774296153,60,,,
200340,Les Rencontres de Bélaye,,/associations/les-rencontres-de-belaye,https://cdn.helloasso.com/img/logos/les rencontres de belaye-a5c4ad18d8074d5eb66c51da19927151.png,,Bélaye,46140,Lot,Occitanie,Mairie,44.45742,1.19082,Association1901Rig,Arts et Culture | Arts | Culture,,1,Membership,1586901600,1774942397,60,,rencontresdebelaye@gmail.com,0761609837
248086,Association Les Amis de Saint-Jacques de Calès,"L'association Les Amis de Saint-Jacques de Calès œuvre avec force et vigueur pour la sauvegarde de son église communale, la préservation du patrimoine lotois et religieux et la promotion d'un lien social et cultuel autour de son église (concerts, expositions, animations etc.)    ",/associations/association-les-amis-de-saint-jacques-de-cales,https://cdn.helloasso.com/img/logos/croppedimage-c38f6e57a66842d0a16526a658098134.png,,Calès,46350,Lot,Occitanie,130 rue des écoles,44.811374,1.537884,Association1901,Patrimoine | Religion,,2,"Donation, Membership",1614121200,1771250049,60,,soulacroup.sylvie@yahoo.com,0687897191
560298,Rêvons nos villages,"L’association Rêvons nos villages et son tiers-lieu le Quinte & Sens sont installés à Felzins depuis 2022. Espace de rencontre et Espace de Vie Sociale soutenu par la CAF, le Quinte propose une quinzaine d'activités culturelles et sociales tous les mois à Felzins et dans les communes alentours. ",/associations/revons-nos-villages,https://cdn.helloasso.com/img/logos/croppedimage-bb52e314e3e94b8bafd3191c694ea23e.png,,Felzins,46270,Lot,Occitanie,570 Route du Bourg,44.604828,2.135131,Association1901,Culture | Humanitaire | Solidarité | Solidarité et Action Sociale,,3,"Donation, Membership",1736204400,1769105370,60,,revonsnosvillages@gmail.com,
464145,Les Jardiniers Bourians,,/associations/les-jardiniers-bourians,,https://cdn.helloasso.com/img/photos/croppedimage-24fb1cf1d94d49d2aa007c8e2c3cc013.png,Salviac,46340,Lot,Occitanie,5 Boulevard Hugon,44.68147,1.263822,Association1901,Ecologie et Environnement | Environnement,,1,Membership,1704841200,1774716514,60,,jardinbourian@gmail.com,0618349634
