objectID,name,description,url,logo,banner,city,zipcode,department,region,address,lat,lng,org_type,category_tags,ha_tags,active_forms_count,active_forms_type,creation_date,last_order_date,score,partners,contact_email,contact_phone
441828,Association les Kikouyou's,"Club de rugby situé dans le Lot (46), le club de Gourdon XV Bouriane organise des lotos, des tombolas et des bourriches tout au long de sa saison.",/associations/association-les-kikouyou-s,https://cdn.helloasso.com/img/logos/croppedimage-8218113a785840019ad045f80d7bfd3b.png,https://cdn.helloasso.com/img/photos/croppedimage-0372c1c3720c4e48a4a616e1fb4775d8.png,Gourdon,46300,Lot,Occitanie,BP 51 Stade Louis Delpech ,44.736687,1.371789,Association1901,Rugby | Sport,,2,"Event, Donation",1697493600,1735235411,110,,alexandre.andrieu18@gmail.com,0634080748
549593,MELODY MASSACRE,"MELODY MASSACRE est une association française dédiée à la promotion d’artistes musicaux à forte dimension culturelle. Elle soutient les talents émergents en leur offrant des opportunités de diffusion, de production et de développement, pour valoriser la richesse de la scène musicale.",/associations/melody-massacre,https://cdn.helloasso.com/img/logos/croppedimage-4f378f2973c2420f872b0eca84d54fc7.png,https://cdn.helloasso.com/img/photos/croppedimage-cff1027be86b44a0b5a93a326eb538c1.jpg,Prudhomat,46130,Lot,Occitanie,Camp del Rieu,44.902523,1.814452,Association1901,Arts | Culture | Musique,,1,Donation,1731538800,,110,,melodymassacre.asso@gmail.com,+33671245367
549490,PEINTRES D'OLT,"PEINTRES D'OLT réunit les peintres amateurs du Lot pour partager leurs pratiques et progresser ensemble. Avec des ateliers animés par un artiste plasticien, visites culturelles et expositions, l’association encourage l'échange et la créativité locale.",/associations/peintres-d-olt,https://cdn.helloasso.com/img/logos/croppedimage-75756fe940574e58a67d1f3fb0451c68.png,https://cdn.helloasso.com/img/photos/croppedimage-1c01f7bec233495d8045e52f5a4cf73a.jpg,Cahors,46000,Lot,Occitanie,Place Bessières,44.4522,1.438871,Association1901,Arts | Culture | Arts et Culture,,1,Donation,1731538800,,110,,peintresdolt.asso@gmail.com,+33671387654
326902,La tangente du corbeau,"La volonté de la Tangente du Corbeau est de soutenir, de faire émerger, car la tangente c'est ce point de contact entre une courbe et une droite, autrement dit, un point de rencontre original et ambitieux entre public, territoire et artistes d'horizons très divers. ",/associations/la-tangente-du-corbeau,https://cdn.helloasso.com/img/logos/croppedimage-976e40e4f3d940fdb0ae431387263174.png,https://cdn.helloasso.com/img/photos/croppedimage-d2e7f91351b44bd2a8b85dd290c2d2eb.jpg,Gourdon,46300,Lot,Occitanie,Cauzenille,44.721111,1.343957,Association1901,Arts | Culture | Arts et Culture,,1,Event,1654466400,1733855662,110,,latangenteducorbeau@gmail.com,0680284981
542704,LALBENQUE CHESS CLUB,"Lalbenque Chess Club est un club d'échecs accueillant et dynamique situé à Lalbenque. Il propose des cours pour enfants et adultes, débutants ou experts, tous les mercredis. L'ambiance est chaleureuse et l'apprentissage ludique. Le club offre une approche moderne et créative des échecs,",/associations/lalbenque-chess-club,https://cdn.helloasso.com/img/logos/croppedimage-4a1e0f57776e49b08b36a6fc628c4a0a.png,https://cdn.helloasso.com/img/photos/croppedimage-3a4054174eef479995ee3d3ebdb6a247.jpg,Lalbenque,46230,Lot,Occitanie,120 Rue du Marche aux Truffes,44.337985,1.546445,Association1901,Enfance | Échecs | Loisirs,,1,Shop,1729202400,1729681072,110,BasicCompta,lalbenquechessclub@gmail.com,0633907037
44573,TOTEM RECIDIVE,"La compagnie TOTEM Recidive a été fondée en 2016 par Loris REYNAERT, Christine Tzerkézos et Thomas Bouyou. En un peu plus de cinq ans, la compagnie a été à l’origine de cinq créations professionnelles et mène de nombreux ateliers de transmission.",/associations/totem-recidive,https://cdn.helloasso.com/img/logos/croppedimage-d0057584150f43728dfef1c9197f7ae9.png,https://cdn.helloasso.com/img/photos/croppedimage-a3c818abb4644953a234d9260365a6f1.png,Touzac,46700,Lot,Occitanie,Les Lacades,44.491043,1.054471,Association1901Rig,Arts | Culture | Arts et Culture,Don,2,"Donation, Membership",1460671200,1710583581,110,,cietotemrecidive@gmail.com,
484531,Lot of Africa,"Créée en 2023 dans le charmant village de Cajarc, l’association Lot of Africa a pour noble aspiration d'organiser chaque année des collectes de dons dans le but d'apporter son soutien aux populations africaines dans le besoin.",/associations/lot-of-africa,https://cdn.helloasso.com/img/logos/croppedimage-b1323db21414412ea17da9f68068f5dd.png,https://cdn.helloasso.com/img/photos/croppedimage-a57296896e67410b89a908afe3d6cb05.png,Cajarc,46160,Lot,Occitanie,12 Place de l’Eglise,44.485111,1.843172,Association1901,Caritatif | Humanitaire | Solidarité et Action Sociale,,2,"Donation, Membership",1710111600,,110,,administration@lot-of-africa.com,0618013365
35672,association pour la recherche contre la maladie de charcot ,association pour la recherche contre la maladie de charcot,/associations/association-pour-la-recherche-contre-la-maladie-de-charcot,https://cdn.helloasso.com/img/logos/association-pour-la-recherche-contre-la-maladie-de-charcot.jpg,https://cdn.helloasso.com/img/photos/68120.jpeg,Girac,46130,Lot,Occitanie,La serre ,44.922459,1.824558,Association1901,Recherche | Santé,,1,Donation,1435960800,1580988863,110,,fourquet2@gmail.com,0621321894
458271,le bolide de faustine,"L'association ""Le Bolide de Faustine"" a été créée avec la mission principale d'apporter un soutien significatif aux enfants et aux familles touchés par les conséquences tragiques des accidents de la route. ",/associations/le-bolide-de-faustine,https://cdn.helloasso.com/img/logos/croppedimage-bae01fd637634b189068837f88301cf0.png,https://cdn.helloasso.com/img/photos/croppedimage-0415f665ef414ed09a38dbc2b26e48e2.png,Cahors,46000,Lot,Occitanie,Place Bessières,44.4522,1.438871,Association1901,Enfance | Humanitaire | Solidarité | Solidarité et Action Sociale,,1,Donation,1702681200,1719609089,110,,lebolidedefaustine@gmail.com,0685710294
23342,chats grains d'amour,Association de protection animale qui lutte (entre autre) contre la proliferation des chats errants en les sterilisant et les soignant. Nous replaçons les sociables dans des familles aimantes et attentionnées.,/associations/chats-grains-d-amour,https://cdn.helloasso.com/img/logos/chats-grains-d-amour.jpg,https://cdn.helloasso.com/img/photos/33766.JPG,Pescadoires,46220,Lot,Occitanie,ld le bourg. Grand place,44.50579,1.158142,Association1901Rig,Animaux | Chats | Humanitaire | Solidarité,,3,"CrowdFunding, Donation",1366495200,1506779366,110,,chatsgrainsdamour@yahoo.fr,0622604482
57210,AFRICAMY, Lutter contre la pauvreté et la précarité en République.de Guinée,/associations/africamy,https://cdn.helloasso.com/img/logos/africamy.JPG,https://cdn.helloasso.com/img/photos/101307.JPG,Payrac,46350,Lot,Occitanie,Lieu-dit Camy,44.782058,1.457952,Association1901Rup,Solidarité et Action Sociale | Humanitaire | Solidarité,Don,4,"PaymentForm, Membership, Donation",1484089200,1736170994,110,,bbrechenade@gmail.com,0678602187
542287,UNIS VERS TERRE,"Unis Vers Terre expérimente et diffuse les pratiques écologiques, au sens large du terme, incluant l'écologie intérieure et relationnelle. Elle organise des ateliers inspirés de l'éducation populaire pour petits et grands, des conférences, des visites de jardins, des temps d'action ressourçant.",/associations/unis-vers-terre,https://cdn.helloasso.com/img/logos/croppedimage-0124e71735eb46368280bae961f5398f.png,https://cdn.helloasso.com/img/photos/croppedimage-ce8dd810c2ba452fba638f00464a7e23.png,Pontcirq,46150,Lot,Occitanie,Route de la Crouzette,44.55077,1.264774,Association1901,Formation | Jardinage | Écologie | Ecologie et Environnement,,1,Membership,1729116000,,110,,unisversterre@protonmail.com,0668744002
396498,JSG TENNIS,"Le club de tennis  « JSG GRAMAT » situé au nord du département du Lot  est composé d’un Bureau, d’un Comité Directeur dynamiques et convivial,  à l’écoute des attentes de ses adhérents.  ",/associations/jsg-tennis,https://cdn.helloasso.com/img/logos/croppedimage-75d398a4be9a42f689e0927dd428c46e.png,https://cdn.helloasso.com/img/photos/croppedimage-3ec44aaa9d244749af84941ec162a2ab.png,Gramat,46500,Lot,Occitanie,235 Impasse Léo Lagrange,44.785066,1.730966,Association1901,Tennis | Sport,,1,Shop,1682373600,1752870063,110,FFT,tennisclubgramat@live.fr,07643645880
396769,COCEEL,Le COCEEL organise la course d'endurance à cheval LES 2 JOURS DE MONTCUQ les 1er et 2 Novembre 2024 pour la 48ème éditions. Epreuve Reine que tout cavalier souhaite ajouter à son palmarès !,/associations/coceel,https://cdn.helloasso.com/img/logos/croppedimage-ee595bd95fad4064ae6fe99ec6ddfb22.png,https://cdn.helloasso.com/img/photos/croppedimage-9c92279509f545a5a00dbba288bc87eb.png,Montcuq-en-Quercy-Blanc,46800,Lot,Occitanie,1 place des Consults,44.338418,1.209699,Association1901Rig,Animaux | Sport,Don,2,Donation,1682460000,1722011484,110,,les2jdemontcuq@gmail.com,0688702758
479271,raid off course,"Distribution de produits non périssables au resto du cœur, et des fournitures scolaires aux enfants défavorisés lors d'un raid humanitaire en Twingo 1",/associations/raid-off-course,https://cdn.helloasso.com/img/logos/croppedimage-30c85d684957475faf2ea378f0528a19.jpg,https://cdn.helloasso.com/img/photos/croppedimage-bd424c6304054218a06d723da148611d.png,Figeac,46100,Lot,Occitanie,29 Rue de la Parrine Basse,44.612358,2.020131,Association1901,Caritatif | Enfance | Humanitaire | Solidarité et Action Sociale,,1,Donation,1708729200,,110,,acidezen@wanadoo.fr,0664104490
523093,ASSOCIATION FONCIÈRE PASTORALE LIBRE DU PLATEAU QUERCY OUEST,L’association foncière pastorale libre a pour objet de contribuer à la prévention des risques incendie et à la préservation de la biodiversité par le maintien d’une activité pastorale favorisant la maîtrise de l’embroussaillement des milieux naturels (art. L.113-2 du code rural).,/associations/association-fonciere-pastorale-libre-du-plateau-quercy-ouest,https://cdn.helloasso.com/img/logos/croppedimage-5abbd32de0a3435d88ee8773363480da.png,https://cdn.helloasso.com/img/photos/croppedimage-e08a99cbe39d48d891fda17d5096521d.png,Floressas,46700,Lot,Occitanie,Place de la Mairie,44.444068,1.121256,AssociationProprietaire,Arts | Biodiversité | Environnement | Ecologie et Environnement,,1,CrowdFunding,1722549600,,110,,afpl.quercy.ouest@gmail.com,0671617296
62264,La Petite Graine Solidaire,"""La Petite Graine Solidaire"" association créée le 15 mars 2017. -Restaurant favorisant la mixité sociale, luttant contre l’exclusion et l’isolement.  -Partenariat avec diverses associations caritatives. -Menu unique à chaque repas (Entrée, plat principal, dessert).  -Prix abordable ",/associations/la-petite-graine-solidaire,https://cdn.helloasso.com/img/logos/croppedimage-9129b06edf7a4fbc8701f0faae1a7428.png,https://cdn.helloasso.com/img/photos/croppedimage-20b90a73ffcb405f99beda37361614a2.png,Figeac,46100,Lot,Occitanie,41 Rue Emile Zola,44.609096,2.035863,Association1901Rig,Caritatif | Humanitaire | Solidarité | Solidarité et Action Sociale,Don,1,CrowdFunding,1493330400,1733822604,110,,lapetitegrainesolidaire@gmail.com,06 67 95 26 70
516750,Au cocon d oree , « Au cocon d’Orée » offre un  espace pour accueillir les femmes et les hommes au sein d’un cercle de paroles et également des sessions de danses et d’autres pratiques corporelles et artistiques ,/associations/au-cocon-d-oree,https://cdn.helloasso.com/img/logos/croppedimage-7067d0eda9074eccb8fcec7af9a38d50.png,https://cdn.helloasso.com/img/photos/croppedimage-eb96772009464774ba74e0920dab2ce8.png,Laval-de-Cère,46130,Lot,Occitanie,101 Route de Gagnac,44.9529,1.9326,Association1901,Arts | Danse | Humanitaire | Solidarité | Spiritualité | Solidarité et Action Sociale,,1,Membership,1719525600,1719770993,110,,swaelie@protonmail.com,0695570107
515783,Désir de Livres,"Désir de livres a vu le jour en 2017, à l’initiative d’un petit groupe de passionnés, lotois d’origine ou d’adoption, animés par l’envie de provoquer des rencontres, et des enthousiasmes, et des vocations de lectrices et lecteurs. ",/associations/desir-de-livres,https://cdn.helloasso.com/img/logos/croppedimage-9dd5e1e4d33e4277833d15cabe7dd737.png,https://cdn.helloasso.com/img/photos/croppedimage-321361dcf4474080960b24077cf3c0a7.jpg,Martel,46600,Lot,Occitanie,Place des Consuls,44.936712,1.608318,Association1901,Arts | Culture | Lecture | Arts et Culture,,1,Membership,1719180000,1764752908,110,,desirdelivreslot@gmail.com,0615784296
485355,Athlé 46 ,"Athlé 46 Souillac est une association sportive créée en 1974 par JC Cristol. Elle vise à permettre et encourager la pratique du sport à Souillac. Aujourd'hui existent plusieurs sections : athlétisme, badminton, escalade, roller, tennis de table.",/associations/athle-46,https://cdn.helloasso.com/img/logos/croppedimage-df20dc4b0cf24eb99572dcee6fe8114d.png,https://cdn.helloasso.com/img/photos/croppedimage-9bc2549481284136b8038740dfa759db.png,Souillac,46200,Lot,Occitanie,Hôtel de Ville,44.895406,1.477378,Association1901,Sport | Athlétisme | Badminton | Escalade | Roller | Tennis de table,,1,Event,1710284400,1718955589,110,,,
94318,Association du Château de Cadrieu,Association d'amoureux•ses de douces fêtes et de vieilles pierres - Loi 1901,/associations/association-du-chateau-de-cadrieu,https://cdn.helloasso.com/img/logos/croppedimage-4bcd2b2b52f741d89ac77f7c8c61ec20.png,https://cdn.helloasso.com/img/photos/croppedimage-06d470abf38d45a9a2930796fe9bdea7.png,Cadrieu,46160,Lot,Occitanie,271 Rue du Château,44.49282,1.883546,Association1901,Arts | Culture | Fête | Arts et Culture,,1,Event,1522360800,1724595007,110,,chateaudecadrieu@gmail.com,
380943,Un brin de bien-être,"Créer du lien, des moments de partage pour se sentir bien, voilà l'objectif de notre association ""Un Brin de Bien Être""",/associations/un-brin-de-bien-etre,https://cdn.helloasso.com/img/logos/croppedimage-8b61c83a036742ff82af2e17ab3e64f0.png,https://cdn.helloasso.com/img/photos/croppedimage-ab8e62532458455c9894e3aff1b7b610.png,Prayssac,46220,Lot,Occitanie,79 Rue de la République,44.514411,1.189914,Association1901,Loisirs,,1,Membership,1677538800,1717400322,110,,unbrindebienetre@gmail.com,0686909041
314556,Mafala,"L'association Mafala a été créée par 3 domaines viticoles de l'appellation Cahors : Le Vent des Jours, le Mas del Périé, et le Clos Troteligotte. L'association est tenue par des bénévoles aspirant au rayonnement du vin de Cahors, au dynamisme de nos territoires et la rencontre de tous les publics. ",/associations/mafala,https://cdn.helloasso.com/img/logos/croppedimage-37547443a9cc47c1896e377253840fc6.png,https://cdn.helloasso.com/img/photos/croppedimage-10bbb7b8452f48c2874a860be6963e70.png,Villesèque,46090,Lot,Occitanie,Al Cap Blanc,44.393712,1.340781,Association1901,Arts | Culture | Artisanat et Cuisine,,2,"Event, Shop",1648764000,1717246013,110,,associationmafala@gmail.com,
210420,AJEF46,"Action pour la Jeunesse, l'Enfance et la Famille du Lot.  Nous proposons des activités ludiques, sportives ou culturelles à différents publics: enfants, jeunes, adultes, personnes âgées, en fonction des besoins et des envies  de chacun. ",/associations/ajef46,https://cdn.helloasso.com/img/logos/croppedimage-37a0e6186b204d38ab863631f30b7a31.png,https://cdn.helloasso.com/img/photos/croppedimage-7382083443494b179e54c3caa217fb17.png,Cahors,46000,Lot,Occitanie,Cahors,44.45771,1.438407,Association1901,Culture | Enfance | Humanitaire | Solidarité | Education,,3,"Event, Donation, Shop",1593295200,1717353768,110,,ajef46@orange.fr,0781788891
503333,Les Raies Nettes - Amicale des joueurs de rugby subaquatique de Puy l'evêque ,Amicale des joueurs de Puy-l’Évêque ,/associations/les-raies-nettes-amicale-des-joueurs-de-rugby-subaquatique-de-puy-l-eveque,https://cdn.helloasso.com/img/logos/croppedimage-e24b0ef684164c148754f483f5b70be7.png,https://cdn.helloasso.com/img/photos/croppedimage-4201362169a94879ab246d05128da41e.png,Puy-l’Évêque,46700,Lot,Occitanie,1 Place de la Truffière,44.503998,1.136734,Association1901,Loisirs,,3,"PaymentForm, Event",1714860000,,110,,lesraiesnettes46@gmail.com,0781917238
447665,Apel St Etienne second degré,"Apel (Association de parents d'élèves de l'enseignement libre) de l'ensemble scolaire St Etienne de Cahors : Collège, lycée général, technologique, professionnel, enseignement supérieur. L'Apel d'établissement a un rôle d'accueil, d'animation, d'information et de conseil des parents d'élèves. ",/associations/apel-st-etienne-second-degre,https://cdn.helloasso.com/img/logos/croppedimage-4edc38c7690c44c7b8bc7ab582e3e3a6.png,https://cdn.helloasso.com/img/photos/croppedimage-b4a8912c9c1144ecb36686b07516ec88.png,Cahors,46000,Lot,Occitanie,49 Rue des Soubirous,44.450402,1.44134,Association1901,Education | Enseignement | Formation | Parents d'élèves | Professionnels | Technologie,,1,Shop,1699398000,1764224838,110,,ludovic.nicolle0360@orange.fr,0664241875
501890,ASSOCIATION DES AMIS DE CAIX ET DES ENVIRONS,"OUI à la rénovation de la base, NON au téléski.  L'association des Amis de Caïx et des environs est une association loi 1901 qui consiste en la préservation patrimoniale de: l’architecture, la flore, la faune, la biodiversité, ses activités viticoles et agricoles, sa qualité de base familiale.",/associations/association-des-amis-de-caix-et-des-environs,https://cdn.helloasso.com/img/logos/croppedimage-22c976aac44741baad3896f9d166a3da.png,https://cdn.helloasso.com/img/photos/croppedimage-bca0681420d34d26a6c22817652745b8.png,Luzech,46140,Lot,Occitanie,81 Impasse du Manoir,44.491642,1.296858,Association1901,Architecture | Biodiversité | Environnement | Ecologie et Environnement,,1,Membership,1714341600,1715697678,110,,associationdesamisdecaix@gmail.com,
461439,Follow Your Heart,  cette association a pour but de promouvoir la culture musicale jamaïquaine des sound system  ,/associations/follow-your-heart,https://cdn.helloasso.com/img/logos/croppedimage-ce4d9babaf5d44849ceafeab512f5dbf.png,https://cdn.helloasso.com/img/photos/croppedimage-d34384550b20424aa80fca175b2afec1.png,Montfaucon,46240,Lot,Occitanie,99 Rue des Tilleuls,44.685033,1.559875,Association1901,Arts | Culture | Musique,,1,Event,1704236400,1713973435,110,,followyourheart2020@outlook.fr,
487989,TANGOMANIA,"DÉVELOPPER ET PROMOUVOIR L'ENSEIGNEMENT, LA PRATIQUE ET LA CULTURE DU TANGO ARGENTIN.",/associations/tangomania,https://cdn.helloasso.com/img/logos/croppedimage-073bcf3a03594171b48e9cc300bc2648.png,https://cdn.helloasso.com/img/photos/croppedimage-a2358de1dfd042c4b1117dabd4006ffa.png,Cahors,46000,Lot,Occitanie,Rue jacques Brel Residence La Fontaine BAT B3 Appt 82,44.452297,1.447687,Association1901,Arts | Culture | Enseignement | Tango | Arts et Culture,,1,Event,1710716400,1713361973,110,,tangomania46@gmail.com,+33680546481
492773,association wekadoc,Création documentaire,/associations/association-wekadoc,https://cdn.helloasso.com/img/logos/croppedimage-e18c45583efc4666bf1f20a51d57a544.png,https://cdn.helloasso.com/img/photos/croppedimage-9ee98fe8d240412f9e08013f66278a7e.jpg,Saint-Laurent-les-Tours,46400,Lot,Occitanie,Saint-Laurent-les-Tours,44.878137,1.897266,Association1901,Arts | Culture | Arts et Culture,,1,Membership,1711922400,1713292377,110,,ameteoterre@gmail.com,
218295,ENSEMBLE LA MARQUISE,,/associations/ensemble-la-marquise,https://cdn.helloasso.com/img/logos/croppedimage-5d7578c0f1864d91b18ed857aa910e4a.png,https://cdn.helloasso.com/img/photos/croppedimage-bd931612c50943cf9b4114934fdb1a9c.png,Lanzac,46200,Lot,Occitanie,Route de la Durantie,44.876591,1.476668,Association1901,Arts et Culture | Arts | Culture,,6,"Shop, PaymentForm, Donation, Event, Membership",1599256800,1681577116,110,,ensemblelamarquise@gmail.com,
364658,Association Contre les Discriminations et le Harcèlment en milieu scolaire-ACDH,"Notre association a pour but, de lutter contre les Discriminations et le Harcèlement dans le milieu scolaire de la primaire au lycée, dans les établissements scolaires, les transports scolaires, ect... Nous proposons des formations pour les personnels, parents et des activités de sensibilisation.",/associations/association-contre-les-discriminations-et-le-harcelment-en-milieu-scolaire-acdh,https://cdn.helloasso.com/img/logos/croppedimage-5455bf9ad0dd4f1d90aa0cf9c5ee1e3b.png,https://cdn.helloasso.com/img/photos/croppedimage-279ff2015ce34dc89ffa1a9557588c6d.png,Cahors,46000,Lot,Occitanie,Place Bessières,44.4522,1.438871,Association1901,Education | Formation | Humanitaire | Solidarité,,3,"Membership, Donation, CrowdFunding",1671577200,,110,,association-acdh@laposte.net,0695583136
398353,Asssociation LuzArt,"LuzArt, association d’habitants de Luzech et des environs, porte un projet de tiers lieux, dans l’ancien collège de Luzech, sis avenue d’Uxellodunum. Ce lieu nommé Absolument Fabuleux (AbFab), se définit comme un conservatoire rural du vivre mieux, dans un cadre laïc.",/associations/asssociation-luzart,https://cdn.helloasso.com/img/logos/croppedimage-44f5f3f2f2024bb89acd654fb90fb647.png,https://cdn.helloasso.com/img/photos/croppedimage-30a9b9934c5c4a5594a13dc50731e68c.png,Luzech,46140,Lot,Occitanie,204 Avenue d'Uxellodunum,44.476917,1.289339,Association1901Rig,Arts | Culture | Ecologie et Environnement | Patrimoine,Don,2,"Donation, Membership",1683064800,1705692094,110,,admin@absolumentfabuleux.org,0682739355
480617,Association sportive du lycée hôtelier Quercy Périgord,"L'Association sportive du lycée hôterlier Quercy Périgord propose une collecte de dons en ligne, pour permettre à nos élèves de participer aux championnats de France de futsal filles et rugby cadets garçons.  Merci de votre contribution !",/associations/association-sportive-du-lycee-hotelier-quercy-perigord,https://cdn.helloasso.com/img/logos/croppedimage-3171e9c0b78f4c40815f046703f5d3ca.png,https://cdn.helloasso.com/img/photos/croppedimage-7c405424125a4234831d691c1d792cc3.jpg,Souillac,46200,Lot,Occitanie,Avenue Roger Couderc,44.894195,1.470812,Association1901,Sport | Futsal | Rugby,,1,Donation,1709074800,1710321640,110,,alexandre.andrieu18@gmail.com,0634080748
77646,Cultures des Demains,"L'association Cultures des Demains œuvre la promotion d'une approche permaculturelle dans tous les domaines de la vie. Elle propose des formations, des ateliers, des chantiers participatifs, des animations, du conseil et de l'accompagnement.",/associations/cultures-des-demains,https://cdn.helloasso.com/img/logos/croppedimage-10cacedc90b94813995804d62d48e1c9.png,https://cdn.helloasso.com/img/photos/croppedimage-1869e9f8f68d44c38c52557018a25032.png,Le Bouyssou,46120,Lot,Occitanie,lieu-dit La Grassetie,44.6945,1.9373,Association1901Rig,Culture | Formation | Education,,2,"Donation, Membership",1519945200,1708978089,110,,contact@culturesdesdemains.fr,06 65 23 65 79
477231,Collectif La Case Départ,"Asso loi 1901, créée en janvier 2024, La Case Départ voyage au cœur de l’humain et plus particulièrement en Casamance, région située au sud du Sénégal. Nous proposons des activités telles que l’organisation d’évènements culturels, la vente de produits/services ou des actions d'éducation/formation!",/associations/collectif-la-case-depart,https://cdn.helloasso.com/img/logos/croppedimage-1988148360b843478606bd2d268dfaf4.png,https://cdn.helloasso.com/img/photos/croppedimage-5d1e05d894b84107864b5e202fad2132.png,Cahors,46000,Lot,Occitanie,344 chemin du Levant,44.445471,1.452235,Association1901,Caritatif | Culture | Formation | Humanitaire | Voyages | Solidarité et Action Sociale,,1,Membership,1708297200,1715866895,110,,collectif.lacasedepart@gmail.com,0670829126
387384,Les Mallains ,"Les Mallains est une association ayant pour objet de fournir du matériel scolaire et sportif, des dons alimentaires et financiers ainsi qu’un appui technique et logistique à différentes associations et/ou organismes à but non lucratif dans le domaine humanitaire et environnemental.",/associations/les-mallains,https://cdn.helloasso.com/img/logos/croppedimage-c240dd1a4d3b40ba97c15645a106c945.jpg,https://cdn.helloasso.com/img/photos/croppedimage-2281ac67420c43c28161a5e56faa1c86.png,Souillac,46200,Lot,Occitanie,59 Rue de la Récège,44.900766,1.474277,Association1901,Caritatif | Environnement | Humanitaire | Solidarité et Action Sociale,,1,CrowdFunding,1679439600,1707747102,110,,les.mallains@gmail.com,
356074,Ski Club Gramatois,Ski Club Gramatois || Gramat (LOT - 46) || Occitanie,/associations/ski-club-gramatois,https://cdn.helloasso.com/img/logos/croppedimage-4b213464098d4aa49886fe047640f597.png,https://cdn.helloasso.com/img/photos/croppedimage-c887979690e54f3faf63d3d4d0acc27a.png,Gramat,46500,Lot,Occitanie,Avenue Victor Hugo,44.784944,1.736278,Association1901,Sport | Ski,,2,"PaymentForm, Donation",1668121200,1708419413,110,,skiclubgramatois@gmail.com,0749934608
331706,association BOXER'AMI,Association de protection animale Dédiée aux chiens de race Boxer et croisés boxer,/associations/association-boxer-ami,https://cdn.helloasso.com/img/logos/croppedimage-2db8adf061bd4096bec0be9304e2965d.jpg,https://cdn.helloasso.com/img/photos/croppedimage-07dbc9b5e72a43c591f26892e877de5e.png,Gignac,46600,Lot,Occitanie,909 route du mas roudie,44.971022,1.451874,Association1901,Animaux | Chiens | Humanitaire | Solidarité,,1,Membership,1656108000,,110,,association.boxerami@gmail.com,0769922571
