objectID,name,description,url,logo,banner,city,zipcode,department,region,address,lat,lng,org_type,category_tags,ha_tags,active_forms_count,active_forms_type,creation_date,last_order_date,score,partners,contact_email,contact_phone
524370,Le petit chœur de Lugagnac,"Chorale mixte d'environ 13 chanteurs, animée bénévolement à Lugagnac, 46, Le Petit Choeur de Lugagnac donne un petit récital pour le Noël des enfants du village, et un concert ""au chapeau"" dans l'église du village en fin juin, accompagné autant que possible par d'autres musiciens amateurs voisins.",/associations/le-petit-ch-ur-de-lugagnac,,,Lugagnac,46260,Lot,Occitanie,152 Route des Serres,44.408705,1.738814,Association1901,Arts | Chant | Chorale | Culture | Enfance | Musique,,1,Membership,1723327200,,30,,devilliers.michelle@orange.fr,0674409889
481498,Comité des fêtes de SOULOMES,"Association ayant pour but d'organiser des rencontres dansantes (4 bals+ 3 jours de fêtes) , théâtrales...",/associations/comite-des-fetes-de-soulomes,,,Soulomès,46240,Lot,Occitanie,Place de l’Eglise,44.63281,1.594509,Association1901,Fête | Théâtre | Loisirs,Comites-des-fetes,1,Event,1709334000,,30,,chantal.sotoul@wanadoo.fr,0680651045
505010,Imagine Corrèze,"Imagine… est un collectif de personnes réunies pour faire émerger des possibles et créer de l’innovation sociale, culturelle, éducative et environnementale, en acquérant des lieux à vocation collective et en permettant à des projets, respectueux du vivant, d'émerger et de s’y développer ",/associations/imagine-correze,,,Saint-Céré,46400,Lot,Occitanie,170 Quai Auguste Salesses,44.857901,1.89569,Association1901,Culture | Environnement | Humanitaire | Solidarité | Ecologie et Environnement | Solidarité et Action Sociale,,1,CrowdFunding,1715551200,,30,,,
412504,BIOPERMA ,"BIOPERMA est une association créer, dans un projet de partage sociaux culturels, autour d'une idée simple, et, d'un mot clé ""Ensemble"". Notre secteur d'activité, est l'agriculture. L'agriculture sous ça forme la plus naturel et la plus logique.  ""La nature au naturel""  ",/associations/bioperma,,,Gramat,46500,Lot,Occitanie,6 Avenue Léon Gambetta,44.781442,1.727675,Association1901,Culture | Environnement | Ecologie et Environnement,,3,"Donation, Membership",1687298400,,30,,j.boyer1346@yahoo.com,0784715216
510130,US LUZECH CYCLOTOURISME,Union sportive luzechoise section cyclotourisme ,/associations/us-luzech-cyclotourisme,,,Catus,46150,Lot,Occitanie,Mairie de LUZECH,44.557199,1.33705,Association1901,Sport,,1,Event,1717106400,,30,,chrisgigou46@gmail.com,0632631462
485180,Les Corneilles,"L'association a pour but d'organiser des événements culturels autour du livre et de la lecture : festival BD, Mangas, festival polar, mais aussi conférences sur le thème de la nature et de l'écologie et autres rencontres.",/associations/les-corneilles,,,Prayssac,46220,Lot,Occitanie,11 Rue René Lafargue,44.505749,1.191895,Association1901Rig,Arts | Bande-dessinée | Culture | Lecture | Écologie | Arts et Culture,,1,Membership,1710284400,1762095692,30,,association.corneilles@gmail.com,
478033,GIGNAC ENSEMBLE,"Association citoyenne qui œuvre sur le nord du Lot et cherche à développer l'implication citoyenne dans le cadre d'une démarche participative. Elle organise différentes manifestations dans les domaines artistique, culturel ou scientifique en mettant le partage au cœur de son activité.",/associations/gignac-ensemble,,,Gignac,46600,Lot,Occitanie,58 CHEMIN DES CLUZELS,45.006271,1.473258,Association1901,Arts | Culture | Arts et Culture | Loisirs,,1,Donation,1708470000,1709562856,30,,contact@gignac-ensemle.fr,0674208973
475569,MAXOUWOOD,"MAXOUWOOD, une association dédiée à la promotion du cinéma en milieu rural. Notre mission est d'apporter l'art cinématographique au cœur des communautés rurales, offrant ainsi un accès facile et enrichissant à des films de qualité.",/associations/maxouwood,,,Maxou,46090,Lot,Occitanie,les Maries,44.536669,1.430399,Association1901,Arts | Cinéma | Arts et Culture,,1,Membership,1707865200,,30,,,
469398,Resilience Environnement Sport Osmose,"lieu accueil et d activités permanentes . Remise en valeur de notre espace rural et patrimonial  résilience locale. stage sportif et chantiers participatifs, activités de la ferme ",/associations/resilience-environnement-sport-osmose,,,Rignac,46500,Lot,Occitanie,roussieres,44.809725,1.706728,Association1901,Patrimoine,,1,Event,1706223600,,30,,reso46lot@gmail.com,
302942,L'Oasis de Capucine,"Cette association à but non lucratif a pour but l’éducation à la nature, la protection de la biodiversité, et le développement des liens qui unissent l’homme et la nature. Les activités culturelles et de bien-être proposées favorisent le partage et un vivre ensemble respectueux de la vie. ",/associations/l-oasis-de-capucine,,,Fajoles,46300,Lot,Occitanie,Le Pech - Chemin des Prades,44.801713,1.400728,Association1901,Biodiversité | Culture | Environnement | Ecologie et Environnement,,1,Membership,1643410800,1717071182,30,,oasisdecapucine@gmail.com,
384312,Festival La Source Bleue,,/associations/festival-la-source-bleue,,,Touzac,46700,Lot,Occitanie,725 Route de la Source Bleue,44.490584,1.053089,Association1901,Arts et Culture | Arts | Culture,,2,"Membership, Donation",1678575600,1722100920,30,,festivalsourcebleue@gmail.com,0642843790
457766,APEL classes primaires et maternelles institution jeanne d'arc,Nous représentons tous les parents sur les sujets qu'ils souhaitent. Nos sommes là pour améliorer le bien être des enfants à l'école et proposer des animations. nous avons besoin de vous parents pour proposer encore plus de projets.,/associations/apel-classes-primaires-et-maternelles-institution-jeanne-d-arc,,,Figeac,46100,Lot,Occitanie,1 Rue du Monastere,44.607634,2.035843,Association1901,Enfance | Formation | Education,,1,Membership,1702508400,,30,,jeannedarc.ec.figeac@apel46.fr,0565341248
215262,Farang boxing club,"Nous somme un club sportif. Nous enseignons la boxe thaï, boxe anglaise et la gym fitness. Pour les enfants, adultes.",/associations/farang-boxing-club,,,Belmont-Bretenoux,46130,Lot,Occitanie,Lieu Dit Fontalba,44.888571,1.882109,Association1901,Sport | Boxe | Enfance | Fitness | Gymnastique,,1,Donation,1597269600,1702931017,30,,mdesnot@yahoo.com,0610848114
442393,FSE collège Jean Lurçat,"Association destinée aux élèves du collège Jean Lurçat, 46400 Saint Céré, et tout ce qui gravite autour de leurs apprentissages, de la culture, du sport, de leur épanouissement,...",/associations/fse-college-jean-lurcat,,,Saint-Céré,46400,Lot,Occitanie,lucien darnis,44.857185,1.89629,Association1901,Education | Culture | Formation,,1,CrowdFunding,1697666400,,30,,barbara.thomas@ac-toulouse.fr,0616353045
446623,L'OUTIL EN MAIN CAHORS ET BASSE VALLEE DUU LOT,Sensibilisation des enfants de 9 a 14 ans aux métiers manuels,/associations/l-outil-en-main-cahors-et-basse-vallee-duu-lot,,,Cahors,46000,Lot,Occitanie,Rue Saint Ambroise,44.46568,1.45055,Association1901,Enfance | Formation | Education,,1,Membership,1699052400,,30,,lafragettejean@gmail.com,0607125778
381479,Ephem'r,,/associations/ephem-r,,,Cahors,46000,Lot,Occitanie,35 Rue Henri Puget,44.446143,1.437448,Association1901,Arts et Culture | Arts | Culture,,1,Event,1677711600,1693687348,30,,ephemr.asso@gmail.com,0632942375
421073,Mercues football club,Foot ,/associations/mercues-football-club,,,Espère,46090,Lot,Occitanie,18 rue des chenes,44.50552,1.38219,Association1901,Sport | Football,,1,Event,1690408800,,30,,combadazou.lea@icloud.com,0603947128
412052,Patrick Brouelles,Association a but non lucratif basé à Brouelles,/associations/patrick-brouelles,,,Maxou,46090,Lot,Occitanie,786 Route des Mas,44.553105,1.451864,Association1901,Arts | Culture | Arts et Culture,,1,Event,1687212000,,30,,MASLEVIGNE46@GMAIL.COM,0630643470
148868,LIVERNON-AUTREMENT,L'Eau et les Sols du LOT menacés par le DIGESTAT  BRUT des méthaniseurs,/associations/livernon-autrement,,,Livernon,46320,Lot,Occitanie,Le Mejour,44.642865,1.842719,Association1901Rig,Environnement | Ecologie et Environnement,Don,3,"Donation, Shop",1558476000,1706725016,30,,alireve@club-internet.fr,0682023459
375657,Caisse de grève Réforme des retraites SNETAP FSU Elan Commun Occitanie ,Constituer un outil de solidarité afin de gagner ensemble la bataille contre cette réforme des retraites.,/associations/caisse-de-greve-reforme-des-retraites-snetap-fsu-elan-commun-occitanie,,,Le Montat,46090,Lot,Occitanie,422 Lieu Dit Lacoste,44.376195,1.438423,Association1901,Humanitaire | Solidarité | Solidarité et Action Sociale,,1,Donation,1675897200,,30,,occitanie@snetap-fsu.fr,
372096,REGROUPEMENT GAMING FRANCE,Association Multi gaming et ESPORT,/associations/regroupement-gaming-france,,,Puy-l’Évêque,46700,Lot,Occitanie,Puy-l'Évêque,44.500949,1.139046,Association1901,Sport,,1,Membership,1674774000,,30,,contact@rgfr-esport.fr,0768099794
94626,Festival du Quercy Blanc et des Arts Vivants,Organisation de concerts de musique classique en milieu rural,/associations/festival-du-quercy-blanc-et-des-arts-vivants,,,Lendou-en-Quercy,46800,Lot,Occitanie,Mairie,44.307309,1.265047,Association1901Rup,Arts | Culture | Musique classique | Musique,,1,Donation,1522796400,,30,,mireille.cma46@gmail.com,
191629,Sans ses Oreilles,Promouvoir la langue des signes française en milieu rural,/associations/sans-ses-oreilles,,,Teyssieu,46190,Lot,Occitanie,Teyssieu,44.923995,1.959905,Association1901,Education | Formation,,2,Donation,1581289200,,30,,rives_cindy@yahoo.fr,0646755543
347361,Créer Accompagner Partager Le CAP,lva ,/associations/creer-accompagner-partager-le-cap,,,Camburat,46100,Lot,Occitanie,Le Cap Del Castel ,44.651209,2.012679,Association1901,Humanitaire | Solidarité | Solidarité et Action Sociale,,1,Donation,1664665200,,30,,tche46@aol.com,0683187174
311392,les Archers du Causse de Gramat,"Le club des Archers du Causse de Gramat, dans le Lot, est un petit club de tir à l'arc, qui a la responsabilité d'organiser le Championnat de France par équipes de clubs de tir 3d, en septembre 2022.",/associations/les-archers-du-causse-de-gramat,,,Gramat,46500,Lot,Occitanie,Rue Alexandre Dumas,44.787027,1.721103,Association1901,Sport | Tir | Tir à l'arc,,1,Donation,1647298800,1662533960,30,,cdf2022archersducausse@gmail.com,0613270135
328245,Jauzac multisport,Je cherche des aides financières au travers de sponsors qui me permettront d’aller au bout de 2 nouveaux objectifs et de vivre ces belles aventures sportives ! Championnat d’Europe le 18 septembre 2022 à Bilbao (Espagne) Championnats du Monde de Half-IRONMAN le 29 octobre 2022 à Saint-Georges (USA),/associations/jauzac-multisport,,,Gagnac-sur-Cère,46130,Lot,Occitanie,Gagnac-sur-Cère,44.942129,1.879311,Association1901,Sport,,1,Donation,1654815600,,30,,remi.jauzac@hotmail.fr,0626833654
186193,Les lotoises ,,/associations/les-lotoises,,,Saint-Chamarand,46310,Lot,Occitanie,Mas de Gamot,44.688949,1.448857,Association1901,Sport,,1,Event,1578697200,,30,,aude4646@hotmail.fr,0630419092
97152,Sanctuaire ND de Rocamadour - Association diocésaine de Cahors,"Sanctuaire du diocèse de Cahors situé en Quercy - Vallée de Dordogne accueillant les visiteurs : pélerins et touristes, découverte d'un site culturel et spirituel",/associations/sanctuaire-nd-de-rocamadour-association-diocesaine-de-cahors,,,Rocamadour,46500,Lot,Occitanie,Rue de la Mercerie,44.798429,1.616856,Association1905Rup,Culture | Religion | Tourisme | Patrimoine,,1,Event,1524780000,1739349070,30,,events@rocamadour.eu,
332304,Collège du Puy d'Issolud - VAYRAC,Bienvenue sur la page du Foyer Socio Éducatif du Collège du Puy d'Issolud de Vayrac (46).  ,/associations/college-du-puy-d-issolud-vayrac,,,Vayrac,46110,Lot,Occitanie,Avenue de la Liberation,44.954343,1.705973,Association1901,Education | Formation,,1,Membership,1656370800,,30,,nicolas.gagneux@ac-toulouse.fr,0673047351
62897,Le Presque Rien,"Le Presque Rien, un lieu culturel convivial à Fons !",/associations/le-presque-rien,,,Fons,46100,Lot,Occitanie,Le Bourg,44.678158,1.93931,Association1901,Culture | Arts et Culture,,1,Membership,1494367200,1506601887,30,,lepresquerien.fons@gmail.com,
468293,Avenir vivant et citoyen en Quercy,Association œuvrant à la transition énergétique et écologique en Quercy Blanc par la promotion d'actions citoyennes et locales de sobriété et de préservation de la biodiversité,/associations/avenir-vivant-et-citoyen-en-quercy,,,Montcuq-en-Quercy-Blanc,46800,Lot,Occitanie,Rue de la Mairie,44.338296,1.209957,Association1901,Ecologie et Environnement | Biodiversité | Environnement | Écologie,,0,,1705964400,1765950227,30,,avecq@protonmail.com,0688367057
342657,TLAXNAIWALHAC ,Association de loi de 1901 qui a pour but de promouvoir l'échange des cultures à travers le monde,/associations/tlaxnaiwalhac,,,Orniac,46330,Lot,Occitanie,chemin du moulin du liauzu,44.521031,1.673778,Association1901,Arts | Culture | Arts et Culture,,0,,1662760800,1760813302,30,,dhassoun@hotmail.com,0612114656
573227,COMITE DES FETES SAUZET,"Comité des Fêtes de Sauzet:  Association 1901 à but non lucratif.  Nous sommes une vingtaine de bénévoles ayant à cœur la vie local, le dynamisme de notre village dans la convivialité et la bonne humeur. Nous organisons des manifestations au cours de l'année (Foire à l'ail, marché de Noël,...)",/associations/comite-des-fetes-sauzet,,,Sauzet,46140,Lot,Occitanie,Place de la Mairie,44.417776,1.254203,Association1901,Fête | Loisirs,Comites-des-fetes,0,,1740524400,1759739377,30,,comitedesfetessauzet26@gmail.com,
308269,Comice agricole Livernon,"Exposition d'animaux présents dans l'ancien canton de Livernon, exposition de vieux matériels agricole, rencontre artisannale locale ",/associations/comice-agricole-livernon,,,Durbans,46320,Lot,Occitanie,Durbans,44.672447,1.79611,Association1901,Patrimoine | Animaux,,0,,1646002800,1757680447,30,,patrick.villepontoux46@orange.fr,0761104476
401592,VAYRAC TENNIS CLUB,Pratique du sport du tennis,/associations/vayrac-tennis-club,,,Vayrac,46110,Lot,Occitanie,Impasse du Gymnase,44.955209,1.709375,Association1901,Sport | Tennis,,0,,1684101600,1756040859,30,BasicCompta | FFT,tennisclubvayrac@orange.fr,0777054024
516072,Jamais Sans Toit 46 Cahors,"Au sein d'un collectif, JST46 est une association qui, à Cahors, a pour mission de trouver  des solutions de ré-hébergement pour des personnes, migrant-tes et réfugié-es, lesquelles débouté-es de leur demande d’asile, sans plus d’aide d’état, sont en situation d’être à la rue.          ",/associations/jamais-sans-toit-46-cahors,,,Cahors,46000,Lot,Occitanie,750 Chemin de Peyrolis,44.434746,1.433175,Association1901,Solidarité et Action Sociale | Caritatif | Humanitaire,,0,,1719266400,1735549441,30,,info@jst46-cahors.fr,0673130450
541061,Comité des Fêtes de Saint Pierre Lafeuille,"Grâce à une équipe de bénévoles engagés, le comité propose des activités variées pour rassembler les habitants, petits et grands, autour de moments de partage et de plaisir.",/associations/comite-des-fetes-de-saint-pierre-lafeuille,,,Saint-Pierre-Lafeuille,46090,Lot,Occitanie,Saint-Pierre-Lafeuille,44.519331,1.455334,Association1901,Loisirs,Comites-des-fetes,0,,1728770400,1731751094,30,,cdf.stpierrelafeuille@gmail.com,0670277647
499700,Association Loisirs Culture Patrimoine du Pays de Sousceyrac-en-Quercy,"Sur le territoire du Pays de Sousceyrac-en-Quercy (46190)      Notre association a pour objet - de promouvoir les richesses patrimoniales et environnementales,  - de développer et d'organiser des activités culturelles,  - de développer et d'organiser des activités de loisirs sportifs et d'animations",/associations/association-loisirs-culture-patrimoine-du-pays-de-sousceyrac-en-quercy,,,Sousceyrac-en-Quercy,46190,Lot,Occitanie,"ALCP Mairie de Sousceyrac 8, allée Gaston Monnerville",44.872481,2.036451,Association1901Rig,Culture | Environnement | Patrimoine,,0,,1713650400,1730406868,30,,alcpsousceyrac@gmail.com,0618223242
496553,Miss Rêve et Diadème,"Miss Rêve et Diadème est une association ouverte à toutes les femmes, créée en 2024. C'est un comité qui met en avant la femme actuelle sous toutes ses formes. Cette aventure est destinée à toutes les femmes (à partir de 15ans, catégorie JUNIOR, 18 ans, catégorie ADULTE). Aucun critères physique.",/associations/miss-reve-et-diademe,,,Biars-sur-Cère,46130,Lot,Occitanie,32 Avenue de la République,44.926941,1.845264,Association1901,Arts | Culture | Solidarité et Action Sociale,,0,,1712700000,1729545015,30,,missreveetdiademe.france@gmail.com,0766138852
347987,COMITE DES FETES DE LIMOGNE EN QUERCY,Fête traditionnelle et intergénérationnelle,/associations/comite-des-fetes-de-limogne-en-quercy,,,Limogne-en-Quercy,46260,Lot,Occitanie,Place de la Mairie,44.397417,1.770718,Association1901,Fête | Loisirs,,0,,1664834400,1723808297,30,Fncof,,
483386,RCBBV,,/associations/rcbbv,,,Bretenoux,46130,Lot,Occitanie,103 Avenue Charles de Gaulle,44.917518,1.836992,Association1901,Loisirs,,0,,1709766000,1718564989,30,,zoe.bouzou46130@gmail.com,0643618963
453680,holistique moi,"œuvrer pour un esprit et un corps en osmose à travers des ateliers, activités, manifestations, etc...",/associations/holistique-moi,,,Lamagdelaine,46090,Lot,Occitanie,255 Chemin de Coty,44.462536,1.494507,Association1901,Étudiants | Réseaux pros et étudiants,,0,,1701126000,1705767135,30,,karine.soussiel@orange.fr,0636102166
417462,AGNEAU FERMIER DU QUERCY,"Notre association est un Organisme de Défense et de Gestion d'une démarche qualité en agroalimentaire, l'Agneau Fermier du Quercy. C'est un Label rouge et une Indication Géographique Protégée. Nos éleveurs sont sur le département du LOT et nos points de vente se trouvent partout en France. ",/associations/agneau-fermier-du-quercy,,,Gramat,46500,Lot,Occitanie,Impasse du Périé,44.763352,1.760859,Association1901,Étudiants | Réseaux pros et étudiants,,0,,1688680800,1694610332,30,,igp@agneau-quercy.fr,0683793743
253520,association culturelle La Mouchine,L'association La Mouchine est à l'origine et organise chaque année le Festival de Musiques de Saint Cirq Lapopie.,/associations/association-culturelle-la-mouchine,,,Berganty,46090,Lot,Occitanie,Rue de Lapeyre Haute,44.454586,1.627417,Association1901Rig,Arts | Culture | Musique,Don,0,,1616626800,1688494179,30,,lamouchine@gmail.com,
385411,La Marelle 46,Association de parents d'élèves ,/associations/la-marelle-46,,,Douelle,46140,Lot,Occitanie,Place de l’Ecole,44.471028,1.360583,Association1901,Parents d'élèves | Education,,0,,1678834800,1679768586,30,,lamarelle46@gmail.com,0687108863
306386,L'épicerie du Causse,Proposer à toutes personnes qui le désire l’accès à proximité à des produits alimentaires et du quotidien qui répondent au maximum aux critères de la liste suivante  : Agriculture paysanne ;  produits biologiques ; fonctionnement en circuit court;  des emballages limités au strict nécessaires. ,/associations/l-epicerie-du-causse,,,Durbans,46320,Lot,Occitanie,Le Mazut,44.66328,1.722657,Association1901,Humanitaire | Solidarité | Réseaux pros et étudiants,,0,,1645052400,1645344696,30,,,
191298,Comité des fêtes - FESTIV'MARNHAC,ass comité des fêtes ,/associations/comite-des-fetes-festiv-marnhac,,,Labastide-Marnhac,46090,Lot,Occitanie,736 Chemin de la Fontaine,44.388031,1.389184,Association1901Rig,Arts | Culture | Fête | Arts et Culture,Comites-des-fetes,0,,1581116400,1627934848,30,,festivmarnhac@gmail.com,0673597722
270371,LOT SPOT,"L’association a pour objet de promouvoir l’activité musicale en tant qu’outil de reconnaissance des différences culturelles, et de mettre en valeur le talent artistique de musiciens issus de la société civile. Elle se veut être l’expression de la promotion sociale pour les artistes.",/associations/lot-spot,,,Cahors,46000,Lot,Occitanie,Boulevard Gambetta,44.447482,1.440388,Association1901,Arts | Culture | Musique | Arts et Culture,,0,,1623967200,1625483930,30,,lot.spot@laposte.net,
101137,sourcesdesagesses,sourcesdesagesses,/associations/sourcesdesagesses,,,Touzac,46700,Lot,Occitanie,"Moulin de Leygues , lieu dit source bleue",44.490368,1.052219,Association1901,,,0,,1529445600,1590239449,30,,sourcesdesagesses@gmail.com,
658768,LE BONHEUR SE REMERCIE,"Mettre plus de Cœur dans nos vies...Ensemble, retrouvons le chemin de notre cœur d'enfant. Marches, groupes de parole, conférences, ateliers: des espaces sans jugement pour comprendre son passé, s'aimer au présent, s'émerveiller et avancer. Solidarité. Adhésion et bienveillance 5 Euros et don libre.",/associations/le-bonheur-se-remercie,,,Bagnac-sur-Célé,46270,Lot,Occitanie,3 avenue du Quercy,44.665196,2.157946,Association1901,,,0,,1774479600,,30,,,
649402,KITTY DANCERS 46,Rencontres autour de la danse country et  danse en lignes,/associations/kitty-dancers-46,,,Gourdon,46300,Lot,Occitanie,"14, rue des Roses,",44.730286,1.378,Association1901,Arts et Culture | Arts | Culture | Danse | Musique country,,0,,1771196400,,30,,,
625962,COMITÉ DES FÊTES DE GRAMAT,"Association qui anime la ville de Gramat dans le Lot en organisant divers manifestation: vide grenier, vide ta chambre, fête de la musique, fête nationale, fête votive, bourse de noël et le marché de noël. ",/associations/comite-des-fetes-de-gramat,,,Gramat,46500,Lot,Occitanie,"mairie, 3, place du Four,",44.779296,1.72358,Association1901,Arts | Culture | Fête | Loisirs | Musique,Comites-des-fetes,0,,1762038000,,30,,boursedenoelgramat@gmail.com,
624352,CANCER SUPPORT FRANCE,Cancer Support France is a network of 13 associations throughout France which provides support for English-speaking people of any nationality who have been touched by cancer. Each association organises itself according to the needs of its own area ,/associations/cancer-support-france,,,Cahors,46000,Lot,Occitanie,Place Clément Marot,44.447544,1.443044,Association1901Rig,Cancer | Caritatif | Humanitaire | Solidarité et Action Sociale,,0,,1761429600,,30,,treasurer@cancersupportfrance.org,
615688,DUO DE VOLUTES,Duo de Volutes est une association loi 1901 dont les objectifs sont de faire connaître et de préserver le patrimoine ainsi que de diffuser la culture.,/associations/duo-de-volutes,,,Sérignac,46700,Lot,Occitanie,"mairie,",44.416613,1.076757,Association1901,Patrimoine | Culture,,0,,1758492000,,30,,c.gillard-uhl@orange.fr,
602735,GV-SPORT SANTÉ,Club de gymnastique sportive non compétitive. S'adresse à tous publics et tous niveaux physiques.,/associations/gv-sport-sante,,,Figeac,46100,Lot,Occitanie,12 avenue Casimir Marcenac,44.612481,2.030778,Association1901,Sport | Gymnastique,,0,,1752703200,,30,,gvsportsante46@gmail.com,
581132,CinemAtalante,"Association dont l'objectif est de développer l'activité cinéma art & essai, promouvoir le cinéma d'auteur, accompagner les films en organisant des rencontres avec les professionnels du cinéma et autres arts.",/associations/cinematalante,,,Gourdon,46300,Lot,Occitanie,Place de l'Hôtel de Ville,44.737014,1.38213,Association1901,Arts et Culture | Arts | Cinéma | Culture | Professionnels,,0,,1743458400,,30,,Delphine.soubiroux@gmail.com,
579636,CORPS ET AME Lot,"Promouvoir la santé, le bien être en tenant compte du corps et de l’esprit à travers la pratique d’activités physiques, sportives et de relaxation. Différentes méthodes sont utilisées, comme le Yoga, le Pilates, le stretching et des cours plus cardio. Tout public. Collectifs ou particuliers.",/associations/corps-et-ame-lot,,,Bretenoux,46130,Lot,Occitanie,22 Avenue de la Libération,44.915649,1.838589,Association1901,Bien-être | Pilates,,0,,1742943600,,30,,corpsetame@gmail.com,
563977,Association de développement commune de la pierre Haïti ,"Dans l’objectif de structurer et de promouvoir le développement durable de la commune de pierre Haïti qui fait face à de nombreux défis, nous proposons plusieurs initiatives clés pour améliorer les conditions de vie des habitants. Ces projets visent à répondre aux besoins urgents de la communauté. ",/associations/association-de-developpement-commune-de-la-pierre-haiti,,,Marminiac,46250,Lot,Occitanie,Route de Cazals,44.658727,1.206152,Association1901,Développement durable | Environnement | Ecologie et Environnement,,0,,1737327600,,30,,germithalarrieux738@gmail.com,
559537,Bodega Souillac,une association qui se compose de cinq associations pour mettre en avant un festival musical accessible en milieux rural.,/associations/bodega-souillac,,,Souillac,46200,Lot,Occitanie,Avenue de Sarlat,44.896447,1.46514,Association1901,Arts | Culture | Musique,,0,,1735858800,,30,,bodegasouillac@gmail.com,
556101,Équilibre lotois ,Association sportive équitation compétition ,/associations/equilibre-lotois,,,Mechmont,46150,Lot,Occitanie,1586 Route de Mechmont,44.574978,1.451036,Association1901,Sport | Equitation,,0,,1733958000,,30,,1881dm@gmail.com,
554644,OFFICE CENTRAL DE LA COOPERATION A L'ECOLE DU LOT - OCCE 46,"L'Office Central de la Coopération à l'Ecole (OCCE) a été créé en 1928, par des membres de l'enseignement et de militants de la coopération, convaincus de la nécessité d'enseigner, dès l'école, les principes et les vertus de la coopération que l'on retrouve dans le fonctionnement de l'ESS.",/associations/office-central-de-la-cooperation-a-l-ecole-du-lot-occe-46,,,Cahors,46000,Lot,Occitanie,80 Rue des Jardiniers,44.442612,1.438333,Association1901,Education | Enseignement | Formation,,0,,1733353200,,30,,ad46@occe.coop,
