objectID,name,description,url,logo,banner,city,zipcode,department,region,address,lat,lng,org_type,category_tags,ha_tags,active_forms_count,active_forms_type,creation_date,last_order_date,score,partners,contact_email,contact_phone
452007,La Clé des Arts,"Activités de guitare, piano, chorale et reggaeton",/associations/la-cle-des-arts,https://cdn.helloasso.com/img/logos/croppedimage-eafa96ef7a984d67b9ac469a079267ae.png,,Montbartier,82700,Tarn-et-Garonne,Occitanie,1 Place de la Mairie,43.912781,1.272199,Association1901,Arts | Chorale | Culture | Guitare | Piano | Musique,,4,"Event, Membership",1700607600,1774119108,60,,lacledesarts82@gmail.com,
618982,ASSOCIATION DES PARENTS D'ELEVES DE L'ECOLE DE GOLFECH,"Bonjour à tous, Nous sommes l’Association des Parents d’Élèves de l'école de Golfech. Notre mission ? Créer du lien entre les familles, les enseignants et l’école, soutenir les projets scolaires et organiser des moments conviviaux. Au plaisir d’échanger avec vous ! L’équipe APE",/associations/association-des-parents-d-eleves-de-l-ecole-de-golfech,https://cdn.helloasso.com/img/logos/croppedimage-beb80ff76517494ba04d66428cc53b6f.png,,Golfech,82400,Tarn-et-Garonne,Occitanie,6 Place du Padouen,44.114268,0.851101,Association1901,Education | Enseignement,,2,Shop,1759528800,1774197414,60,,apedegolfech@gmail.com,
564414,VILAVIE,"L'association Vilavie propose des cours de danse africaine, de coupé décalé, de Hip-hop, de danse orientales, de danse contemporaine et de percussions. ",/associations/vilavie,https://cdn.helloasso.com/img/logos/croppedimage-ad5cb7762b1b43f6a85bd6f246550b98.png,,Montech,82700,Tarn-et-Garonne,Occitanie,562 Route de Finhan,43.947357,1.221477,Association1901,Danse | Hip-hop | Percussion | Arts et Culture | Sport,Octobre-rose,4,"Shop, Event",1737414000,1773253702,60,,asso.vilavie.montech@gmail.com,0664744361
215584,TriceraSports,Notre but est de faire du sport tout en réalisant une action solidaire.,/associations/tricerasports,https://cdn.helloasso.com/img/logos/croppedimage-d4f8d9b25ac343bd88679311a700d9f4.png,,Saint-Etienne-de-Tulmont,82410,Tarn-et-Garonne,Occitanie,8 b Chemin des 5 Chemins,44.049107,1.433092,Association1901,Sport,,2,"CrowdFunding, Shop",1597701600,1773172901,60,,,
651756,ARTHESSAIM,"ArThessaim est un collectif d’arts-thérapeutes en Tarn-et-Garonne, réuni·e·s autour d’une pratique éthique et professionnelle des Arts-thérapie. Elle participe à la diffusion de l’art-thérapie auprès du grand public, des institutions et des professionnel·le·s, dans le respect des codes déontologie.",/associations/arthessaim,https://cdn.helloasso.com/img/logos/croppedimage-aa6c06d8a60943248d4cfdd79167c14a.png,,Montauban,82000,Tarn-et-Garonne,Occitanie,90 chemin de Saint Pierre,44.030626,1.343151,Association1901,Arts | Humanitaire | Professionnels | Solidarité | Santé,,1,Event,1771974000,1773442416,60,,,
651279,4L CAP SUD,"Théo et Bryan se lancent dans le 4L Trophy 2027 : une aventure folle entre désert, galères et entraide. Mais pour y arriver, ils ont besoin d’un coup de pouce financier. Suivez leur rêve et soutenez la team 4L CAP Sud dans ce défi unique !",/associations/4l-cap-sud,https://cdn.helloasso.com/img/logos/croppedimage-eb1b34db364543c182eb38bd67689879.png,,Montech,82700,Tarn-et-Garonne,Occitanie,889 route de Montbartier,43.946427,1.235444,Association1901Rig,Caritatif | Humanitaire | Sport automobile | Solidarité et Action Sociale,,1,Donation,1771801200,1774957479,60,,capsud4l@icloud.com,
152822,Confédération Paysanne 82 ,"La Confédération paysanne milite pour une agriculture paysanne, respectueuse de l'environnement, de l'emploi agricole et de la qualité des produits. Elle se bat pour une reconnaissance du droit à la souveraineté alimentaire et une juste rémunération . ",/associations/confederation-paysanne-82,https://cdn.helloasso.com/img/logos/confederation paysanne 82-010f6b008121428c85fba0d63c56f474.jpg,,Montauban,82000,Tarn-et-Garonne,Occitanie,16 Rue Jacques Cartier,44.010694,1.380262,Association1901,Environnement | Ecologie et Environnement,,7,"Shop, PaymentForm, Donation, Membership",1560290400,1773483347,60,,cp82@wanadoo.fr,0604758303
426963,Roulé Boulé Roller,Roulé Boulé Roller est une association loi 1901 de Roller Loisir située sur la commune de Bressols.   site web : roulebouleroller.fr,/associations/roule-boule-roller,https://cdn.helloasso.com/img/logos/croppedimage-124534adc4d04439987e50303401ee82.png,,Bressols,82710,Tarn-et-Garonne,Occitanie,Halles du vergnet 8 Rte de Lavaur,43.96696,1.339746,Association1901,Sport | Informatique | Roller,,2,"Event, Membership",1693346400,1772006049,60,FFRS,roulebouleroller@gmail.com,0770018202
561217,Les Amis de la Compagnie Marceau Faure ,L'association Les Amis de la Compagnie Marceau-Faure a pour but de préserver la mémoire et l'histoire de la Compagnie des Sapeurs-pompiers de Castelsarrasin de 1839 à 2017. ,/associations/les-amis-de-la-compagnie-marceau-faure,https://cdn.helloasso.com/img/logos/croppedimage-e3c07cb9bfb34a4e9596b2f6ffb18b86.jpg,,Castelsarrasin,82100,Tarn-et-Garonne,Occitanie,64 Avenue de Courbieu,44.044919,1.102011,Association1901,Patrimoine | Protection civile,,1,Event,1736463600,1774898433,60,Infolocale,Compagniemarceaufaure@gmail.com,
201362,APEL Notre Dame Montauban,L'APEL Notre Dame Montauban met en place de nombreuses opérations afin de soutenir l'Ensemble Scolaire Notre Dame. L'équipe met en place également des animations au sein de la Communauté éducative pour les enfants et les parents.,/associations/apel-notre-dame-montauban,https://cdn.helloasso.com/img/logos/croppedimage-e7c09af0eeb24929b84c2d19e6a1e06b.png,,Montauban,82000,Tarn-et-Garonne,Occitanie,12 avenue Gambetta,44.016153,1.357902,Association1901,Enfance | Humanitaire | Solidarité | Education,,10,Shop,1587506400,1774434505,60,,notredame.Mtb@apel82.fr,0658149213
308927,Garo-Molkky,"Favoriser la pratique et le développement du jeu de Mölkky ainsi que ses dérivés sous toutes ses formes mais également de favoriser le développement et la découverte de jeux d’adresse, d’organiser des animations, des tournois, des forums, des manifestations...,",/associations/garo-molkky,https://cdn.helloasso.com/img/logos/croppedimage-6bebd463fe1f4befa774ba64e9e40461.png,,Grisolles,82170,Tarn-et-Garonne,Occitanie,Rue des Servics,43.827296,1.29422,Association1901,Jeux | Loisirs,,1,Event,1646262000,1756925946,60,,garomolkky@gmail.com,0611865493
597776,SAUVONS L'ÉGLISE D'ESPIS SUR LE CHEMIN DE COMPOSTELLE,"Notre association s'engage à préserver l'église d'Espis, un joyau du patrimoine local. Nous croyons fermement en son importance culturelle et historique, et nous travaillons activement à sa restauration pour la conserver pour les générations futures.",/associations/sauvons-l-eglise-d-espis-sur-le-chemin-de-compostelle,https://cdn.helloasso.com/img/logos/croppedimage-257a125b284b4199925d1abb1638920c.jpg,,Moissac,82200,Tarn-et-Garonne,Occitanie,256 chemin d'Espis,44.132831,1.106617,Association1901Rup,Patrimoine | Culture,,2,"CrowdFunding, Donation",1750370400,,60,SiteW,pbord12@mac.com,
59858,Association Montalbanaise d'Aide aux Réfugiés,Défense du droit d'asile et insertion des réfugiés et exilés.,/associations/association-montalbanaise-d-aide-aux-refugies,https://cdn.helloasso.com/img/logos/association-montalbanaise-d-aide-aux-refugies-91e095f9b017489cb9b031b127fb90c3.png,,Montauban,82000,Tarn-et-Garonne,Occitanie,24 Rue Caussat,44.017621,1.346326,Association1901Rig,Solidarité et Action Sociale | Humanitaire | Solidarité,Don,3,"Shop, Donation, Membership",1488495600,1769262578,60,,amar.accueil@gmail.com,0563221700
175612,Association Art Points de vue,L'association Art Points de Vue a pour objectif de promouvoir l'art et la culture en milieu rural dans le village de Lauzerte.,/associations/association-art-points-de-vue,https://cdn.helloasso.com/img/logos/croppedimage-dc59bf1787df4e0caa3640c833b68b02.png,,Lauzerte,82110,Tarn-et-Garonne,Occitanie,5 Rue de la Mairie,44.256647,1.137517,Association1901Rig,Arts | Culture | Arts et Culture,,2,"Shop, Membership",1573686000,1772283106,60,,espacepointdevue.lauzerte@gmail.com,0632342929
427987, Guidons quercynois,Club cycliste basé à Caussade (82) pratiquant le VTT et le vélo de route en loisir et compétition,/associations/guidons-quercynois,https://cdn.helloasso.com/img/logos/croppedimage-3d603afd269249cc88d2f2f4de5cdf37.png,,Caussade,82300,Tarn-et-Garonne,Occitanie,31 av edouard herriot,44.156511,1.533108,Association1901,Sport | VTT | Vélo,,1,Event,1693692000,1774727567,60,,guidonsquercynois82@gmail.com,0609653483
254277,ESPERANCE BLEUE 82,"Nous proposons un projet novateur d'habitat inclusif qui permettrait à six jeunes adultes porteurs de troubles du spectre autistique de pouvoir vivre en inclusion dans notre société. Nous souhaitons les faire participer activement à la vie sociale et professionnelle, autour du vivre ensemble.",/associations/esperance-bleue-82,https://cdn.helloasso.com/img/logos/croppedimage-635f8aa2f82d4ce2b4582c06a76cff54.png,,Castelsarrasin,82100,Tarn-et-Garonne,Occitanie,Castelsarrasin,44.065569,1.096335,Association1901Rig,Solidarité et Action Sociale | Autisme | Humanitaire | Solidarité,,2,"Donation, Membership",1617141600,1773424286,60,,esperancebleue82@gmail.com,0664647622
482585,Bullshooter France,"Promouvoir les fléchettes électroniques, Organiser des compétitions",/associations/bullshooter-france,https://cdn.helloasso.com/img/logos/croppedimage-575973d8d4464cec9d634405d5d56897.jpg,,Montech,82700,Tarn-et-Garonne,Occitanie,50 Route de la Rougerie,43.959666,1.212957,Association1901,Sport,,3,"Shop, Membership",1709593200,1773246632,60,,bullshooter.france@gmail.com,0744939155
558451,Plateforme Protestante du Montalbanais,"La Plateforme Protestante du Montalbanais a été créée en 2000 par la pastorale protestante montalbanaise. Elle permet l'organisation d'une journée de culte en commun, une journée sportive et spirituelle, le soutien de la chorale Crescendo de Montauban",/associations/plateforme-protestante-du-montalbanais,https://cdn.helloasso.com/img/logos/croppedimage-5bfed44797db41cdbe65651a08f8bfac.png,,Montauban,82000,Tarn-et-Garonne,Occitanie,20 quai montmurat,44.01972,1.350394,Association1901,Chorale | Religion | Spiritualité,,1,Event,1735167600,1768489384,60,,guy.maillard82@orange.fr,
609718,APE MARCEL GUERRET,"L’APE Marcel Guerret sur helloasso! Des parents motivés  pour soutenir l’école (sorties, activités, matériel), créer des moments conviviaux et offrir aux enfants des souvenirs inoubliables. Retrouvez ici nos actions, participez facilement et restez connectés à la vie de l’école. ?? de votre soutien!",/associations/ape-marcel-guerret,https://cdn.helloasso.com/img/logos/croppedimage-a73fd4a124e94a09bf4996166b92dae5.png,,Montauban,82000,Tarn-et-Garonne,Occitanie,"Ecole Marcel Guerret, 28, avenue Charles de Gaulle,",44.013697,1.376961,Association1901,Enfance | Humanitaire | Solidarité | Education,,2,Shop,1756591200,1767635012,60,,apemarcelguerret@gmail.com,
132159,Association Les Super héros contre le cancer,,/associations/association-les-super-heros-contre-le-cancer,https://cdn.helloasso.com/img/logos/association les super heros contre le cancer-0b27d0ea0a0546f9ac79cca49083793c.jpeg,,Montauban,82000,Tarn-et-Garonne,Occitanie,150 D Route de Molières,44.04062,1.357958,Association1901Rig,Caritatif | Humanitaire | Solidarité et Action Sociale,Don,2,Donation,1553295600,1765994130,60,,lessuperheroscontrelecancer@gmail.com,0695161963
540654,LES BAMBINS D ABORD,"Nous sommes une APE de l'école de Monbéqui et souhaitons proposer un paiement en ligne pour les réservations de notre ""BOURSE AUX JOUETS"" qui aura lieu le &er décembre 2024.",/associations/les-bambins-d-abord,https://cdn.helloasso.com/img/logos/croppedimage-545d801f06e043afb2bc791797dc6d10.png,,Monbéqui,82170,Tarn-et-Garonne,Occitanie,20 Route de Montbartier,43.892609,1.23995,Association1901,Caritatif | Humanitaire | Solidarité et Action Sociale,,3,"Event, PaymentForm",1728597600,1764007866,60,,lesbambinsdabord.monbequi@gmail.com,+33619781621
447662,BASKET CLUB BASTIDIEN,BCB Ensemble !,/associations/basket-club-bastidien,https://cdn.helloasso.com/img/logos/croppedimage-17c6207804c64b069c8ecbca1c6554d3.png,,Labastide-Saint-Pierre,82370,Tarn-et-Garonne,Occitanie,Chemin de Labinal,43.915248,1.370128,Association1901,Sport,,2,"Shop, Event",1699398000,1764014538,60,,basketclubbastidien@gmail.com,
575679,Comité des fêtes de Beaumont-de-Lomagne,"Comité des fêtes repris en septembre 2023, nous avons pour but de participer à la dynamique de la commune en proposant tout un tas d'évènement divers et variés pour tous les âges.  Votre soutien est la plus belle récompense en tant que bénévole.",/associations/comite-des-fetes-de-beaumont-de-lomagne,https://cdn.helloasso.com/img/logos/croppedimage-14f9953c37f04286be19111bbca96345.png,,Beaumont-de-Lomagne,82500,Tarn-et-Garonne,Occitanie,13 Place Gambetta,43.883069,0.988514,Association1901,Arts | Culture | Fête | Arts et Culture,Comites-des-fetes,1,Event,1741561200,1754835922,60,Fncof,comitedesfetesbmt@gmail.com,
623807,ASSOCIATION DES PARENTS D'ELEVES DE L'ECOLE DE LUNEL,"Association de parents bénévoles qui soutient les projets pédagogiques et organise des événements festifs (loto, kermesse, marché de Noël) pour améliorer la vie de l’école et le bien-être des enfants.",/associations/association-des-parents-d-eleves-de-l-ecole-de-lunel,https://cdn.helloasso.com/img/logos/croppedimage-d1abe9ce863f49c090f19484275bed02.png,,Lafrançaise,82130,Tarn-et-Garonne,Occitanie,10 avenue de Saint Maurice,44.123643,1.244894,Association1901,Education | Enfance | Formation | Fête | Loterie,,1,Event,1761170400,1764531585,60,,lunel.ape@gmail.com,
264649,MONTAUBAN BASKET CLUB,Pratique du Basket Ball,/associations/montauban-basket-club,https://cdn.helloasso.com/img/logos/croppedimage-6fecd96143874e16927826a2dbfafa3a.png,,Montauban,82000,Tarn-et-Garonne,Occitanie,49 Rue du Ramiérou,44.012649,1.37524,Association1901,Sport | Basketball,,3,"Shop, Donation",1622066400,1770918488,60,FFBB,contact@montauban-basket-club.fr,0563031000
536703,Association Téléthon Force T Moissac,"Notre association locale reverse les fonds récoltés au cours des diverses manifestations à l'AFM Téléthon. Cet événement caritatif national, permet d'améliorer la recherche en faveur des maladies génétiques rares et orphelines.",/associations/association-telethon-force-t-moissac,https://cdn.helloasso.com/img/logos/croppedimage-23c82b8f686e4fb6a71cb9023e92d048.png,,Moissac,82200,Tarn-et-Garonne,Occitanie,730 Chemin de Malengane,44.11264,1.097448,Association1901,Caritatif | Humanitaire | Recherche | Santé,Téléthon,2,"Donation, Event",1727474400,1765051135,60,,telethondemoissac@gmail.com,06 31 61 42 62
531691,TENNIS CLUB GRISOLLES,"Club de Tennis à Grisolles, dans le Tarn-et-Garonne.",/associations/tennis-club-grisolles,https://cdn.helloasso.com/img/logos/croppedimage-7f457c1ae12b4173b7aa3e554258dfb2.png,,Grisolles,82170,Tarn-et-Garonne,Occitanie,Chemin de Belle Gabrielle,43.822064,1.28934,Association1901,Sport | Tennis,,4,"PaymentForm, Membership",1725919200,1774868203,60,FFT,tcgrisolles@fft.fr,0681293077
197830,Institut sportif hagwon,Institut sportif Hagwon - c'est 12 Disciplines  : - Taekwondo (dès 3 ans) - Self-défense (dès 6 ans) - Cross-training (dès 6 ans) - Tai Chi Chuan (dès 12 ans) - Yoga Ashtanga (dès 14 ans) - Relaxation massage (dès 16 ans) - Mindset & performance (dès 10 ans) - Stretching & mobilité (dès 10 ans),/associations/institut-sportif-hagwon,https://cdn.helloasso.com/img/logos/institut sportif hagwon-72e2c3c61e83484a824b059fdcd768f7.jpg,,Montauban,82000,Tarn-et-Garonne,Occitanie,38 rue voltaire,44.037738,1.360187,Association1901,Bien-être | Self defense | Taekwondo,,1,Membership,1584918000,1773504906,60,,institut.ish@gmail.com,0673107170
229424,Association Billy Billy,"Valorisation du patrimoine local en Quercy-Rouergue par l'organisation d'événements multiculturels, dans une démarche écologique.",/associations/association-billy-billy,https://cdn.helloasso.com/img/logos/croppedimage-158fbc7d7fa848ebbbf0e1f5b8c929e5.png,,Saint-Projet,82160,Tarn-et-Garonne,Occitanie,Mas de Farnel,44.301658,1.785533,Association1901,Patrimoine | Arts | Culture | Écologie,,2,"Membership, Donation",1605135600,1760431461,60,,coucou@billybilly.fr,0769995414
550931,APE Gérard Lalanne ,Association de parents d'élèves de l'école Gérard Lalanne de Valence d'Agen ,/associations/ape-gerard-lalanne,https://cdn.helloasso.com/img/logos/croppedimage-d6bfaee50db14befa6099ac35a0b3df3.png,,Valence,82400,Tarn-et-Garonne,Occitanie,25 Rue de La République,44.107247,0.889168,Association1901,Education | Formation | Parents d'élèves,,1,Membership,1732057200,1761232868,60,,ape.gerard.lalanne@gmail.com,
430677,Oé,Nouer des liens pour conjuguer les talents.,/associations/oe,https://cdn.helloasso.com/img/logos/croppedimage-1add695757ac44c4afb84a29c2a0333d.png,,Asques,82120,Tarn-et-Garonne,Occitanie,240 Route du Pin,44.002607,0.96274,Association1901Rig,Arts | Culture | Arts et Culture,,1,Membership,1694210400,,60,,oe.infos@gmail.com,+33619537898
203945,Lafittois Trail ,Association de Trail sur la commune de Lafitte(82),/associations/lafittois-trail,https://cdn.helloasso.com/img/logos/lafittois trail-3ad241b5c0e94924b3631176f319cf0d.jpg,,Lafitte,82100,Tarn-et-Garonne,Occitanie,1648 Route des Moulins,43.983873,1.117644,Association1901Rig,Sport | Trail,,1,Membership,1589148000,1753818541,60,,mieuletmathieu@yahoo.fr,0602245481
503504,SPORT POUR TOUS CASTELSARRASIN,Pratique d'activités physiques à caractère non compétitif.,/associations/sport-pour-tous-castelsarrasin,https://cdn.helloasso.com/img/logos/croppedimage-f62c1919f00a4677b7e239bc26c9a501.png,,Castelsarrasin,82100,Tarn-et-Garonne,Occitanie,20 Route de Toulouse,44.034878,1.117057,Association1901Rup,Sport,,1,Membership,1714946400,1770301783,60,FFSportspourTous,sportpourtous82@gmail.com,0607601007
154807,Agape'O Souffle de vie,Association Caritative Chrétienne à but non lucratif d'aide aux plus démunis,/associations/agape-o-souffle-de-vie,https://cdn.helloasso.com/img/logos/agape o souffle de vie-e5df5a4864774f04aaa128f64bf96270.png,,Nègrepelisse,82800,Tarn-et-Garonne,Occitanie,1 Avenue Jean Moulin,44.071909,1.525104,Association1901,Caritatif | Humanitaire | Religion | Solidarité | Solidarité et Action Sociale,,3,Donation,1561068000,1768383978,60,,agape.o.souffledevie@gmail.com,06.19.92.30.97
350207,APEL Saint-Théodard Montauban,,/associations/apel-saint-theodard-montauban,,https://cdn.helloasso.com/img/photos/croppedimage-fa0086ea3be74cc0b077765b1e481a23.png,Montauban,82000,Tarn-et-Garonne,Occitanie,12 Quai de Verdun,44.021857,1.347912,Association1901,Education | Formation,,1,Donation,1665612000,1768464967,60,,sttheodard.mtb@apel82.fr,
114461,Protection et Aide aux Enfants Camerounais Défavorisés,Agir pour un avenir meilleur,/associations/protection-et-aide-aux-enfants-camerounais-defavorises,https://cdn.helloasso.com/img/logos/protection aide aux enfants camerounais et defavorise-e242124c648f47bd858ebf628b45c85c.png,,Montauban,82000,Tarn-et-Garonne,Occitanie,11 rue hergé,44.056102,1.396328,Association1901,Caritatif | Humanitaire | Solidarité et Action Sociale,,1,Donation,1537480800,1765183973,60,,secretariat.paecd@gmail.com,0699401089
190638,Association Française des Malades de la Thyroïde ,Nombreux sont ceux et celles d’entre nous qui ont connu un long parcours de mal être avant qu’on ne leur diagnostique un problème thyroïdien. L’association leur permettra de mieux gérer et comprendre leur pathologie.,/associations/association-francaise-des-malades-de-la-thyroide,https://cdn.helloasso.com/img/logos/association francaise des malades de la thyroide-ecd6225097b54a378b8e5039615af198.jpg,,Bourret,82700,Tarn-et-Garonne,Occitanie,AFMT,43.943955,1.166474,Association1901Rig,Humanitaire | Solidarité | Solidarité et Action Sociale,Don,1,Donation,1580857200,1774687597,60,,helloassothyro@gmail.com,
43309,Association Motocycliste Alternative,Le moto-Club LGBTI+ de ta région !,/associations/association-motocycliste-alternative,https://cdn.helloasso.com/img/logos/association motocycliste alternative-52ed97babe49492282e80a960e63ef24.png,,Monteils,82300,Tarn-et-Garonne,Occitanie,2281 Route des Pigeonniers Guillaynes,44.176095,1.571657,Association1901Rig,Humanitaire | Moto | Solidarité | Sport,,9,"Event, Donation, Membership",1457910000,1774466573,60,,nelson.toulouse@hotmail.fr,
74201,France alzheimer Tarn-et-Garonne,France Alzheimer 82 vous aide à profiter de la vie !,/associations/france-alzheimer-tarn-et-garonne,https://cdn.helloasso.com/img/logos/82_tarn-et-garonne.jpg,,Montauban,82000,Tarn-et-Garonne,Occitanie,275 rue du Clos Maury,44.008743,1.39379,Association1901Rig,Solidarité et Action Sociale,,1,Donation,1515711600,1750084586,60,,f.alzheimer82@gmail.com,05 63 20 47 64
249756,UNION SPORTIVE MONTALBANAISE,"Fondée en 1903,l'Association U.S.Montauban Rugby a pour mission de favoriser la pratique et le développement du Rugby chez les jeunes.",/associations/union-sportive-montalbanaise,https://cdn.helloasso.com/img/logos/croppedimage-1496a53a0b5e465d8e196cb539b637a0.jpg,,Montauban,82000,Tarn-et-Garonne,Occitanie,15 RUE DU CHANOINE BELLOC   ,44.009524,1.352788,Association1901Rup,Sport | Rugby,Don,1,Donation,1615158000,1704037724,60,,sapiacains.solidaire@usmsapiac.fr,
247045,les amis de Georgette Blaquière,,/associations/les-amis-de-georgette-blaquiere,,https://cdn.helloasso.com/img/photos/croppedimage-add0330317d24109a303d4232bda3367.png,Léojac,82230,Tarn-et-Garonne,Occitanie,174 Route de Bellegarde,43.999109,1.45137,Association1901,Arts et Culture | Arts | Culture,,1,Donation,1613430000,1773937497,60,,tellierdesalberts05@gmail.com,0750925149
526424,ASSOCIATION DANSE LOISIR,"Notre association ""Danse Loisir"" propose des cours de classique, hip-hop, jazz, éveil à la danse et street dance. Nous accueillons tous les niveaux dans une ambiance conviviale et dynamique. Rejoignez-nous pour développer votre passion et votre créativité à travers la danse !",/associations/association-danse-loisir,https://cdn.helloasso.com/img/logos/croppedimage-4948dafdedd849fab7554fd82de51d55.png,,Moissac,82200,Tarn-et-Garonne,Occitanie,24 Rue de la Solidarité,44.103079,1.089353,Association1901,Danse | Hip-hop | Jazz | Arts et Culture | Sport,,1,Event,1724536800,1746343393,60,,associationdanseloisir@gmail.com,0563041010
580692,Ose un pause,"Ose une Pause est une association créée en 2018  afin de proposer des ateliers intergénérationnels autour de la parentalité, du bien-être et de la protection de l'environnement.  L'association propose une nouvelle action ""La Cabane 82"" : création d'un lieu ressource en nature pour parents et enfants",/associations/ose-un-pause,https://cdn.helloasso.com/img/logos/croppedimage-e9aaa8315c4f4d55825a31de5e484973.png,,Grisolles,82170,Tarn-et-Garonne,Occitanie,148 Chemin de Beausoleil,43.831165,1.317561,Association1901,Enfance | Environnement | Formation | Ecologie et Environnement,,2,"Donation, CrowdFunding",1743372000,1746004411,60,,Lacabane82@proton.me,
571467,UNION SPORTIVE MONCLAR QUERCY VERT,"Installé à Monclar de Quercy  dans le Tarn et Garonne, le club de football de Monclar comprend une école de foot masculine et féminine et 1 équipe sénior qui évolue en D3 ( possible montée en D2 )",/associations/union-sportive-monclar-quercy-vert,https://cdn.helloasso.com/img/logos/croppedimage-f601d26a29ab45d9bd4ae70dc9b59ae5.png,,Monclar-de-Quercy,82230,Tarn-et-Garonne,Occitanie,"mairie, place des Capitouls,",43.966773,1.584392,Association1901,Sport | Football,,1,Membership,1739833200,,60,,ds.usmqv@outlook.com,
563161,Des Ailes pour Ambrine,"Rejoignez-nous dans notre engagement et nos actions afin de récolter des fonds pour Ambrine : Ensemble, soutenons son accès aux soins essentiels, matériels, thérapies.. non pris en charge pour lui permettre une meilleure inclusion et atténuons les surcoûts liés à son handicap !"" ",/associations/des-ailes-pour-ambrine,https://cdn.helloasso.com/img/logos/croppedimage-642f246cc0f941f2bfc94231f0626676.png,,Castelsarrasin,82100,Tarn-et-Garonne,Occitanie,253 Avenue du Maréchal de Lattre de Tassigny,44.044184,1.113374,Association1901,Caritatif | Handicap | Humanitaire | Solidarité et Action Sociale | Santé,,1,Membership,1736982000,1748898645,60,,desailespourambrine@gmail.com,
552620,ART'ITUDE,"Nous avons pour objectif d'ouvrir l'accès aux arts du spectacle au plus grand nombre, avec du théâtre mais aussi toutes les activités que doivent gérer une troupe d'artistes telles que les décors, les costumes, ....",/associations/art-itude,https://cdn.helloasso.com/img/logos/croppedimage-7aae2445da8b4636a5629c7162bc561d.png,,Dieupentale,82170,Tarn-et-Garonne,Occitanie,201 Chemin de Lapeyrière,43.872251,1.278592,Association1901Rig,Arts | Culture | Théâtre | Arts et Culture,,1,CrowdFunding,1732662000,,60,,asso.artitude.82@gmail.com,
533943,Association Pas un enfant de plus 82-46,"défense des droits de l'enfant conformément à la convention internationale des droits de l'enfant ; accompagner, conseiller et outiller les mineurs et les adultes en contact avec des mineurs dans le besoin ; lutte pour la défense de l'ensemble des droits de l'enfant qu'ils soient dans leur famille, ",/associations/association-pas-un-enfant-de-plus-82-46,https://cdn.helloasso.com/img/logos/croppedimage-265833f7f2b84de6aea5b7d1e5c3b3ea.png,,Puylaroque,82240,Tarn-et-Garonne,Occitanie,22 Rue Mazel,44.250396,1.610676,Association1905,Défense des droits | Enfance | Humanitaire | Solidarité | Solidarité et Action Sociale,,1,Membership,1726696800,1733834636,60,,assopasunenfantdeplus@gmail.com,
