objectID,name,description,url,logo,banner,city,zipcode,department,region,address,lat,lng,org_type,category_tags,ha_tags,active_forms_count,active_forms_type,creation_date,last_order_date,score,partners,contact_email,contact_phone
480100,Clic'n Focus,"Photographes passionnés, dédiée à la lutte contre le syndrome du gène Epsilon et la maladie de Crohn. Fondée par un photographe engagé, nous réalisons des road trips à vélo pour capturer des images inspirantes, compilées dans des livres dont les ventes soutiennent la recherche médicale. ",/associations/clic-n-focus,https://cdn.helloasso.com/img/logos/croppedimage-da7ad37790b0499488fcb2f8969cb36e.png,https://cdn.helloasso.com/img/photos/croppedimage-56d1dfe812cc4a19ad3eb68f58504cfe.png,Montauban,82000,Tarn-et-Garonne,Occitanie,16 rue françois cevert,44.010661,1.393175,Association1901,Humanitaire | Photographie | Recherche | Solidarité | Vélo | Santé,,1,Membership,1708988400,1718093215,110,,clic-n-focus@outlook.fr,0782966190
483275,Montauban United Rugby Golf,"Club de Rugbygolf situé à Montauban, pour des moments de partage et de convivialité autour de ce nouveau sport regroupant le golf et le rugby.  Le Rugbygolf consiste à jouer avec un ballon de rugby sur un parcours de golf avec les pieds ou les mains, depuis une aire de départ jusque dans une cible.",/associations/montauban-united-rugby-golf,https://cdn.helloasso.com/img/logos/croppedimage-f02db90c599f483bae77a709fd5b12b9.png,https://cdn.helloasso.com/img/photos/croppedimage-6c3f4132e6b34b2fb6e7b88f461f1a43.png,Montauban,82000,Tarn-et-Garonne,Occitanie,1089 chemin de preyssac,44.05148,1.320851,Association1901,Sport | Golf | Rugby,,1,Event,1709766000,1717320393,110,,montaubanunited.rugbygolf@gmail.com,0613975593
505537,Viensdanser82,Association d’événements de danse,/associations/viensdanser82,https://cdn.helloasso.com/img/logos/croppedimage-13de660e497a4cce9e56478027ef9cd2.png,https://cdn.helloasso.com/img/photos/croppedimage-384a1926c7da42c482a204d6d18577ca.png,Montauban,82000,Tarn-et-Garonne,Occitanie,2 rue philippe denfert rochereau,44.018138,1.359769,Association1901,Arts et Culture | Arts | Culture | Danse,,1,Event,1715724000,1717098663,110,,viensdanser82@gmail.com,0633700677
114976,chorale si on chantait,"L'Association CHORALE ""SI ON CHANTAIT"" est localisée au 12 GRAND RUE à La Ville-dieu-du-temple (82290) dans le département du Tarn-et-Garonne. Cette association loi 1901 ou assimilé fondée en 2003(SIRET : 823874433 00019), recensée sous le naf : Arts du spectacle vivant.",/associations/chorale-si-on-chantait,https://cdn.helloasso.com/img/logos/chorale si on chantait-a272e5317a1c498397568da8ce56cd53.jpg,https://cdn.helloasso.com/img/photos/croppedimage-7f5f27e0c6e24a23a247688fbb49a0ee.png,La Ville-Dieu-du-Temple,82290,Tarn-et-Garonne,Occitanie,Mairie de la ville-dieu du temple 12-14 Rue Grand Rue,44.03429,1.21725,Association1901,Arts | Chorale | Culture | Arts et Culture,,2,"Shop, Event",1538172000,1651927652,110,Fncof,choralesionchantait82290@gmail.com,0635079371
414053,Berre jah,Association berre jah groupe de musique à but non lucratif   Cette association a pour but le partage et promotion de la musique et du chant.,/associations/berre-jah,https://cdn.helloasso.com/img/logos/croppedimage-9eb8e86a563945f1b2b1ccda90ba61c2.jpg,https://cdn.helloasso.com/img/photos/croppedimage-ff68c8324ccc4bafa64756eb06fd752d.png,Lavit,82120,Tarn-et-Garonne,Occitanie,"12, Route du Casteron",43.950375,0.911689,Association1901,Arts | Chant | Culture | Musique,,2,Membership,1687816800,,110,,berre-jah.974@outlook.fr,0630372662
256212,Moissac Métiers d'Art et de Création,"L'association ""L'art s'invite"" organise des événements culturels (expo, concerts, spectacles) uniques qui se déroulent tout au long de l’été. Plus de 15 artistes proposent de découvrir leur travail dans différents lieux de la ville (extérieurs et intérieurs)",/associations/moissac-metiers-d-art-et-de-creation,https://cdn.helloasso.com/img/logos/croppedimage-d22ba36d1efe448291602e9c6267f1da.png,https://cdn.helloasso.com/img/photos/croppedimage-1ee5ade506fd4d2c919e77c8d6b54da1.jpg,Moissac,82200,Tarn-et-Garonne,Occitanie,Moissac,44.120593,1.108562,Association1901,Arts | Culture | Arts et Culture,,4,"Membership, Donation",1618351200,1718213184,110,,artamoissac@gmail.com,0785596651
499423,BASTIDEBOY ULTRAS,"les bastiboys du acb de la bastide du temple sont toujours présent à chaque match à domicile comme à l’extérieure (tifo,ambiance de folie...) rdv au parking du stade à chaque match pour l’avant match (apéritif)????",/associations/bastideboy-ultras,https://cdn.helloasso.com/img/logos/croppedimage-8a150dd440fa44f49887f01fd51086e6.png,https://cdn.helloasso.com/img/photos/croppedimage-45b44e55395245b6bacb45ef9e9f4228.png,Labastide-du-Temple,82100,Tarn-et-Garonne,Occitanie,Labastide-du-Temple,44.078053,1.19367,Association1901,Loisirs,,1,Shop,1713477600,,110,,intermarchef@gmail.com,
488396,Brigade d'intervention solidaire et culturelle,L'association BISC à pour but l'accès à la culture pour tous à travers des fresques murales et autres projets artistiques ,/associations/brigade-d-intervention-solidaire-et-culturelle,https://cdn.helloasso.com/img/logos/croppedimage-28276463c11a4272b295f810040ba0d8.png,https://cdn.helloasso.com/img/photos/croppedimage-c3a38e175e2c4d90b90acb34f476084a.png,Verdun-sur-Garonne,82600,Tarn-et-Garonne,Occitanie,70 Traverse d’Encessoy,43.848186,1.224372,Association1901,Arts | Culture | Arts et Culture,,1,Donation,1710802800,1713013327,110,,assobisc@gmail.com,0782734788
488052,Les amis du 31,"L’association a pour objet de participer à la sauvegarde et à la divulgation du patrimoine du régiment, de maintenir le souvenir des services rendus à la patrie par ses formations, d’honorer la mémoire de leurs morts et de veiller au soutien actif de leurs blessés. ",/associations/les-amis-du-31,https://cdn.helloasso.com/img/logos/croppedimage-342de1a1d45f4f0fa6d214c134607b19.png,https://cdn.helloasso.com/img/photos/croppedimage-43f9ea32358f4fd2a9fa5b264ac58545.png,Castelsarrasin,82100,Tarn-et-Garonne,Occitanie,323 Route de Gandalou,44.051966,1.112982,Association1901,Formation | Étudiants | Patrimoine,,1,Shop,1710716400,1765447696,110,,christian.vergonnier@intradef.gouv.fr,0611845936
490954,Club des ainés de la Galaspo d Or,"L'association propose des animations amicales entre tous les adhérents et apporte entraide et réconfort à tous les ainés dans son rayon d'action. Elle organise voyages, conférences, expositions artistiques, lotos. Elle offre activités et ateliers: jeux divers, forme physique, loisirs créatifs ...",/associations/club-des-aines-de-la-galaspo-d-or,https://cdn.helloasso.com/img/logos/croppedimage-1df0200fadcd412babb12c67da8df081.png,https://cdn.helloasso.com/img/photos/croppedimage-ade97ff632974657981980e28c95f62b.png,Moissac,82200,Tarn-et-Garonne,Occitanie,24 Rue de la Solidarité,44.103079,1.089353,Association1901,Arts | Jeux | Voyages | Loisirs,,1,Event,1711407600,1715417729,110,,clubdesainesmoissac82@outlook.fr,05 63 04 99 54
476410,Club Rotary Montauban Passion,"Le Club Rotary Montauban Passion agit localement , dans le Tarn-et--Garonne, pour soutenir l'action d'associations aidant les personnes en difficultés : Les Blouses Roses 82, Quand sert l'Espoir, Hôpital Sourire. Nous contribuons également à des actions internationales, via la Fondation Rotary.",/associations/club-rotary-montauban-passion,https://cdn.helloasso.com/img/logos/croppedimage-9c0495ae0a4d4955a4897f2fe1e0e693.png,https://cdn.helloasso.com/img/photos/croppedimage-3904a2f8a0f2443082b8199e90ef43b0.png,Montauban,82000,Tarn-et-Garonne,Occitanie,12 rue notre dame,44.015707,1.355173,Association1901,Caritatif | Humanitaire | Solidarité et Action Sociale,,1,Event,1708038000,,110,,rotarymp82@gmail.com,0672528131
487497,Atelier sabor latino,"Promouvoir la pratique de la danse pour tous, proposer des cours de danse, organiser des événements autour de la danse, du rythme et de la musique.",/associations/atelier-sabor-latino,https://cdn.helloasso.com/img/logos/croppedimage-bb3c4fd69c134af8a85abaf964b16c9f.png,https://cdn.helloasso.com/img/photos/croppedimage-893c35f05ea24f7185100781c3511351.png,Fabas,82170,Tarn-et-Garonne,Occitanie,Place Pierre Tajan,43.862447,1.350507,Association1901,Danse | Humanitaire | Solidarité | Arts et Culture,,1,Shop,1710543600,,110,,nicolas.verdugaud@yahoo.fr,0613223358
333580,ENCORPS,éducation corporelle & émotionelle,/associations/encorps,https://cdn.helloasso.com/img/logos/croppedimage-6e4fffee13f1408a93e670dd03000b25.png,https://cdn.helloasso.com/img/photos/croppedimage-7c239342738f414fbf600e934a756678.jpg,Molières,82220,Tarn-et-Garonne,Occitanie,Molières,44.193132,1.364319,Association1901,Arts | Culture | Arts et Culture,,7,"PaymentForm, Donation, Shop, Membership",1656885600,1710936259,110,,elise.schdr@gmail.com,0646289148
426132,PhotoTherHappy,"PhotoTherHappy a pour but d'aider par différents biais les personnes affaiblies physiquement et moralement par des accidents, agressions ou maladies à retrouver confiance en eux et en la vie.",/associations/phototherhappy,https://cdn.helloasso.com/img/logos/croppedimage-537c696379634fe1848622dbb32b3e52.png,https://cdn.helloasso.com/img/photos/croppedimage-312e4705b28347b2bfc64dffad169dc0.png,Montauban,82000,Tarn-et-Garonne,Occitanie,300 route de l'aveyron,44.039125,1.35291,Association1901,Humanitaire | Solidarité | Solidarité et Action Sociale | Santé,,1,Membership,1693087200,1706554554,110,,phototherhappy@gmail.com,0604108589
455319,Association d'Entrepreneurs du Quercy Rouergue,"L'AEQR, un réseau vivant d'entrepreneurs en Quercy Rouergue, qui promeut la croissance et la résilience en milieu rural. Rejoignez-nous pour des formations, un soutien, et une communauté solide.",/associations/association-d-entrepreneurs-du-quercy-rouergue,https://cdn.helloasso.com/img/logos/croppedimage-ae32245d67a94bb6b0fb34daf4db4b44.png,https://cdn.helloasso.com/img/photos/croppedimage-27e99df12a424b7588f3b165bb03376d.jpg,Caylus,82160,Tarn-et-Garonne,Occitanie,9 Rue Droite,44.235991,1.770472,Association1901,Formation | Étudiants | Solidarité et Action Sociale,,2,"Donation, Membership",1701644400,1705919371,110,,admin@aeqr.org,0619512167
466025,LES JARDINS DES GORGES DE L'AVEYRON,"L'association les Jardins des Gorges de l'Aveyron, Atelier et Chantier d'Insertion Professionnelle, se situent dans le champ de l'Economie Sociale et Solidaire et du Développement Durable. Ils permettent l'inclusion par le travail à des personnes en difficultés sociales et professionnelles.",/associations/les-jardins-des-gorges-de-l-aveyron,https://cdn.helloasso.com/img/logos/croppedimage-44ff6bbfbf5d4649bbb7111f8c7f48a1.png,https://cdn.helloasso.com/img/photos/croppedimage-fb9f7e1e8df14c689048d009dc87ec4f.png,Féneyrols,82140,Tarn-et-Garonne,Occitanie,Féneyrols,44.141,1.826,Association1901Rup,Développement durable | Humanitaire | Insertion | Jardinage | Solidarité | Économie | Solidarité et Action Sociale,,2,"PaymentForm, Membership",1705359600,1706558977,110,,directioncocagne82@gmail.com,0786779727
454061,DON YE NI YE ,"développer la pratique de la danse et de la musique d'inspirations culturelles différentes, sous forme de cours, d'échanges, de manifestations culturelles, ou toutes activités favorisant l'apprentissage, la créativité, les liens humains dans un esprit de rencontre, d'ouverture, de partage et respect",/associations/don-ye-ni-ye,https://cdn.helloasso.com/img/logos/croppedimage-8898fecd182b4b6c9406f2e5c8c079ff.png,https://cdn.helloasso.com/img/photos/croppedimage-2ba4dab5ba364699ad139ad5b57b251a.png,Réalville,82440,Tarn-et-Garonne,Occitanie,12 Rue Jean Delzars,44.114662,1.479592,Association1901,Arts | Culture | Danse | Arts et Culture,,1,Event,1701212400,,110,,associationdonyeniye@gmail.com,0661241612
419889,La Box du Filmmaker ,"Association de production audiovisuelle dans l'écriture, le tournage, le montage, l'étalonnage et le master basée en Occitanie (Montauban).",/associations/la-box-du-filmmaker,https://cdn.helloasso.com/img/logos/croppedimage-24c34c5606de44a5a9dcb718b4e83b5d.png,https://cdn.helloasso.com/img/photos/croppedimage-61ceeb152db1409ea780e9f4f990b744.png,Montauban,82000,Tarn-et-Garonne,Occitanie,"2 Rue Charles Trenet, Bat D1, Apt 02",44.028818,1.33479,Association1901Rig,Arts | Culture | Arts et Culture,Don,1,Shop,1689804000,1703412060,110,,laboxdufilmmaker@gmail.com,0750837598
436555,Replay82,Association Retrogaming située à Canals dans le Tarn-et-Garonne (82). ,/associations/replay82,https://cdn.helloasso.com/img/logos/croppedimage-dc09ba73981d48fc93ff527dd2ad204b.png,https://cdn.helloasso.com/img/photos/croppedimage-f00580fe4dec4cf89beae7029828518c.png,Canals,82170,Tarn-et-Garonne,Occitanie,1023 Route de Fabas,43.855658,1.303439,Association1901,Loisirs,,1,Membership,1695938400,1727385567,110,,alainh31@gmail.com,0661584535
408285,Comité des fêtes de Montpezat de Quercy ,Comité des fêtes pour rassembler les jeunes et moins jeunes autour de moments conviviaux ,/associations/comite-des-fetes-de-montpezat-de-quercy,https://cdn.helloasso.com/img/logos/croppedimage-196b4d2ce8da48aba0f5b5d0a699bf6a.png,https://cdn.helloasso.com/img/photos/croppedimage-6507c6bb0a054cfb9c94ac6af36a6fa5.png,Montpezat-de-Quercy,82270,Tarn-et-Garonne,Occitanie,2 Place de la Resistance,44.237437,1.476954,Association1901,Arts | Culture | Fête | Loisirs,Comites-des-fetes,1,Event,1686002400,1699436813,110,,comitemontpezat82@gmail.com,0632255872
442022,Pitray and Co,Association des cavaliers du Stade Equestre de Pitray.,/associations/pitray-and-co,https://cdn.helloasso.com/img/logos/croppedimage-681e93a1d2894d02bb02f1f2ebf47940.png,https://cdn.helloasso.com/img/photos/croppedimage-d37bc64850654d52aa6ed45a706212b7.png,Saint-Etienne-de-Tulmont,82410,Tarn-et-Garonne,Occitanie,Saint-Étienne-de-Tulmont,44.047238,1.46114,Association1901,Sport | Equitation,,1,Event,1697580000,1699726646,110,,pitrayandco@free.fr,
401495,BOXING Moissagais,"Club pratiquant multiple style de boxe : la Boxe Thaï, le KickBoxing, le K-1, le Pancrace...",/associations/boxing-moissagais,https://cdn.helloasso.com/img/logos/croppedimage-e1f49fdfdb7d432c8fe913d00da40996.png,https://cdn.helloasso.com/img/photos/croppedimage-191d4e05f5874e0db03f27c1947acf6d.png,Moissac,82200,Tarn-et-Garonne,Occitanie,20 Chemin de Calas,44.108676,1.106308,Association1901,Sport | Boxe,,1,Event,1684015200,1697808678,110,,boxing-moissagais@hotmail.fr,0662882491
425872,340MS,La vitesse du son est la vitesse de propagation des ondes sonores. Cette vitesse est de 340 mètres par seconde. Notre projet consiste à créer une série de documentaires qui mettront en valeur les sons uniques des diverses forêts à travers le monde.,/associations/340ms,https://cdn.helloasso.com/img/logos/croppedimage-e5a6e8273dc54a399e8e4fc450ebc02a.png,https://cdn.helloasso.com/img/photos/croppedimage-930594bf2dc14112bfd5e69f8f05c866.png,Montauban,82000,Tarn-et-Garonne,Occitanie,12 rue des lys,44.031314,1.334955,Association1901,Forêt | Patrimoine,,1,Event,1693000800,1694796660,110,,340ms.project@gmail.com,0684557783
417294,La Grûte Production,"Créée en 2015 autour de la performance Une grute fur rute, La Grüte Productions est le nouveau nid des joyeux tailleurs du Quercy et reprend Le Père Quépas et Les Baloch. Un peu trop court pour relancer un Père Quépas cette année, La Grüte propose Le Presq'Quépas !",/associations/la-grute-production,https://cdn.helloasso.com/img/logos/croppedimage-622d6176a10449fcb63adc9d5a541e5e.jpg,https://cdn.helloasso.com/img/photos/croppedimage-da2334b6e71042779f4bf6d589070283.png,Montaigu-de-Quercy,82150,Tarn-et-Garonne,Occitanie,La gravière de thirondel,44.304657,0.987105,Association1901,Arts | Culture | Arts et Culture,,2,"Membership, Event",1688594400,1691866573,110,,lagruteproductions@gmail.com,0698530071
417988,Fsociété,"Une revue entre journalisme et sociologie, qui défend une société en rupture avec le néolibéralisme et le consumérisme, ainsi que des valeurs de solidarité et de sobriété. ",/associations/fsociete,https://cdn.helloasso.com/img/logos/croppedimage-da03f911ca214616b11d5ee1be37a545.png,https://cdn.helloasso.com/img/photos/croppedimage-9a21d91dc0544540b78b0d04dc231974.png,Montauban,82000,Tarn-et-Garonne,Occitanie,4 rue bernard segalas talous,44.0119,1.365892,Association1901,Arts | Culture | Solidarité | Solidarité et Action Sociale,,1,Shop,1688940000,,110,,benjamin_respaud@yahoo.fr,0602737605
408866,LES 4 TUILES,"Hello tout le monde! Nous c'est Éva et Joris, aka Les 4 Tuiles, et nous nous sommes lancés le défi fou de faire le 4L Trophy en 2024! L'objectif de notre association est d'apporter des fournitures scolaires aux enfants du désert marocain afin qu'ils aillent à l'école dans les meilleures conditions.",/associations/les-4-tuiles,https://cdn.helloasso.com/img/logos/croppedimage-13c84ebc5f0c4839bd52b0afd73cd97e.png,https://cdn.helloasso.com/img/photos/croppedimage-f208f81fa44b47e6b2cc743adda6fcb1.png,Montauban,82000,Tarn-et-Garonne,Occitanie,8 Impasse Marcel Pagnol,44.006015,1.380495,Association1901,Caritatif | Enfance | Humanitaire | Sport automobile | Solidarité et Action Sociale,,1,Donation,1686175200,1706552757,110,,les4tuiles@gmail.com,0770705393
399834,Ciné Noble Val,"Née suite à la fermeture du cinéma de Saint-Antonin-Noble-Val, l'association Ciné Noble Val compte aujourd'hui 300 adhérents, convaincus qu'une salle de cinéma peut et doit vivre dans ce village !",/associations/cine-noble-val,https://cdn.helloasso.com/img/logos/croppedimage-5dcb731e17f447529274ca82e926923d.png,https://cdn.helloasso.com/img/photos/croppedimage-4cf845b3565a4543bc50763a8bf2b74d.png,Saint-Antonin-Noble-Val,82140,Tarn-et-Garonne,Occitanie,23 Place de la Mairie,44.150854,1.756118,Association1901,Arts | Cinéma | Culture | Arts et Culture,,1,Membership,1683496800,1767375003,110,,contact@cinenobleval.org,0624436455
369786,Le sable des rêves,"L'association a été créée afin de récolter des fonds pour participer au Trek'in Gazelles 2023 et soutenir une asso d'enfants gravement malades. Notre présidente, âgée de 16 ans défend les valeurs d'engagement des jeunes et des femmes aujourd'hui dans l'action solidaire, sportive et environnementale",/associations/le-sable-des-reves,https://cdn.helloasso.com/img/logos/croppedimage-b397a48251204192bb7059847a7fed28.png,https://cdn.helloasso.com/img/photos/croppedimage-f1c3ce9038ec4cafb466a699be2752ca.png,Montech,82700,Tarn-et-Garonne,Occitanie,46 Route de la Pisciculture,43.952327,1.239583,Association1901,Enfance | Environnement | Sport | Solidarité et Action Sociale,,1,Event,1673996400,1685201598,110,,,
383108,Quercy Interventions Services,"QIS est l'association de préfiguration du projet ""Territoire Zéro Chômeur de Longue Durée"" défini sur onze communes du Quercy Caussadais. Sa création vise à la poursuite de la structuration d'une Entreprise à But d'Emploi, ayant pour but de proposer un CDI à temps choisi aux participants du projet.",/associations/quercy-interventions-services,https://cdn.helloasso.com/img/logos/croppedimage-fe74fa0d62874c8b82a73b1a02b5ad84.png,https://cdn.helloasso.com/img/photos/croppedimage-9312f1d966f545c988b6bf2b5b812a5a.png,Septfonds,82240,Tarn-et-Garonne,Occitanie,Rue de la Republique,44.178341,1.618882,Association1901,Humanitaire | Solidarité | Réseaux pros et étudiants,,1,Donation,1678230000,,110,,tzcld.midiquercy@gmail.com,0563246064
400453,Sporting Club Nègrepelissien section tennis,"Le SCN tennis est un club de dimension moyenne, chaleureux et convivial qui dispose d'un cadre de vie agréable. Le club est composé d'un terrain couvert en moquette très confortable, de deux terrains extérieurs en greenset et d'un club house avec un bar pour les après matchs !",/associations/sporting-club-negrepelissien-section-tennis,https://cdn.helloasso.com/img/logos/croppedimage-71da81bf7e8e4c35bb86400f8342dcfd.png,https://cdn.helloasso.com/img/photos/croppedimage-3f61940389ac45f6a8641722db99ee97.png,Nègrepelisse,82800,Tarn-et-Garonne,Occitanie,Bureau des associations 14 pl de la mairie,44.07526,1.522199,Association1901,Sport | Tennis,,1,Shop,1683669600,1772127186,110,FFT,scn.tennis@gmail.com,0630082075
361469,Les olympiennes 82,Association pour la levée de fond pour les associations ruban rose et enfants du desert ,/associations/les-olympiennes-82,https://cdn.helloasso.com/img/logos/croppedimage-763a4a2367f345299fa3af1416924ec7.png,https://cdn.helloasso.com/img/photos/croppedimage-f0e586a683204cfa8be412d25db34e8f.png,Montauban,82000,Tarn-et-Garonne,Occitanie,Chemin de Couloumbayres,44.021246,1.423083,Association1901,Caritatif | Enfance | Humanitaire | Solidarité et Action Sociale,,2,"Donation, Shop",1670367600,1695837342,110,,lesolympiennes82@gmail.com,0631601736
384060,ACRMP-O,"Les missions de l'Association des Conservateurs-Restaurateurs de Méditerranée-Pyrénées-Occitanie (ACRMP-O) sont de mettre en valeur, préserver, promouvoir, animer et défendre, la conservation et la restauration du Patrimoine en Occitanie",/associations/acrmp-o,https://cdn.helloasso.com/img/logos/croppedimage-d254929f8a394a6a90119e1afbd7657a.png,https://cdn.helloasso.com/img/photos/croppedimage-bb302f0acb974a86aade0902ac058bbb.png,Verdun-sur-Garonne,82600,Tarn-et-Garonne,Occitanie,8 Rue Joliot Curie,43.852461,1.23474,Association1901,Patrimoine,,1,Donation,1678489200,,110,,acrmp31@gmail.com,0671499361
365141,Beaumont Lavit Lomagne Volley-ball,Association sportive de volley-ball. Compétition FFVB et Loisir UFOLEP. De catégorie Baby à senior.,/associations/beaumont-lavit-lomagne-volley-ball,https://cdn.helloasso.com/img/logos/croppedimage-46bb67d9dd644630b377a1dcb9f12331.png,https://cdn.helloasso.com/img/photos/croppedimage-db49b976c9fa4f948a4c1e642869b411.png,Beaumont-de-Lomagne,82500,Tarn-et-Garonne,Occitanie,Beaumont-de-Lomagne,43.883205,0.993906,Association1901,Sport | Volley-ball,,1,Membership,1671922800,,110,,volley.beaumont@gmail.com,0681071161
152783,association mission pour l'unité France ,"Parce que l'unité des chrétiens est une demande du Christ en Jean 17, 20-26",/associations/association-mission-pour-l-unite-france,https://cdn.helloasso.com/img/logos/association mission pour l unite france-6548db1a60114f41bd02d05347699d48.png,https://cdn.helloasso.com/img/photos/croppedimage-8b5d7729609d49c3958bae8cd3261655.png,Savenès,82600,Tarn-et-Garonne,Occitanie,243 Chemin d'Engouse,43.843886,1.19451,Association1901,Religion | Spiritualité,,5,"PaymentForm, Donation",1560290400,1620497427,110,,contact@mission4unity.fr,0661146046
158172,CARREFOUR DE DÉVELOPPEMENT DE NKAOULÉ ,"Lutter contre la pauvreté dans le village Nkaoulé, à l'Est du Cameroun.",/associations/carrefour-de-developpement-de-nkaoule,https://cdn.helloasso.com/img/logos/carrefour de developpement de nkaoule-d21927fb905542ac9453efb488060af6.jpg,https://cdn.helloasso.com/img/photos/img-20190218-wa0006-8b5a103c6e114b22a8e71d39dfc3b5c4.jpg,Verdun-sur-Garonne,82600,Tarn-et-Garonne,Occitanie,Chemin des Najats,43.85877,1.228409,Association1901,Solidarité et Action Sociale | Caritatif | Humanitaire,,1,Donation,1563400800,,110,cmo,florenceassambong@yahoo.fr,0601369689
120634,La Maison de la Halle,"Une très grande maison à rénover au cœur du village, pour y faire un bar associatif et culturel, un espace de vie sociale, des logements à prix abordable. Accompagner les associations du territoire, promouvoir les producteurs locaux...",/associations/la-maison-de-la-halle,https://cdn.helloasso.com/img/logos/la maison de la halle-ad5c948578c94794b697aed7b3b4efa2.jpeg,https://cdn.helloasso.com/img/photos/croppedimage-f01cdbd8e8494d95b919c897c68abfdf.png,Verfeil,82330,Tarn-et-Garonne,Occitanie,Place de la Halle,44.18707,1.876161,Association1901Rig,Bar associatif | Culture | Humanitaire | Logement | Solidarité | Solidarité et Action Sociale,,1,Donation,1544310000,1677579906,110,,lamaisondelahalle@verfeil.net,0615625761
349544,Emmaüs Tarn-et-Garonne,"Emmaüs Tarn-et-Garonne est une association auto-suffisante fondée 1995 qui accueille aujourd'hui 280 personnes; salariés, compagnes/compagnons, personnes orientées par le 115 et bénévoles!  3 lieux de vie, 4 lieux de vente, 3 chantiers d’insertion répartis sur le département.  Aidez-nous à aider !  ",/associations/emmaus-tarn-et-garonne,https://cdn.helloasso.com/img/logos/croppedimage-381a0ac41e9b4ff186275a0c5f4816cb.png,https://cdn.helloasso.com/img/photos/croppedimage-e8173177efae4ee69097889420712404.png,La Ville-Dieu-du-Temple,82290,Tarn-et-Garonne,Occitanie,2861 Route de Lagarde,44.048978,1.248645,Association1901,Humanitaire | Solidarité | Solidarité et Action Sociale,,1,Donation,1665439200,1665591217,110,,communication@emmaus82.org,05693315145
372196,Theas Alumni,Association des anciens élèves du lycée Pierre-Marie Théas,/associations/theas-alumni,https://cdn.helloasso.com/img/logos/croppedimage-ed04267cf7c6406b8600c162ac5f9caa.png,https://cdn.helloasso.com/img/photos/croppedimage-1089690d3c844035855b01eab4dbf488.png,Montauban,82000,Tarn-et-Garonne,Occitanie,1 Rue Marie-rose Gineste,43.99989,1.36114,Association1901,Étudiants | Education,,1,Membership,1674774000,1687607985,110,,theas.alumni@gmail.com,0672517534
