objectID,name,description,url,logo,banner,city,zipcode,department,region,address,lat,lng,org_type,category_tags,ha_tags,active_forms_count,active_forms_type,creation_date,last_order_date,score,partners,contact_email,contact_phone
571075,AAPE MONTECH,"AAPE MONTECH est une association de parents d'élèves de la ville de Montech. Les membres participent aux conseils d'école et aux conseils de classe à l'école primaire, au collège et au lycée. Ils organisent différents évènements festifs dont le carnaval de Montech.",/associations/aape-montech,,,Montech,82700,Tarn-et-Garonne,Occitanie,81 Impasse de Saragnac,43.949834,1.238465,Association1901,Education | Fête | Humanitaire | Parents d'élèves | Solidarité,,0,,1739746800,,30,,lucie_1826@hotmail.com,
563783,Les amis de la vallée de L'Union ,Promotion de l'amitié de ses membres,/associations/les-amis-de-la-vallee-de-l-union,,,Caussade,82300,Tarn-et-Garonne,Occitanie,8 Rue du Parc,44.164303,1.536971,Association1901,Spiritualité | Religion,,0,,1737241200,,30,,christophe.dessard@orange.fr,
543923,L'Eldorado des vieux sabots ,"a pour but de recueillir, accueillir, soigner, protéger et subvenir aux besoins des vieux chevaux et des vieux poneys de club équestre ",/associations/l-eldorado-des-vieux-sabots,,,Verdun-sur-Garonne,82600,Tarn-et-Garonne,Occitanie,2600 Chemin de Grisolles,43.840379,1.268786,Association1901,Animaux | Caritatif | Equitation | Humanitaire,,0,,1729634400,,30,,leldoradodesvieuxsabots@gmail.com,0643283707
520131,FSE DU Collège François Mitterrand de Moissac,"Le Foyer socio éducatif du collège François Mitterrand de Moissac (82)  est une association loi 1901 dont le but est d'aider les élèves en proposant un goûer à chaque récréation de la matinée, des clubs et une participation financière aux voyages scolaires.",/associations/fse-du-college-francois-mitterrand-de-moissac,,,Moissac,82200,Tarn-et-Garonne,Occitanie,Boulevard du Lycée,44.105339,1.092367,Association1901,Education | Formation | Voyages,,0,,1721080800,,30,,fseducfm82@gmail.com,0689539100
473159,Freewheels,Association sportive dans le domaine du cyclisme principalement le BMX race. Elle a pour but d'accompagner et aider ses adhérents dans leur évolution et participation aux compétitions. Elle peut organiser des stages ou initiations vélo. les bénéfices en fin de saison seront reversés à la recherche. ,/associations/freewheels,,,Beaupuy,82600,Tarn-et-Garonne,Occitanie,416 Route de Bouillac,43.825362,1.117699,Association1901,Sport | BMX | Cyclisme | Recherche | Vélo,,0,,1707174000,,30,,erictrastet@yahoo.fr,0667095213
461215,Association Biodiversité Ré Enchantée,Notre association dispense des initiations à la permaculture et des cours de théâtre. Nous lions art et agroécologie sur notre ferme expérimentale de 13Ha. Lauréats de Ma Solution pour le Climat : https://bit.ly/38nJ0Ov.   www.lesexpressionsdeletre.fr facebook : marielle - biodiversité réenchantée,/associations/association-biodiversite-re-enchantee,,,Monclar-de-Quercy,82230,Tarn-et-Garonne,Occitanie,1680 Route de Montauban,43.966575,1.562384,Association1901,Arts | Biodiversité | Climat | Environnement | Permaculture | Théâtre | Ecologie et Environnement,,0,,1704150000,,30,,mariellecostamagna@gmail.com,0628342094
456514,boxrelais,"Boxrelais.com est une association de loi 1901 qui a pour objectif de soutenir, gérer et évaluer les projets d'économie sociale et solidaire de ses membres signataires de la charte L-800.",/associations/boxrelais,,,Nègrepelisse,82800,Tarn-et-Garonne,Occitanie,35 Rue de Turenne,44.074112,1.522117,Association1901,Humanitaire | Solidarité | Économie | Solidarité et Action Sociale,,0,,1702076400,,30,,reseauecolo@gmail.com,0603896707
455558,montgolfiere a vol d'oiseau,Bapteme de vol en montgolfiere,/associations/montgolfiere-a-vol-d-oiseau,,,Mirabel,82440,Tarn-et-Garonne,Occitanie,61 Impasse du Stade,44.147761,1.421304,Association1901,Sport,,0,,1701730800,,30,,associationmvo82@gmail.com,+33608346841
451562,Oklahoma-Occitania ,"Faire vivre les liens historiques, culturels, amicaux liant la Nation Osage à la ville de Montauban, et à l'Occitanie.",/associations/oklahoma-occitania,,,Montauban,82000,Tarn-et-Garonne,Occitanie,rue du trapeze,44.021778,1.367055,Association1901,Arts | Culture | Arts et Culture,,0,,1700521200,,30,,oklahomaoccitania@gmail.com,
434873,Corvus Corax,L'association Corvus Corax est une association Bikers qui lutte pour l'aide à l'enfance.,/associations/corvus-corax,,,Lizac,82200,Tarn-et-Garonne,Occitanie,1050 Route de la Serre,44.120566,1.175761,Association1901,Caritatif | Enfance | Humanitaire | Solidarité et Action Sociale | Santé,,0,,1695333600,,30,,corvuscoraxasso82@outlook.fr,
418986,Football des Terrasses du Tarn,Club de football regroupant garçons et filles âgés de 6 à 17 ans ,/associations/football-des-terrasses-du-tarn,,,Labastide-du-Temple,82100,Tarn-et-Garonne,Occitanie,9 Grand Rue,44.084486,1.194159,Association1901,Sport | Football,,0,,1689372000,,30,,lasval82@gmail.com,0659506188
413352,ASSOCIATION MULTI ACTIVITÉS DE BELBÈZE EN LOMAGNE,,/associations/association-multi-activites-de-belbeze-en-lomagne,,,Belbèze-en-Lomagne,82500,Tarn-et-Garonne,Occitanie,1 Place du 19 Mars 1962,43.901921,1.07106,Association1901,Arts | Culture | Jeux | Arts et Culture,,0,,1687644000,,30,,AMABEL@OUTLOOK.fr,
389067,Protection civile tarn et garonne ,Nous sommes un organisme de premiers secours et nous faisons aussi les formations au premiers secours ,/associations/protection-civile-tarn-et-garonne,,,Montauban,82000,Tarn-et-Garonne,Occitanie,Chemin de Paulet,44.014532,1.314424,Association1901,Caritatif | Formation | Humanitaire | Solidarité et Action Sociale,,0,,1679958000,,30,,contact@protectioncivile82.org,
380211,Domaine du Grand Barreau,"Notre association a pour objectif de donner à cette magnifique demeure du XVIIIème siècle un nouvel élan. Ensemble construisons un lieu de culture, un lieu d'échange et de partage dynamique. C'est de l'intelligence collective que nous ferons émerger un projet ambitieux, riche de valeurs novatrices.",/associations/domaine-du-grand-barreau,,,Albias,82350,Tarn-et-Garonne,Occitanie,Place de l’Hotel de Ville,44.090561,1.45016,Association1901,Arts | Culture | Spiritualité,,0,,1677366000,,30,,renaudeau.fabienne@orange.fr,0677759532
377871,MONTAUBAN FESTIVITES LES 400 COUPS ,"L'asso organise 2 évènements dans l'année. La soirée Election de la Reine des 400 Coups, soirée Diner Spectacle. Et la fête des 400 Coups, le 2° w-end de sept. 2 cavalcades de 12 chars plus musiciens, le samedi soir + le dim. a-midi. Et les concerts musicaux au Cours Foucault les vend et sam soirs.",/associations/montauban-festivites-les-400-coups,,,Montauban,82000,Tarn-et-Garonne,Occitanie,111 Quai Adolphe Poult,44.010946,1.346223,Association1901,Arts | Culture | Fête | Musique | Loisirs | Arts et Culture,,0,,1676588400,,30,,montauban.festivites@orange.fr,0620627306
373895,Amis des plantes,Ensemble nous apprenons des plantes,/associations/amis-des-plantes,,,Léojac,82230,Tarn-et-Garonne,Occitanie,827 Chemin de Rastely,44.018031,1.443046,Association1901,Arts | Culture | Arts et Culture,,0,,1675292400,,30,,followingthespiritofnature@gmail.com,+33788608230
362977,La table des Opticiens Indépendants,"La promotion de l’activité d'opticien indépendant, l’aide à la communication et à la publicité en matière d'optique, l’étude de marchés, l’aide à la réalisation d'économies dans le cadre des achats de marchandises, l'aide à la négociation avec les fournisseurs",/associations/la-table-des-opticiens-independants,,,Montauban,82000,Tarn-et-Garonne,Occitanie,3 Rue Jules Michelet,44.017156,1.354669,Association1901,Réseaux pros et étudiants,,0,,1670626800,,30,,latabledesopticiens@gmail.com,0675281875
329906,Moissac Castelsarrasin Basket Ball,Club de basket ball qui se situe à Moissac  Cosec Armand Rigal  82200 Moissac,/associations/moissac-castelsarrasin-basket-ball,,,Moissac,82200,Tarn-et-Garonne,Occitanie,7 Rue Jean Moulin,44.104511,1.091292,Association1901,Sport | Basketball,,0,,1655420400,,30,,fmataly@free.fr,0688638492
309441,Pharmacie Humanitaire Internationale 82,"PHI favorise l’accès aux soins et aux médicaments des plus démunis  Récupération et mise à disposition de matériel médical dans le cadre de nos missions ou par l'intermédiaire d'autres associations humanitaires. Actions de formation , de prévention et d'éducation sanitaire (scolaire, forum...) ",/associations/pharmacie-humanitaire-internationale-82,,,Castelsarrasin,82100,Tarn-et-Garonne,Occitanie,10 Place Gaston Benac,44.041594,1.104174,Association1901,Caritatif | Formation | Humanitaire | Solidarité et Action Sociale | Santé,,0,,1646521200,,30,,phi.82@hotmail.fr,0662123417
308110,groupement d'AMITIE,"Fondée en 1975 notre association a pour but de réunir et venir en aide aux handicapés locaux et de passage et de fournir un lieu d'accueil et d'hébergement temporaire. Elle gère un local adapté de 10 chambres avec séjour, lieu de réunion, cuisine et jardin en ville. ",/associations/groupement-d-amitie,,,Moissac,82200,Tarn-et-Garonne,Occitanie,3 Rue François Raynal,44.100745,1.081463,Association1901,Caritatif | Cuisine | Handicap | Humanitaire | Jardinage | Solidarité et Action Sociale,,0,,1645916400,,30,,michel.cassignol82@orange.fr,0563042905
295028,TCKM 82,Association sportive,/associations/tckm-82,,,Donzac,82340,Tarn-et-Garonne,Occitanie,39 Rue du Placiot,44.10809,0.819378,Association1901,Sport,,0,,1638572400,,30,,pierre.garcia6@wanadoo.fr,0563398988
282980,Club biracais ,Yoga,/associations/club-biracais,,,Lamothe-Capdeville,82130,Tarn-et-Garonne,Occitanie,13 Port Ardus,44.075795,1.373776,Association1901,Bien-être,,0,,1631833200,,30,,mimosa_soleil@hotmail.fr,0665521106
272595,Société de Sciences Naturelles de Tarn-et-Garonne,"Asso naturaliste créée en 1951. Son objet est l'étude et la protection de la nature, de l'environnement et de la biodiversité dans son ensemble sur le département du Tarn-et-Garonne et sur les départements limitrophes dans le cadre d'une continuité géographique, naturelle, écologique ou autre.",/associations/societe-de-sciences-naturelles-de-tarn-et-garonne,,,Montauban,82000,Tarn-et-Garonne,Occitanie,2 Place Antoine Bourdelle,44.017084,1.35105,Association1901,Biodiversité | Environnement | Écologie | Ecologie et Environnement,,0,,1625094000,,30,,contact@ssntg82.com,0768277729
259807,Les Baladins de l'Evangile,Evangéliser par le théâtre,/associations/les-baladins-de-l-evangile,,,Lacapelle-Livron,82160,Tarn-et-Garonne,Occitanie,228 Impasse de Salvagnac,44.259653,1.795413,Association1901Rig,Arts et Culture | Arts | Culture | Théâtre,,0,,1620424800,,30,,com@baladinsevangile.com,33 (0)563670861
243128,Atmosphère,,/associations/atmosphere,,,Saint-Antonin-Noble-Val,82140,Tarn-et-Garonne,Occitanie,Les Granges,44.150531,1.755878,Association1901,Loisirs,,0,,1611702000,,30,,geraldine.ramond@gmail.com,
167200,association les cavaliers des sabots de l'honor, ,/associations/association-les-cavaliers-des-sabots-de-l-honor,,,L'Honor-de-Cos,82130,Tarn-et-Garonne,Occitanie,3865 Côte de Mirabel,44.122576,1.38497,Association1901,Sport,,0,,1568844000,,30,,,
100458,PARTAGE EN CONSCIENCE,PARTAGE EN CONSCIENCE,/associations/partage-en-conscience,,,Grisolles,82170,Tarn-et-Garonne,Occitanie,11 RUE DU CAZALAS,43.827698,1.294335,Association1901,Spiritualité,,0,,1528671600,,30,,abimounia@gmail.com,
480616,Association Couleur Image Design,,/associations/association-couleur-image-design,,,Montauban,82000,Tarn-et-Garonne,Occitanie,116 boulevard montauriol,44.009976,1.360819,Association1901,Étudiants | Réseaux pros et étudiants,,2,Event,1709074800,1774979364,10,,acid.iup@gmail.com,
653180,MOUVEMENT POUR L'ETIQUETAGE HUMANISTE,,/associations/mouvement-pour-l-etiquetage-humaniste,,,Esparsac,82500,Tarn-et-Garonne,Occitanie,624 route de Notary,43.904106,0.951246,AssociationProprietaire,Solidarité et Action Sociale,,1,Membership,1772578800,,10,,,
483431,Associaton sante pour tous,,/associations/associaton-sante-pour-tous,,,Pompignan,82170,Tarn-et-Garonne,Occitanie,29 Hameau du Bel soleil,43.818713,1.31164,Association1901,Humanitaire | Solidarité | Solidarité et Action Sociale,,3,"Event, Donation, Membership",1709852400,1774718685,10,,a.santepourtous@gmail.com,0619697680
629562,RESPAWN OF GEEK,,/associations/respawn-of-geek,,,Saint-Etienne-de-Tulmont,82410,Tarn-et-Garonne,Occitanie,700 Route de Léojac,44.036555,1.456098,Association1901,Arts et Culture | Arts | Culture,,3,"Shop, Event, Membership",1763334000,1774568926,10,,rog82000@gmail.com,
607182,PRIDE82,,/associations/pride82,,,Montauban,82000,Tarn-et-Garonne,Occitanie,rue des oules,44.009322,1.335954,Association1901,Loisirs,,2,"Event, Membership",1755468000,1774643675,10,,Pride82.asso@gmail.com,
535030,QUERCY-GRIMPE,,/associations/quercy-grimpe,,,Saint-Antonin-Noble-Val,82140,Tarn-et-Garonne,Occitanie,Route de la Vallée,44.142603,1.79404,Association1901,Sport,,2,"Event, Membership",1727042400,1774796747,10,federation-francaise-montagne-escalade,quercygrimpe@hotmail.fr,0634366530
643985,"ASSOCIATION COREA- COMPRENDRE, RESSENTIR ET AGIR",,/associations/association-corea-comprendre-ressentir-et-agir,,,Montauban,82000,Tarn-et-Garonne,Occitanie,910 B boulevard Blaise Doumerc,44.019851,1.36263,Association1901,Solidarité et Action Sociale | Humanitaire | Solidarité,,1,Membership,1769468400,1773178741,10,,,
651446,AU PRÉ EN BULLES,,/associations/au-pre-en-bulles,,,Monclar-de-Quercy,82230,Tarn-et-Garonne,Occitanie,"849, route des Janoutaous,",43.976734,1.570633,Association1901,Étudiants | Réseaux pros et étudiants,,1,CrowdFunding,1771887600,1773064845,10,,,
645461,"POUR CAYLUS, SON URBANISME ET SON ENVIRONNEMENT",,/associations/pour-caylus-son-urbanisme-et-son-environnement,,,Caylus,82160,Tarn-et-Garonne,Occitanie,lieu-dit Quercy,44.241501,1.705651,AssociationProprietaire,Ecologie et Environnement | Environnement,,1,CrowdFunding,1769900400,1774894106,10,,,
652030,Les Elles  Blanches ,,/associations/les-elles-blanches,,,Monbéqui,82170,Tarn-et-Garonne,Occitanie,140 Rue du Bac,43.891978,1.238212,Association1901,Sport,,1,CrowdFunding,1772060400,1773408451,10,,,
629039,APE VILLEBRUMIER,,/associations/ape-villebrumier,,,Villebrumier,82370,Tarn-et-Garonne,Occitanie,1 Place de la Mairie,43.907264,1.452512,Association1901,Education | Formation,,1,Event,1763161200,1773776057,10,,Apevillebrumier82370@gmail.com,
583997,THÉATRE & CETERA,,/associations/theatre-cetera,,,Caussade,82300,Tarn-et-Garonne,Occitanie,"9, avenue de Molieres,",44.164454,1.535451,AssociationProprietaire,Arts et Culture | Arts | Culture,,1,Event,1744668000,1760463710,10,,theatretcetera@yahoo.com,
427888,Association des parents d'élèves de l'école de Pompignan,,/associations/association-des-parents-d-eleves-de-l-ecole-de-pompignan,,,Pompignan,82170,Tarn-et-Garonne,Occitanie,3 Rue Bernard Peyrille,43.817683,1.310667,Association1901,Solidarité et Action Sociale | Humanitaire | Solidarité,,2,"Shop, Membership",1693692000,1773247744,10,,apepompignan82@gmail.com,0664427101
585969,association Epice82 drogues et société,,/associations/association-epice82-drogues-et-societe,,,Montauban,82000,Tarn-et-Garonne,Occitanie,3 rue theophile delcasse,44.020039,1.35488,Association1901,Solidarité et Action Sociale | Humanitaire | Solidarité,,1,CrowdFunding,1745532000,1765452364,10,,secretariatrdr@epice82.fr,
621863,COMITE TERRITORIAL QUERCY GARONNE LOT TARN ET GARONNE BASKET BALL,,/associations/comite-territorial-quercy-garonne-lot-tarn-et-garonne-basket-ball,,,Montauban,82000,Tarn-et-Garonne,Occitanie,"8, rue des Primeurs,",44.03265,1.350759,Association1901,Sport,,1,Event,1760479200,1771314009,10,,n.laumond@basket-qg.fr,
617525,LES DROLES DE MONTBARTIER,,/associations/les-droles-de-montbartier,,,Montbartier,82700,Tarn-et-Garonne,Occitanie,1 Place de la Mairie,43.912781,1.272199,Association1901,Education | Formation,,1,Shop,1759096800,1774377283,10,,ape.montbartier@gmail.com,
278270,Valence d'Agen Roller 2 Rives,,/associations/valence-d-agen-roller-2-rives,,,Valence,82400,Tarn-et-Garonne,Occitanie,Rue General Vidalot,44.106301,0.893161,Association1901,Sport,,1,Shop,1629842400,1630161485,10,FFRS,valencedagenroller2rives@gmail.com,
642750,LA TROUPE DE LA SANS PAREILLE,,/associations/la-troupe-de-la-sans-pareille,,,Montauban,82000,Tarn-et-Garonne,Occitanie,436 chemin des Gasous,44.050877,1.367363,Association1901,Arts et Culture | Arts | Culture,,1,Event,1769036400,,10,,,
628096,LE REFUGE DES VIBRISSES,,/associations/le-refuge-des-vibrisses,,,Escazeaux,82500,Tarn-et-Garonne,Occitanie,1 route de Faudoas,43.832924,1.019263,Association1901,Ecologie et Environnement | Environnement,,2,"Shop, Donation",1762815600,1771511886,10,,lerefugedesvibrisses@outlook.fr,
608117,FÉDÉRATION DE LA DIASPORA KURDE DE FRANCE,,/associations/federation-de-la-diaspora-kurde-de-france,,,Montauban,82000,Tarn-et-Garonne,Occitanie,9 rue Caussat,44.017438,1.346266,Association1901Rig,Arts et Culture | Arts | Culture,,3,"Donation, Membership",1755900000,1766174264,10,,fdkf@orange.fr,
642143,LES GAZ'L DU QUERCY,,/associations/les-gaz-l-du-quercy,,,Montauban,82000,Tarn-et-Garonne,Occitanie,10 rue des Cambis,44.021414,1.354783,Association1901,Caritatif | Humanitaire | Solidarité et Action Sociale,,1,Donation,1768863600,1770575022,10,,,
519977,Terres des confluences handball,,/associations/terres-des-confluences-handball,,,Saint-Porquier,82700,Tarn-et-Garonne,Occitanie,15 Route de Toulouse,44.004333,1.179553,Association1901,Sport,,2,Event,1720994400,1771071904,10,FFHB,terresdesconfluenceshb@gmail.com,0618081693
591264,AIXPLORE RUNNING CLUB,,/associations/aixplore-running-club,,,Caussade,82300,Tarn-et-Garonne,Occitanie,1280 chemin de Naudou,,,AssociationProprietaire,Sport,,4,Event,1747692000,1774983426,10,,Mathisyvrard13@gmail.com,
639170,ANTENNE DE COORDINATION DU THEÂTRE AMATEUR EN TARN-ET-GARONNE,,/associations/antenne-de-coordination-du-theatre-amateur-en-tarn-et-garonne,,,Castelsarrasin,82100,Tarn-et-Garonne,Occitanie,19 rue de la Fraternité,44.04079,1.106132,Association1901,Arts et Culture | Arts | Culture,,2,"Shop, Membership",1767826800,1768150978,10,,,
363980,CPTS GRIMONVER,,/associations/cpts-grimonver,,,Montech,82700,Tarn-et-Garonne,Occitanie,22 Avenue de la Mouscane,43.963946,1.245028,Association1901,Étudiants | Réseaux pros et étudiants,,1,Membership,1671145200,1773661187,10,,cpts.grimonver@gmail.com,
637221,ASSOCIATION OMAYA,,/associations/association-omaya,,,Saint-Antonin-Noble-Val,82140,Tarn-et-Garonne,Occitanie,23 place de la Mairie,44.150948,1.756088,Association1901,Loisirs,,2,"Shop, Membership",1766876400,,10,,omaya.yoga.asso@gmail.com,
574049,TISANE DU KIRC,,/associations/tisane-du-kirc,,,Montauban,82000,Tarn-et-Garonne,Occitanie,540 rue Issanchou,44.0294,1.349832,Association1901,Arts et Culture | Arts | Culture,,1,Membership,1740956400,1772137280,10,,tisanedukirc@mailo.com,
632869,LA RUCHE ÉTUDIANTE,,/associations/la-ruche-etudiante,,,Montauban,82000,Tarn-et-Garonne,Occitanie,61 avenue Gambetta,44.020635,1.36037,Association1901,Étudiants | Réseaux pros et étudiants,,1,Membership,1764630000,1769191368,10,,bde-laruche@egc-occitanie.com,
615105,MONTAUBAN BADMINTON CLUB (M.B.C.),,/associations/montauban-badminton-club-m-b-c,,,Montauban,82000,Tarn-et-Garonne,Occitanie,49 rue du ramiérou,44.012649,1.37524,Association1901,Sport,,1,Shop,1758319200,1771803295,10,,montaubad@gmail.com,
407836,Association Consistoriale Israélite de Montauban,,/associations/association-consistoriale-israelite-de-montauban,,,Montauban,82000,Tarn-et-Garonne,Occitanie,12 RUE SAINTE CLAIRE  - BP  501,44.020752,1.351528,Association1905Rup,Religion | Spiritualité,Don,1,Donation,1685829600,1774167612,10,,,
473534,association des z'arts équestres,,/associations/association-des-z-arts-equestres,,,Monclar-de-Quercy,82230,Tarn-et-Garonne,Occitanie,Place des Capitouls,43.966773,1.584392,Association1901,Arts et Culture | Arts | Culture,,1,Event,1707260400,1772465107,10,,robin.waeles@gmail.com,0621016558
634147,ASSOCIATION COEUR DE PIN UP,,/associations/association-coeur-de-pin-up,,,Canals,82170,Tarn-et-Garonne,Occitanie,284 chemin Sirech,43.857583,1.308163,Association1901,Loisirs,,1,Event,1765148400,1770554245,10,,coeurdepinupoccitanie@gmail.com,
636353,LA PLÈBE MUSIQUE,,/associations/la-plebe-musique,,,Pommevic,82400,Tarn-et-Garonne,Occitanie,30 avenue de Bordeaux,44.100378,0.923774,Association1901,Arts et Culture | Arts | Culture,,1,Event,1766185200,1768675864,10,,laplebe.musique@gmail.com,
634080,Fédération départementale des AFC du Tarn-et-Garonne,,/associations/federation-departementale-des-afc-du-tarn-et-garonne,,,Montauban,82000,Tarn-et-Garonne,Occitanie,100 faubourg lacapelle,44.015073,1.357812,Association1901,Solidarité et Action Sociale | Humanitaire | Solidarité,,1,Event,1765148400,1769677193,10,,gillesvaladie9@gmail.com,
586025,CENTRE DE JEUNES DIRIGEANTS D'ENTREPRISE SECTION TARN-ET-GARONNE,,/associations/centre-de-jeunes-dirigeants-d-entreprise-section-tarn-et-garonne,,,Montauban,82000,Tarn-et-Garonne,Occitanie,10 place nationale,44.01784,1.354399,Association1901,Étudiants | Réseaux pros et étudiants,,1,Membership,1745532000,1773337146,10,,nathalie.picardat@nepco.fr,
537992,ASSOCIATION SPORTIVE DU LYCEE D’ENSEIGNEMENT GENERAL ET TECHNOLOGIQUE PRIVE PIERRE MARIE THEAS,,/associations/association-sportive-du-lycee-d-enseignement-general-et-technologique-prive-pierre-marie-theas,,,Montauban,82000,Tarn-et-Garonne,Occitanie,1 rue marie-rose gineste,43.999887,1.36114,Association1901,Sport,,1,Membership,1727820000,1765989575,10,,as.iftheas82@gmail.com,
582050,ARTS MARTIAUX MONTAUBAN 82,,/associations/arts-martiaux-montauban-82,,,Montauban,82000,Tarn-et-Garonne,Occitanie,49 rue du Ramierou,44.012649,1.37524,AssociationProprietaire,Sport,,1,Membership,1743890400,1766408079,10,BasicCompta,amm82@hotmail.fr,
458405,Rotary Club de Caussade Midi Quercy,,/associations/rotary-club-de-caussade-midi-quercy,,,Caussade,82300,Tarn-et-Garonne,Occitanie,33 Boulevard Léonce Granié,44.161205,1.535858,Association1901,Caritatif | Humanitaire | Solidarité et Action Sociale,,1,Donation,1702767600,1762736375,10,,sophie.bogaert@outlook.fr,0616261942
618059,REFUGE ANIMALIER DE DESTARAC,,/associations/refuge-animalier-de-destarac,,,Larrazet,82500,Tarn-et-Garonne,Occitanie,175 lieu-dit Belleperchette,43.938626,1.067824,Association1901Rup,Ecologie et Environnement | Environnement,,2,Membership,1759269600,,10,,educ-canin@outlook.fr,
632836,L'ART DE VIVRE MICHELET,,/associations/l-art-de-vivre-michelet,,,Montauban,82000,Tarn-et-Garonne,Occitanie,22 faubourg Lacapelle,44.013154,1.361457,Association1901,Loisirs,,1,Membership,1764630000,1769504524,10,,artdevivremichelet@gmail.com,
619106,LESWONDERWOMAN,,/associations/leswonderwoman,,,Montauban,82000,Tarn-et-Garonne,Occitanie,1389 route de l'Aveyron,44.046351,1.344376,Association1901,Loisirs,,1,Event,1759615200,1764356740,10,,leswonder82@gmail.com,
532256,Francas 82,,/associations/francas-82,,,Montauban,82000,Tarn-et-Garonne,Occitanie,25 rue d'albert,44.021193,1.353882,Association1901,Education | Formation,,1,Event,1726092000,1764600077,10,,accueil.francas82@francasoccitanie.org,0563664906
615270,CLUB DE RACE MAINE COON : OCCI'COON,,/associations/club-de-race-maine-coon-occi-coon,,,Montech,82700,Tarn-et-Garonne,Occitanie,731 route de la Ville Dieu,43.965669,1.23423,Association1901,Étudiants | Réseaux pros et étudiants,,6,Membership,1758405600,1774717670,10,,occi-coon@outlook.com,
531056,ASSOCIATION SPORTIVE COLLEGE INSTITUT FAMILIAL,,/associations/association-sportive-college-institut-familial,,,Montauban,82000,Tarn-et-Garonne,Occitanie,1 allees mortarieu,44.015075,1.35643,Association1901,Sport,,1,Membership,1725746400,1770143951,10,,as.iftheas82@gmail.com,
547707,La Garde d'Avalon,,/associations/la-garde-d-avalon,,,Bressols,82710,Tarn-et-Garonne,Occitanie,2 Route de Lavaur,43.967486,1.339438,Association1901,Loisirs,,2,Donation,1730934000,1763205116,10,,lesgardiensdavalon82@gmail.com,0609769139
623615,LES RIVERAINS DU BUO DE MONTAUBAN,,/associations/les-riverains-du-buo-de-montauban,,,Montauban,82000,Tarn-et-Garonne,Occitanie,7 rue Victor Grezel,44.031304,1.336443,Association1901,Ecologie et Environnement | Environnement,,1,Membership,1761084000,1765558364,10,,riverainsbuomtbn@gmail.com,
593982,FESTIVITÉS NOHIC,,/associations/festivites-nohic,,,Nohic,82370,Tarn-et-Garonne,Occitanie,216 rue de la Republique,43.890613,1.437394,Association1901,Solidarité et Action Sociale | Humanitaire | Solidarité,,1,Event,1748815200,1765211166,10,,festivites.nohic@gmail.com,
603146,Stade Beaumontois Lomagne Rugby,,/associations/stade-beaumontois-lomagne-rugby,,,Beaumont-de-Lomagne,82500,Tarn-et-Garonne,Occitanie,Avenue de Gascogne,43.878499,0.980878,Association1901,Sport,,1,Membership,1752876000,1762012930,10,,stade.beaumontois@orange.fr,
614675,Le coeur rose Bressolais,,/associations/le-coeur-rose-bressolais,,,Bressols,82710,Tarn-et-Garonne,Occitanie,2 Route de Lavaur,43.967486,1.339438,Association1901,Caritatif | Humanitaire | Solidarité et Action Sociale,Octobre-rose,1,Event,1758146400,1760791955,10,,coeur.rose.bressolais@gmail.fr,
583643,VAREN EN SCÈNE,,/associations/varen-en-scene,,,Varen,82330,Tarn-et-Garonne,Occitanie,31 rue de la Mairie,44.15747,1.893755,Association1901,Arts et Culture | Arts | Culture,,1,Event,1744581600,1763834207,10,,ves@gmx.fr,
606692,ARTESCENCE,,/associations/artescence,,,Grisolles,82170,Tarn-et-Garonne,Occitanie,5 rue Adrien Hebrard,43.827766,1.296529,Association1901,Arts et Culture | Arts | Culture,,2,Event,1755036000,1760795770,10,,artescence82@gmail.com,
