objectID,name,description,url,logo,banner,city,zipcode,department,region,address,lat,lng,org_type,category_tags,ha_tags,active_forms_count,active_forms_type,creation_date,last_order_date,score,partners,contact_email,contact_phone
590133,BELLE ARABESQUE,"L’école de danse Belle Arabesque est une association dynamique située à Castelsarrasin, au 31 boulevard du 4 Septembre.  Fondée en 2009, elle est dirigée par Éléonore Lemouzy, professeure diplômée d’État, qui y enseigne depuis plus de 15 ans . ",/associations/belle-arabesque,https://cdn.helloasso.com/img/logos/croppedimage-b36ae48454724281982facd5ab849cc0.png,https://cdn.helloasso.com/img/photos/croppedimage-b9fc27ba18ec4856b29071c023c282ff.png,Castelsarrasin,82100,Tarn-et-Garonne,Occitanie,31 Boulevard du 4 Septembre,44.04128,1.106785,Association1901,Danse | Sport,,1,Event,1747260000,1774979945,110,,bellearabesque@outlook.com,0661845890
174685,"Les 3 Dindes, Ferme-Refuge","LES 3 DINDES Ferme-Refuge est une association à but non lucratif dédiée à la cause animale. Notre refuge accueille les animaux de la ferme abandonnés, saisis pour maltraitance, rescapés de l'élevage industriel...sans distinction d'espèces.",/associations/les-3-dindes-ferme-refuge,https://cdn.helloasso.com/img/logos/les 3 dindes ferme refuge-c7a949e7ed3c45c9a5466e9e42583818.jpg,https://cdn.helloasso.com/img/photos/croppedimage-d96e0b7bbad4484f9253e6a1d632f364.png,L'Honor-de-Cos,82130,Tarn-et-Garonne,Occitanie,1145 Chemin de Rossignol,44.112602,1.337474,Association1901Rig,Animaux | Environnement,Don,10,"Shop, Donation, Membership",1573167600,1774977818,110,OHME | Ouisub,les3dindes.ferme.refuge@gmail.com,0973375438
542591,France Rayonnements Ionisants,"France Rayonnements Ionisants a pour objet de rapprocher et fédérer les acteurs français du domaine des rayonnements ionisants, faciliter et développer les activités de ces acteurs et encourager les échanges, les collaborations et les partenariats.",/associations/france-rayonnements-ionisants,https://cdn.helloasso.com/img/logos/croppedimage-b7046df4ec914de6aba754ed6004706d.png,https://cdn.helloasso.com/img/photos/croppedimage-a2a01cf67df443ad963e118ed56ea0a0.png,Saint-Sardos,82600,Tarn-et-Garonne,Occitanie,405 Route de Bouillac,43.891177,1.137539,Association1901,Étudiants | Solidarité et Action Sociale,,2,"Event, Membership",1729202400,1774431046,110,,contact@france-ri.fr,
520158,REBOOST,"REBOOST est une association qui accompagne avec humanité les personnes en burn-out. Accueil, écoute, ateliers, entraide : nous aidons chacun à se reconstruire à son rythme, dans un cadre bienveillant, humain… et profondément solidaire.",/associations/reboost,https://cdn.helloasso.com/img/logos/croppedimage-a76bde971ca44425adb9642dd6609c01.png,https://cdn.helloasso.com/img/photos/croppedimage-aa4d1ca7219c427fb31cf785817d53aa.png,Montauban,82000,Tarn-et-Garonne,Occitanie,3770 chemin des lebrats,43.988908,1.41551,Association1901Rig,Humanitaire | Solidarité | Solidarité et Action Sociale,,6,"CrowdFunding, Shop, Event, Membership",1721080800,1774880683,110,,sylviacaujolle@gmail.com,0786318834
593292,L'Univers de Ros'A,"L’Univers de Ros’A est une association artistique fondée par Rosa Alessi. Basée à Corbarieu, elle propose des ateliers créatifs, master class et événements pour valoriser la voix, l’expression artistique et accompagner les talents de demain.",/associations/l-univers-de-ros-a,https://cdn.helloasso.com/img/logos/croppedimage-70dd80e7db4e4baea9f285575d387130.png,https://cdn.helloasso.com/img/photos/croppedimage-77891f8934cb4208bd85d7d5ca410f34.png,Corbarieu,82370,Tarn-et-Garonne,Occitanie,28 rue d'estilhac,43.948674,1.365544,Association1901Rig,Arts | Culture | Arts et Culture,,5,"Shop, Membership",1748469600,1774693984,110,,rosa.alessi82@gmail.com,
465425,association manel,"Soutien et assistance aux cinq filles d'Isabelle, victime de féminicide ",/associations/association-manel,https://cdn.helloasso.com/img/logos/croppedimage-00b9b1111b984bd0a465592457725691.png,https://cdn.helloasso.com/img/photos/croppedimage-ad3aeecadbc04cfbae63231fcb15a080.png,L'Honor-de-Cos,82130,Tarn-et-Garonne,Occitanie,175 Rue de l’Eglise,44.089999,1.347747,Association1901,Solidarité et Action Sociale | Humanitaire | Solidarité,,5,"Membership, CrowdFunding, Donation, Shop",1705186800,1774893921,110,,associationmanel@gmail.com,0667977858
570088,LE DEFI CASTEL,Pratique des activités physiques et sportives pour la gymnastique.,/associations/le-defi-castel,https://cdn.helloasso.com/img/logos/croppedimage-248d57e3715846568e5fa414e79d3b48.png,https://cdn.helloasso.com/img/photos/croppedimage-385811ae8987441688666016123a0321.png,Castelsarrasin,82100,Tarn-et-Garonne,Occitanie,Gymnase des Fontaines ,44.03164708846108,1.118651367674698,Association1901,Sport | Gymnastique,,4,"Shop, Event",1739314800,1774019541,110,,ledeficastel@gmail.com,
544428,Familles rurales Poly Valence En 2 Rives,"Des  Ateliers pour toute la famille.   Poly Valence en 2 Rives est une association qui à pour but d'apporter du partage, du lien sociale, des interactions, des informations en proposant:  - Des Ateliers enfants/parents  - Des ateliers parentalité  - Des animations  - Des sorties  - Des évènements ",/associations/familles-rurales-poly-valence-en-2-rives,https://cdn.helloasso.com/img/logos/croppedimage-596e38094d5b4a16b1e2281ddac92900.png,https://cdn.helloasso.com/img/photos/croppedimage-e817c23a41e14ed6aa359d4f8074bdab.png,Goudourville,82400,Tarn-et-Garonne,Occitanie,Route de la Mairie,44.113048,0.927111,Association1901,Enfance | Humanitaire | Solidarité | Solidarité et Action Sociale,,3,"Event, Donation, Membership",1729807200,1774704639,110,,polyvalence2rives@gmail.com,0609307309
59519,Association Confluences,L'association Confluences propose des évènements et manifestations autour du livre et de la littérature !  Contact : 05 63 63 57 62 ou contact[a]confluences.org Site : confluences.org,/associations/association-confluences,https://cdn.helloasso.com/img/logos/association-confluences-ef1f04b581b244ec96a8ecf010a61f0f.png,https://cdn.helloasso.com/img/photos/croppedimage-fcf81ce3141f41cdaf4350810ce447ec.png,Montauban,82000,Tarn-et-Garonne,Occitanie,41 Rue de la Comédie,44.019153,1.35335,Association1901Rig,Arts | Culture | Littérature | Arts et Culture,Don,4,"Event, Donation, Membership",1488150000,1774862060,110,,contact@confluences.org,0563635762
118119,Marguest'ô live,"Le Marguest’Ô Rural Art Festival est un évènement culturel gratuit, s'organisant sur la commune d’Aucamville, Tarn & Garonne et propose, le temps d’une soirée, des concerts et la découverte d’artistes musicaux aux univers variés. ",/associations/marguest-o-live,https://cdn.helloasso.com/img/logos/croppedimage-e3a665f07fbc44f3a6627fd823ec807a.png,https://cdn.helloasso.com/img/photos/croppedimage-f3a676c9df2141d0b53a58ab41c97a45.png,Aucamville,82600,Tarn-et-Garonne,Occitanie,Rue Paul Majorel,43.800721,1.21624,Association1901Rig,Arts | Culture | Musique,,10,"Donation, Shop, Event, PaymentForm, Membership",1541977200,1774796721,110,,marguestolive.asso@gmail.com,0682015773
612860,AFRICA IMARA,"Un projet global alliant éducation et formation. Bâtir avec les communautés tanzaniennes des infrastructures durables,  tout en transmettant des savoir-faire pérennes,  grâce aux ressources naturelles et abondantes du pays. ",/associations/africa-imara,https://cdn.helloasso.com/img/logos/croppedimage-d07e62bdbdd741fab325e5df1a89f38c.png,https://cdn.helloasso.com/img/photos/croppedimage-b5243d86b8034eb9926bd5f449507172.png,Montaigu-de-Quercy,82150,Tarn-et-Garonne,Occitanie,899 chemin de Pech Del Bouys,44.35062,1.0291,Association1901Rig,Caritatif | Humanitaire | Solidarité et Action Sociale,,1,Donation,1757541600,1774456509,110,,sandrinebergerat14@gmail.com,
287015,A.P.D.S.L. ASSO POUR LA PROTECTION DES DROITS ET LA SENSIBILISATION CONTRE LES LIENS TOXIQUES," Chez APDSL, nous comprenons votre souffrance. Si vous êtes victime de contrôle coercitif ou d'emprise psychologique, nous sommes là pour vous écouter et vous soutenir, en toute confidentialité. N'ayez pas peur de franchir le pas, contactez-nous en toute confiance. Vous n'êtes pas seul(e).",/associations/a-p-d-s-l-asso-pour-la-protection-des-droits-et-la-sensibilisation-contre-les-liens-toxiques,https://cdn.helloasso.com/img/logos/croppedimage-4a56aafaef744ba1b707d7a49dce242f.png,https://cdn.helloasso.com/img/photos/croppedimage-609a5390afa640d7b2b5e956f453d2c9.png,Moissac,82200,Tarn-et-Garonne,Occitanie,3 Rue de la Solidarité,44.102839,1.088208,Association1901,Humanitaire | Solidarité | Solidarité et Action Sociale,,5,"Shop, Event, Donation, Membership",1634162400,1771705669,110,,APDSL@yahoo.com,0646005064
187434,Association Coeurs de Geants,"Aide aux personnes en difficulté avec leurs Géants ( Bouvier bernois, Terre Neuve , Saint bernard, Golden retriever ... )   Placements & Adoptions de Géants.   ",/associations/association-coeurs-de-geants,https://cdn.helloasso.com/img/logos/croppedimage-12b5651d54584847954a34429616a49f.png,https://cdn.helloasso.com/img/photos/croppedimage-917eb1886b8b457bac9e8f700a066e8e.png,Saint-Loup,82340,Tarn-et-Garonne,Occitanie,"53, Rue Roger Lucien",44.086416,0.852162,Association1901,Caritatif | Humanitaire,Solidarité Ukraine,7,"Shop, Donation, PaymentForm, Membership",1579302000,1773788908,110,,coeursdegeants@gmail.com,0627171772
577464,BOUGER POUR S'EN SORTIR,"Bienvenue sur notre page. Bouger pour s’en sortir agit pour la santé, le lien social et l’inclusion par l’activité physique adaptée. Depuis 2009, nous accompagnons des personnes en difficulté vers un mieux-être global. Rejoignez un mouvement humain, solidaire et engagé où chaque action compte.",/associations/bouger-pour-s-en-sortir,https://cdn.helloasso.com/img/logos/croppedimage-bb1370b3645d45ab9e5143894afd8ccb.png,https://cdn.helloasso.com/img/photos/croppedimage-2b8e4b7cfe5f4cc39c2f2969f3799624.png,Montauban,82000,Tarn-et-Garonne,Occitanie,10 rue johannes gutenberg,44.038214,1.363551,Association1901Rig,Santé,,7,"Shop, Donation, Membership",1742166000,1774952757,110,FFSportspourTous,association.bouger@gmail.com,0623257568
244057,UDAF 82,"Créée en 1946, notre association, reconnue d’utilité publique, accueille et informe les familles, les accompagne et facilite leurs démarches, et agit également pour les droits et la protection des plus vulnérables.  Régie par le CASF, elle est membre du réseau national de l'UNAF.  ",/associations/udaf-82,https://cdn.helloasso.com/img/logos/croppedimage-08d60a449c81435a85994a14ce8bbbf3.png,https://cdn.helloasso.com/img/photos/croppedimage-d2c5a69e930c476e8733db20f12636ca.png,Montauban,82000,Tarn-et-Garonne,Occitanie,Boulevard Gustave Garrisson,44.016489,1.36181,Association1901Rup,Solidarité et Action Sociale | Humanitaire | Solidarité,,1,Event,1612220400,1774856988,110,,udaf@udaf82.fr,0563669852
656725,la calesita,Danses trad et tango ,/associations/la-calesita,https://cdn.helloasso.com/img/logos/croppedimage-eefd80ad8cea4611a8b86fd96cb89086.png,https://cdn.helloasso.com/img/photos/croppedimage-0f3c6f59e7be4b2cbc9e27d131c1766f.png,Bruniquel,82800,Tarn-et-Garonne,Occitanie,2996 Chemin des Nouals,44.025224,1.663555,Association1901,,,1,Event,1773702000,1774701980,110,,,
257904,Les amis de Coralie Syndrome de DiGeorge 82,"L'association ""Les Amis de Coralie Syndrome de DiGeorge 82"" a été crée en 2006. Elle a pour but de venir en aide aux enfants atteints par le syndrome de DiGeorge comme Coralie. Nous avons deux parrains: Pierre BONDOUY et Olivier BERHA.",/associations/les-amis-de-coralie-syndrome-de-digeorge-82,https://cdn.helloasso.com/img/logos/croppedimage-eca6b8c10b9e4ecb925d040cb2158c9b.jpg,https://cdn.helloasso.com/img/photos/croppedimage-1163c4b6c66648cc90cf8c952c80b2e7.png,Saint-Etienne-de-Tulmont,82410,Tarn-et-Garonne,Occitanie,16 Rue de la Mairie,44.04993,1.460163,Association1901Rup,Enfance | Humanitaire | Solidarité | Solidarité et Action Sociale,Octobre-rose | Don,3,"CrowdFunding, Donation",1619388000,1774627311,110,,assolesamisdecoralie@gmail.com,
387427,Montauban Beach Soccer 82,"Association qui à pour essence le développement des sports de sables, les activités physiques et sportives auprès des jeunes et personnes éloignées de celles-ci et le développements des pratiques diversifiées du Football (Beach Soccer, Futnet, FootVolley, Foot à 5, Futsal...).",/associations/montauban-beach-soccer-82,https://cdn.helloasso.com/img/logos/croppedimage-4073c3c6ba894f5e9e8923715ea64325.png,https://cdn.helloasso.com/img/photos/croppedimage-1e236d0abaa34c6a9cdeba70168570dc.png,Montauban,82000,Tarn-et-Garonne,Occitanie,2085 Chemin de Berthoumieu,43.995887,1.407272,Association1901,Sport | Football | Futsal,,4,"Event, Donation, Membership",1679439600,1774986644,110,,montauban.beach82@gmail.com,0642110609
621987,ASSOCIATION DES PARENTS D'ELEVES DES ECOLES DE MONTBETON,"L’AP2EM est l’Association des Parents d’Élèves des écoles élémentaire et maternelle de Montbeton. Elle a pour mission de représenter les familles, soutenir les projets scolaires et organiser des actions conviviales pour renforcer le lien entre parents, enfants et enseignants. ",/associations/association-des-parents-d-eleves-des-ecoles-de-montbeton,https://cdn.helloasso.com/img/logos/croppedimage-493dc3d898d2456794cf8313acfb9eb3.png,https://cdn.helloasso.com/img/photos/croppedimage-46e2ec8338f14de491e8626594d767bf.png,Montbeton,82290,Tarn-et-Garonne,Occitanie,"Mairie, 50, rue Cyprien Majorel,",44.010137,1.287136,Association1901,Education | Enfance | Enseignement | Formation,,3,"Shop, Membership",1760479200,1774110484,110,,ap2em@outlook.fr,
476010,fédération de pêche et de protection des milieux aquatiques du Tarn-et-Garonne,"La fédération de pêche du Tarn-et-Garonne a pour objet :  Le développement durable de la pêche amateur, la mise en oeuvre d'actions de promotion du loisir pêche, la protection des milieux aquatiques, la mise en valeur et la surveillance du domaine piscicole départemental. ",/associations/federation-de-peche-et-de-protection-des-milieux-aquatiques-du-tarn-et-garonne,https://cdn.helloasso.com/img/logos/croppedimage-5128f75f581448279b9c29f5084e4a3c.png,https://cdn.helloasso.com/img/photos/croppedimage-db244ee6b072482fa16b54a3242ad9f5.jpg,Montauban,82000,Tarn-et-Garonne,Occitanie,275 avenue de Beau soleil,44.0065841,1.36895072,Association1901,Développement durable | Environnement | Pêche | Loisirs,,3,Event,1707951600,1774112913,110,,celian.templier@fedepeche82.fr,0563630177
645828,NATIBEL,"NATIBEL œuvre pour la création et la diffusion de projets culturels à vocation éducative et citoyenne. L’association favorise la transmission des savoirs, le dialogue des mémoires, la rencontre des cultures et des générations, et l’accès du plus grand nombre aux arts.",/associations/natibel,https://cdn.helloasso.com/img/logos/croppedimage-4fc21b4f245443beb998435fb3386e56.png,https://cdn.helloasso.com/img/photos/croppedimage-ced09f14ce1e4605bceb12846329dbe8.png,Beaumont-de-Lomagne,82500,Tarn-et-Garonne,Occitanie,Beaumont-de-Lomagne,43.88374,0.99516,Association1901,Arts et Culture | Arts | Culture,,2,"Donation, Membership",1769986800,1774444549,110,,belnatur97@gmail.com,0760090971
330361,NOTRE LIEU,"NOTRE LIEU est un lieu d’accueil, de partages et d’entraide.  NOTRE LIEU est un endroit parfait pour développer son ou ses réseaux : professionnel, féminin, écolo, d’artisans, de soutien, etc.  NOTRE LIEU est un tremplin : un endroit où tester la faisabilité des projets avant de… prendre son envol !",/associations/notre-lieu,https://cdn.helloasso.com/img/logos/croppedimage-46a47fc91ae441af9211db590e5919ad.png,https://cdn.helloasso.com/img/photos/croppedimage-f9e6f9161c544a0a91f8bd89ec251b03.png,Castelsarrasin,82100,Tarn-et-Garonne,Occitanie,Le Concept Store 2bis Rue Edouard Herriot,44.039803,1.108078,Association1901,Artisanat | Humanitaire | Professionnels | Solidarité | Solidarité et Action Sociale,,7,"Event, PaymentForm, Donation, Membership",1655676000,1771342961,110,,elodie@notrelieu.fr,0671905127
93305,assotvlocale,"Ensemble, redynamisons nos localités !",/associations/assotvlocale,https://cdn.helloasso.com/img/logos/assotvlocale-6f2c569c0ae3407786f4277fa1aa2ff6.png,https://cdn.helloasso.com/img/photos/croppedimage-f9d71d32e5964f86b399bbb236e75cc9.png,Albias,82350,Tarn-et-Garonne,Occitanie,2901 Route de Cos,44.09247,1.412792,Association1901,Caritatif | Humanitaire | Solidarité et Action Sociale,,4,"PaymentForm, Membership",1521327600,1751994748,110,,gaelle.laborie@tvlocale.fr,0563655646
395761,FC LOMAGNE 82,"Club de football amateur. Les villages de Beaumont de Lomagne, Larrazet, Garganvillar et Lavit se sont regroupés et officient désormais sous la bannière rouge et blanche du FC LOMAGNE 82. ",/associations/fc-lomagne-82,https://cdn.helloasso.com/img/logos/croppedimage-770ed7942bc44f20ac9eb00de7798256.png,https://cdn.helloasso.com/img/photos/croppedimage-9511d0ef16c64c09b0f20864d98454dd.png,Lavit,82120,Tarn-et-Garonne,Occitanie,1 Place de la Halle,43.95764,0.920353,Association1901,Sport | Football,,2,Membership,1682114400,1774986404,110,,561193@footoccitanie.fr,
246477,Club indépendant d'airsoft ,"Le Club Indépendant d'Airsoft est né de la passion partagée de quelques amis pour ce loisir. Aujourd'hui, nous vous invitons à découvrir le Club Indépendant d'Airsoft, une communauté passionnée qui se consacre à l'airsoft dans un esprit de camaraderie, de sécurité et de respect.",/associations/club-independant-d-airsoft,https://cdn.helloasso.com/img/logos/croppedimage-b390a09d01824e8cb7c6c1667627b65d.png,https://cdn.helloasso.com/img/photos/croppedimage-60bbcc242d7941dba281e28fe920e66d.png,Campsas,82370,Tarn-et-Garonne,Occitanie,Campsas,43.890336,1.324824,Association1901,Airsoft | Sécurité | Sport,,3,"Event, PaymentForm, Membership",1613084400,1774540448,110,,contact@ciarsoft.com,0664870817
209030,CLUB ATHLETIC BIRACAIS,"Le club Athlétic Biracais est une association multi-sports située à Montauban, dans le quartier de Birac.",/associations/club-athletic-biracais,https://cdn.helloasso.com/img/logos/club athletic biracais-7c63fea7effb4e5caf77b909abcc29f3.jpg,https://cdn.helloasso.com/img/photos/bureau-cbf081bfeac742f5b895148499c877fa.jpg,Montauban,82000,Tarn-et-Garonne,Occitanie,140 Rue Lagravette,44.028903,1.352147,Association1901,Sport,,1,Membership,1592431200,1773510345,110,,,
630077,LES MONCHALBANAIS,L'association a pour but de sensibiliser à la cause des chats libres et errants de Montauban (82). Elle se concentre principalement sur la population des chats du cimetière de la ville. Contact : 07 54 72 02 52 les.monchalbanais@gmail.com,/associations/les-monchalbanais,https://cdn.helloasso.com/img/logos/croppedimage-2246fc38d27f48a0aeff73dbc78753be.png,https://cdn.helloasso.com/img/photos/croppedimage-6b6965b048de4553acd6f3baf314ea06.png,Montauban,82000,Tarn-et-Garonne,Occitanie,31 rue gaspard monge,44.011692,1.362108,Association1901,Chats | Environnement | Animaux,,3,"Shop, Donation, Membership",1763506800,1773999554,110,,les.monchalbanais@gmail.com,0754720252
524613,US MONTAUBAN HANDBALL,"L'USM handball est un club sportif créé la saison sportive de 1969. Association loi 1901, l'USM compte plus de 300 licenciés par an depuis ces dernières années. Du baby hand au Loisirs, avec une vingtaine d'équipes, il y a un collectif pour chacun !!  ",/associations/us-montauban-handball,https://cdn.helloasso.com/img/logos/croppedimage-dbff98b2dbd548b5b35ec3d0872520dd.png,https://cdn.helloasso.com/img/photos/croppedimage-cc11b68cddfe415e9ec70879c4bcdd2f.png,Montauban,82000,Tarn-et-Garonne,Occitanie,22 avenue chamier,44.013099,1.344878,Association1901,Sport | Handball,,1,Event,1723500000,1774447579,110,FFHB,6182001@ffhandball.net,0661743394
369499,Secours populaire français - Fédération du Tarn-et-Garonne,"Jour après jour, ici comme ailleurs, le Secours populaire, association reconnue d’utilité publique, agit pour un monde plus juste et plus solidaire, en permettant à chacun de s’émanciper et trouver sa place de citoyen, là où il vit, travaille ou étudie. ",/associations/secours-populaire-francais-federation-du-tarn-et-garonne,https://cdn.helloasso.com/img/logos/croppedimage-8a4a064c78ac4efbb3bb3e70b4656f0d.png,https://cdn.helloasso.com/img/photos/croppedimage-65a901f561d34b5486a57729b17fcb17.png,Montauban,82000,Tarn-et-Garonne,Occitanie,7 Rue Paul Riquet,44.038799,1.368905,Association1901,Humanitaire | Solidarité | Solidarité et Action Sociale,,4,"Shop, Event, Donation",1673910000,1773738995,110,Infolocale,spf82@orange.fr,0563202327
345166,Mer m'aide,"L'Association Mer M’aide a pour objet de : Soutenir et favoriser la re-dynamisation physique et psychique et la réinsertion sociale de personnes  en situation de handicap, notamment la pratique de la pêche sportive en mer, d’activités de pleine nature ou d’actions de protection du milieu.",/associations/mer-m-aide,https://cdn.helloasso.com/img/logos/croppedimage-950c439902d04f7fa21c40c6dfbdcded.png,https://cdn.helloasso.com/img/photos/croppedimage-f0166e0887454c428ebff61efedbf65b.png,Castelsarrasin,82100,Tarn-et-Garonne,Occitanie,400 Chemin de Lamour,44.03574,1.13221,Association1901,Handicap | Humanitaire | Insertion | Solidarité | Solidarité et Action Sociale,,3,"Donation, Membership",1663797600,1728327656,110,,asso.mermaide@gmail.com,0642189235
559468,Promouvoir l'animation culturelle et sociale en Occitanie,"PACSO est une association ayant pour but le dynamisme local autour d'évènements artistiques, culturels et sociaux.",/associations/promouvoir-l-animation-culturelle-et-sociale-en-occitanie,https://cdn.helloasso.com/img/logos/croppedimage-061a1b4b4449434aa3af25b33b5bce22.png,https://cdn.helloasso.com/img/photos/croppedimage-65213abe37664b8f97ea958b4cec7532.png,Boudou,82200,Tarn-et-Garonne,Occitanie,310 Chemin de Ronde,44.096078,1.013205,Association1901,Arts | Culture | Arts et Culture,,2,"Event, Membership",1735858800,1774001147,110,,pacso@mailo.com,
510061,AMARÉ,"Amaré soutient la musique de chambre auprès des amateurs et jeunes professionnels. Résidences d’artistes, master classes, concerts et festival annuel : l’association crée des espaces de rencontre, de transmission et de partage autour du répertoire classique.",/associations/amare,https://cdn.helloasso.com/img/logos/croppedimage-a776c561b3f5438188e3f8f48b221183.png,https://cdn.helloasso.com/img/photos/croppedimage-4505440257c8429c93f734d3f36102e3.png,Puylagarde,82160,Tarn-et-Garonne,Occitanie,360 Chemin de Pastres,44.296612,1.829871,Association1901,Arts | Culture | Musique classique | Professionnels | Musique,,3,"Event, Donation, Membership",1717106400,1773479192,110,,amare82160@gmail.com,0767074302
37269,P'tite Lumière et Cie,"Association culturelle et féministe qui œuvre pour la visibilité et la reconnaissance des femmes artistes. Basée entre Toulouse et Laguépie, elle conçoit et organise des événements artistiques engagés, favorisant l’accès à la culture en milieu rural et luttant contre les inégalités et les discrim",/associations/p-tite-lumiere-et-cie,https://cdn.helloasso.com/img/logos/p tite lumiere et cie-dff4ed5fa5784d82a2ffe59bfcef315d.png,https://cdn.helloasso.com/img/photos/98515.png,Laguépie,82250,Tarn-et-Garonne,Occitanie,6 Rue du Balat,44.143489,1.970624,Association1901Rig,Arts et Culture | Arts | Culture | Féminisme,,2,"Event, Membership",1446159600,1773670088,110,,ptitelumiere.et.cie@gmail.com,+33661484987
538243,POUCHKINE 82,"Depuis 1945, notre association fait découvrir la culture russe aux Français et soutient la diffusion de la culture française en Russie.Nous proposons des événements culturels, des cours de russe, des repas, des concerts, des ateliers, des voyages, en valorisant la diversité des cultures russophones",/associations/pouchkine-82,https://cdn.helloasso.com/img/logos/croppedimage-8f8de72db0344d4ebe3490cc616d8abe.png,https://cdn.helloasso.com/img/photos/croppedimage-86eb8ef672a649e190b001a04c8fd630.png,Montauban,82000,Tarn-et-Garonne,Occitanie,Allée de l'Empereur,44.016763,1.356689,Association1901,Arts | Culture | Voyages | Arts et Culture,,4,"Event, Donation, Membership",1727906400,1774560309,110,,contact@pouchkine82.com,0631067156
128222,Association Cocon d'éveil,"Cocon d’éveil, c’est pour s’informer, échanger et découvrir autour de l’arrivée de bébé et du développement du Tout-Petit.  Participez à des ateliers conviviaux, animés par des professionnel·le·s, pour renforcer le lien avec votre enfant et rencontrer d’autres parents. Dans le 82 et le 46",/associations/association-cocon-d-eveil,https://cdn.helloasso.com/img/logos/association cocon d eveil-2281c897418a4d69acb1558f1d25cbdc.jpg,https://cdn.helloasso.com/img/photos/croppedimage-025d5564cf564973be6c6bf804ca5c51.png,Puylaroque,82240,Tarn-et-Garonne,Occitanie,713 route de la Tuilerie,44.25102979320339,1.618663328698106,Association1901Rig,Enfance | Formation | Professionnels | Education,,6,"Shop, Event, Membership",1550790000,1774616803,110,,cocondeveilasso@gmail.com,0663645136
575996,ORI MENINO (ASSOCIATION DE DANSE TAHITIENNE),"Association de danse tahitienne, proposant des cours de danse tahitienne, de produits polynésiens, propose des spectacles et shows privé. Nous sommes situé sur Castelsarrasin ",/associations/ori-menino-association-de-danse-tahitienne,https://cdn.helloasso.com/img/logos/croppedimage-e84d7cff28bb41ee8743ed3624db31af.jpg,https://cdn.helloasso.com/img/photos/croppedimage-bbd62bb39db34ba89acd159394863ed2.png,Castelsarrasin,82100,Tarn-et-Garonne,Occitanie,13 Place de la Raison,44.037825,1.107627,AssociationProprietaire,Arts et Culture | Arts | Culture | Danse,,2,"Event, Membership",1741647600,1773092302,110,,orimenino82100@gmail.com,0778059524
